patent_number,date,title,spacy_pos,spacy_label,is_prpn_spacy,is_person_spacy,spacy_pos_len,bad_endings
US3497907A,1967-07-26,Snap-fitted hinge assembly,"['NOUN', 'PUNCT', 'VERB', 'NOUN', 'PROPN']",[],1,0,6,1
US3497965A,1966-12-03,Means and method for defrosting frozen products,"['PROPN', 'CCONJ', 'NOUN', 'ADP', 'VERB', 'ADJ', 'NOUN']",[],1,0,8,1
US3498065A,1967-10-30,Method and apparatus for barge anchoring and stabilizing,"['PROPN', 'CCONJ', 'NOUN', 'ADP', 'ADJ', 'NOUN', 'CCONJ', 'VERB']",[],1,0,9,1
US3498118A,1966-12-23,Self-heating compensation for bonded filament strain gage transducers,"['NOUN', 'PUNCT', 'NOUN', 'NOUN', 'ADP', 'PROPN', 'PROPN', 'NOUN', 'NOUN', 'NOUN']",[],1,0,11,1
US3499040A,1964-06-29,Copolymeric ether glycol and process for its manufacture,"['PROPN', 'ADV', 'NOUN', 'CCONJ', 'NOUN', 'ADP', 'PRON', 'NOUN']",['PRODUCT'],1,0,9,1
US3499202A,1967-10-10,Film cartridge loading machine,"['PROPN', 'NOUN', 'NOUN', 'NOUN']",[],1,0,5,1
US3499481A,1969-03-24,Pressurized liquid cooling system,"['PROPN', 'NOUN', 'VERB', 'NOUN']",['ORG'],1,0,5,1
US3499618A,1968-02-08,Film cartridge having a floating film guide,"['PROPN', 'NOUN', 'VERB', 'DET', 'VERB', 'NOUN', 'NOUN']",[],1,0,8,1
US3499629A,1968-03-19,Constant tension chain jack assembly,"['ADJ', 'NOUN', 'NOUN', 'PROPN', 'PROPN']",['PERSON'],1,1,6,1
US3499634A,1968-02-14,Combustible support,"['PROPN', 'NOUN']",[],1,0,3,1
US3499636A,1968-04-05,Method of and apparatus for producing low sulfur lime,"['PROPN', 'ADP', 'CCONJ', 'NOUN', 'ADP', 'VERB', 'ADJ', 'NOUN', 'NOUN']",[],1,0,10,1
US3499638A,1967-11-13,Method of cooling damaged blast furnace cooling elements,"['PROPN', 'ADP', 'VERB', 'VERB', 'NOUN', 'NOUN', 'VERB', 'NOUN']",[],1,0,9,1
US3499738A,1967-02-17,Method and apparatus for producing cyanogen chloride using a modified oldershaw reaction column,"['PROPN', 'CCONJ', 'NOUN', 'ADP', 'VERB', 'NOUN', 'NOUN', 'VERB', 'DET', 'VERB', 'NOUN', 'NOUN', 'NOUN']",[],1,0,14,1
US3400152A,1964-06-25,Sulfonamides and sulfonimides,"['NOUN', 'CCONJ', 'VERB']",[],0,0,4,1
US3400222A,1963-04-23,Message unit charging and billing equipment,"['NOUN', 'NOUN', 'VERB', 'CCONJ', 'NOUN', 'NOUN']",[],0,0,7,1
US3400247A,1965-10-12,Electrical radiant heating panels,"['ADJ', 'NOUN', 'NOUN', 'NOUN']",[],0,0,5,1
US3400337A,1966-12-23,Stabilized variable frequency multivibrator,"['VERB', 'ADJ', 'NOUN', 'NOUN']",[],0,0,5,1
US3400411A,1966-08-16,Sealing gasket means,"['VERB', 'NOUN', 'VERB']",[],0,0,4,1
US3400520A,1966-11-16,Filter material for internal combustion engine air cleaner,"['NOUN', 'NOUN', 'ADP', 'ADJ', 'NOUN', 'NOUN', 'NOUN', 'ADJ']",[],0,0,9,1
US3400569A,1966-08-17,Metal forming machine having improved forming slide means,"['NOUN', 'VERB', 'NOUN', 'AUX', 'VERB', 'VERB', 'NOUN', 'VERB']",[],0,0,9,1
US3400633A,1966-08-16,Ultra-torque nut runner with motor brake,"['ADJ', 'ADJ', 'ADJ', 'NOUN', 'NOUN', 'ADP', 'NOUN', 'NOUN']",[],0,0,9,1
US3400660A,1965-10-20,Ammunition projectile,"['NOUN', 'NOUN']",[],0,0,3,1
US3400701A,1966-11-18,Combustion chamber pistons,"['NOUN', 'NOUN', 'VERB']",[],0,0,4,1
US3400735A,1966-08-30,Pressure regulating release valve,"['NOUN', 'NOUN', 'NOUN', 'VERB']",[],0,0,5,1
US3400736A,1966-05-31,Reversing valve,"['VERB', 'VERB']",[],0,0,3,1
US3400744A,1965-10-23,Cleated pneumatic tire,"['VERB', 'ADJ', 'NOUN']",[],0,0,4,1
US3400775A,1965-01-22,Automatic weigher with rapping means to aid discharge of materials,"['ADJ', 'ADV', 'ADP', 'VERB', 'NOUN', 'PART', 'VERB', 'NOUN', 'ADP', 'NOUN']",[],0,0,11,1
US3400791A,1967-11-20,Ring rail lowering mechanism having overload slip clutch,"['NOUN', 'NOUN', 'NOUN', 'NOUN', 'VERB', 'NOUN', 'NOUN', 'VERB']",[],0,0,9,1
US3401103A,1965-10-23,Electrochemical machining process and electrolyte composition of chloride and sulfates,"['ADJ', 'NOUN', 'NOUN', 'CCONJ', 'ADJ', 'NOUN', 'ADP', 'NOUN', 'CCONJ', 'VERB']",[],0,0,11,1
US3401167A,1966-01-07,Oxobisbenzoxazin-2-ones and process for their production,"['NUM', 'PUNCT', 'NOUN', 'CCONJ', 'NOUN', 'ADP', 'PRON', 'NOUN']",[],0,0,9,1
US3401229A,1964-05-30,Electronic musical instrument of just intonation,"['ADJ', 'ADJ', 'NOUN', 'ADP', 'ADV', 'NOUN']",[],0,0,7,1
US3401260A,1966-10-31,Corrosive liquid flow meter,"['ADJ', 'ADJ', 'NOUN', 'NOUN']",[],0,0,5,1
US3401270A,1964-08-25,Composite cover for a light control unit,"['ADJ', 'NOUN', 'ADP', 'DET', 'ADJ', 'NOUN', 'NOUN']",[],0,0,8,1
US3401281A,1966-03-18,Electric motor with permanent magnet stator poles and method of making,"['ADJ', 'NOUN', 'ADP', 'ADJ', 'NOUN', 'NOUN', 'NOUN', 'CCONJ', 'NOUN', 'ADP', 'VERB']",[],0,0,12,1
US3401442A,1965-10-21,Pipeline lining and reinforcement machine,"['NOUN', 'NOUN', 'CCONJ', 'NOUN', 'NOUN']",['ORG'],0,0,6,1
US3401469A,1966-04-21,Educational system with mobile student learning stations,"['ADJ', 'NOUN', 'ADP', 'NOUN', 'NOUN', 'NOUN', 'NOUN']",[],0,0,8,1
US3401549A,1966-08-09,Failure monitor for attitude reference systems,"['NOUN', 'VERB', 'ADP', 'NOUN', 'NOUN', 'NOUN']",[],0,0,7,1
US3401594A,1965-12-01,Photographic printing apparatus for making plural assorted-sized prints simultaneously,"['ADJ', 'NOUN', 'NOUN', 'ADP', 'VERB', 'ADJ', 'VERB', 'PUNCT', 'ADJ', 'NOUN', 'ADV']",[],0,0,12,1
US3401601A,1967-01-23,Hydraulic servo valve,"['ADJ', 'NOUN', 'VERB']",[],0,0,4,1
US3401627A,1967-01-04,Addressing machine having radially movable imprinting means,"['VERB', 'NOUN', 'VERB', 'ADV', 'ADJ', 'NOUN', 'VERB']",[],0,0,8,1
US3401935A,1965-12-14,Bowling bowl,"['NOUN', 'VERB']",[],0,0,3,1
US3401983A,1967-01-24,Vehicle brake control,"['NOUN', 'NOUN', 'NOUN']",[],0,0,4,1
US3401984A,1967-01-24,Vehicle brake control,"['NOUN', 'NOUN', 'NOUN']",[],0,0,4,1
US3402079A,1965-07-21,High temperature thermocouple,"['ADJ', 'NOUN', 'PRON']",[],0,0,4,1
US3402176A,1964-12-24,"O-pyrazolo-(1, 5-a)-pyrimidyl phosphorus-containing esters","['NOUN', 'NOUN', 'NOUN', 'PUNCT', 'NUM', 'PUNCT', 'NOUN', 'NOUN', 'PUNCT', 'VERB', 'NOUN']",['CARDINAL'],0,0,12,1
US3402289A,1966-12-29,Automatic control system for vehicles incorporating a ranging system for vehicle traffic safety control,"['ADJ', 'NOUN', 'NOUN', 'ADP', 'NOUN', 'VERB', 'DET', 'VERB', 'NOUN', 'ADP', 'NOUN', 'NOUN', 'NOUN', 'NOUN']",[],0,0,15,1
US3402600A,1966-06-24,Electric motor testing apparatus,"['ADJ', 'NOUN', 'NOUN', 'NOUN']",[],0,0,5,1
US3402760A,1967-09-08,Air-conditioning system having fresh air intake,"['NOUN', 'PUNCT', 'NOUN', 'NOUN', 'VERB', 'ADJ', 'NOUN', 'NOUN']",[],0,0,9,1
US3402785A,1965-10-23,Muffler with resonance chambers for high and low frequencies,"['NOUN', 'ADP', 'NOUN', 'NOUN', 'ADP', 'ADJ', 'CCONJ', 'ADJ', 'NOUN']",[],0,0,10,1
US3402821A,1966-08-31,Centrifugal separator,"['ADJ', 'NOUN']",[],0,0,3,1
US3402870A,1965-09-20,Explosive tube welding device,"['ADJ', 'NOUN', 'NOUN', 'NOUN']",[],0,0,5,1
US3403260A,1965-03-08,Plural channel optical memory using color to discriminate among channels,"['ADJ', 'NOUN', 'ADJ', 'NOUN', 'VERB', 'NOUN', 'PART', 'VERB', 'ADP', 'NOUN']",[],0,0,11,1
US3403318A,1965-11-01,Static inverter system with frequency regulation of inverter output voltage as a function of inverter input voltage amplitude,"['ADJ', 'NOUN', 'NOUN', 'ADP', 'ADJ', 'NOUN', 'ADP', 'ADJ', 'NOUN', 'NOUN', 'ADP', 'DET', 'NOUN', 'ADP', 'ADJ', 'NOUN', 'NOUN', 'NOUN']",[],0,0,19,1
US3403596A,1965-07-21,Obturator arrangement for gun barrels,"['NOUN', 'NOUN', 'ADP', 'NOUN', 'NOUN']",[],0,0,6,1
US3403721A,1966-06-13,Tensile strengths of certain sand cores,"['ADJ', 'NOUN', 'ADP', 'ADJ', 'NOUN', 'VERB']",[],0,0,7,1
US3403953A,1967-02-13,Device for renovating old cabinets,"['NOUN', 'ADP', 'VERB', 'ADJ', 'NOUN']",[],0,0,6,1
US3403975A,1964-11-20,Synthesis and decomposition of ammonia,"['NOUN', 'CCONJ', 'NOUN', 'ADP', 'NOUN']",[],0,0,6,1
US3404109A,1963-02-14,Production of polyether diols using water as a telogen,"['NOUN', 'ADP', 'NOUN', 'NOUN', 'VERB', 'NOUN', 'ADP', 'DET', 'NOUN']",[],0,0,10,1
US3404250A,1966-07-01,Welding apparatus,"['NOUN', 'NOUN']",[],0,0,3,1
US3404286A,1965-08-18,Signal responsive apparatus,"['ADJ', 'ADJ', 'NOUN']",[],0,0,4,1
US3404306A,1966-04-06,Traveling-wave tube focusing field straightener,"['NOUN', 'PUNCT', 'NOUN', 'NOUN', 'VERB', 'NOUN', 'NOUN']",[],0,0,8,1
US3404362A,1966-07-29,Selective indexing guide device for electrical connectors of printed circuit cards,"['ADJ', 'NOUN', 'NOUN', 'NOUN', 'ADP', 'ADJ', 'NOUN', 'ADP', 'VERB', 'NOUN', 'NOUN']",[],0,0,12,1
US3404495A,1966-07-08,Combined flashing and fascia system and method of making same,"['VERB', 'NOUN', 'CCONJ', 'NOUN', 'NOUN', 'CCONJ', 'NOUN', 'ADP', 'VERB', 'ADJ']",[],0,0,11,1
US3404628A,1966-07-11,Automatic marking device,"['ADJ', 'VERB', 'NOUN']",[],0,0,4,1
US3404641A,1966-07-25,Railway truck side frame having a fulcrum in a window,"['NOUN', 'NOUN', 'NOUN', 'NOUN', 'VERB', 'DET', 'NOUN', 'ADP', 'DET', 'NOUN']",[],0,0,11,1
US3404643A,1966-12-15,Incinerators,['NOUN'],[],0,0,2,1
US3404744A,1966-08-12,Disenabling mechanism for lever in ratio balance,"['NOUN', 'NOUN', 'ADP', 'NOUN', 'ADP', 'NOUN', 'NOUN']",[],0,0,8,1
US3404749A,1967-03-27,Chain saw muffler,"['NOUN', 'VERB', 'NOUN']",[],0,0,4,1
US3405005A,1964-05-23,Welding electrode,"['NOUN', 'ADP']",[],0,0,3,1
US3405130A,1961-10-25,"Adducts of aluminum, beryllium and zirconium borohydrides with nitrogen and/or oxygen-containing ligands","['NOUN', 'ADP', 'NOUN', 'PUNCT', 'NOUN', 'CCONJ', 'NOUN', 'NOUN', 'ADP', 'NOUN', 'CCONJ', 'NOUN', 'PUNCT', 'VERB', 'NOUN']",[],0,0,16,1
US3405151A,1966-07-01,Chromatographic separation of gamma-linolenic acid esters,"['ADJ', 'NOUN', 'ADP', 'NOUN', 'PUNCT', 'ADJ', 'NOUN', 'NOUN']",[],0,0,9,1
US3405495A,1967-08-04,Building wall construction with laterally spaced panel members,"['VERB', 'NOUN', 'NOUN', 'ADP', 'ADV', 'VERB', 'NOUN', 'NOUN']",[],0,0,9,1
US3405505A,1964-11-09,"Machine for automatically forming, filling, closing and sealing cartons","['NOUN', 'ADP', 'ADV', 'VERB', 'PUNCT', 'NOUN', 'PUNCT', 'NOUN', 'CCONJ', 'VERB', 'NOUN']",[],0,0,12,1
US3405675A,1965-04-06,Water-borne gas-cushion vehicles,"['NOUN', 'PUNCT', 'VERB', 'NOUN', 'PUNCT', 'NOUN', 'NOUN']",[],0,0,8,1
US3405692A,1965-07-31,Supercharged rotary internal combustion engine,"['VERB', 'ADJ', 'ADJ', 'NOUN', 'NOUN']",[],0,0,6,1
US3405705A,1963-09-13,Snow melter,"['NOUN', 'NOUN']",[],0,0,3,1
US3405708A,1965-07-15,Blood flow measuring apparatus,"['NOUN', 'NOUN', 'VERB', 'NOUN']",[],0,0,5,1
US3405746A,1966-05-27,Plywood panel patching apparatus,"['NOUN', 'NOUN', 'VERB', 'NOUN']",[],0,0,5,1
US3405830A,1965-10-23,Bottle-stopper,"['NOUN', 'PUNCT', 'NOUN']",[],0,0,4,1
US3405898A,1966-06-24,Mounting bracket,"['VERB', 'NOUN']",[],0,0,3,1
US3405935A,1966-12-30,Card picker mechanism,"['NOUN', 'NOUN', 'NOUN']",[],0,0,4,1
US3406203A,1963-05-15,Dihaloamino-carboranes,"['NOUN', 'PUNCT', 'NOUN']",[],0,0,4,1
US3406248A,1966-10-27,Cable with extruded covering having fibrous interlayer,"['NOUN', 'ADP', 'NOUN', 'NOUN', 'VERB', 'ADJ', 'NOUN']",[],0,0,8,1
US3406264A,1964-12-11,Manufacture and testing of phonograph records,"['NOUN', 'CCONJ', 'NOUN', 'ADP', 'NOUN', 'NOUN']",[],0,0,7,1
US3406268A,1967-11-20,Miniature single pole-double throw ceramic-metal switch structure,"['ADJ', 'ADJ', 'NOUN', 'PUNCT', 'NOUN', 'VERB', 'ADJ', 'PUNCT', 'NOUN', 'NOUN', 'NOUN']",[],0,0,12,1
US3406303A,1965-05-05,Bi-directional motor reversal control device,"['ADJ', 'PUNCT', 'ADJ', 'NOUN', 'NOUN', 'NOUN', 'NOUN']",[],0,0,8,1
US3406352A,1965-05-17,Solid state high frequency power amplifier,"['ADJ', 'NOUN', 'ADJ', 'NOUN', 'NOUN', 'ADP']",[],0,0,7,1
US3406379A,1965-08-16,Digital data processing system,"['ADJ', 'NOUN', 'NOUN', 'NOUN']",['ORG'],0,0,5,1
US3406390A,1967-06-19,Automatic processor for stacked beam radar,"['ADJ', 'NOUN', 'ADP', 'VERB', 'NOUN', 'NOUN']",[],0,0,7,1
US3406795A,1966-09-08,Seat adjuster control mechanism,"['NOUN', 'NOUN', 'NOUN', 'NOUN']",[],0,0,5,1
US3406797A,1966-05-18,Criss cross guides for a latch operated clutch,"['ADJ', 'NOUN', 'VERB', 'ADP', 'DET', 'NOUN', 'VERB', 'VERB']",['NORP'],0,0,9,1
US3406822A,1965-10-04,Inspecting open mouth translucent containers for defects,"['VERB', 'ADJ', 'NOUN', 'ADJ', 'NOUN', 'ADP', 'NOUN']",[],0,0,8,1
US3406989A,1965-06-11,Combined multiple fluid distribution panel blocks and connector means therefor,"['VERB', 'ADJ', 'ADJ', 'NOUN', 'NOUN', 'NOUN', 'CCONJ', 'NOUN', 'VERB', 'ADP']",[],0,0,11,1
US3407021A,1966-08-08,Pocket utility device including writing instrument,"['NOUN', 'NOUN', 'NOUN', 'VERB', 'VERB', 'NOUN']",[],0,0,7,1
US3407346A,1965-10-14,Electric sequential combination mechanism,"['ADJ', 'ADJ', 'NOUN', 'NOUN']",[],0,0,5,1
US3407385A,1965-06-17,Winker system for vehicles,"['NOUN', 'NOUN', 'ADP', 'NOUN']",[],0,0,5,1
US3407454A,1966-04-23,Quick release fasteners,"['ADJ', 'NOUN', 'NOUN']",[],0,0,4,1
US3407490A,1966-07-28,Process for developing electrical coils in inductive devices,"['NOUN', 'ADP', 'VERB', 'ADJ', 'NOUN', 'ADP', 'ADJ', 'NOUN']",[],0,0,9,1
US3407576A,1966-06-14,Self-supporting filter element,"['NOUN', 'PUNCT', 'VERB', 'NOUN', 'NOUN']",[],0,0,6,1
US3407583A,1967-06-12,Splicing of textile strands,"['NOUN', 'ADP', 'NOUN', 'VERB']",[],0,0,5,1
US3407753A,1966-03-21,Railway car construction,"['NOUN', 'NOUN', 'NOUN']",[],0,0,4,1
US3408064A,1966-05-03,Auxiliary paper tray for copying machines,"['ADJ', 'NOUN', 'NOUN', 'ADP', 'VERB', 'NOUN']",[],0,0,7,1
US3408201A,1965-10-06,Mink food product containing bile and slaughter house and packing house byproducts,"['NOUN', 'NOUN', 'NOUN', 'VERB', 'NOUN', 'CCONJ', 'NOUN', 'NOUN', 'CCONJ', 'VERB', 'NOUN', 'NOUN']",[],0,0,13,1
US3408251A,1964-01-10,Tows of synthetic filaments and method for making the same,"['NOUN', 'ADP', 'ADJ', 'NOUN', 'CCONJ', 'NOUN', 'ADP', 'VERB', 'DET', 'ADJ']",[],0,0,11,1
US3408477A,1966-02-28,Detector and system for removing ice and snow,"['NOUN', 'CCONJ', 'NOUN', 'ADP', 'VERB', 'NOUN', 'CCONJ', 'NOUN']",[],0,0,9,1
US3408482A,1962-07-05,"Machine for sequentially scanning lines, as in test scoring","['NOUN', 'ADP', 'ADV', 'VERB', 'NOUN', 'PUNCT', 'ADP', 'ADP', 'NOUN', 'VERB']",[],0,0,11,1
US3408822A,1965-08-06,Diving method and apparatus,"['ADJ', 'NOUN', 'CCONJ', 'NOUN']",[],0,0,5,1
US3409043A,1965-10-19,Air conditioning,"['NOUN', 'NOUN']",[],0,0,3,1
US3409198A,1965-04-30,Bonding apparatus which assures bondability,"['NOUN', 'NOUN', 'PRON', 'VERB', 'NOUN']",[],0,0,6,1
US3409200A,1966-08-26,Container and method of forming the same,"['NOUN', 'CCONJ', 'NOUN', 'ADP', 'VERB', 'DET', 'ADJ']",[],0,0,8,1
US3409549A,1965-10-22,Compositions and articles including non-pyrophoric microparticles,"['NOUN', 'CCONJ', 'NOUN', 'VERB', 'ADJ', 'ADJ', 'ADJ', 'NOUN']",[],0,0,9,1
US3409743A,1964-04-18,System for changing signal duration with reproduction frequency compensation,"['NOUN', 'ADP', 'VERB', 'NOUN', 'NOUN', 'ADP', 'NOUN', 'NOUN', 'NOUN']",[],0,0,10,1
US3409852A,1965-04-17,Electromagnet coil construction,"['NOUN', 'NOUN', 'NOUN']",[],0,0,4,1
US3409922A,1966-02-09,Dockboard,['NOUN'],[],0,0,2,1
US3409934A,1966-01-04,Door check,"['NOUN', 'VERB']",[],0,0,3,1
US3409971A,1965-06-08,Wiring harness aid,"['NOUN', 'NOUN', 'NOUN']",[],0,0,4,1
US3410064A,1965-10-22,Rotary plant knocker for a seed harvester,"['ADJ', 'NOUN', 'NOUN', 'ADP', 'DET', 'NOUN', 'NOUN']",['GPE'],0,0,8,1
US3410066A,1967-04-28,Recovery of cotton and similar plant products,"['NOUN', 'ADP', 'NOUN', 'CCONJ', 'ADJ', 'NOUN', 'NOUN']",[],0,0,8,1
US3410262A,1967-04-07,Snow melting device,"['NOUN', 'NOUN', 'NOUN']",[],0,0,4,1
US3410291A,1965-04-30,Bridge-type fluid circuit,"['NOUN', 'PUNCT', 'NOUN', 'NOUN', 'NOUN']",[],0,0,6,1
US3410351A,1965-06-02,Sonic earth ripper bar with temperature gradient control,"['ADJ', 'NOUN', 'NOUN', 'NOUN', 'ADP', 'NOUN', 'NOUN', 'NOUN']",['NORP'],0,0,9,1
US3410491A,1966-08-26,Valve means,"['NOUN', 'VERB']",[],0,0,3,1
US3410594A,1967-03-28,Workpiece loading fixture,"['NOUN', 'NOUN', 'NOUN']",[],0,0,4,1
US3410707A,1964-12-29,Protective coatings for aluminum and aluminum alloys,"['ADJ', 'NOUN', 'ADP', 'NOUN', 'CCONJ', 'NOUN', 'NOUN']",[],0,0,8,1
US3410712A,1965-10-19,Pressure responsive transfer system and process of making,"['NOUN', 'ADJ', 'NOUN', 'NOUN', 'CCONJ', 'NOUN', 'ADP', 'VERB']",[],0,0,9,1
US3410795A,1964-06-08,Slurry flow control,"['NOUN', 'VERB', 'NOUN']",[],0,0,4,1
US3410878A,1964-04-01,Preparation of quinol ethers,"['NOUN', 'ADP', 'NOUN', 'NOUN']",[],0,0,5,1
US3411233A,1965-10-21,Retractable fishhook,"['ADJ', 'NOUN']",[],0,0,3,1
US3411340A,1965-09-01,Knock-out device of impact forming machine,"['VERB', 'PUNCT', 'ADP', 'NOUN', 'ADP', 'NOUN', 'VERB', 'NOUN']",[],0,0,9,1
US3411370A,1966-12-27,Torque responsive multi-roller friction drive,"['NOUN', 'ADJ', 'ADJ', 'ADJ', 'ADJ', 'NOUN', 'VERB']",[],0,0,8,1
US3411386A,1966-12-05,Deburring tools,"['NOUN', 'NOUN']",[],0,0,3,1
US3411519A,1966-11-18,Telescopic collapsible umbrella frame,"['NOUN', 'ADJ', 'NOUN', 'NOUN']",[],0,0,5,1
US3411527A,1966-06-24,Bits for pipe punches,"['NOUN', 'ADP', 'NOUN', 'NOUN']",[],0,0,5,1
US3411547A,1965-10-06,Weft thread supply apparatus for looms,"['ADJ', 'NOUN', 'NOUN', 'NOUN', 'ADP', 'NOUN']",['ORG'],0,0,7,1
US3411550A,1966-11-02,Transfer-tail-clamping apparatus,"['NOUN', 'PUNCT', 'NOUN', 'PUNCT', 'VERB', 'NOUN']",[],0,0,7,1
US3411633A,1966-05-05,Checking apparatus for garment racks and the like,"['VERB', 'NOUN', 'ADP', 'NOUN', 'NOUN', 'CCONJ', 'DET', 'ADJ']",[],0,0,9,1
US3411637A,1963-11-05,Constructional assemblies for use in buildings,"['ADJ', 'NOUN', 'ADP', 'NOUN', 'ADP', 'NOUN']",[],0,0,7,1
US3411642A,1967-01-11,Object storage and retrieval facility,"['NOUN', 'NOUN', 'CCONJ', 'NOUN', 'NOUN']",[],0,0,6,1
US3411681A,1965-07-06,"Stand for thread bobbins, particularly for sewing machines in clothing producing workshops","['VERB', 'ADP', 'NOUN', 'NOUN', 'PUNCT', 'ADV', 'ADP', 'NOUN', 'NOUN', 'ADP', 'NOUN', 'NOUN', 'NOUN']",[],0,0,14,1
US3411820A,1967-05-18,Rear seat cushion retaining means,"['ADJ', 'NOUN', 'NOUN', 'VERB', 'VERB']",[],0,0,6,1
US3412018A,1965-11-15,Water purifying process,"['NOUN', 'NOUN', 'NOUN']",[],0,0,4,1
US3412077A,1964-07-16,Polymers of acrylonitrile with olefinically unsaturated semicarbazide,"['NOUN', 'ADP', 'NOUN', 'ADP', 'ADV', 'ADJ', 'NOUN']",[],0,0,8,1
US3412193A,1965-12-13,"11-(4-methyl-1-piperazinyl)dibenz[b, f][1, 4]oxazepines or thiazepines for controlling fertility","['NOUN', 'PUNCT', 'SPACE', 'PUNCT', 'NUM', 'PUNCT', 'NUM', 'PUNCT', 'NOUN', 'CCONJ', 'NOUN', 'ADP', 'VERB', 'NOUN']",['CARDINAL'],0,0,15,1
US3412335A,1965-09-30,Automatic frequency control circuit,"['ADJ', 'NOUN', 'NOUN', 'NOUN']",[],0,0,5,1
US3412696A,1965-03-25,Incinerator,['NOUN'],[],0,0,2,1
US3412778A,1966-10-24,Liquid distributor for tubular internal falling film evaporator,"['ADJ', 'NOUN', 'ADP', 'ADJ', 'ADJ', 'VERB', 'NOUN', 'NOUN']",[],0,0,9,1
US3412794A,1966-11-23,Production of oil by steam flood,"['NOUN', 'ADP', 'NOUN', 'ADP', 'NOUN', 'NOUN']",[],0,0,7,1
US3413038A,1967-04-10,Transportation of solids,"['NOUN', 'ADP', 'NOUN']",[],0,0,4,1
US3413049A,1966-10-12,Toilet tissue holder,"['NOUN', 'NOUN', 'NOUN']",[],0,0,4,1
US3413206A,1964-10-21,"Process for the manufacture of 2, 2, 3-trichlorobutane","['NOUN', 'ADP', 'DET', 'NOUN', 'ADP', 'NUM', 'PUNCT', 'NUM', 'PUNCT', 'NUM', 'PUNCT', 'NOUN']","['CARDINAL', 'DATE', 'QUANTITY']",0,0,13,1
US3413250A,1964-10-26,"Printing ink comprising particulate interpolymer, wax-like material and rosin ester","['VERB', 'NOUN', 'VERB', 'NOUN', 'NOUN', 'PUNCT', 'NOUN', 'PUNCT', 'ADJ', 'NOUN', 'CCONJ', 'NOUN', 'NOUN']",[],0,0,14,1
US3413260A,1966-05-25,Stabilization of solid polymers with quaternary ammonium borohydrides,"['NOUN', 'ADP', 'ADJ', 'NOUN', 'ADP', 'ADJ', 'NOUN', 'VERB']",[],0,0,9,1
US3413349A,1965-05-21,Process for preparing phenylhydroxylamine and cupferron,"['NOUN', 'ADP', 'VERB', 'NOUN', 'CCONJ', 'NOUN']",[],0,0,7,1
US3413458A,1966-05-27,Ornamental electrical novelty,"['ADJ', 'ADJ', 'NOUN']",[],0,0,4,1
US3413569A,1967-05-19,Repetitively operating thyristor switch circuit with rapid turn-off action,"['ADV', 'VERB', 'NOUN', 'NOUN', 'NOUN', 'ADP', 'ADJ', 'NOUN', 'PUNCT', 'ADP', 'NOUN']",[],0,0,12,1
US3413587A,1966-02-21,Electrical resistor,"['ADJ', 'NOUN']",[],0,0,3,1
US3413678A,1966-09-28,Carpet seam securing device,"['NOUN', 'NOUN', 'VERB', 'NOUN']",['ORG'],0,0,5,1
US3413680A,1965-07-30,Spiral counterbalance unit,"['ADJ', 'NOUN', 'NOUN']",[],0,0,4,1
US3414224A,1966-03-28,Interlock structural members,"['ADJ', 'ADJ', 'NOUN']",[],0,0,4,1
US3414380A,1965-08-09,Extraction of tellurium from tellurium-bearing ores,"['NOUN', 'ADP', 'NOUN', 'ADP', 'NOUN', 'PUNCT', 'NOUN', 'NOUN']",[],0,0,9,1
US3414410A,1964-04-15,Recording process,"['NOUN', 'NOUN']",[],0,0,3,1
US3414572A,1965-09-09,Basic substituted alkylxanthine derivatives,"['ADJ', 'VERB', 'NOUN', 'NOUN']",[],0,0,5,1
US3414783A,1966-03-14,Electronic apparatus for high speed transistor switching,"['ADJ', 'NOUN', 'ADP', 'ADJ', 'NOUN', 'NOUN', 'VERB']",[],0,0,8,1
US3414793A,1967-08-28,Hearing aid battery charger,"['VERB', 'NOUN', 'NOUN', 'NOUN']",[],0,0,5,1
US3414911A,1966-08-26,Self-raising water closet seat,"['NOUN', 'PUNCT', 'VERB', 'NOUN', 'NOUN', 'NOUN']",[],0,0,7,1
US3414992A,1967-06-28,Power operated clothes press,"['NOUN', 'VERB', 'NOUN', 'VERB']",[],0,0,5,1
US3415028A,1966-11-30,Panel joint structure,"['NOUN', 'ADJ', 'NOUN']",[],0,0,4,1
US3415058A,1967-04-26,Hydraulic pump control system,"['ADJ', 'NOUN', 'NOUN', 'NOUN']",[],0,0,5,1
US3415134A,1967-05-17,Stepless torque converter,"['ADJ', 'NOUN', 'NOUN']",[],0,0,4,1
US3415307A,1966-03-03,Process for casting ductile iron,"['NOUN', 'ADP', 'VERB', 'NOUN', 'NOUN']",[],0,0,6,1
US3415351A,1967-05-10,Bag accumulator,"['ADJ', 'NOUN']",[],0,0,3,1
US3415352A,1965-10-21,Transporting system and method,"['VERB', 'NOUN', 'CCONJ', 'NOUN']",[],0,0,5,1
US3415357A,1967-12-26,Self-contained tennis ball storage container and pressurizing device,"['NOUN', 'PUNCT', 'VERB', 'NOUN', 'NOUN', 'NOUN', 'NOUN', 'CCONJ', 'VERB', 'NOUN']",[],0,0,11,1
US3415362A,1968-01-02,Multi-product carton with product-retaining feature,"['ADJ', 'ADJ', 'ADJ', 'NOUN', 'ADP', 'NOUN', 'PUNCT', 'VERB', 'NOUN']",[],0,0,10,1
US3415564A,1966-12-16,Drum hoisting beam,"['NOUN', 'NOUN', 'NOUN']",[],0,0,4,1
US3415567A,1967-04-17,Truck body,"['NOUN', 'NOUN']",[],0,0,3,1
US3415584A,1966-09-12,Knockdown cabinet construction,"['NOUN', 'NOUN', 'NOUN']",[],0,0,4,1
US3415853A,1965-04-28,"Process for the preparation of delta1,3,5(10)-3,17-dihydroxy steroids","['NOUN', 'ADP', 'DET', 'NOUN', 'ADP', 'NOUN', 'PUNCT', 'NOUN', 'NOUN']",[],0,0,10,1
US3416027A,1967-03-10,Radome lightning protection means,"['ADJ', 'NOUN', 'NOUN', 'VERB']",[],0,0,5,1
US3416063A,1965-05-14,Stabilized sine wave inverter,"['VERB', 'NOUN', 'NOUN', 'NOUN']",[],0,0,5,1
US3416097A,1964-08-27,Q-switched laser system,"['NOUN', 'PUNCT', 'VERB', 'NOUN', 'NOUN']",[],0,0,6,1
US3416103A,1966-04-05,Electronic pulse line for producing symmetrical square-topped pulses,"['ADJ', 'NOUN', 'NOUN', 'ADP', 'VERB', 'ADJ', 'ADJ', 'PUNCT', 'VERB', 'NOUN']",[],0,0,11,1
US3416185A,1965-08-24,Casket hinge structure,"['NOUN', 'NOUN', 'NOUN']",[],0,0,4,1
US3416242A,1965-03-31,Teaching machine and control system,"['VERB', 'NOUN', 'CCONJ', 'NOUN', 'NOUN']",[],0,0,6,1
US3416527A,1966-11-25,Topical arch tray,"['ADJ', 'ADJ', 'NOUN']",[],0,0,4,1
US3416555A,1965-03-09,Reversing cocks for distributing water,"['VERB', 'NOUN', 'ADP', 'VERB', 'NOUN']",[],0,0,6,1
US3416569A,1965-07-30,Mixing faucet,"['VERB', 'NOUN']",[],0,0,3,1
US3416632A,1966-10-20,Beat frequency sonic technique and apparatus for use in seismic surveys,"['VERB', 'ADJ', 'NOUN', 'NOUN', 'CCONJ', 'NOUN', 'ADP', 'NOUN', 'ADP', 'ADJ', 'NOUN']",['ORG'],0,0,12,1
US3416697A,1966-05-10,Package and removable cover therefor,"['NOUN', 'CCONJ', 'ADJ', 'NOUN', 'ADP']",[],0,0,6,1
US3416700A,1967-10-25,Safety device for easy opening container ends,"['NOUN', 'NOUN', 'ADP', 'ADJ', 'NOUN', 'NOUN', 'VERB']",[],0,0,8,1
US3416822A,1965-06-23,System for coupling and mutually securing together two parts,"['NOUN', 'ADP', 'NOUN', 'CCONJ', 'ADV', 'VERB', 'ADV', 'NUM', 'NOUN']",['CARDINAL'],0,0,10,1
US3416952A,1963-06-05,Surface modifying treatment of shaped articles made from polyesters,"['NOUN', 'NOUN', 'NOUN', 'ADP', 'VERB', 'NOUN', 'VERB', 'ADP', 'NOUN']",[],0,0,10,1
US3416977A,1966-04-01,Cryogenic cooling,"['ADJ', 'VERB']",['ORG'],0,0,3,1
US3417071A,1966-12-30,"Bleaching and stabilizing rosin compounds with 1,3,4-thiadiazole polysulfides","['NOUN', 'CCONJ', 'VERB', 'NOUN', 'VERB', 'ADP', 'NUM', 'PUNCT', 'NOUN', 'NOUN']",['CARDINAL'],0,0,11,1
US3417072A,1966-05-18,Intermediates in the synthesis of secretin,"['VERB', 'ADP', 'DET', 'NOUN', 'ADP', 'NOUN']",[],0,0,7,1
US3417084A,1963-06-13,Light absorbing dyes derived from barbituric and 2-thiobarbituric acid compounds useful for photography and their preparation,"['NOUN', 'VERB', 'NOUN', 'VERB', 'ADP', 'NOUN', 'CCONJ', 'NUM', 'PUNCT', 'ADJ', 'NOUN', 'VERB', 'ADJ', 'ADP', 'NOUN', 'CCONJ', 'PRON', 'NOUN']",['CARDINAL'],0,0,19,1
US3417085A,1965-06-03,"3,1-benzothiazines and 3,1-benzoxazines","['NOUN', 'PUNCT', 'NOUN', 'CCONJ', 'NOUN', 'PUNCT', 'NOUN']",[],0,0,8,1
US3417364A,1967-02-07,Fluorescent tube socket safety lock,"['NOUN', 'NOUN', 'NOUN', 'NOUN', 'NOUN']",[],0,0,6,1
US3417430A,1965-08-10,Screw adjustment mechanism,"['NOUN', 'NOUN', 'NOUN']",['CARDINAL'],0,0,4,1
US3417637A,1966-07-29,Manual override unit for automatic valves,"['ADJ', 'NOUN', 'NOUN', 'ADP', 'ADJ', 'NOUN']",[],0,0,7,1
US3417729A,1966-03-04,Rotor blade strike indicator,"['NOUN', 'NOUN', 'NOUN', 'NOUN']",[],0,0,5,1
US3417765A,1967-09-14,Telescoping and longitudinally adjustable crutch,"['NOUN', 'CCONJ', 'ADV', 'ADJ', 'NOUN']",[],0,0,6,1
US3417777A,1965-10-25,Valve,['VERB'],[],0,0,2,1
US3417853A,1966-12-06,Conveyor assembly,"['NOUN', 'NOUN']",['GPE'],0,0,3,1
US3417887A,1967-01-30,Chokerless skidder,"['NOUN', 'NOUN']",[],0,0,3,1
US3417998A,1967-04-18,Vertical record player,"['ADJ', 'NOUN', 'NOUN']",['ORG'],0,0,4,1
US3418023A,1965-11-18,Longwall coal-cutting machine,"['ADJ', 'NOUN', 'PUNCT', 'VERB', 'NOUN']",[],0,0,6,1
