patent_number,date,title,spacy_pos,spacy_label,is_prpn_spacy,is_person_spacy,spacy_pos_len,bad_endings
US3400427A,1964-03-02,Hose curing unit,"['PROPN', 'VERB', 'NOUN']",['PERSON'],1,1,4,1
US3400428A,1963-07-04,Method of and apparatus for extruding high-viscous thermoplastic plastics materials,"['PROPN', 'ADP', 'CCONJ', 'NOUN', 'ADP', 'VERB', 'ADJ', 'PUNCT', 'ADJ', 'ADJ', 'NOUN', 'NOUN']",[],1,0,13,1
US3400494A,1965-09-24,Apparatus for machining hard materials,"['PROPN', 'ADP', 'VERB', 'ADJ', 'NOUN']",[],1,0,6,1
US3401150A,1960-04-20,Method of preparing condensation polyester resins,"['PROPN', 'ADP', 'VERB', 'NOUN', 'NOUN', 'NOUN']",[],1,0,7,1
US3401338A,1966-04-11,Tester for semiconductor devices having a zener diode controlled bias removal protection circuit,"['PROPN', 'ADP', 'NOUN', 'NOUN', 'VERB', 'DET', 'NOUN', 'NOUN', 'VERB', 'NOUN', 'NOUN', 'NOUN', 'NOUN']",[],1,0,14,1
US3401805A,1965-08-25,Tongs turner for rolled material,"['PROPN', 'NOUN', 'ADP', 'VERB', 'NOUN']",['GPE'],1,0,6,1
US3402038A,1965-04-02,Apparatus for heating and tempering glass sheets,"['PROPN', 'ADP', 'NOUN', 'CCONJ', 'VERB', 'NOUN', 'NOUN']",[],1,0,8,1
US3402145A,1962-11-19,Thermally stable phenolic composition with inorganic phosphorus-nitrogen modifications,"['ADV', 'ADJ', 'ADJ', 'NOUN', 'ADP', 'ADJ', 'PROPN', 'PUNCT', 'NOUN', 'NOUN']",[],1,0,11,1
US3402203A,1964-11-19,"Process of preparing n, n-dimethylamino alcohols","['PROPN', 'ADP', 'VERB', 'ADP', 'PUNCT', 'ADJ', 'PUNCT', 'ADJ', 'NOUN']",[],1,0,10,1
US3404327A,1958-12-16,Conversion systems comprising scr's with gate control arrangements,"['NOUN', 'NOUN', 'VERB', 'NOUN', 'PART', 'ADP', 'PROPN', 'PROPN', 'NOUN']",[],1,0,10,1
US3405090A,1963-01-04,Ultraviolet light stable poly-alpha-olefin composition,"['PROPN', 'ADJ', 'ADJ', 'NOUN', 'PUNCT', 'NOUN', 'PUNCT', 'NOUN', 'NOUN']",[],1,0,10,1
US3405095A,1965-12-24,Polymerization of unsaturated aldehydes using metallic silver as reducing agent in aredox catalyst,"['NOUN', 'ADP', 'ADJ', 'NOUN', 'VERB', 'ADJ', 'NOUN', 'ADP', 'VERB', 'NOUN', 'ADP', 'PROPN', 'NOUN']",[],1,0,14,1
US3405135A,1964-04-09,Process for producing n:n'-disubstituted 4:4'-bipyridylium salts,"['PROPN', 'ADP', 'VERB', 'ADV', 'PUNCT', 'VERB', 'NUM', 'NOUN']",[],1,0,9,1
US3405321A,1966-09-07,Solid state magnetron modulator mismatch protective circuit,"['ADJ', 'NOUN', 'NOUN', 'NOUN', 'PROPN', 'ADJ', 'NOUN']",[],1,0,8,1
US3405500A,1966-10-24,Method and apparatus for filling liquids into bottles and for capping the same,"['PROPN', 'CCONJ', 'NOUN', 'ADP', 'VERB', 'NOUN', 'ADP', 'NOUN', 'CCONJ', 'ADP', 'VERB', 'DET', 'ADJ']",[],1,0,14,1
US3405502A,1963-08-13,Apparatus for forming commodity bearing sachets from pressure sensitive or heat sealable material,"['PROPN', 'ADP', 'VERB', 'NOUN', 'VERB', 'NOUN', 'ADP', 'NOUN', 'ADJ', 'CCONJ', 'NOUN', 'ADJ', 'NOUN']",[],1,0,14,1
US3405508A,1965-10-08,Method and apparatus for purifying gases,"['PROPN', 'CCONJ', 'NOUN', 'ADP', 'VERB', 'NOUN']",[],1,0,7,1
US3405509A,1966-11-08,Means for conserving heat and regulating temperature in a stack,"['PROPN', 'ADP', 'VERB', 'NOUN', 'CCONJ', 'VERB', 'NOUN', 'ADP', 'DET', 'NOUN']",[],1,0,11,1
US3405510A,1967-03-07,Apparatus for transporting hydrogen,"['PROPN', 'ADP', 'VERB', 'NOUN']",[],1,0,5,1
US3405833A,1963-06-10,Biaxially oriented alkenyl aromatic resinous tape having a pressure sensitive adhesive thereon,"['ADV', 'VERB', 'NOUN', 'ADJ', 'ADJ', 'NOUN', 'VERB', 'DET', 'NOUN', 'ADJ', 'PROPN', 'PROPN']",[],1,0,13,1
US3406101A,1963-12-23,Method and apparatus for determining corrosion rate,"['PROPN', 'CCONJ', 'NOUN', 'ADP', 'VERB', 'NOUN', 'NOUN']",[],1,0,8,1
US3406148A,1964-11-13,"Cross-linked polyimides and methods of producing same from halogenated n,n'-bis-maleimides","['ADJ', 'ADJ', 'VERB', 'NOUN', 'CCONJ', 'NOUN', 'ADP', 'VERB', 'ADJ', 'ADP', 'ADJ', 'PROPN', 'PUNCT', 'NOUN', 'PUNCT', 'NOUN']",[],1,0,17,1
US3406550A,1966-12-19,Apparatus for forming wire cable grips,"['PROPN', 'ADP', 'VERB', 'NOUN', 'NOUN', 'NOUN']",[],1,0,7,1
US3407337A,1966-11-15,Leak detector for swimming pool lights and the like,"['PROPN', 'NOUN', 'ADP', 'NOUN', 'NOUN', 'NOUN', 'CCONJ', 'DET', 'ADJ']",[],1,0,10,1
US3407714A,1966-04-13,Apparatus for anchoring the margin of synthetic turf,"['PROPN', 'ADP', 'VERB', 'DET', 'NOUN', 'ADP', 'ADJ', 'NOUN']",[],1,0,9,1
US3408306A,1959-07-20,Method of controlling foaming,"['PROPN', 'ADP', 'VERB', 'VERB']",[],1,0,5,1
US3408566A,1964-03-17,Phase shift method and apparatus for mass-independent measurement of the properties of dielectric materials,"['NOUN', 'NOUN', 'NOUN', 'CCONJ', 'NOUN', 'ADP', 'ADJ', 'PUNCT', 'ADJ', 'NOUN', 'ADP', 'DET', 'NOUN', 'ADP', 'PROPN', 'NOUN']",[],1,0,17,1
US3408569A,1964-09-08,Null balance for ph meter,"['ADJ', 'NOUN', 'ADP', 'PROPN', 'NOUN']",[],1,0,6,1
US3408780A,1966-08-23,Guy wire anchorage device for attachment to a sloping shingle roof,"['PROPN', 'NOUN', 'NOUN', 'NOUN', 'ADP', 'NOUN', 'ADP', 'DET', 'VERB', 'NOUN', 'NOUN']",[],1,0,12,1
US3408790A,1966-06-14,Lightweight harness,"['PROPN', 'NOUN']",[],1,0,3,1
US3409603A,1966-02-01,Method of polymerizing conjugated diolefins by contacting same with a catalyst comprising a complex of a lithium hydrocarbon with a cobaltocene or nickelocene,"['PROPN', 'ADP', 'VERB', 'VERB', 'NOUN', 'ADP', 'VERB', 'ADJ', 'ADP', 'DET', 'NOUN', 'VERB', 'DET', 'NOUN', 'ADP', 'DET', 'NOUN', 'NOUN', 'ADP', 'DET', 'NOUN', 'CCONJ', 'NOUN']",[],1,0,24,1
US3410177A,1966-06-20,Apparatus for providing a command signal for a servoactuator,"['PROPN', 'ADP', 'VERB', 'DET', 'NOUN', 'NOUN', 'ADP', 'DET', 'NOUN']",[],1,0,10,1
US3410517A,1966-03-15,Hose water regulator,"['PROPN', 'NOUN', 'NOUN']",['PERSON'],1,1,4,1
US3410943A,1960-05-20,Method of imparting high gloss and stain-resistance to thermosetting molded articles,"['PROPN', 'ADP', 'VERB', 'ADJ', 'NOUN', 'CCONJ', 'NOUN', 'PUNCT', 'NOUN', 'ADP', 'VERB', 'VERB', 'NOUN']",[],1,0,14,1
US3411112A,1966-04-15,Ferrimagnetic couplers employing a transition from air dielectric waveguide to solid dielectric waveguide,"['ADJ', 'NOUN', 'VERB', 'DET', 'NOUN', 'ADP', 'PROPN', 'PROPN', 'PROPN', 'ADP', 'ADJ', 'PROPN', 'PROPN']",[],1,0,14,1
US3411118A,1966-07-28,Vacuum relay with improved armature mounting and movable contact,"['PROPN', 'NOUN', 'ADP', 'ADJ', 'NOUN', 'VERB', 'CCONJ', 'ADJ', 'NOUN']",[],1,0,10,1
US3411274A,1965-06-25,Combine harvesters,"['PROPN', 'VERB']",[],1,0,3,1
US3411425A,1967-01-09,Air diffusion outlet with laterally adjustable weir control,"['NOUN', 'NOUN', 'NOUN', 'ADP', 'ADV', 'ADJ', 'PROPN', 'PROPN']",[],1,0,9,1
US3411616A,1965-07-26,Cigar overwrapping and banding machine,"['PROPN', 'VERB', 'CCONJ', 'ADJ', 'NOUN']",['PERSON'],1,1,6,1
US3411852A,1963-11-06,Optical monitoring apparatus which includes a reflector system for focusing light ona sample and for receiving light reflected from the sample,"['ADJ', 'NOUN', 'NOUN', 'PRON', 'VERB', 'DET', 'NOUN', 'NOUN', 'ADP', 'VERB', 'ADJ', 'PROPN', 'NOUN', 'CCONJ', 'ADP', 'VERB', 'NOUN', 'VERB', 'ADP', 'DET', 'NOUN']",[],1,0,22,1
US3412302A,1966-04-28,Reversible direct coupled drive circuit for stepping motors,"['ADJ', 'ADJ', 'VERB', 'NOUN', 'NOUN', 'ADP', 'PROPN', 'NOUN']",[],1,0,9,1
US3412741A,1966-04-11,Method and apparatus for treating liquids with gas,"['PROPN', 'CCONJ', 'NOUN', 'ADP', 'VERB', 'NOUN', 'ADP', 'NOUN']",[],1,0,9,1
US3412929A,1966-12-06,Inline centrifugal fan,"['PROPN', 'ADJ', 'NOUN']",[],1,0,4,1
US3412937A,1966-05-20,Spray gun with paint agitator,"['PROPN', 'NOUN', 'ADP', 'NOUN', 'NOUN']",[],1,0,6,1
US3412970A,1966-05-16,Resilient insert pilot seat and connector,"['ADJ', 'PROPN', 'NOUN', 'NOUN', 'CCONJ', 'NOUN']",[],1,0,7,1
US3413296A,1965-06-28,"Certain 11-(3-tropanyloxy)-6, 11-dihydro-dibenzo[b, e] thiepin derivatives","['ADJ', 'PROPN', 'PUNCT', 'ADV', 'PUNCT', 'NUM', 'PUNCT', 'NOUN', 'PUNCT', 'NOUN', 'PUNCT', 'NOUN', 'PUNCT', 'NOUN', 'VERB']","['CARDINAL', 'CARDINAL']",1,0,16,1
US3413417A,1965-03-30,Auxiliary earphone circuit for a high voltage transistor amplifier,"['PROPN', 'NOUN', 'NOUN', 'ADP', 'DET', 'ADJ', 'NOUN', 'NOUN', 'ADP']",[],1,0,10,1
US3413545A,1965-06-23,Apparatus and method for determining aerosol particle concentration and particle size distribution,"['PROPN', 'CCONJ', 'NOUN', 'ADP', 'VERB', 'NOUN', 'NOUN', 'NOUN', 'CCONJ', 'NOUN', 'NOUN', 'NOUN']",[],1,0,13,1
US3413571A,1965-11-03,Keyer/modulator circuit for encoding generalized periodic waveforms into phase script,"['PROPN', 'SYM', 'NOUN', 'NOUN', 'ADP', 'VERB', 'VERB', 'ADJ', 'NOUN', 'ADP', 'NOUN', 'NOUN']",['ORG'],1,0,13,1
US3413631A,1965-08-23,Indicator apparatus,"['PROPN', 'NOUN']",[],1,0,3,1
US3414068A,1965-12-27,Method of treating abrasive-laden drilling liquid,"['PROPN', 'ADP', 'VERB', 'ADJ', 'PUNCT', 'NOUN', 'NOUN', 'NOUN']",[],1,0,9,1
US3414399A,1959-09-11,Method for control of plant growth,"['PROPN', 'ADP', 'NOUN', 'ADP', 'NOUN', 'NOUN']",[],1,0,7,1
US3414438A,1963-09-27,Fuel cell having sintered porous electrode consisting of electrically conductive material and of boron,"['NOUN', 'NOUN', 'AUX', 'VERB', 'ADJ', 'NOUN', 'VERB', 'ADP', 'ADV', 'ADJ', 'NOUN', 'CCONJ', 'ADP', 'PROPN']",[],1,0,15,1
US3414586A,1963-10-01,Acetoamido derivatives,"['PROPN', 'VERB']",[],1,0,3,1
US3414980A,1967-02-21,Method of spray drying,"['PROPN', 'ADP', 'NOUN', 'VERB']",[],1,0,5,1
US3416275A,1965-06-23,Wall construction,"['PROPN', 'NOUN']",[],1,0,3,1
US3416343A,1963-03-28,Method and means for forming fittings,"['PROPN', 'CCONJ', 'VERB', 'ADP', 'VERB', 'NOUN']",[],1,0,7,1
US3416359A,1966-07-01,Method and apparatus for testing hermetically sealed transistor devices,"['PROPN', 'CCONJ', 'NOUN', 'ADP', 'VERB', 'ADV', 'VERB', 'NOUN', 'NOUN']",[],1,0,10,1
US3416437A,1967-06-26,Laundry loaders,"['PROPN', 'VERB']",['ORG'],1,0,3,1
US3416655A,1966-06-30,Tray-enclosed jewelry box,"['PROPN', 'PUNCT', 'VERB', 'NOUN', 'NOUN']",[],1,0,6,1
US3416724A,1966-07-21,Low resistance strip valve,"['ADJ', 'NOUN', 'PROPN', 'VERB']",[],1,0,5,1
US3416899A,1966-10-03,Gel compositions and preparation,"['PROPN', 'NOUN', 'CCONJ', 'NOUN']",[],1,0,5,1
US3416976A,1965-11-16,Method for heat treating titanium carbide tool steel,"['PROPN', 'ADP', 'NOUN', 'VERB', 'NOUN', 'PROPN', 'NOUN', 'NOUN']",[],1,0,9,1
US3416995A,1965-09-13,Apparatus for loosening cementitious water-laid pipe from a mandrel,"['PROPN', 'ADP', 'VERB', 'ADJ', 'NOUN', 'PUNCT', 'VERB', 'NOUN', 'ADP', 'DET', 'NOUN']",[],1,0,12,1
US3418632A,1965-08-26,Means for merging sequences of data,"['PROPN', 'ADP', 'VERB', 'NOUN', 'ADP', 'NOUN']",[],1,0,7,1
US3419080A,1965-10-23,Zone protection apparatus,"['PROPN', 'NOUN', 'NOUN']",[],1,0,4,1
US3420169A,1966-07-29,Master handling means for duplicating machines,"['PROPN', 'NOUN', 'NOUN', 'ADP', 'VERB', 'NOUN']",[],1,0,7,1
US3420406A,1967-10-27,Cup dispenser invertible to dispense cups of different sizes,"['PROPN', 'NOUN', 'ADJ', 'PART', 'NOUN', 'NOUN', 'ADP', 'ADJ', 'NOUN']",[],1,0,10,1
US3420464A,1965-09-23,Strip film adapter,"['PROPN', 'NOUN', 'NOUN']",['LOC'],1,0,4,1
US3420620A,1966-08-11,Monofluoro-polyphosphates,"['PROPN', 'PUNCT', 'NOUN']",['GPE'],1,0,4,1
US3420623A,1967-06-01,Manufacture of purified ammonium phosphates from wet process phosphoric acid,"['PROPN', 'ADP', 'ADJ', 'NOUN', 'NOUN', 'ADP', 'ADJ', 'NOUN', 'PROPN', 'PROPN']",[],1,0,11,1
US3420840A,1960-08-04,Fluorinated compounds,"['PROPN', 'VERB']",[],1,0,3,1
US3420858A,1964-12-11,Process for the production of fatty acid esters of hydroxy sulfonates,"['NOUN', 'ADP', 'DET', 'NOUN', 'ADP', 'ADJ', 'PROPN', 'NOUN', 'ADP', 'ADJ', 'NOUN']",[],1,0,12,1
US3420938A,1965-06-23,Apparatus for delivering molten materials,"['PROPN', 'ADP', 'VERB', 'ADJ', 'NOUN']",[],1,0,6,1
US3420980A,1966-07-22,Method and material for hard-surfacing,"['PROPN', 'CCONJ', 'NOUN', 'ADP', 'ADV', 'PUNCT', 'VERB']",[],1,0,8,1
US3422063A,1964-08-03,Epoxide resin from epichlorohydrin and a mixture of bisphenols,"['PROPN', 'NOUN', 'ADP', 'NOUN', 'CCONJ', 'DET', 'NOUN', 'ADP', 'NOUN']",[],1,0,10,1
US3422182A,1964-10-30,Method of treating an animal having demodectic mange,"['PROPN', 'ADP', 'VERB', 'DET', 'NOUN', 'VERB', 'ADJ', 'NOUN']",[],1,0,9,1
US3422213A,1966-04-21,Connector strips,"['PROPN', 'VERB']",[],1,0,3,1
US3422341A,1965-06-18,Rectifying apparatus for producing constant d.c. output voltage,"['PROPN', 'NOUN', 'ADP', 'VERB', 'ADJ', 'PROPN', 'PUNCT', 'NOUN', 'NOUN']",['PERSON'],1,1,10,1
US3422343A,1966-11-21,Reactive power compensation by phase angle control and tap changer means,"['ADJ', 'NOUN', 'NOUN', 'ADP', 'NOUN', 'PROPN', 'NOUN', 'CCONJ', 'NOUN', 'NOUN', 'VERB']",[],1,0,12,1
US3422344A,1964-10-02,Quantum optical detection systems with two alkali resonance cells,"['PROPN', 'ADJ', 'NOUN', 'NOUN', 'ADP', 'NUM', 'ADJ', 'NOUN', 'NOUN']","['ORG', 'CARDINAL']",1,0,10,1
US3422713A,1965-12-18,Apparatus for granulating plastic string,"['PROPN', 'ADP', 'VERB', 'NOUN', 'NOUN']",[],1,0,6,1
US3423227A,1965-09-27,Organophosphorus polymer protective coating,"['PROPN', 'NOUN', 'ADJ', 'NOUN']",[],1,0,5,1
US3423791A,1966-09-28,Apparatus for forming walled structures of plastic foam,"['PROPN', 'ADP', 'VERB', 'ADJ', 'NOUN', 'ADP', 'NOUN', 'NOUN']",[],1,0,9,1
US3423925A,1964-10-27,Method of spinning fibers from a fluid suspension,"['PROPN', 'ADP', 'VERB', 'NOUN', 'ADP', 'DET', 'ADJ', 'NOUN']",[],1,0,9,1
US3424136A,1965-11-10,Intake system for rotary piston internal combustion engine,"['ADJ', 'NOUN', 'ADP', 'ADJ', 'PROPN', 'PROPN', 'PROPN', 'NOUN']",[],1,0,9,1
US3424173A,1967-09-14,Filter element for selectively removing nicotine from tobacco smoke,"['PROPN', 'NOUN', 'ADP', 'ADV', 'VERB', 'NOUN', 'ADP', 'NOUN', 'NOUN']",[],1,0,10,1
US3424412A,1967-03-28,Mounting bracket for outboard motors,"['VERB', 'NOUN', 'ADP', 'PROPN', 'NOUN']",[],1,0,6,1
US3424586A,1963-06-10,Silver halide emulsions sensitized with cyanine dyes containing a hydroxypropyl sulfonic acid radical,"['ADJ', 'NOUN', 'NOUN', 'VERB', 'ADP', 'ADJ', 'NOUN', 'VERB', 'DET', 'PROPN', 'ADJ', 'PROPN', 'ADJ']",[],1,0,14,1
US3424989A,1964-05-19,Circuit for conserving battery power by eliminating the third harmonic of an electrical square wave,"['PROPN', 'ADP', 'VERB', 'NOUN', 'NOUN', 'ADP', 'VERB', 'DET', 'ADJ', 'NOUN', 'ADP', 'DET', 'ADJ', 'ADJ', 'NOUN']",['ORDINAL'],1,0,16,1
US3425113A,1966-09-21,Method of making composite sheet structures with internal passages by roll bonding,"['PROPN', 'ADP', 'VERB', 'ADJ', 'NOUN', 'NOUN', 'ADP', 'ADJ', 'NOUN', 'ADP', 'NOUN', 'NOUN']",[],1,0,13,1
US3425207A,1965-12-09,"Rope,strand or the like","['PROPN', 'PUNCT', 'PROPN', 'CCONJ', 'DET', 'ADJ']",[],1,0,7,1
US3425537A,1967-11-13,Combination shipping and display carton,"['NOUN', 'NOUN', 'CCONJ', 'VERB', 'PROPN']",[],1,0,6,1
US3425777A,1966-10-17,Photocopier cycling apparatus,"['PROPN', 'NOUN', 'NOUN']",[],1,0,4,1
US3425883A,1965-02-23,Method of making a molded v-belt,"['PROPN', 'ADP', 'VERB', 'DET', 'VERB', 'NOUN', 'PUNCT', 'NOUN']",[],1,0,9,1
US3426699A,1966-11-29,Overhead rail systems,"['PROPN', 'NOUN', 'NOUN']",[],1,0,4,1
US3426700A,1966-11-22,Carrier for power and free conveyor systems,"['PROPN', 'ADP', 'NOUN', 'CCONJ', 'ADJ', 'NOUN', 'NOUN']",[],1,0,8,1
US3427764A,1966-02-21,Method of pointing wire-like elements,"['PROPN', 'ADP', 'VERB', 'NOUN', 'PUNCT', 'ADJ', 'NOUN']",[],1,0,8,1
US3427871A,1966-07-11,Method and apparatus for in situ bore hole testing,"['PROPN', 'CCONJ', 'NOUN', 'ADP', 'ADP', 'ADJ', 'NOUN', 'NOUN', 'VERB']",[],1,0,10,1
US3427934A,1966-08-31,Ski slope or the like with layer of tree bark,"['NOUN', 'NOUN', 'CCONJ', 'DET', 'NOUN', 'ADP', 'NOUN', 'ADP', 'NOUN', 'PROPN']",[],1,0,11,1
US3428124A,1967-02-03,Apparatus and method for sealing deep wells,"['PROPN', 'CCONJ', 'NOUN', 'ADP', 'VERB', 'ADJ', 'NOUN']",[],1,0,8,1
US3428381A,1965-09-22,Utensil tray,"['PROPN', 'VERB']",['GPE'],1,0,3,1
US3428428A,1964-05-27,Production of hydrides of elements of group v of the periodic system,"['NOUN', 'ADP', 'NOUN', 'ADP', 'NOUN', 'ADP', 'NOUN', 'PROPN', 'ADP', 'DET', 'ADJ', 'NOUN']",[],1,0,13,1
US3428461A,1965-09-29,Culinary mixes,"['PROPN', 'VERB']",[],1,0,3,1
US3428629A,1965-07-13,Halovinyl compounds,"['PROPN', 'VERB']",['PERSON'],1,1,3,1
US3428806A,1965-07-30,Apparatus for measuring the humidity and mass of soils,"['PROPN', 'ADP', 'VERB', 'DET', 'NOUN', 'CCONJ', 'NOUN', 'ADP', 'NOUN']",[],1,0,10,1
US3429038A,1966-08-01,Method of manufacturing electrical intraconnectors,"['PROPN', 'ADP', 'VERB', 'ADJ', 'NOUN']",[],1,0,6,1
US3429360A,1966-06-08,Method of preparing sand molds,"['PROPN', 'ADP', 'VERB', 'NOUN', 'VERB']",[],1,0,6,1
US3429618A,1967-01-17,Apparatus for the flat laying of stockings,"['PROPN', 'ADP', 'DET', 'ADJ', 'NOUN', 'ADP', 'NOUN']",[],1,0,8,1
US3429830A,1964-09-14,Process for preparing a crystalline zeolite catalyst composite,"['NOUN', 'ADP', 'VERB', 'DET', 'NOUN', 'NOUN', 'PROPN', 'PROPN']",[],1,0,9,1
US3430085A,1966-03-10,Stator cooling system for a.c. generator,"['NOUN', 'VERB', 'NOUN', 'ADP', 'PROPN', 'PROPN', 'NOUN']",[],1,0,8,1
US3430279A,1966-05-23,Polisher for high voltage electric lines,"['PROPN', 'ADP', 'ADJ', 'NOUN', 'ADJ', 'NOUN']",[],1,0,7,1
US3430423A,1967-03-31,Automatic locking control for cutter bar,"['ADJ', 'NOUN', 'NOUN', 'ADP', 'NOUN', 'PROPN']",[],1,0,7,1
US3431292A,1966-12-23,Olefinic nitriles by ammoxidation of olefins with promoted antimony oxideuranium oxide catalyst,"['ADJ', 'NOUN', 'ADP', 'NOUN', 'ADP', 'NOUN', 'ADP', 'VERB', 'ADP', 'PROPN', 'NOUN', 'NOUN']",[],1,0,13,1
US3431586A,1966-12-12,Hideaway handle with i-shaped link,"['PROPN', 'VERB', 'ADP', 'NOUN', 'PUNCT', 'VERB', 'NOUN']",[],1,0,8,1
US3431614A,1965-10-21,Method for manufacturing an electrode,"['PROPN', 'ADP', 'VERB', 'DET', 'NOUN']",[],1,0,6,1
US3431624A,1966-10-14,Strip inspection system,"['PROPN', 'NOUN', 'NOUN']",[],1,0,4,1
US3431693A,1966-12-08,Hanger structure,"['PROPN', 'NOUN']",[],1,0,3,1
US3431767A,1966-06-24,Method for making dies,"['PROPN', 'ADP', 'VERB', 'VERB']",[],1,0,5,1
US3432268A,1964-08-28,Method and apparatus for testing cell suspensions,"['PROPN', 'CCONJ', 'NOUN', 'ADP', 'VERB', 'NOUN', 'NOUN']",[],1,0,8,1
US3432288A,1966-06-29,Process control of top-blown oxygen converter,"['PROPN', 'NOUN', 'ADP', 'ADV', 'PUNCT', 'VERB', 'NOUN', 'NOUN']",[],1,0,9,1
US3432614A,1961-06-15,Apparatus for recording video and audio signals with means for facilitating synchronous cutting,"['PROPN', 'ADP', 'VERB', 'NOUN', 'CCONJ', 'ADJ', 'NOUN', 'ADP', 'NOUN', 'ADP', 'VERB', 'ADJ', 'NOUN']",[],1,0,14,1
US3432763A,1966-12-13,Amplifier employing nonlinear dc negative feedback to stabilize its dc operating point,"['ADP', 'VERB', 'ADJ', 'NOUN', 'ADJ', 'NOUN', 'PART', 'VERB', 'PRON', 'PROPN', 'NOUN', 'NOUN']",['PERSON'],1,1,13,1
US3432824A,1964-06-25,Multiapertured magnetic memory element,"['PROPN', 'ADJ', 'NOUN', 'NOUN']",[],1,0,5,1
US3433273A,1967-10-03,Weft controller,"['PROPN', 'VERB']",[],1,0,3,1
US3433476A,1966-01-13,Apparatus for elimination of sheets in cross cutting and similar machines,"['PROPN', 'ADP', 'NOUN', 'ADP', 'NOUN', 'ADP', 'NOUN', 'NOUN', 'CCONJ', 'ADJ', 'NOUN']",[],1,0,12,1
US3433575A,1964-05-28,Polyurethane associated with fibrous substrate through reaction with polyamide,"['PROPN', 'VERB', 'ADP', 'ADJ', 'NOUN', 'ADP', 'NOUN', 'ADP', 'NOUN']",[],1,0,10,1
US3433747A,1966-11-04,Method of preparing petroleum cracking catalysts,"['PROPN', 'ADP', 'VERB', 'NOUN', 'VERB', 'NOUN']",[],1,0,7,1
US3434206A,1964-05-12,Method of manufacturing a laminated foil resistor,"['PROPN', 'ADP', 'VERB', 'DET', 'VERB', 'NOUN', 'NOUN']",[],1,0,8,1
US3434248A,1965-10-20,Apparatus and method for grinding inserts,"['PROPN', 'CCONJ', 'NOUN', 'ADP', 'VERB', 'NOUN']",[],1,0,7,1
US3434655A,1967-10-23,Rotary compressor,"['PROPN', 'NOUN']",['GPE'],1,0,3,1
US3434804A,1964-08-06,Apparatus utilizing a webbed stirrer for continuous mixing,"['PROPN', 'VERB', 'DET', 'VERB', 'NOUN', 'ADP', 'ADJ', 'NOUN']",[],1,0,9,1
US3434994A,1963-02-19,Oil extension of high solids latex,"['NOUN', 'NOUN', 'ADP', 'ADJ', 'NOUN', 'PROPN']",[],1,0,7,1
US3435661A,1967-01-06,Gas sample injection apparatus,"['NOUN', 'NOUN', 'PROPN', 'NOUN']",[],1,0,5,1
US3436183A,1965-07-31,Method for preparing diamond crystals,"['PROPN', 'ADP', 'VERB', 'NOUN', 'NOUN']",[],1,0,6,1
US3436227A,1966-01-03,Method for reducing foam in instant coffee,"['PROPN', 'ADP', 'VERB', 'NOUN', 'ADP', 'ADJ', 'NOUN']",[],1,0,8,1
US3436228A,1965-08-13,Method of treating dough before baking,"['PROPN', 'ADP', 'VERB', 'NOUN', 'ADP', 'VERB']",[],1,0,7,1
US3436237A,1966-10-25,Coke bonded basic refractory,"['PROPN', 'VERB', 'ADJ', 'NOUN']",['ORG'],1,0,5,1
US3436250A,1964-08-25,Method for retaining flame and soil resistances to fabrics,"['PROPN', 'ADP', 'VERB', 'NOUN', 'CCONJ', 'NOUN', 'NOUN', 'ADP', 'NOUN']",[],1,0,10,1
US3436304A,1965-05-19,Method for manufacturing nonwoven fibrous products from gel fibers,"['PROPN', 'ADP', 'VERB', 'ADJ', 'ADJ', 'NOUN', 'ADP', 'PROPN', 'NOUN']",[],1,0,10,1
US3436359A,1965-10-14,Polyether polyprimary polyamines and elastomeric products thereof,"['PROPN', 'ADJ', 'NOUN', 'CCONJ', 'ADJ', 'NOUN', 'ADV']",[],1,0,8,1
US3436447A,1966-04-19,Manufacture of reinforced plastic sleeving and the like,"['PROPN', 'ADP', 'VERB', 'NOUN', 'NOUN', 'CCONJ', 'DET', 'ADJ']",[],1,0,9,1
US3436946A,1964-02-06,Method of and apparatus for making terminals for making electrical connections,"['PROPN', 'ADP', 'CCONJ', 'NOUN', 'ADP', 'VERB', 'NOUN', 'ADP', 'VERB', 'ADJ', 'NOUN']",[],1,0,12,1
US3437128A,1964-09-28,Method and apparatus for continuous casting,"['PROPN', 'CCONJ', 'NOUN', 'ADP', 'ADJ', 'NOUN']",[],1,0,7,1
US3437511A,1966-04-07,"Metal surfaced with boron and coating of silicon,silicon carbide or titanium nitride","['NOUN', 'VERB', 'ADP', 'NOUN', 'CCONJ', 'NOUN', 'ADP', 'NOUN', 'PUNCT', 'PROPN', 'PROPN', 'CCONJ', 'NOUN', 'NOUN']",[],1,0,15,1
US3437997A,1965-01-19,Audiofrequency remote control system for working equipment,"['PROPN', 'ADJ', 'NOUN', 'NOUN', 'ADP', 'NOUN', 'NOUN']",[],1,0,8,1
US3438838A,1964-11-12,Method of manufacturing decorative panels and the resulting article formed thereby,"['PROPN', 'ADP', 'VERB', 'ADJ', 'NOUN', 'CCONJ', 'DET', 'VERB', 'NOUN', 'VERB', 'ADV']",[],1,0,12,1
US3438934A,1966-08-18,Salicylate stabilized fluoro-polymers,"['PROPN', 'VERB', 'PROPN', 'PUNCT', 'NOUN']","['ORG', 'GPE']",1,0,6,1
US3439224A,1966-10-24,Electron injection plasma variable reactance device,"['PROPN', 'NOUN', 'VERB', 'ADJ', 'NOUN', 'NOUN']",[],1,0,7,1
US3439521A,1965-09-17,Apparatus for corrugating sets of fins on sectors of tubular elements,"['PROPN', 'ADP', 'ADJ', 'NOUN', 'ADP', 'NOUN', 'ADP', 'NOUN', 'ADP', 'ADJ', 'NOUN']",[],1,0,12,1
US3439977A,1964-07-22,Journal for actuator of glare reducing rear vision mirror,"['PROPN', 'ADP', 'NOUN', 'ADP', 'NOUN', 'VERB', 'ADJ', 'NOUN', 'NOUN']",['ORG'],1,0,10,1
US3440041A,1966-05-06,Method of producing rare earth metals and silicon alloys,"['PROPN', 'ADP', 'VERB', 'ADJ', 'NOUN', 'NOUN', 'CCONJ', 'NOUN', 'NOUN']",[],1,0,10,1
US3440102A,1963-12-27,Method of operating a fuel cell with an insoluble fuel,"['PROPN', 'ADP', 'VERB', 'DET', 'NOUN', 'NOUN', 'ADP', 'DET', 'ADJ', 'NOUN']",[],1,0,11,1
US3440263A,1964-12-23,Method of preparing modified silicone polymers,"['PROPN', 'ADP', 'VERB', 'VERB', 'NOUN', 'NOUN']",[],1,0,7,1
US3440315A,1966-03-29,Method of bedding panels into frames,"['PROPN', 'ADP', 'ADJ', 'NOUN', 'ADP', 'NOUN']",[],1,0,7,1
US3440346A,1965-11-24,Method of multiplex representation of sampled data,"['PROPN', 'ADP', 'PROPN', 'NOUN', 'ADP', 'VERB', 'NOUN']",[],1,0,8,1
US3440364A,1965-12-21,Speaker magnet having curved preferred direction of magnetization,"['PROPN', 'NOUN', 'AUX', 'VERB', 'ADJ', 'NOUN', 'ADP', 'NOUN']",[],1,0,9,1
US3441024A,1966-03-21,Loin garment for absorbent pads,"['PROPN', 'NOUN', 'ADP', 'NOUN', 'VERB']",[],1,0,6,1
US3441320A,1967-08-04,Vehicle wheel brake antilock system and method,"['PROPN', 'NOUN', 'NOUN', 'NOUN', 'NOUN', 'CCONJ', 'VERB']",[],1,0,8,1
US3442404A,1967-04-27,Method and apparatus for disposal of waste employing rail and off-road equipment,"['PROPN', 'CCONJ', 'NOUN', 'ADP', 'NOUN', 'ADP', 'NOUN', 'NOUN', 'NOUN', 'CCONJ', 'ADP', 'PUNCT', 'NOUN', 'NOUN']",[],1,0,15,1
US3442509A,1967-03-30,Merry-go-round,"['PROPN', 'PUNCT', 'VERB', 'PUNCT', 'NOUN']",[],1,0,6,1
US3444703A,1966-04-10,Guide bar swinging mechanism for a double needle bar warp knitting machine,"['PROPN', 'NOUN', 'NOUN', 'NOUN', 'ADP', 'DET', 'ADJ', 'NOUN', 'NOUN', 'NOUN', 'VERB', 'NOUN']",[],1,0,13,1
US3444717A,1967-04-18,Strip metal deforming apparatus,"['PROPN', 'NOUN', 'VERB', 'NOUN']",['LOC'],1,0,5,1
US3445305A,1967-06-02,Gelation of galactomannan containing water-bearing explosives,"['PROPN', 'ADP', 'NOUN', 'VERB', 'NOUN', 'PUNCT', 'VERB', 'NOUN']",[],1,0,9,1
US3445314A,1965-10-22,Strip material applicator,"['PROPN', 'NOUN', 'NOUN']",[],1,0,4,1
US3445468A,1964-10-13,Spiro thiophosphates,"['PROPN', 'VERB']",['PERSON'],1,1,3,1
US3445909A,1966-11-02,Method of making bearing material,"['PROPN', 'ADP', 'VERB', 'VERB', 'NOUN']",[],1,0,6,1
US3446202A,1966-09-02,Radiator mounting assembly for gas wall heater,"['NOUN', 'VERB', 'NOUN', 'ADP', 'NOUN', 'NOUN', 'PROPN']",[],1,0,8,1
US3446269A,1966-08-08,Apparatus for the transporting of the intermediate container of continuous casting machines,"['PROPN', 'ADP', 'DET', 'NOUN', 'ADP', 'DET', 'ADJ', 'NOUN', 'ADP', 'ADJ', 'NOUN', 'NOUN']",[],1,0,13,1
US3446434A,1968-04-26,Irrigating apparatus connector assembly,"['NOUN', 'NOUN', 'PROPN', 'PROPN']",[],1,0,5,1
US3446623A,1964-11-27,Method for preparing a cookie-like product,"['PROPN', 'ADP', 'VERB', 'DET', 'NOUN', 'PUNCT', 'ADJ', 'NOUN']",[],1,0,9,1
US3446626A,1966-08-25,Method for preparing a bromelain solution for ante-mortem injection,"['PROPN', 'ADP', 'VERB', 'DET', 'NOUN', 'NOUN', 'ADP', 'NOUN', 'PUNCT', 'NOUN', 'NOUN']",[],1,0,12,1
US3446633A,1966-03-24,Method of preparing an oil-treated edible collagen sausage casing,"['PROPN', 'ADP', 'VERB', 'DET', 'NOUN', 'PUNCT', 'VERB', 'ADJ', 'NOUN', 'NOUN', 'VERB']",[],1,0,12,1
