patent_number,date,title,spacy_pos,spacy_label,is_prpn_spacy,is_person_spacy,spacy_pos_len,bad_endings
US3435000A,1967-11-01,Organopolysiloxane compositions,"['NOUN', 'NOUN']",[],0,0,3,1
US3435233A,1966-03-24,Gain control system for photomultiplier systems,"['NOUN', 'NOUN', 'NOUN', 'ADP', 'NOUN', 'NOUN']",[],0,0,7,1
US3435460A,1966-01-20,Sponge rubber scrimmage caps,"['VERB', 'NOUN', 'NOUN', 'VERB']",[],0,0,5,1
US3435723A,1965-12-23,Musical drum,"['ADJ', 'NOUN']",[],0,0,3,1
US3435777A,1966-05-20,"Pump,particularly hydraulic pump for drilling plant","['VERB', 'PUNCT', 'ADV', 'ADJ', 'NOUN', 'ADP', 'NOUN', 'NOUN']",[],0,0,9,1
US3435845A,1967-04-13,"Sludge-eliminating,air-venting,flow-control device","['NOUN', 'PUNCT', 'VERB', 'PUNCT', 'NOUN', 'PUNCT', 'NOUN', 'PUNCT', 'NOUN', 'PUNCT', 'NOUN', 'NOUN']",[],0,0,13,1
US3435846A,1966-08-01,Tank fittings,"['NOUN', 'NOUN']",[],0,0,3,1
US3435847A,1966-01-03,Automotive cooling system flushing device,"['ADJ', 'VERB', 'NOUN', 'VERB', 'NOUN']",[],0,0,6,1
US3435849A,1965-02-02,Mechanical mixing tap,"['ADJ', 'VERB', 'NOUN']",[],0,0,4,1
US3435854A,1965-06-04,Control apparatus for a loom,"['NOUN', 'NOUN', 'ADP', 'DET', 'NOUN']",[],0,0,6,1
US3436041A,1967-03-31,Seam construction with heat shrinkable loop elements,"['VERB', 'NOUN', 'ADP', 'NOUN', 'ADJ', 'NOUN', 'NOUN']",[],0,0,8,1
US3436505A,1966-05-04,Slide valve for gas blast breakers,"['NOUN', 'NOUN', 'ADP', 'NOUN', 'NOUN', 'NOUN']",[],0,0,7,1
US3436630A,1966-05-03,Electrostatic synchronous motor,"['ADJ', 'ADJ', 'NOUN']",[],0,0,4,1
US3436869A,1965-10-23,Handle and mounting for hand manipulated power tool,"['VERB', 'CCONJ', 'VERB', 'ADP', 'NOUN', 'VERB', 'NOUN', 'NOUN']",[],0,0,9,1
US3436875A,1966-08-05,Abrasive disc holder,"['ADJ', 'NOUN', 'NOUN']",[],0,0,4,1
US3436936A,1967-10-30,Combination helmet and locking attachment,"['NOUN', 'NOUN', 'CCONJ', 'VERB', 'NOUN']",[],0,0,6,1
US3436980A,1966-06-21,Transmission for surgical outfits or the like,"['NOUN', 'ADP', 'ADJ', 'NOUN', 'CCONJ', 'DET', 'ADJ']",[],0,0,8,1
US3437003A,1967-12-06,Retaining pin with scissors-like joint,"['VERB', 'NOUN', 'ADP', 'NOUN', 'PUNCT', 'ADJ', 'ADJ']",[],0,0,8,1
US3437018A,1968-01-08,Concrete slab key-joint forming member,"['ADJ', 'NOUN', 'ADJ', 'PUNCT', 'ADJ', 'VERB', 'NOUN']",[],0,0,8,1
US3437118A,1966-10-10,Internally threaded self-locking fastener and method of making the same,"['ADV', 'VERB', 'NOUN', 'PUNCT', 'VERB', 'NOUN', 'CCONJ', 'NOUN', 'ADP', 'VERB', 'DET', 'ADJ']",[],0,0,13,1
US3437151A,1961-12-18,Tomato harvester,"['NOUN', 'VERB']",[],0,0,3,1
US3437356A,1967-05-01,Casing hanger and seal assembly,"['VERB', 'NOUN', 'CCONJ', 'VERB', 'NOUN']",[],0,0,6,1
US3437364A,1967-09-21,Sliding door lock assembly,"['VERB', 'NOUN', 'NOUN', 'NOUN']",[],0,0,5,1
US3437556A,1967-10-23,Test circuit for reactor safety control system,"['NOUN', 'NOUN', 'ADP', 'NOUN', 'NOUN', 'NOUN', 'NOUN']",[],0,0,8,1
US3437557A,1966-04-07,Arrangement for preventing shutdown of a nuclear reactor plant when the load on a turbine driven thereby decreases suddenly,"['NOUN', 'ADP', 'VERB', 'NOUN', 'ADP', 'DET', 'ADJ', 'NOUN', 'NOUN', 'SCONJ', 'DET', 'NOUN', 'ADP', 'DET', 'NOUN', 'VERB', 'ADV', 'VERB', 'ADV']",[],0,0,20,1
US3438000A,1966-07-07,Multiple station random access storage and retrieval device,"['ADJ', 'NOUN', 'ADJ', 'NOUN', 'NOUN', 'CCONJ', 'NOUN', 'NOUN']",[],0,0,9,1
US3438141A,1967-09-22,Psychology test method and device,"['NOUN', 'NOUN', 'NOUN', 'CCONJ', 'NOUN']",[],0,0,6,1
US3438146A,1967-04-03,Removable lawn edging device,"['ADJ', 'NOUN', 'VERB', 'NOUN']",[],0,0,5,1
US3438197A,1966-09-09,Ornamental timers,"['ADJ', 'NOUN']",[],0,0,3,1
US3438288A,1967-05-01,Bearing support for tool spindles,"['VERB', 'NOUN', 'ADP', 'NOUN', 'NOUN']",[],0,0,6,1
US3438337A,1968-04-10,High-speed ground transportation system,"['ADJ', 'PUNCT', 'NOUN', 'NOUN', 'NOUN', 'NOUN']",[],0,0,7,1
US3438440A,1967-12-22,Electroless metal bonding of unconsolidated formations into consolidated formations,"['ADJ', 'NOUN', 'NOUN', 'ADP', 'ADJ', 'NOUN', 'ADP', 'ADJ', 'NOUN']",[],0,0,10,1
US3438450A,1967-02-24,Hydraulically operated earth boring tools,"['ADV', 'VERB', 'NOUN', 'ADJ', 'NOUN']",[],0,0,6,1
US3438677A,1967-03-21,Vibrator for dumping vehicles,"['NOUN', 'ADP', 'VERB', 'NOUN']",[],0,0,5,1
US3438680A,1967-10-05,Transportation of sulfur in pipelines as a sulfur-aqueous polysulfide slurry,"['NOUN', 'ADP', 'NOUN', 'ADP', 'NOUN', 'ADP', 'DET', 'NOUN', 'PUNCT', 'ADJ', 'NOUN', 'NOUN']",[],0,0,13,1
US3438736A,1965-06-22,Gravimetric titration process and apparatus therefor,"['ADJ', 'NOUN', 'NOUN', 'CCONJ', 'NOUN', 'VERB']",['GPE'],0,0,7,1
US3438771A,1966-09-29,Extruded article of magnesium-base alloy,"['ADJ', 'NOUN', 'ADP', 'NOUN', 'PUNCT', 'NOUN', 'NOUN']",[],0,0,8,1
US3438782A,1965-01-18,Edible oil supplement for feed ration,"['ADJ', 'NOUN', 'NOUN', 'ADP', 'NOUN', 'NOUN']",[],0,0,7,1
US3438869A,1967-01-13,System for conversion of sea water into fresh water,"['NOUN', 'ADP', 'NOUN', 'ADP', 'NOUN', 'NOUN', 'ADP', 'ADJ', 'NOUN']",[],0,0,10,1
US3438940A,1965-04-03,Process of preparing water dispersible polyurethanes and resulting product,"['NOUN', 'ADP', 'VERB', 'NOUN', 'ADJ', 'NOUN', 'CCONJ', 'VERB', 'NOUN']",[],0,0,10,1
US3439060A,1966-06-21,Selective removal of cyclopentadiene from a mixture containing at least one other hydrocarbon,"['ADJ', 'NOUN', 'ADP', 'NOUN', 'ADP', 'DET', 'NOUN', 'VERB', 'ADV', 'ADV', 'NUM', 'ADJ', 'NOUN']",[],0,0,14,1
US3439076A,1965-11-15,Process for preparing concrete tiles having a top layer of epoxy resin,"['NOUN', 'ADP', 'VERB', 'ADJ', 'NOUN', 'VERB', 'DET', 'ADJ', 'NOUN', 'ADP', 'NOUN', 'NOUN']",[],0,0,13,1
US3439109A,1961-09-29,Thin film magnetic stores using printed electric circuits,"['ADJ', 'NOUN', 'ADJ', 'NOUN', 'VERB', 'VERB', 'ADJ', 'NOUN']",[],0,0,9,1
US3439236A,1965-12-09,Insulated-gate field-effect transistor with critical bulk characteristics for use as an oscillator component,"['VERB', 'PUNCT', 'NOUN', 'NOUN', 'PUNCT', 'NOUN', 'NOUN', 'ADP', 'ADJ', 'ADJ', 'NOUN', 'ADP', 'NOUN', 'ADP', 'DET', 'ADJ', 'NOUN']",[],0,0,18,1
US3439246A,1963-08-14,Bi-directional proportional servo motor control system,"['ADJ', 'PUNCT', 'ADJ', 'ADJ', 'ADJ', 'NOUN', 'NOUN', 'NOUN']",[],0,0,9,1
US3439599A,1966-08-05,Aerial camera,"['ADJ', 'NOUN']",[],0,0,3,1
US3439669A,1968-02-01,Supporting means for shutter of oven door window,"['VERB', 'NOUN', 'ADP', 'NOUN', 'ADP', 'ADJ', 'NOUN', 'NOUN']",[],0,0,9,1
US3439727A,1966-10-27,Garage door operator,"['NOUN', 'NOUN', 'NOUN']",[],0,0,4,1
US3439996A,1965-06-09,Tile assembly for radiant gas burners,"['NOUN', 'NOUN', 'ADP', 'ADJ', 'NOUN', 'NOUN']",[],0,0,7,1
US3440019A,1965-06-01,Polycondensation reactor,"['NOUN', 'NOUN']",[],0,0,3,1
US3440021A,1966-07-05,High pressure reactor,"['ADJ', 'NOUN', 'NOUN']",[],0,0,4,1
US3440146A,1966-05-02,Desalination method and apparatus with plural vaporization chambers containing shallow layers of liquid,"['NOUN', 'NOUN', 'CCONJ', 'NOUN', 'ADP', 'ADJ', 'NOUN', 'NOUN', 'VERB', 'ADJ', 'NOUN', 'ADP', 'NOUN']",[],0,0,14,1
US3440169A,1965-12-03,Cadmium-substituted ferrite materials,"['NOUN', 'PUNCT', 'VERB', 'ADJ', 'NOUN']",[],0,0,6,1
US3440205A,1965-11-02,Room temperature curing organopoly-siloxane elastomers,"['NOUN', 'NOUN', 'VERB', 'ADJ', 'PUNCT', 'NOUN', 'NOUN']",[],0,0,8,1
US3440334A,1967-02-02,Connector with helically wound spring and external means for releasing the spring to cause gripping of wires,"['NOUN', 'ADP', 'ADV', 'ADJ', 'NOUN', 'CCONJ', 'ADJ', 'NOUN', 'ADP', 'VERB', 'DET', 'NOUN', 'PART', 'VERB', 'NOUN', 'ADP', 'NOUN']",[],0,0,18,1
US3440342A,1962-12-11,Televideophonic broadcasting and receiving system,"['ADJ', 'NOUN', 'CCONJ', 'VERB', 'NOUN']",[],0,0,6,1
US3440359A,1964-11-02,Shiftable mounting means for transducers,"['ADJ', 'VERB', 'NOUN', 'ADP', 'NOUN']",[],0,0,6,1
US3440422A,1965-06-24,Biplane x-ray image system,"['NOUN', 'NOUN', 'NOUN', 'NOUN', 'NOUN', 'NOUN']",[],0,0,7,1
US3440467A,1965-09-14,Gas filled thyratrons having improved electrode cooling provisions,"['NOUN', 'VERB', 'NOUN', 'AUX', 'VERB', 'NOUN', 'VERB', 'NOUN']",[],0,0,9,1
US3440613A,1966-03-25,Interface system for digital computers and serially operated input and output devices,"['NOUN', 'NOUN', 'ADP', 'ADJ', 'NOUN', 'CCONJ', 'ADV', 'VERB', 'NOUN', 'CCONJ', 'NOUN', 'NOUN']",[],0,0,13,1
US3440833A,1967-11-09,Vapor cycle refrigeration system,"['NOUN', 'NOUN', 'NOUN', 'NOUN']",[],0,0,5,1
US3440888A,1962-11-07,Bifurcate resonance column,"['ADJ', 'NOUN', 'NOUN']",['PRODUCT'],0,0,4,1
US3440974A,1966-10-21,Article handling and positioning apparatus,"['NOUN', 'VERB', 'CCONJ', 'VERB', 'NOUN']",[],0,0,6,1
US3441201A,1967-04-19,Transverse flow blowers having controlled secondary flows,"['NOUN', 'NOUN', 'NOUN', 'AUX', 'VERB', 'ADJ', 'NOUN']",[],0,0,8,1
US3441202A,1966-03-22,Noise dampening in hermetic refrigerant compressors,"['NOUN', 'VERB', 'ADP', 'ADJ', 'ADJ', 'NOUN']",[],0,0,7,1
US3441210A,1967-03-08,Preset timer,"['ADJ', 'NOUN']",[],0,0,3,1
US3441456A,1966-10-31,Striker compositions,"['NOUN', 'NOUN']",['PERSON'],0,1,3,1
US3441522A,1965-08-16,"Curable,tacky polymers of water and a polyepoxide and process for the preparation thereof","['ADJ', 'PUNCT', 'ADJ', 'NOUN', 'ADP', 'NOUN', 'CCONJ', 'DET', 'NOUN', 'CCONJ', 'NOUN', 'ADP', 'DET', 'NOUN', 'ADV']",[],0,0,16,1
US3441574A,1966-01-12,Process for making anthraquinone,"['NOUN', 'ADP', 'VERB', 'NOUN']",[],0,0,5,1
US3441602A,1965-03-22,"1,1",['NUM'],['CARDINAL'],0,0,1,1
US3441611A,1961-12-04,Hydroxyalkylamine oxide detergent compounds,"['ADJ', 'NOUN', 'NOUN', 'VERB']",[],0,0,5,1
US3441946A,1965-06-29,Circuit for supplying writing signals for use with electrosensitive paper recorders,"['NOUN', 'ADP', 'VERB', 'NOUN', 'NOUN', 'ADP', 'NOUN', 'ADP', 'ADJ', 'NOUN', 'NOUN']",[],0,0,12,1
US3442071A,1965-10-23,Automatic celery harvesting machine,"['ADJ', 'NOUN', 'NOUN', 'NOUN']",[],0,0,5,1
US3442073A,1964-09-26,Stretchable knitted fabrics,"['ADJ', 'VERB', 'NOUN']",[],0,0,4,1
US3442210A,1967-12-20,Printer platen control,"['NOUN', 'NOUN', 'VERB']",[],0,0,4,1
US3442214A,1965-05-24,Shotgun cartridge,"['ADJ', 'NOUN']",[],0,0,3,1
US3442297A,1967-04-21,Flexible tubing,"['ADJ', 'NOUN']",[],0,0,3,1
US3442356A,1966-12-06,Low-noise hydraulic disk brake,"['ADJ', 'PUNCT', 'NOUN', 'NOUN', 'NOUN', 'NOUN']",[],0,0,7,1
US3442484A,1966-08-29,Blast furnace backdraft valve,"['NOUN', 'NOUN', 'NOUN', 'VERB']",[],0,0,5,1
US3443074A,1965-10-01,Sequential analog-digital computer,"['ADJ', 'NOUN', 'PUNCT', 'NOUN', 'NOUN']",['GPE'],0,0,6,1
US3443147A,1966-07-16,Television cathode ray tube apparatus,"['NOUN', 'NOUN', 'NOUN', 'NOUN', 'NOUN']",[],0,0,6,1
US3443335A,1967-10-25,Rod and reel holder,"['NOUN', 'CCONJ', 'NOUN', 'NOUN']",['PERSON'],0,1,5,1
US3443520A,1967-09-11,Gradient forming pumps and method,"['ADJ', 'NOUN', 'NOUN', 'CCONJ', 'VERB']",[],0,0,6,1
US3443757A,1966-10-14,Supersonic fluid flow exhaust nozzles,"['ADJ', 'NOUN', 'NOUN', 'NOUN', 'NOUN']",[],0,0,6,1
US3443914A,1965-07-31,Composite metal wire with a base of iron or nickel and an outer coat of palladium,"['ADJ', 'NOUN', 'NOUN', 'ADP', 'DET', 'NOUN', 'ADP', 'NOUN', 'CCONJ', 'NOUN', 'CCONJ', 'DET', 'ADJ', 'NOUN', 'ADP', 'NOUN']",[],0,0,17,1
US3443931A,1965-09-10,Process for making metallized pellets from iron oxide containing material,"['NOUN', 'ADP', 'VERB', 'ADJ', 'NOUN', 'ADP', 'NOUN', 'NOUN', 'VERB', 'NOUN']",[],0,0,11,1
US3443982A,1965-07-01,Coatings for rendering corrodible metal corrosion resistant,"['NOUN', 'ADP', 'VERB', 'ADJ', 'NOUN', 'NOUN', 'ADJ']",[],0,0,8,1
US3444038A,1966-07-09,Nuclear power station with carbon dioxide cooling system,"['ADJ', 'NOUN', 'NOUN', 'ADP', 'NOUN', 'NOUN', 'VERB', 'NOUN']",[],0,0,9,1
US3444077A,1965-01-21,Liquid clarifying method,"['NOUN', 'VERB', 'NOUN']",[],0,0,4,1
US3444471A,1966-04-28,Diversity receiving system with a voltage controlled oscillator coupled to a crystal controlled oscillator in at least one channel,"['NOUN', 'NOUN', 'NOUN', 'ADP', 'DET', 'NOUN', 'VERB', 'NOUN', 'VERB', 'ADP', 'DET', 'NOUN', 'VERB', 'NOUN', 'ADP', 'ADV', 'ADV', 'NUM', 'NOUN']",['CARDINAL'],0,0,20,1
US3444472A,1967-06-12,Sense amplifier circuit,"['NOUN', 'ADP', 'NOUN']",[],0,0,4,1
US3444602A,1964-04-29,Electrical capacitor and method of making the same,"['ADJ', 'NOUN', 'CCONJ', 'NOUN', 'ADP', 'VERB', 'DET', 'ADJ']",[],0,0,9,1
US3444797A,1964-12-16,Photographic self-cocking shutter with swinging-through blades,"['ADJ', 'NOUN', 'PUNCT', 'VERB', 'NOUN', 'ADP', 'NOUN', 'PUNCT', 'NOUN', 'NOUN']",[],0,0,11,1
US3444954A,1966-08-08,Stethoscope,['VERB'],[],0,0,2,1
US3445016A,1967-07-05,Swivelling tool support for earth-working machine,"['VERB', 'NOUN', 'NOUN', 'ADP', 'NOUN', 'PUNCT', 'VERB', 'NOUN']",[],0,0,9,1
US3445141A,1966-02-19,Braking arrangement,"['VERB', 'NOUN']",[],0,0,3,1
US3445196A,1966-06-06,Exhaust muffler with removable catalytic unit,"['NOUN', 'NOUN', 'ADP', 'ADJ', 'ADJ', 'NOUN']",[],0,0,7,1
US3445272A,1964-12-18,Porous elastomeric coating,"['ADJ', 'ADJ', 'NOUN']",[],0,0,4,1
US3445291A,1966-07-14,Thermal battery with temperature indicating potting composition,"['ADJ', 'NOUN', 'ADP', 'NOUN', 'VERB', 'VERB', 'NOUN']",[],0,0,8,1
US3445447A,1965-02-04,Tert-amyloxycarbonyl derivatives of amino acids,"['ADJ', 'PUNCT', 'NOUN', 'NOUN', 'ADP', 'ADJ', 'NOUN']",[],0,0,8,1
US3445465A,1965-02-11,"3-(2-fluorophenyl)-1,2,3-benzotriazin-4-one","['NUM', 'PUNCT', 'NOUN', 'PUNCT', 'SPACE', 'PUNCT', 'NUM']","['CARDINAL', 'CARDINAL']",0,0,8,1
US3445537A,1966-04-01,Plurality of extractive-distillation zones and stripping zones,"['NOUN', 'ADP', 'ADJ', 'PUNCT', 'NOUN', 'NOUN', 'CCONJ', 'VERB', 'NOUN']",[],0,0,10,1
US3445583A,1965-11-29,Composite tubing,"['ADJ', 'NOUN']",[],0,0,3,1
US3445600A,1964-08-07,Telephone answering device,"['NOUN', 'VERB', 'NOUN']",[],0,0,4,1
US3445761A,1965-09-22,Magnetic field intensity meter,"['ADJ', 'NOUN', 'NOUN', 'NOUN']",[],0,0,5,1
US3445766A,1966-05-16,Electrical probe device having a plurality of adjustable contacting elements for testing transistors and the like,"['ADJ', 'NOUN', 'NOUN', 'VERB', 'DET', 'NOUN', 'ADP', 'ADJ', 'VERB', 'NOUN', 'ADP', 'VERB', 'NOUN', 'CCONJ', 'DET', 'ADJ']",[],0,0,17,1
US3445773A,1966-05-06,Transport time delay unit,"['NOUN', 'NOUN', 'NOUN', 'NOUN']",[],0,0,5,1
US3446033A,1964-12-18,Earring including loss-preventing attaching device,"['NOUN', 'VERB', 'NOUN', 'PUNCT', 'NOUN', 'VERB', 'NOUN']",[],0,0,8,1
US3446043A,1966-04-08,Speed control for a laundry machine,"['NOUN', 'NOUN', 'ADP', 'DET', 'ADJ', 'NOUN']",[],0,0,7,1
US3446188A,1966-01-14,Steam generator or heater for an atomic power generating plant,"['NOUN', 'NOUN', 'CCONJ', 'NOUN', 'ADP', 'DET', 'ADJ', 'NOUN', 'NOUN', 'NOUN']",[],0,0,11,1
US3446226A,1967-03-22,Automatic hydrant dripping apparatus,"['ADJ', 'ADJ', 'ADJ', 'NOUN']",[],0,0,5,1
US3446413A,1967-01-19,Tubular frame package and blank therefor,"['ADJ', 'NOUN', 'NOUN', 'CCONJ', 'ADJ', 'ADP']",[],0,0,7,1
US3446423A,1967-12-06,Air distributor manifold and valve disk,"['NOUN', 'NOUN', 'NOUN', 'CCONJ', 'VERB', 'NOUN']",[],0,0,7,1
US3446510A,1966-12-02,Play toy,"['NOUN', 'NOUN']",[],0,0,3,1
US3446723A,1965-07-09,Electrodeposition of a copolymer containing basic nitrogen atoms,"['NOUN', 'ADP', 'DET', 'NOUN', 'VERB', 'ADJ', 'NOUN', 'NOUN']",[],0,0,9,1
US3447198A,1966-09-28,Chair control back back-plate with integrally formed bearings,"['NOUN', 'NOUN', 'ADV', 'NOUN', 'PUNCT', 'NOUN', 'ADP', 'ADV', 'VERB', 'NOUN']",[],0,0,11,1
US3447288A,1965-08-23,Gas-diffusion assembly including thin hydrogen-permeable impervious foil,"['NOUN', 'PUNCT', 'NOUN', 'NOUN', 'VERB', 'ADJ', 'NOUN', 'PUNCT', 'ADJ', 'ADJ', 'NOUN']",[],0,0,12,1
US3447350A,1964-06-10,Method and device for the magnetic forming of metallic workpieces,"['NOUN', 'CCONJ', 'NOUN', 'ADP', 'DET', 'ADJ', 'NOUN', 'ADP', 'ADJ', 'NOUN']",[],0,0,11,1
US3447351A,1964-12-30,Roll forming machine including divided roll parts and spacers therefor,"['VERB', 'VERB', 'NOUN', 'VERB', 'VERB', 'NOUN', 'NOUN', 'CCONJ', 'NOUN', 'ADP']",[],0,0,11,1
US3447440A,1967-05-25,Film advancement control means,"['NOUN', 'NOUN', 'NOUN', 'VERB']",[],0,0,5,1
US3447657A,1967-04-27,"Tape rewinding accessory for computers,calculating machines,and the like","['NOUN', 'VERB', 'NOUN', 'ADP', 'NOUN', 'PUNCT', 'VERB', 'NOUN', 'PUNCT', 'CCONJ', 'DET', 'ADJ']",[],0,0,13,1
US3447716A,1966-04-13,Transport case of an expanded artificial material,"['NOUN', 'NOUN', 'ADP', 'DET', 'VERB', 'ADJ', 'NOUN']",[],0,0,8,1
US3447726A,1967-11-28,Frames for supporting wigs during the processing thereof,"['NOUN', 'ADP', 'VERB', 'NOUN', 'ADP', 'DET', 'NOUN', 'ADV']",[],0,0,9,1
US3447759A,1967-05-19,Collapsible film reel,"['ADJ', 'NOUN', 'VERB']",[],0,0,4,1
US3447795A,1967-07-13,Self-contained die cushion with air saver,"['NOUN', 'PUNCT', 'VERB', 'NOUN', 'NOUN', 'ADP', 'NOUN', 'NOUN']",[],0,0,9,1
US3447796A,1964-05-08,Spring suspension for vehicle wheels,"['NOUN', 'NOUN', 'ADP', 'NOUN', 'NOUN']",[],0,0,6,1
US3447797A,1966-12-14,"Telescoping,spring-loaded,hydraulically damped shock absorber","['ADJ', 'PUNCT', 'NOUN', 'PUNCT', 'VERB', 'PUNCT', 'ADV', 'VERB', 'NOUN', 'NOUN']",[],0,0,11,1
US3448081A,1964-06-26,Process for preparing thermostabilized trioxane-cyclic ether copolymers,"['NOUN', 'ADP', 'VERB', 'ADJ', 'NOUN', 'PUNCT', 'NOUN', 'ADJ', 'NOUN']",[],0,0,10,1
US3448239A,1966-04-06,Battery charging circuit,"['NOUN', 'VERB', 'NOUN']",[],0,0,4,1
US3448308A,1967-09-01,Directional control systems for synchronous motors,"['ADJ', 'NOUN', 'NOUN', 'ADP', 'ADJ', 'NOUN']",[],0,0,7,1
US3448477A,1966-11-02,Appliance for cleaning horizontal or inclined devices containing bundles of tubes,"['NOUN', 'ADP', 'VERB', 'ADJ', 'CCONJ', 'ADJ', 'NOUN', 'VERB', 'NOUN', 'ADP', 'NOUN']",[],0,0,12,1
US3448485A,1965-01-21,Sweeper,['NOUN'],[],0,0,2,1
US3448509A,1964-02-05,Processes of removing plastic insulation from wires and of controlling gases resulting therefrom,"['NOUN', 'ADP', 'VERB', 'ADJ', 'NOUN', 'ADP', 'NOUN', 'CCONJ', 'ADP', 'VERB', 'NOUN', 'VERB', 'ADP']",[],0,0,14,1
US3448619A,1967-06-07,Clinical temperature indicating device,"['ADJ', 'NOUN', 'VERB', 'NOUN']",[],0,0,5,1
US3448765A,1965-09-07,Automatic pulse valve,"['ADJ', 'NOUN', 'VERB']",[],0,0,4,1
US3448901A,1967-12-29,Packaging insert for collars,"['NOUN', 'NOUN', 'ADP', 'NOUN']",[],0,0,5,1
US3448924A,1966-12-12,Resonant pulse jet fogger,"['ADJ', 'NOUN', 'NOUN', 'NOUN']",[],0,0,5,1
US3448980A,1966-08-29,Automatic separation mechanism for the use of a copying machine,"['ADJ', 'NOUN', 'NOUN', 'ADP', 'DET', 'NOUN', 'ADP', 'DET', 'NOUN', 'NOUN']",[],0,0,11,1
US3449160A,1965-03-11,Process for the production of fine porous coatings on textiles with preparations containing a polymer and microcapsules,"['NOUN', 'ADP', 'DET', 'NOUN', 'ADP', 'ADJ', 'ADJ', 'NOUN', 'ADP', 'NOUN', 'ADP', 'NOUN', 'VERB', 'DET', 'NOUN', 'CCONJ', 'NOUN']",[],0,0,18,1
US3449192A,1966-12-16,Polyethylene aluminum laminates,"['NOUN', 'NOUN', 'VERB']",[],0,0,4,1
US3449244A,1964-09-11,Recovery of steam condensate,"['NOUN', 'ADP', 'NOUN', 'NOUN']",[],0,0,5,1
US3449405A,1966-02-04,2-halo-3-methylphenyl n-methylcarbamates,"['NUM', 'PUNCT', 'SPACE', 'PUNCT', 'NOUN', 'NOUN', 'PUNCT', 'NOUN']",['CARDINAL'],0,0,9,1
US3449418A,1965-12-22,Etherified bisaryl compounds,"['VERB', 'NOUN', 'VERB']",[],0,0,4,1
US3449598A,1964-10-14,Transistor circuits,"['NOUN', 'VERB']",[],0,0,3,1
US3449602A,1966-05-02,Means for and method of heating gases for magnetohydrodynamic devices,"['VERB', 'ADP', 'CCONJ', 'NOUN', 'ADP', 'NOUN', 'NOUN', 'ADP', 'ADJ', 'NOUN']",[],0,0,11,1
US3449695A,1964-10-09,Voltage to frequency converter including a feedback control circuit,"['NOUN', 'PART', 'VERB', 'NOUN', 'VERB', 'DET', 'NOUN', 'NOUN', 'NOUN']",[],0,0,10,1
US3449819A,1968-05-17,Explosively welded honeycomb method,"['ADV', 'VERB', 'NOUN', 'NOUN']",[],0,0,5,1
US3449823A,1967-10-02,Tool loading device for machine tools,"['NOUN', 'NOUN', 'NOUN', 'ADP', 'NOUN', 'NOUN']",[],0,0,7,1
US3449916A,1967-07-12,Tunnel liner and method of making same,"['NOUN', 'NOUN', 'CCONJ', 'NOUN', 'ADP', 'VERB', 'ADJ']",[],0,0,8,1
US3450192A,1967-01-20,Process and apparatus for modulating the temperature within enclosures,"['NOUN', 'CCONJ', 'NOUN', 'ADP', 'VERB', 'DET', 'NOUN', 'ADP', 'NOUN']",[],0,0,10,1
US3450257A,1964-03-02,Processing of clay,"['NOUN', 'ADP', 'NOUN']",[],0,0,4,1
US3450366A,1968-01-08,Self-threading film reel with free-wheeling hubs,"['NOUN', 'PUNCT', 'VERB', 'NOUN', 'NOUN', 'ADP', 'ADV', 'PUNCT', 'VERB', 'NOUN']",[],0,0,11,1
US3450373A,1966-08-25,Plural modulation of radio-frequency carrier wave for remote missile control systems,"['ADJ', 'NOUN', 'ADP', 'NOUN', 'PUNCT', 'NOUN', 'NOUN', 'NOUN', 'ADP', 'ADJ', 'NOUN', 'NOUN', 'NOUN']",[],0,0,14,1
US3450421A,1966-06-20,Ball connector,"['NOUN', 'NOUN']",[],0,0,3,1
US3450602A,1966-05-20,Water desalinization system,"['NOUN', 'NOUN', 'NOUN']",[],0,0,4,1
US3450708A,1967-06-30,"4-acetyl-5,5-dimethyl-2-(5-nitro-2-furyl)-delta**2-1,3,4-oxadi","['NUM', 'PUNCT', 'NOUN', 'PUNCT', 'NOUN', 'PUNCT', 'SPACE', 'PUNCT', 'NOUN', 'PUNCT', 'NUM', 'PUNCT', 'NOUN']",['CARDINAL'],0,0,14,1
US3450749A,1966-02-10,Organic sulfonate production and purification,"['ADJ', 'ADJ', 'NOUN', 'CCONJ', 'NOUN']",[],0,0,6,1
US3450750A,1966-07-27,(4-(2-(alkoxymethyl)alkanoyl)phenoxy)acetic acids and derivatives thereof,"['PUNCT', 'NUM', 'NOUN', 'CCONJ', 'NOUN', 'ADV']",['CARDINAL'],0,0,7,1
US3450923A,1965-03-17,Gas-filled overvoltage arrester for telecommunication installations,"['NOUN', 'PUNCT', 'VERB', 'NOUN', 'NOUN', 'ADP', 'NOUN', 'NOUN']",[],0,0,9,1
US3450948A,1967-03-01,Electrical distribution system,"['ADJ', 'NOUN', 'NOUN']",[],0,0,4,1
US3451048A,1965-10-05,Drive system for a magnetic core array,"['VERB', 'NOUN', 'ADP', 'DET', 'ADJ', 'NOUN', 'NOUN']",[],0,0,8,1
US3451091A,1968-02-23,Device for cleaning pipes and tubes,"['NOUN', 'ADP', 'VERB', 'NOUN', 'CCONJ', 'NOUN']",[],0,0,7,1
US3451279A,1966-07-20,Pawl and ratchet stepping mechanisms,"['NOUN', 'CCONJ', 'NOUN', 'VERB', 'NOUN']",[],0,0,6,1
US3451280A,1965-07-29,Device for transforming the movement for an electronic watch,"['NOUN', 'ADP', 'VERB', 'DET', 'NOUN', 'ADP', 'DET', 'ADJ', 'NOUN']",[],0,0,10,1
US3451551A,1967-09-15,Free-flow filter bypass valve,"['ADJ', 'PUNCT', 'NOUN', 'NOUN', 'NOUN', 'VERB']",[],0,0,7,1
US3451595A,1966-03-25,Wheeled vehicle vibratory spreader for granular material,"['ADJ', 'NOUN', 'NOUN', 'NOUN', 'ADP', 'ADJ', 'NOUN']",[],0,0,8,1
US3451667A,1967-07-13,Self-contained die cushion with air saver,"['NOUN', 'PUNCT', 'VERB', 'NOUN', 'NOUN', 'ADP', 'NOUN', 'NOUN']",[],0,0,9,1
US3452021A,1965-03-24,10-(aminoalkanoyl) acridanes,"['NUM', 'PUNCT', 'VERB']",['DATE'],0,0,4,1
US3452172A,1965-07-12,Current limiting circuit breaker,"['ADJ', 'VERB', 'NOUN', 'NOUN']",[],0,0,5,1
US3452210A,1966-05-23,Automatic starter for automobiles,"['ADJ', 'NOUN', 'ADP', 'NOUN']",[],0,0,5,1
US3452315A,1965-07-06,"Electric boards,plug contacts and system","['ADJ', 'NOUN', 'PUNCT', 'VERB', 'NOUN', 'CCONJ', 'NOUN']",[],0,0,8,1
US3452615A,1967-10-12,Tubular flexible remote control device,"['ADJ', 'ADJ', 'ADJ', 'NOUN', 'NOUN']",[],0,0,6,1
US3452645A,1965-06-18,Monitoring of control systems,"['NOUN', 'ADP', 'NOUN', 'NOUN']",[],0,0,5,1
US3452693A,1966-05-31,Machine for very rapidly pressing ball pen points and other articles starting from a metallic strip or wire,"['NOUN', 'ADP', 'ADV', 'ADV', 'VERB', 'NOUN', 'NOUN', 'NOUN', 'CCONJ', 'ADJ', 'NOUN', 'VERB', 'ADP', 'DET', 'ADJ', 'NOUN', 'CCONJ', 'NOUN']",[],0,0,19,1
US3452821A,1966-02-01,Row crop thinning implement,"['NOUN', 'NOUN', 'NOUN', 'VERB']",[],0,0,5,1
US3452937A,1965-07-07,Centrifugal impact mill,"['ADJ', 'NOUN', 'NOUN']",[],0,0,4,1
US3453196A,1963-11-18,Beta-emitting radioisotope source sealed onto the surface of an inert carrier,"['NOUN', 'PUNCT', 'VERB', 'NOUN', 'NOUN', 'VERB', 'ADP', 'DET', 'NOUN', 'ADP', 'DET', 'ADJ', 'NOUN']",[],0,0,14,1
US3453354A,1965-12-27,Methods of manufacturing ion-exchange membranes,"['NOUN', 'ADP', 'VERB', 'NOUN', 'PUNCT', 'NOUN', 'NOUN']",[],0,0,8,1
US3453402A,1968-01-16,"Electrical three-part,keylocked switch","['ADJ', 'NUM', 'PUNCT', 'NOUN', 'PUNCT', 'VERB', 'VERB']",['CARDINAL'],0,0,8,1
US3453427A,1966-05-27,Electric lamp for uniformly charging the photoconductive insulating layer of a xerographic plate,"['ADJ', 'NOUN', 'ADP', 'ADV', 'VERB', 'DET', 'ADJ', 'VERB', 'NOUN', 'ADP', 'DET', 'ADJ', 'NOUN']",[],0,0,14,1
US3453509A,1966-12-01,Capacitance void meter,"['NOUN', 'ADJ', 'NOUN']","['ORG', 'PERSON']",0,1,4,1
US3453543A,1965-06-01,Device for comparing magnitudes of electrical signals of different frequencies,"['NOUN', 'ADP', 'VERB', 'NOUN', 'ADP', 'ADJ', 'NOUN', 'ADP', 'ADJ', 'NOUN']",[],0,0,11,1
US3453583A,1967-02-23,Nonrectifying solid state element,"['VERB', 'ADJ', 'NOUN', 'NOUN']",[],0,0,5,1
US3453655A,1966-12-19,Street water hydrant guard,"['NOUN', 'NOUN', 'ADJ', 'NOUN']",[],0,0,5,1
US3453667A,1966-10-07,Drain valve connecting means,"['NOUN', 'NOUN', 'VERB', 'VERB']",[],0,0,5,1
US3453746A,1966-08-12,Instruction system for physical endeavors,"['NOUN', 'NOUN', 'ADP', 'ADJ', 'NOUN']",[],0,0,6,1
US3453756A,1968-03-13,Reversible excavating tooth,"['ADJ', 'VERB', 'NOUN']",[],0,0,4,1
US3454102A,1965-11-08,Cross plow corrugator and cultivator,"['NOUN', 'NOUN', 'NOUN', 'CCONJ', 'NOUN']",[],0,0,6,1
US3454143A,1967-02-09,Power-operated tool,"['NOUN', 'PUNCT', 'VERB', 'NOUN']",[],0,0,5,1
US3454190A,1967-11-08,Integral opener and closure,"['ADJ', 'NOUN', 'CCONJ', 'NOUN']",[],0,0,5,1
US3454237A,1967-08-28,Two-part winding mandrel,"['NUM', 'PUNCT', 'NOUN', 'VERB', 'NOUN']",['CARDINAL'],0,0,6,1
US3454262A,1967-04-04,Interchangeable fence construction,"['ADJ', 'NOUN', 'NOUN']",[],0,0,4,1
US3454379A,1964-10-23,Hydrocarbon oil composition having improved low temperature pumpability,"['NOUN', 'NOUN', 'NOUN', 'AUX', 'VERB', 'ADJ', 'NOUN', 'NOUN']",[],0,0,9,1
US3454390A,1968-01-16,Process for desiccating plants,"['NOUN', 'ADP', 'VERB', 'NOUN']",[],0,0,5,1
