patent_number,date,title,spacy_pos,spacy_label,is_prpn_spacy,is_person_spacy,spacy_pos_len,tokens,bad_endings
US2970479A,1958-02-25,Wide range accelerometer,"['ADJ', 'NOUN', 'ADP']",[],0,0,4,"['wide', 'range', 'accelerometer']",1
US2970575A,1954-12-30,Multiple input hydraulic amplifier,"['ADJ', 'NOUN', 'NOUN', 'ADP']",[],0,0,5,"['multiple', 'input', 'hydraulic', 'amplifier']",1
US2970667A,1958-06-18,Self propelled aerial platform and hydraulic control system therefor,"['NOUN', 'VERB', 'ADJ', 'NOUN', 'CCONJ', 'ADJ', 'NOUN', 'NOUN', 'ADP']",[],0,0,10,"['self', 'propelled', 'aerial', 'platform', 'and', 'hydraulic', 'control', 'system', 'therefor']",1
US2970738A,1959-11-16,Sectioned container and blank therefor,"['ADJ', 'NOUN', 'CCONJ', 'ADJ', 'ADP']",[],0,0,6,"['sectioned', 'container', 'and', 'blank', 'therefor']",1
US2970847A,1956-03-06,Vehicle spring suspension and fluid pressure leveling device therefor,"['NOUN', 'NOUN', 'NOUN', 'CCONJ', 'ADJ', 'NOUN', 'NOUN', 'NOUN', 'ADP']",[],0,0,10,"['vehicle', 'spring', 'suspension', 'and', 'fluid', 'pressure', 'leveling', 'device', 'therefor']",1
US2970965A,1955-12-14,Printing inks and vehicles therefor,"['NOUN', 'NOUN', 'CCONJ', 'NOUN', 'ADP']",[],0,0,6,"['printing', 'inks', 'and', 'vehicles', 'therefor']",1
US2970970A,1958-07-16,Composition comprising cellulose ester and diisocyanate modified polyester amide,"['NOUN', 'VERB', 'NOUN', 'NOUN', 'CCONJ', 'VERB', 'VERB', 'NOUN', 'ADP']",[],0,0,10,"['composition', 'comprising', 'cellulose', 'ester', 'and', 'diisocyanate', 'modified', 'polyester', 'amide']",1
US2970978A,1956-08-06,Plasticized synthetic resin and mastic tile product made therefrom,"['ADJ', 'ADJ', 'NOUN', 'CCONJ', 'ADJ', 'NOUN', 'NOUN', 'VERB', 'ADP']",[],0,0,10,"['plasticized', 'synthetic', 'resin', 'and', 'mastic', 'tile', 'product', 'made', 'therefrom']",1
US2971000A,1961-02-07,Process for the production of,"['NOUN', 'ADP', 'DET', 'NOUN', 'ADP']",[],0,0,5,"['process', 'for', 'the', 'production', 'of']",1
US2971387A,1959-02-06,Oscillatory mechanism and bearing therefor,"['ADJ', 'NOUN', 'CCONJ', 'VERB', 'ADP']",[],0,0,6,"['oscillatory', 'mechanism', 'and', 'bearing', 'therefor']",1
US2971406A,1954-01-18,Epicyclic transmission and control mechanism therefor,"['ADJ', 'NOUN', 'CCONJ', 'NOUN', 'NOUN', 'ADP']",[],0,0,7,"['epicyclic', 'transmission', 'and', 'control', 'mechanism', 'therefor']",1
US2971462A,1951-09-14,Submarine mine and mooring means therefor,"['NOUN', 'NOUN', 'CCONJ', 'NOUN', 'NOUN', 'ADP']",[],0,0,7,"['submarine', 'mine', 'and', 'mooring', 'means', 'therefor']",1
US2971477A,1959-08-20,Railroad car axle-generator system and suspension therefor,"['NOUN', 'NOUN', 'NOUN', 'PUNCT', 'NOUN', 'NOUN', 'CCONJ', 'NOUN', 'ADP']",[],0,0,10,"['railroad', 'car', 'axle-generator', 'system', 'and', 'suspension', 'therefor']",1
US2971496A,1958-06-09,Fluid pressure actuator and cooling means therefor,"['ADJ', 'NOUN', 'NOUN', 'CCONJ', 'VERB', 'NOUN', 'ADP']",[],0,0,8,"['fluid', 'pressure', 'actuator', 'and', 'cooling', 'means', 'therefor']",1
US2971849A,1957-10-07,Coating foods and composition therefor,"['VERB', 'NOUN', 'CCONJ', 'NOUN', 'ADP']",[],0,0,6,"['coating', 'foods', 'and', 'composition', 'therefor']",1
US2971864A,1958-03-26,Aminated mono-organosilanes and method of dyeing glass therewith,"['ADJ', 'NOUN', 'PUNCT', 'NOUN', 'CCONJ', 'NOUN', 'ADP', 'NOUN', 'NOUN', 'ADP']",[],0,0,11,"['aminated', 'mono-organosilanes', 'and', 'method', 'of', 'dyeing', 'glass', 'therewith']",1
US2971872A,1954-09-16,Iron powder and the manufacture of magnetic cores therefrom,"['NOUN', 'NOUN', 'CCONJ', 'DET', 'NOUN', 'ADP', 'ADJ', 'NOUN', 'ADP']",[],0,0,10,"['iron', 'powder', 'and', 'the', 'manufacture', 'of', 'magnetic', 'cores', 'therefrom']",1
US2971997A,1958-03-06,Sampling thermocouple,"['VERB', 'DET']",[],0,0,3,"['sampling', 'thermocouple']",1
US2972006A,1958-11-03,Testing equipment and insulated mounting stud therefor,"['NOUN', 'NOUN', 'CCONJ', 'ADJ', 'VERB', 'NOUN', 'ADP']",[],0,0,8,"['testing', 'equipment', 'and', 'insulated', 'mounting', 'stud', 'therefor']",1
US2972039A,1958-03-13,Tube mill and pressure control therefor,"['NOUN', 'NOUN', 'CCONJ', 'NOUN', 'NOUN', 'ADP']",[],0,0,7,"['tube', 'mill', 'and', 'pressure', 'control', 'therefor']",1
US2972081A,1957-06-20,Low noise amplifier,"['ADJ', 'NOUN', 'ADP']",[],0,0,4,"['low', 'noise', 'amplifier']",1
US2972136A,1955-10-10,Data handling system and magnetic switching network therefor,"['NOUN', 'NOUN', 'NOUN', 'CCONJ', 'ADJ', 'NOUN', 'NOUN', 'ADP']",[],0,0,9,"['data', 'handling', 'system', 'and', 'magnetic', 'switching', 'network', 'therefor']",1
US2972237A,1958-07-02,Refrigerant expansion valve and control unit therefor,"['ADJ', 'NOUN', 'NOUN', 'CCONJ', 'NOUN', 'NOUN', 'ADP']",[],0,0,8,"['refrigerant', 'expansion', 'valve', 'and', 'control', 'unit', 'therefor']",1
US2972547A,1957-08-05,Acyl hydrazine compositions and methods of producing color therewith,"['PRON', 'NOUN', 'NOUN', 'CCONJ', 'NOUN', 'ADP', 'VERB', 'NOUN', 'ADP']",[],0,0,10,"['acyl', 'hydrazine', 'compositions', 'and', 'methods', 'of', 'producing', 'color', 'therewith']",1
US2972675A,1956-09-10,Fluorescent lighting fixture and socket assembly therefor,"['NOUN', 'NOUN', 'NOUN', 'CCONJ', 'NOUN', 'NOUN', 'ADP']",[],0,0,8,"['fluorescent', 'lighting', 'fixture', 'and', 'socket', 'assembly', 'therefor']",1
US2972702A,1958-11-13,High frequency amplifier,"['ADJ', 'NOUN', 'ADP']",[],0,0,4,"['high', 'frequency', 'amplifier']",1
US2972704A,1958-03-27,Video amplifier,"['NOUN', 'ADP']",[],0,0,3,"['video', 'amplifier']",1
US2972729A,1957-09-06,Socket for a printed circuit and mounting therefor,"['NOUN', 'ADP', 'DET', 'VERB', 'NOUN', 'CCONJ', 'VERB', 'ADP']",[],0,0,9,"['socket', 'for', 'a', 'printed', 'circuit', 'and', 'mounting', 'therefor']",1
US2972865A,1959-05-11,Fluid pressure take-up,"['ADJ', 'NOUN', 'VERB', 'PUNCT', 'ADP']",[],0,0,6,"['fluid', 'pressure', 'take-up']",1
US2972903A,1958-11-12,Sectional gearing with lubricating means therefor,"['ADJ', 'NOUN', 'ADP', 'VERB', 'NOUN', 'ADP']",[],0,0,7,"['sectional', 'gearing', 'with', 'lubricating', 'means', 'therefor']",1
US2972982A,1957-12-09,Fluid pressure-operated control and adjusting mechanism therefor,"['ADJ', 'NOUN', 'PUNCT', 'VERB', 'NOUN', 'CCONJ', 'VERB', 'NOUN', 'ADP']",[],0,0,10,"['fluid', 'pressure-operated', 'control', 'and', 'adjusting', 'mechanism', 'therefor']",1
US2972986A,1953-12-23,Vapor generating unit with sequential blow-down,"['NOUN', 'NOUN', 'NOUN', 'ADP', 'ADJ', 'NOUN', 'PUNCT', 'ADP']",['ORG'],0,0,9,"['vapor', 'generating', 'unit', 'with', 'sequential', 'blow-down']",1
US2973130A,1957-04-24,Separable plural carton and blank therefor,"['ADJ', 'ADJ', 'NOUN', 'CCONJ', 'VERB', 'ADP']",[],0,0,7,"['separable', 'plural', 'carton', 'and', 'blank', 'therefor']",1
US2973207A,1956-12-24,Record changer and cabinet therefor,"['NOUN', 'NOUN', 'CCONJ', 'NOUN', 'ADP']",[],0,0,6,"['record', 'changer', 'and', 'cabinet', 'therefor']",1
US2973234A,1955-05-12,Closure and package closed therewith,"['NOUN', 'CCONJ', 'NOUN', 'VERB', 'ADP']",[],0,0,6,"['closure', 'and', 'package', 'closed', 'therewith']",1
US2973270A,1958-12-19,Cake mixes and improved shortenings therefor,"['VERB', 'NOUN', 'CCONJ', 'VERB', 'NOUN', 'ADP']",[],0,0,7,"['cake', 'mixes', 'and', 'improved', 'shortenings', 'therefor']",1
US2973295A,1957-05-08,Process of incorporating foamable materials in corrugated paperboard and the article derived therefrom,"['NOUN', 'ADP', 'VERB', 'ADJ', 'NOUN', 'ADP', 'VERB', 'NOUN', 'CCONJ', 'DET', 'NOUN', 'VERB', 'ADP']",[],0,0,14,"['process', 'of', 'incorporating', 'foamable', 'materials', 'in', 'corrugated', 'paperboard', 'and', 'the', 'article', 'derived', 'therefrom']",1
US2973308A,1958-08-25,Complexed plating electrolyte and method of plating therewith,"['ADJ', 'NOUN', 'NOUN', 'CCONJ', 'NOUN', 'ADP', 'NOUN', 'ADP']",[],0,0,9,"['complexed', 'plating', 'electrolyte', 'and', 'method', 'of', 'plating', 'therewith']",1
US2973332A,1955-12-21,Production of unsaturated polyester resins and of copolymers therefrom,"['NOUN', 'ADP', 'ADJ', 'NOUN', 'NOUN', 'CCONJ', 'ADP', 'NOUN', 'ADP']",[],0,0,10,"['production', 'of', 'unsaturated', 'polyester', 'resins', 'and', 'of', 'copolymers', 'therefrom']",1
US2973448A,1957-09-23,Lightning arrester and housing therefor,"['NOUN', 'NOUN', 'CCONJ', 'NOUN', 'ADP']",[],0,0,6,"['lightning', 'arrester', 'and', 'housing', 'therefor']",1
US2973761A,1957-05-21,Umbilical cord protector sheath and applicator instrument therefor,"['ADJ', 'NOUN', 'NOUN', 'NOUN', 'CCONJ', 'NOUN', 'NOUN', 'ADP']",[],0,0,9,"['umbilical', 'cord', 'protector', 'sheath', 'and', 'applicator', 'instrument', 'therefor']",1
US2973952A,1959-04-01,Shock absorber and retainer therefor,"['NOUN', 'NOUN', 'CCONJ', 'NOUN', 'ADP']",[],0,0,6,"['shock', 'absorber', 'and', 'retainer', 'therefor']",1
US2974009A,1957-09-09,Production of titanium tetrachloride,"['NOUN', 'ADP', 'NOUN', 'ADP']",[],0,0,5,"['production', 'of', 'titanium', 'tetrachloride']",1
US2974066A,1957-06-28,Anti-static compositions and synthetic filamentary textile materials treated therewith,"['ADJ', 'ADJ', 'ADJ', 'NOUN', 'CCONJ', 'ADJ', 'ADJ', 'NOUN', 'NOUN', 'VERB', 'ADP']",[],0,0,12,"['anti-static', 'compositions', 'and', 'synthetic', 'filamentary', 'textile', 'materials', 'treated', 'therewith']",1
US2974128A,1957-04-09,Novel acetals and resins therefrom,"['ADJ', 'NOUN', 'CCONJ', 'NOUN', 'ADP']",[],0,0,6,"['novel', 'acetals', 'and', 'resins', 'therefrom']",1
US2974170A,1959-01-16,Preparation of nuclearly unsaturated ionones and intermediates therefor,"['NOUN', 'ADP', 'ADJ', 'ADJ', 'NOUN', 'CCONJ', 'NOUN', 'ADP']",[],0,0,9,"['preparation', 'of', 'nuclearly', 'unsaturated', 'ionones', 'and', 'intermediates', 'therefor']",1
US2974212A,1958-05-21,Switch blade and mounting therefor,"['VERB', 'NOUN', 'CCONJ', 'VERB', 'ADP']",[],0,0,6,"['switch', 'blade', 'and', 'mounting', 'therefor']",1
US2974214A,1958-06-20,Electrical appliance and support means therefor,"['ADJ', 'NOUN', 'CCONJ', 'NOUN', 'VERB', 'ADP']",[],0,0,7,"['electrical', 'appliance', 'and', 'support', 'means', 'therefor']",1
US2974252A,1957-11-25,Low noise amplifier,"['ADJ', 'NOUN', 'ADP']",[],0,0,4,"['low', 'noise', 'amplifier']",1
US2974259A,1957-10-23,Circuit breakers and panelboards therefor,"['NOUN', 'NOUN', 'CCONJ', 'NOUN', 'ADP']",[],0,0,6,"['circuit', 'breakers', 'and', 'panelboards', 'therefor']",1
US2974288A,1957-10-09,D.-c. amplifier and filter therefor,"['NOUN', 'PUNCT', 'ADV', 'CCONJ', 'NOUN', 'ADP']",[],0,0,7,"['d.-c.', 'amplifier', 'and', 'filter', 'therefor']",1
US2974308A,1954-04-15,Magnetic memory device and magnetic circuit therefor,"['ADJ', 'NOUN', 'NOUN', 'CCONJ', 'ADJ', 'NOUN', 'ADP']",[],0,0,8,"['magnetic', 'memory', 'device', 'and', 'magnetic', 'circuit', 'therefor']",1
US2974383A,1955-09-16,"Clips or tags and draught-excluding strips, beadings, mouldings or the like for use therewith","['NOUN', 'CCONJ', 'NOUN', 'CCONJ', 'NOUN', 'PUNCT', 'VERB', 'NOUN', 'PUNCT', 'NOUN', 'PUNCT', 'NOUN', 'CCONJ', 'DET', 'NOUN', 'ADP', 'NOUN', 'ADP']",[],0,0,19,"['clips', 'or', 'tags', 'and', 'draught-excluding', 'strips,', 'beadings,', 'mouldings', 'or', 'the', 'like', 'for', 'use', 'therewith']",1
US2974588A,1958-06-02,Shallow water mine and arming means therefor,"['ADJ', 'NOUN', 'NOUN', 'CCONJ', 'VERB', 'NOUN', 'ADP']",[],0,0,8,"['shallow', 'water', 'mine', 'and', 'arming', 'means', 'therefor']",1
US2974763A,1955-07-20,Pivoted vent type window and operating mechanism therefor,"['ADJ', 'NOUN', 'NOUN', 'NOUN', 'CCONJ', 'NOUN', 'NOUN', 'ADP']",[],0,0,9,"['pivoted', 'vent', 'type', 'window', 'and', 'operating', 'mechanism', 'therefor']",1
US2974803A,1958-02-25,Filing systems and constructions therefor,"['NOUN', 'NOUN', 'CCONJ', 'NOUN', 'ADP']",[],0,0,6,"['filing', 'systems', 'and', 'constructions', 'therefor']",1
US2974860A,1961-03-14,Balance totalizer control means for,"['NOUN', 'NOUN', 'NOUN', 'VERB', 'ADP']",[],0,0,5,"['balance', 'totalizer', 'control', 'means', 'for']",1
US2974940A,1959-04-08,Scale and adaptor therefor,"['NOUN', 'CCONJ', 'NOUN', 'ADP']",[],0,0,5,"['scale', 'and', 'adaptor', 'therefor']",1
US2975139A,1956-10-02,Laundering method and composition therefor,"['NOUN', 'NOUN', 'CCONJ', 'NOUN', 'ADP']",[],0,0,6,"['laundering', 'method', 'and', 'composition', 'therefor']",1
US2975147A,1958-05-05,"Composition comprising polyester, protective colloid and clay and paper coated therewith","['NOUN', 'VERB', 'NOUN', 'PUNCT', 'ADJ', 'NOUN', 'CCONJ', 'NOUN', 'CCONJ', 'NOUN', 'VERB', 'ADP']",[],0,0,13,"['composition', 'comprising', 'polyester,', 'protective', 'colloid', 'and', 'clay', 'and', 'paper', 'coated', 'therewith']",1
US2975152A,1957-04-09,Esters of pentaerytols and vinyl chloride resin composition plasticized therewith,"['NOUN', 'ADP', 'NOUN', 'CCONJ', 'NOUN', 'NOUN', 'NOUN', 'NOUN', 'VERB', 'ADP']",[],0,0,11,"['esters', 'of', 'pentaerytols', 'and', 'vinyl', 'chloride', 'resin', 'composition', 'plasticized', 'therewith']",1
US2975172A,1958-01-07,"9alpha-halo-11beta, 17alpha-trihydroxypregnenes and intermediates therefor","['NOUN', 'PUNCT', 'NUM', 'PUNCT', 'NOUN', 'PUNCT', 'NOUN', 'CCONJ', 'VERB', 'ADP']",['CARDINAL'],0,0,11,"['9alpha-halo-11beta,', '17alpha-trihydroxypregnenes', 'and', 'intermediates', 'therefor']",1
US2975184A,1959-03-31,Yohimbone derivatives and process therefor,"['NOUN', 'NOUN', 'CCONJ', 'NOUN', 'ADP']",[],0,0,6,"['yohimbone', 'derivatives', 'and', 'process', 'therefor']",1
US2975239A,1954-12-24,Electromagnetic eraser,"['ADJ', 'ADP']",[],0,0,3,"['electromagnetic', 'eraser']",1
US2975288A,1958-03-11,Ion chamber and circuit therefor,"['NOUN', 'NOUN', 'CCONJ', 'NOUN', 'ADP']",[],0,0,6,"['ion', 'chamber', 'and', 'circuit', 'therefor']",1
US2975407A,1958-03-03,Erase forward,"['NOUN', 'ADP']",[],0,0,3,"['erase', 'forward']",1
US2975643A,1958-11-13,Selective dual power take-off,"['ADJ', 'ADJ', 'NOUN', 'VERB', 'PUNCT', 'ADP']",[],0,0,7,"['selective', 'dual', 'power', 'take-off']",1
US2975644A,1957-11-12,Portable motor and separable power take-off coupling therefor,"['ADJ', 'NOUN', 'CCONJ', 'ADJ', 'NOUN', 'VERB', 'PUNCT', 'ADP', 'NOUN', 'ADP']",[],0,0,11,"['portable', 'motor', 'and', 'separable', 'power', 'take-off', 'coupling', 'therefor']",1
US2975808A,1956-12-10,Conduit and fabricating material therefor,"['NOUN', 'CCONJ', 'VERB', 'NOUN', 'ADP']",['ORG'],0,0,6,"['conduit', 'and', 'fabricating', 'material', 'therefor']",1
US2975900A,1958-12-08,Basket screens and improved mounting attachments therefor,"['NOUN', 'NOUN', 'CCONJ', 'VERB', 'VERB', 'NOUN', 'ADP']",[],0,0,8,"['basket', 'screens', 'and', 'improved', 'mounting', 'attachments', 'therefor']",1
US2976151A,1959-02-06,Azamerodicarbocyanine dyes and photographic emulsions sensitized therewith,"['ADJ', 'NOUN', 'CCONJ', 'ADJ', 'NOUN', 'VERB', 'ADP']",[],0,0,8,"['azamerodicarbocyanine', 'dyes', 'and', 'photographic', 'emulsions', 'sensitized', 'therewith']",1
US2976167A,1955-08-17,Process for improving fibrous material and composition therefor,"['NOUN', 'ADP', 'VERB', 'ADJ', 'NOUN', 'CCONJ', 'NOUN', 'ADP']",[],0,0,9,"['process', 'for', 'improving', 'fibrous', 'material', 'and', 'composition', 'therefor']",1
US2976204A,1957-09-06,"Adhesive compositions, methods of employing them, and laminated structures made therefrom","['ADJ', 'NOUN', 'PUNCT', 'NOUN', 'ADP', 'VERB', 'PRON', 'PUNCT', 'CCONJ', 'VERB', 'NOUN', 'VERB', 'ADP']",[],0,0,14,"['adhesive', 'compositions,', 'methods', 'of', 'employing', 'them,', 'and', 'laminated', 'structures', 'made', 'therefrom']",1
US2976267A,1958-03-03,Substituted phosphonylidene dimino dibenzoic acids and polyesters therefrom,"['VERB', 'NOUN', 'NOUN', 'ADJ', 'NOUN', 'CCONJ', 'NOUN', 'ADP']",[],0,0,9,"['substituted', 'phosphonylidene', 'dimino', 'dibenzoic', 'acids', 'and', 'polyesters', 'therefrom']",1
US2976377A,1957-07-23,Switch construction and mechanism therefor,"['VERB', 'NOUN', 'CCONJ', 'NOUN', 'ADP']",[],0,0,6,"['switch', 'construction', 'and', 'mechanism', 'therefor']",1
US2976493A,1958-09-03,Phase stable amplifier,"['NOUN', 'ADJ', 'ADP']",[],0,0,4,"['phase', 'stable', 'amplifier']",1
US2976635A,1958-03-24,Etching machine and paddle element therefor,"['VERB', 'NOUN', 'CCONJ', 'NOUN', 'NOUN', 'ADP']",[],0,0,7,"['etching', 'machine', 'and', 'paddle', 'element', 'therefor']",1
US2976653A,1955-10-10,System of merchandising and equipment therefor,"['NOUN', 'ADP', 'NOUN', 'CCONJ', 'NOUN', 'ADP']",[],0,0,7,"['system', 'of', 'merchandising', 'and', 'equipment', 'therefor']",1
US2976748A,1959-08-10,Tumble drill jig,"['NOUN', 'NOUN', 'ADP']",[],0,0,4,"['tumble', 'drill', 'jig']",1
US2976889A,1958-11-25,Resinous compositions and tubular members prepared therefrom,"['ADJ', 'NOUN', 'CCONJ', 'ADJ', 'NOUN', 'VERB', 'ADP']",[],0,0,8,"['resinous', 'compositions', 'and', 'tubular', 'members', 'prepared', 'therefrom']",1
US2976904A,1958-11-05,Tire chains and attaching means therefor,"['NOUN', 'NOUN', 'CCONJ', 'VERB', 'NOUN', 'ADP']",[],0,0,7,"['tire', 'chains', 'and', 'attaching', 'means', 'therefor']",1
US2976923A,1958-09-25,Foldable traverse curtain and construction units therefor,"['ADJ', 'NOUN', 'NOUN', 'CCONJ', 'NOUN', 'NOUN', 'ADP']",[],0,0,8,"['foldable', 'traverse', 'curtain', 'and', 'construction', 'units', 'therefor']",1
US2976999A,1958-12-05,Magnetic filter for fuel systems and mounting therefor,"['ADJ', 'NOUN', 'ADP', 'NOUN', 'NOUN', 'CCONJ', 'VERB', 'ADP']",[],0,0,9,"['magnetic', 'filter', 'for', 'fuel', 'systems', 'and', 'mounting', 'therefor']",1
US2977029A,1957-08-16,Can push-out panel and slide therefor,"['AUX', 'VERB', 'PUNCT', 'ADP', 'NOUN', 'CCONJ', 'VERB', 'ADP']",[],0,0,9,"['can', 'push-out', 'panel', 'and', 'slide', 'therefor']",1
US2977073A,1956-06-21,Aircraft ski and actuating mechanism therefor,"['NOUN', 'NOUN', 'CCONJ', 'VERB', 'NOUN', 'ADP']",[],0,0,7,"['aircraft', 'ski', 'and', 'actuating', 'mechanism', 'therefor']",1
US2977329A,1957-06-25,Rubber composition containing an amidine nitrite and method of preparing cellular product therefrom,"['NOUN', 'NOUN', 'VERB', 'DET', 'ADJ', 'ADJ', 'CCONJ', 'NOUN', 'ADP', 'VERB', 'ADJ', 'NOUN', 'ADP']",[],0,0,14,"['rubber', 'composition', 'containing', 'an', 'amidine', 'nitrite', 'and', 'method', 'of', 'preparing', 'cellular', 'product', 'therefrom']",1
US2977453A,1958-07-29,Electric heater and control circuit therefor,"['ADJ', 'NOUN', 'CCONJ', 'NOUN', 'NOUN', 'ADP']",[],0,0,7,"['electric', 'heater', 'and', 'control', 'circuit', 'therefor']",1
US2977481A,1958-02-28,Magnetic amplifier,"['ADJ', 'ADP']",[],0,0,3,"['magnetic', 'amplifier']",1
US2977482A,1958-12-24,Microwave amplifier,"['NOUN', 'ADP']",[],0,0,3,"['microwave', 'amplifier']",1
US2977547A,1958-08-01,Differential amplifier,"['ADJ', 'ADP']",[],0,0,3,"['differential', 'amplifier']",1
US2977667A,1959-04-06,Top lead bender and abrader,"['ADJ', 'NOUN', 'NOUN', 'CCONJ', 'ADP']",[],0,0,6,"['top', 'lead', 'bender', 'and', 'abrader']",1
US2977704A,1960-05-23,Ice fishing tip-up,"['NOUN', 'NOUN', 'NOUN', 'PUNCT', 'ADP']",[],0,0,6,"['ice', 'fishing', 'tip-up']",1
US2977764A,1959-04-15,Actuator and control system therefor,"['NOUN', 'CCONJ', 'NOUN', 'NOUN', 'ADP']",[],0,0,6,"['actuator', 'and', 'control', 'system', 'therefor']",1
US2977789A,1958-05-15,Heat exchange test jig,"['NOUN', 'NOUN', 'NOUN', 'ADP']",[],0,0,5,"['heat', 'exchange', 'test', 'jig']",1
US2977791A,1958-10-03,Torsional magnetostrictive pressure pick-up,"['ADJ', 'ADJ', 'NOUN', 'VERB', 'PUNCT', 'ADP']",[],0,0,7,"['torsional', 'magnetostrictive', 'pressure', 'pick-up']",1
US2977963A,1957-10-25,Dishwasher and water distributor therefor,"['NOUN', 'CCONJ', 'NOUN', 'NOUN', 'ADP']",[],0,0,6,"['dishwasher', 'and', 'water', 'distributor', 'therefor']",1
US2977971A,1958-04-03,Fluid distribution system and valves therefor,"['ADJ', 'NOUN', 'NOUN', 'CCONJ', 'NOUN', 'ADP']",[],0,0,7,"['fluid', 'distribution', 'system', 'and', 'valves', 'therefor']",1
US2978021A,1957-10-11,Upwardly acting door and sections therefor,"['ADV', 'VERB', 'NOUN', 'CCONJ', 'NOUN', 'ADP']",[],0,0,7,"['upwardly', 'acting', 'door', 'and', 'sections', 'therefor']",1
US2978129A,1958-07-23,Hydraulic hose take up,"['ADJ', 'NOUN', 'VERB', 'ADP']",[],0,0,5,"['hydraulic', 'hose', 'take', 'up']",1
US2978221A,1959-06-26,Resiliently seated valves and sealing structures therefor,"['ADV', 'VERB', 'NOUN', 'CCONJ', 'VERB', 'NOUN', 'ADP']",[],0,0,8,"['resiliently', 'seated', 'valves', 'and', 'sealing', 'structures', 'therefor']",1
US2978359A,1954-12-22,Preparation of hardenable water soluble condensation products and finishing of textile fabrics therewith,"['NOUN', 'ADP', 'ADJ', 'NOUN', 'ADJ', 'NOUN', 'NOUN', 'CCONJ', 'NOUN', 'ADP', 'NOUN', 'NOUN', 'ADP']",[],0,0,14,"['preparation', 'of', 'hardenable', 'water', 'soluble', 'condensation', 'products', 'and', 'finishing', 'of', 'textile', 'fabrics', 'therewith']",1
US2978519A,1957-05-14,Process for the manufacture of,"['NOUN', 'ADP', 'DET', 'NOUN', 'ADP']",[],0,0,5,"['process', 'for', 'the', 'manufacture', 'of']",1
US2978573A,1957-10-10,Fluorescent lighting fixture and supporting means therefor,"['NOUN', 'NOUN', 'NOUN', 'CCONJ', 'VERB', 'NOUN', 'ADP']",[],0,0,8,"['fluorescent', 'lighting', 'fixture', 'and', 'supporting', 'means', 'therefor']",1
US2978631A,1957-08-01,Transformer pick-off,"['NOUN', 'VERB', 'PUNCT', 'ADP']",[],0,0,5,"['transformer', 'pick-off']",1
US2978638A,1959-01-26,Coercion-free capacitance bridge pick-off,"['NOUN', 'PUNCT', 'ADJ', 'NOUN', 'NOUN', 'VERB', 'PUNCT', 'ADP']",[],0,0,9,"['coercion-free', 'capacitance', 'bridge', 'pick-off']",1
US2978798A,1955-08-31,Aluminum and silicon containing metal powder and method of producing workpieces therefrom,"['NOUN', 'CCONJ', 'NOUN', 'VERB', 'NOUN', 'NOUN', 'CCONJ', 'NOUN', 'ADP', 'VERB', 'NOUN', 'ADP']",[],0,0,13,"['aluminum', 'and', 'silicon', 'containing', 'metal', 'powder', 'and', 'method', 'of', 'producing', 'workpieces', 'therefrom']",1
US2978840A,1955-07-25,Building construction and air conduit structure therefor,"['VERB', 'NOUN', 'CCONJ', 'NOUN', 'NOUN', 'NOUN', 'ADP']",[],0,0,8,"['building', 'construction', 'and', 'air', 'conduit', 'structure', 'therefor']",1
US2979029A,1957-10-28,Eyebrow pencil and sharpener therefor,"['ADJ', 'NOUN', 'CCONJ', 'NOUN', 'ADP']",[],0,0,6,"['eyebrow', 'pencil', 'and', 'sharpener', 'therefor']",1
US2979068A,1956-09-27,Step-type control system and relay therefor,"['NOUN', 'PUNCT', 'NOUN', 'NOUN', 'NOUN', 'CCONJ', 'NOUN', 'ADP']",[],0,0,9,"['step-type', 'control', 'system', 'and', 'relay', 'therefor']",1
US2979108A,1956-09-24,Solution and method for treating mica products and articles produced therefrom,"['NOUN', 'CCONJ', 'NOUN', 'ADP', 'VERB', 'NOUN', 'NOUN', 'CCONJ', 'NOUN', 'VERB', 'ADP']",[],0,0,12,"['solution', 'and', 'method', 'for', 'treating', 'mica', 'products', 'and', 'articles', 'produced', 'therefrom']",1
US2979203A,1958-10-22,Mineral jig,"['NOUN', 'ADP']",[],0,0,3,"['mineral', 'jig']",1
US2979239A,1956-11-29,Spout with sealing cover therefor,"['NOUN', 'ADP', 'VERB', 'NOUN', 'ADP']",[],0,0,6,"['spout', 'with', 'sealing', 'cover', 'therefor']",1
US2979244A,1953-08-14,Record tape assembly and magazine therefor,"['NOUN', 'NOUN', 'NOUN', 'CCONJ', 'NOUN', 'ADP']",[],0,0,7,"['record', 'tape', 'assembly', 'and', 'magazine', 'therefor']",1
US2979307A,1958-02-10,Highway guard rail and post therefor,"['NOUN', 'NOUN', 'NOUN', 'CCONJ', 'NOUN', 'ADP']",[],0,0,7,"['highway', 'guard', 'rail', 'and', 'post', 'therefor']",1
US2979326A,1957-02-25,Pneumatic suspension system and liquid expulsion valve unit therefor,"['ADJ', 'NOUN', 'NOUN', 'CCONJ', 'ADJ', 'NOUN', 'NOUN', 'NOUN', 'ADP']",[],0,0,10,"['pneumatic', 'suspension', 'system', 'and', 'liquid', 'expulsion', 'valve', 'unit', 'therefor']",1
US2979336A,1956-08-15,Turntables for automatic recordchanging phonographs and driving mechanism therefor,"['NOUN', 'ADP', 'ADJ', 'VERB', 'NOUN', 'CCONJ', 'NOUN', 'NOUN', 'ADP']",[],0,0,10,"['turntables', 'for', 'automatic', 'recordchanging', 'phonographs', 'and', 'driving', 'mechanism', 'therefor']",1
US2979410A,1957-05-13,Food package and packaging film therefor,"['NOUN', 'NOUN', 'CCONJ', 'NOUN', 'NOUN', 'ADP']",[],0,0,7,"['food', 'package', 'and', 'packaging', 'film', 'therefor']",1
US2979430A,1955-06-04,"Heat resistant phosphate coatings, methods and articles produced therefrom","['NOUN', 'ADJ', 'NOUN', 'NOUN', 'PUNCT', 'NOUN', 'CCONJ', 'NOUN', 'VERB', 'ADP']",[],0,0,11,"['heat', 'resistant', 'phosphate', 'coatings,', 'methods', 'and', 'articles', 'produced', 'therefrom']",1
US2979535A,1961-04-11,Process for the manufacture of,"['NOUN', 'ADP', 'DET', 'NOUN', 'ADP']",[],0,0,5,"['process', 'for', 'the', 'manufacture', 'of']",1
US2979633A,1958-05-26,Storage electrode,"['NOUN', 'ADP']",[],0,0,3,"['storage', 'electrode']",1
US2979666A,1958-10-14,Stabilized transistor amplifier,"['VERB', 'NOUN', 'ADP']",[],0,0,4,"['stabilized', 'transistor', 'amplifier']",1
US2979667A,1958-05-01,Automatic volume control amplifier,"['ADJ', 'NOUN', 'NOUN', 'ADP']",[],0,0,5,"['automatic', 'volume', 'control', 'amplifier']",1
US2979867A,1957-07-24,Grinder and attachment therefor,"['NOUN', 'CCONJ', 'NOUN', 'ADP']",[],0,0,5,"['grinder', 'and', 'attachment', 'therefor']",1
US2979877A,1958-08-26,Corn harvester and thershing unit therefor,"['NOUN', 'NOUN', 'CCONJ', 'ADJ', 'NOUN', 'ADP']",[],0,0,7,"['corn', 'harvester', 'and', 'thershing', 'unit', 'therefor']",1
US2979883A,1957-08-12,Composite yarn and process of producing bulked fabric therefrom,"['ADJ', 'NOUN', 'CCONJ', 'NOUN', 'ADP', 'VERB', 'VERB', 'NOUN', 'ADP']",[],0,0,10,"['composite', 'yarn', 'and', 'process', 'of', 'producing', 'bulked', 'fabric', 'therefrom']",1
US2980125A,1958-07-18,Fire hydrant and valve therefor,"['NOUN', 'ADJ', 'CCONJ', 'VERB', 'ADP']",[],0,0,6,"['fire', 'hydrant', 'and', 'valve', 'therefor']",1
