patent_number,date,title,spacy_pos,spacy_label,is_prpn_spacy,is_person_spacy,spacy_pos_len,bad_endings
US2900228A,1944-11-03,"Selective separation of uranium from thorium, protactinium and fission products by peroxide dissolution method","['ADJ', 'NOUN', 'ADP', 'NOUN', 'ADP', 'PROPN', 'PUNCT', 'NOUN', 'CCONJ', 'NOUN', 'NOUN', 'ADP', 'ADJ', 'NOUN', 'NOUN', 'SPACE']",[],1,0,16,1
US2900240A,1956-11-13,Preparation of sodium borohydride,"['NOUN', 'ADP', 'PROPN', 'PROPN', 'SPACE']",[],1,0,5,1
US2900868A,1954-05-10,Film strip attachment,"['PROPN', 'PROPN', 'NOUN', 'SPACE']",[],1,0,4,1
US2901435A,1955-04-18,Spray drying calcium hypochlorite slurry,"['PROPN', 'VERB', 'NOUN', 'ADJ', 'NOUN', 'SPACE']",[],1,0,6,1
US2901516A,1956-07-23,"Manufacture of 2,2,3,3-tetrachloro-1,4-butanediol","['PROPN', 'ADP', 'NUM', 'PUNCT', 'NOUN', 'PUNCT', 'NOUN', 'SPACE']",[],1,0,8,1
US2901818A,1951-08-22,Apparatus for stripping rolled tube blank from mandrel bar,"['PROPN', 'ADP', 'VERB', 'VERB', 'NOUN', 'ADJ', 'ADP', 'PROPN', 'PROPN', 'SPACE']",[],1,0,10,1
US2901881A,1958-04-10,Apparatus for doffing lint collection chambers,"['PROPN', 'ADP', 'VERB', 'NOUN', 'NOUN', 'NOUN', 'SPACE']",[],1,0,7,1
US2901899A,1958-04-24,Slip clutch,"['PROPN', 'VERB', 'SPACE']",[],1,0,3,1
US2902067A,1957-04-22,Reciprocating saw,"['PROPN', 'VERB', 'SPACE']",[],1,0,3,1
US2902428A,1955-11-01,Extraction of feedstock with polyethylene glycol solvent,"['NOUN', 'ADP', 'NOUN', 'ADP', 'NOUN', 'PROPN', 'NOUN', 'SPACE']",[],1,0,8,1
US2902434A,1954-04-29,Method of starting up a reforming process,"['PROPN', 'ADP', 'VERB', 'ADP', 'DET', 'VERB', 'NOUN', 'SPACE']",[],1,0,8,1
US2902451A,1953-11-02,Dielectric compositions,"['PROPN', 'NOUN', 'SPACE']",[],1,0,3,1
US2902889A,1956-06-18,Hydraulic turret index,"['PROPN', 'PROPN', 'NOUN', 'SPACE']",[],1,0,4,1
US2902913A,1950-12-12,Range finder for photographic cameras,"['PROPN', 'NOUN', 'ADP', 'ADJ', 'NOUN', 'SPACE']",[],1,0,6,1
US2902930A,1957-02-14,Method and apparatus for aligning and retaining type and the like for printing,"['PROPN', 'CCONJ', 'NOUN', 'ADP', 'VERB', 'CCONJ', 'VERB', 'NOUN', 'CCONJ', 'DET', 'NOUN', 'ADP', 'VERB', 'SPACE']",[],1,0,14,1
US2903392A,1955-03-12,beta-thiosubstituted acylamino-nitro propiophenones,"['NOUN', 'PUNCT', 'VERB', 'PROPN', 'PUNCT', 'PROPN', 'NOUN', 'SPACE']",[],1,0,8,1
US2904453A,1954-12-30,Pipe wrap material and method of producing the same,"['PROPN', 'NOUN', 'NOUN', 'CCONJ', 'NOUN', 'ADP', 'VERB', 'DET', 'ADJ', 'SPACE']",[],1,0,10,1
US2905311A,1956-04-07,"Distributor, in particular for shortlength food-paste products","['PROPN', 'PUNCT', 'ADP', 'ADJ', 'ADP', 'NOUN', 'NOUN', 'PUNCT', 'NOUN', 'NOUN', 'SPACE']",[],1,0,11,1
US2905529A,1954-12-07,Preparation of engel's salt,"['NOUN', 'ADP', 'PROPN', 'PART', 'NOUN', 'SPACE']",[],1,0,6,1
US2905824A,1956-10-08,Film holder for radiographic examination of pipe welds,"['PROPN', 'NOUN', 'ADP', 'ADJ', 'NOUN', 'ADP', 'NOUN', 'NOUN', 'SPACE']",[],1,0,9,1
US2906017A,1955-09-21,Method of splicing cables,"['PROPN', 'ADP', 'VERB', 'NOUN', 'SPACE']",[],1,0,5,1
US2906596A,1955-11-09,Method of processing pulverulent raw materials and an apparatus for performing the same,"['PROPN', 'ADP', 'VERB', 'ADJ', 'ADJ', 'NOUN', 'CCONJ', 'DET', 'NOUN', 'ADP', 'VERB', 'DET', 'ADJ', 'SPACE']",[],1,0,14,1
US2906732A,1954-09-16,Method for preparing an extrusion material from high molecular weight synthetic linear superpolyamides,"['PROPN', 'ADP', 'VERB', 'DET', 'NOUN', 'NOUN', 'ADP', 'ADJ', 'ADJ', 'NOUN', 'ADJ', 'PROPN', 'VERB', 'SPACE']",[],1,0,14,1
US2907542A,1953-10-16,Transformer mount,"['PROPN', 'PROPN', 'SPACE']",[],1,0,3,1
US2907565A,1956-05-25,Strip loop control systems,"['PROPN', 'NOUN', 'NOUN', 'NOUN', 'SPACE']",['LOC'],1,0,5,1
US2907607A,1955-12-07,Brake control system,"['PROPN', 'NOUN', 'NOUN', 'SPACE']",['ORG'],1,0,4,1
US2908034A,1956-10-05,Method and apparatus for making blown plastic articles,"['PROPN', 'CCONJ', 'NOUN', 'ADP', 'VERB', 'VERB', 'NOUN', 'NOUN', 'SPACE']",[],1,0,9,1
US2908042A,1955-12-21,Method for producing mottled sheet material,"['PROPN', 'ADP', 'VERB', 'ADJ', 'NOUN', 'NOUN', 'SPACE']",[],1,0,7,1
US2908117A,1957-07-26,Rotary polishing element,"['PROPN', 'VERB', 'NOUN', 'SPACE']",[],1,0,4,1
US2908141A,1954-07-23,Marine platforms,"['PROPN', 'VERB', 'SPACE']",['NORP'],1,0,3,1
US2908446A,1956-05-18,Spray tube,"['PROPN', 'NOUN', 'SPACE']",[],1,0,3,1
US2910575A,1957-02-07,Lamp construction,"['PROPN', 'NOUN', 'SPACE']",[],1,0,3,1
US2911093A,1958-10-02,Hosiery package,"['PROPN', 'NOUN', 'SPACE']",[],1,0,3,1
US2911307A,1956-05-31,Method of packing fruits and vegetables,"['PROPN', 'ADP', 'VERB', 'NOUN', 'CCONJ', 'NOUN', 'SPACE']",[],1,0,7,1
US2912162A,1958-09-16,Square root extracting circuit arrangements,"['PROPN', 'NOUN', 'VERB', 'NOUN', 'NOUN', 'SPACE']",['EVENT'],1,0,6,1
US2912749A,1956-01-13,Method of making a heat exchanger,"['PROPN', 'ADP', 'VERB', 'DET', 'NOUN', 'NOUN', 'SPACE']",[],1,0,7,1
US2913219A,1958-01-16,Lined valve,"['PROPN', 'VERB', 'SPACE']",[],1,0,3,1
US2913337A,1955-07-25,Shell molding,"['PROPN', 'VERB', 'SPACE']",['ORG'],1,0,3,1
US2913776A,1957-09-04,Method and means for applying panels to a ceiling,"['PROPN', 'CCONJ', 'VERB', 'ADP', 'VERB', 'NOUN', 'ADP', 'DET', 'NOUN', 'SPACE']",[],1,0,10,1
US2914437A,1954-03-22,Method of making multi-surfaced sheet material,"['PROPN', 'ADP', 'VERB', 'ADJ', 'ADJ', 'ADJ', 'NOUN', 'NOUN', 'SPACE']",[],1,0,9,1
US2914611A,1954-10-28,Method and apparatus for multiplex telegraphy,"['PROPN', 'CCONJ', 'NOUN', 'ADP', 'PROPN', 'NOUN', 'SPACE']",[],1,0,7,1
US2914778A,1956-11-23,Bed spring,"['PROPN', 'VERB', 'SPACE']",[],1,0,3,1
US2915438A,1956-08-31,Preparation of brucella antigen,"['NOUN', 'ADP', 'PROPN', 'PROPN', 'SPACE']",[],1,0,5,1
US2916815A,1957-07-02,Method of welding or brazing aluminum,"['PROPN', 'ADP', 'NOUN', 'CCONJ', 'VERB', 'NOUN', 'SPACE']",[],1,0,7,1
US2917390A,1959-12-15,apel etal,"['PROPN', 'NOUN', 'SPACE']",[],1,0,3,1
US2917871A,1955-09-23,Apparatus for treating glass,"['PROPN', 'ADP', 'VERB', 'NOUN', 'SPACE']",[],1,0,5,1
US2918393A,1956-06-12,Method and apparatus for roll coating webs,"['PROPN', 'CCONJ', 'NOUN', 'ADP', 'NOUN', 'NOUN', 'NOUN', 'SPACE']",[],1,0,8,1
US2918396A,1957-08-16,Silicon carbide semiconductor devices and method of preparation thereof,"['PROPN', 'NOUN', 'NOUN', 'NOUN', 'CCONJ', 'NOUN', 'ADP', 'NOUN', 'ADV', 'SPACE']",['ORG'],1,0,10,1
US2918592A,1958-06-23,Arc tube mount,"['PROPN', 'PROPN', 'PROPN', 'SPACE']",[],1,0,4,1
US2918877A,1954-07-02,Vane pumps,"['PROPN', 'VERB', 'SPACE']",[],1,0,3,1
US2919794A,1958-07-28,Tow brake,"['PROPN', 'NOUN', 'SPACE']",[],1,0,3,1
US2920401A,1957-11-18,Means for demonstrating nuclear energy concepts,"['PROPN', 'ADP', 'VERB', 'ADJ', 'NOUN', 'NOUN', 'SPACE']",[],1,0,7,1
US2920708A,1956-11-20,Cultivator or chopper,"['PROPN', 'CCONJ', 'VERB', 'SPACE']",[],1,0,4,1
US2920735A,1958-04-23,Bait vending machine,"['PROPN', 'VERB', 'NOUN', 'SPACE']",[],1,0,4,1
US2922041A,1958-06-09,Linear staircase counter,"['PROPN', 'PROPN', 'VERB', 'SPACE']",[],1,0,4,1
US2922875A,1958-03-12,Clearance lamp for automotive vehicles,"['PROPN', 'NOUN', 'ADP', 'ADJ', 'NOUN', 'SPACE']",[],1,0,6,1
US2923321A,1955-01-22,Reserve device for gas cylinders,"['PROPN', 'NOUN', 'ADP', 'NOUN', 'NOUN', 'SPACE']",[],1,0,6,1
US2923400A,1957-03-27,Shipping case for mobile x-ray unit,"['NOUN', 'NOUN', 'ADP', 'PROPN', 'NOUN', 'NOUN', 'NOUN', 'NOUN', 'SPACE']",[],1,0,9,1
US2923410A,1957-04-29,Portable flexible sluice box,"['ADJ', 'ADJ', 'NOUN', 'PROPN', 'SPACE']",[],1,0,5,1
US2923430A,1957-09-12,Apparatus for applying and lifting heavy covers on containers,"['PROPN', 'ADP', 'VERB', 'CCONJ', 'VERB', 'ADJ', 'NOUN', 'ADP', 'NOUN', 'SPACE']",[],1,0,10,1
US2924409A,1956-12-06,Parachute device,"['PROPN', 'NOUN', 'SPACE']",[],1,0,3,1
US2924418A,1955-12-28,Canopy supporting tool,"['PROPN', 'VERB', 'NOUN', 'SPACE']",[],1,0,4,1
US2924435A,1956-02-15,Apparatus for cleaning gas-swept heating surfaces,"['PROPN', 'ADP', 'VERB', 'NOUN', 'PUNCT', 'VERB', 'NOUN', 'NOUN', 'SPACE']",[],1,0,9,1
US2924710A,1957-01-31,Bistable cathode coupled switching gate generator,"['ADJ', 'NOUN', 'VERB', 'VERB', 'NOUN', 'PROPN', 'SPACE']",[],1,0,7,1
US2924826A,1956-09-21,Apparatus for forming and applying hog ring connectors,"['PROPN', 'ADP', 'VERB', 'CCONJ', 'VERB', 'NOUN', 'NOUN', 'NOUN', 'SPACE']",[],1,0,9,1
US2924918A,1958-06-16,Sharpener for cutting blades,"['PROPN', 'ADP', 'VERB', 'NOUN', 'SPACE']",[],1,0,5,1
US2925144A,1955-02-09,"Apparatus for separating dust from gas, particularly hot gas","['PROPN', 'ADP', 'VERB', 'NOUN', 'ADP', 'NOUN', 'PUNCT', 'ADV', 'ADJ', 'NOUN', 'SPACE']",[],1,0,11,1
US2926208A,1956-02-07,Method and apparatus for melting glass,"['PROPN', 'CCONJ', 'NOUN', 'ADP', 'VERB', 'NOUN', 'SPACE']",[],1,0,7,1
US2927190A,1958-03-31,Method of making blanking die assemblies,"['PROPN', 'ADP', 'VERB', 'VERB', 'NOUN', 'NOUN', 'SPACE']",[],1,0,7,1
US2927624A,1960-03-08,Apparatus for forming tubular articles,"['PROPN', 'ADP', 'VERB', 'ADJ', 'NOUN']",[],1,0,5,1
US2927801A,1956-06-25,Hydraulically actuated trim height control,"['ADV', 'VERB', 'VERB', 'PROPN', 'NOUN', 'SPACE']",[],1,0,6,1
US2927873A,1952-03-26,Method of increasing the resistance of metals to corrosion,"['PROPN', 'ADP', 'VERB', 'DET', 'NOUN', 'ADP', 'NOUN', 'PART', 'VERB', 'SPACE']",[],1,0,10,1
US2929597A,1958-02-19,Mounting rack for fire hose nozzles,"['VERB', 'NOUN', 'ADP', 'NOUN', 'PROPN', 'NOUN', 'SPACE']",[],1,0,7,1
US2929703A,1958-05-27,Method and apparatus for handling gases in a direct reduction process,"['PROPN', 'CCONJ', 'NOUN', 'ADP', 'VERB', 'NOUN', 'ADP', 'DET', 'ADJ', 'NOUN', 'NOUN', 'SPACE']",[],1,0,12,1
US2929802A,1955-01-31,Elastic filaments of linear copolyurethanes,"['ADJ', 'NOUN', 'ADP', 'PROPN', 'NOUN', 'SPACE']",['ORG'],1,0,6,1
US2929827A,1956-04-27,Lactone adducts,"['PROPN', 'VERB', 'SPACE']",[],1,0,3,1
US2930584A,1957-07-29,Method and apparatus for inserting wires in conduits,"['PROPN', 'CCONJ', 'NOUN', 'ADP', 'VERB', 'NOUN', 'ADP', 'NOUN', 'SPACE']",[],1,0,9,1
US2930728A,1954-02-26,Butadiene-styrene-albumin adhesive composition and method of joining members therewith,"['PROPN', 'PUNCT', 'ADJ', 'PUNCT', 'NOUN', 'ADJ', 'NOUN', 'CCONJ', 'NOUN', 'ADP', 'VERB', 'NOUN', 'ADP', 'SPACE']",[],1,0,14,1
US2931764A,1956-03-29,Apparatus for electroplating bearing surfaces of a crankshaft,"['PROPN', 'ADP', 'VERB', 'NOUN', 'NOUN', 'ADP', 'DET', 'NOUN', 'SPACE']",[],1,0,9,1
US2931791A,1955-05-23,Polymerization of hydrocarbons with catalyst of bf3 and bci3,"['NOUN', 'ADP', 'NOUN', 'ADP', 'NOUN', 'ADP', 'NOUN', 'CCONJ', 'PROPN', 'SPACE']",[],1,0,10,1
US2931924A,1958-06-25,Quartz oscillator unit for operation at low temperatures,"['PROPN', 'NOUN', 'NOUN', 'ADP', 'NOUN', 'ADP', 'ADJ', 'NOUN', 'SPACE']",[],1,0,9,1
US2932551A,1958-07-14,Briquette mold,"['PROPN', 'NOUN', 'SPACE']",[],1,0,3,1
US2932986A,1955-03-21,Strain wave gear-species in which only one of the gears is input,"['PROPN', 'NOUN', 'NOUN', 'PUNCT', 'NOUN', 'ADP', 'PRON', 'ADV', 'NUM', 'ADP', 'DET', 'NOUN', 'AUX', 'ADJ', 'SPACE']",['CARDINAL'],1,0,15,1
US2933306A,1956-09-10,Apparatus for feeding sintering machine,"['PROPN', 'ADP', 'VERB', 'VERB', 'NOUN', 'SPACE']",[],1,0,6,1
US2933438A,1958-12-19,Electro processing and apparatus therefor,"['PROPN', 'NOUN', 'CCONJ', 'NOUN', 'VERB', 'SPACE']",['GPE'],1,0,6,1
US2933747A,1955-03-25,Dairy utensil,"['NOUN', 'PROPN', 'SPACE']",[],1,0,3,1
US2934142A,1955-06-14,Method and apparatus for feeding substantially gas-free paper pulp into a paper making machine,"['PROPN', 'CCONJ', 'NOUN', 'ADP', 'VERB', 'ADV', 'NOUN', 'PUNCT', 'ADJ', 'NOUN', 'NOUN', 'ADP', 'DET', 'NOUN', 'VERB', 'NOUN', 'SPACE']",[],1,0,17,1
US2934473A,1956-08-27,Bovine rhinotracheitis vaccine and methods of production,"['PROPN', 'NOUN', 'NOUN', 'CCONJ', 'NOUN', 'ADP', 'NOUN', 'SPACE']",[],1,0,8,1
US2934624A,1957-02-25,Bi-directionally releasable circuit breaker,"['PROPN', 'PUNCT', 'ADV', 'ADJ', 'NOUN', 'NOUN', 'SPACE']",[],1,0,7,1
US2935001A,1955-06-07,Gun firing solenoid,"['PROPN', 'VERB', 'NOUN', 'SPACE']",[],1,0,4,1
US2935275A,1955-10-20,Disc shaped aircraft,"['PROPN', 'VERB', 'NOUN', 'SPACE']",[],1,0,4,1
US2935507A,1958-09-10,Azo dyes,"['PROPN', 'NOUN', 'SPACE']",[],1,0,3,1
US2935783A,1957-09-19,Method of making electron tubes,"['PROPN', 'ADP', 'VERB', 'NOUN', 'NOUN', 'SPACE']",[],1,0,6,1
US2936018A,1959-08-03,Apparatus for straightening metallic extrusions,"['PROPN', 'ADP', 'VERB', 'ADJ', 'NOUN', 'SPACE']",[],1,0,6,1
US2936363A,1956-01-27,Apparatus and method for arc welding,"['PROPN', 'CCONJ', 'NOUN', 'ADP', 'NOUN', 'VERB', 'SPACE']",[],1,0,7,1
US2937018A,1958-08-18,Furnace blow pipes,"['PROPN', 'NOUN', 'NOUN', 'SPACE']",['ORG'],1,0,4,1
US2937049A,1949-10-18,Method of and an apparatus for carrying coals out of a vertical shaft with the aid of heavy liquid in the coal mine,"['PROPN', 'ADP', 'CCONJ', 'DET', 'NOUN', 'ADP', 'VERB', 'NOUN', 'ADP', 'ADP', 'DET', 'ADJ', 'NOUN', 'ADP', 'DET', 'NOUN', 'ADP', 'ADJ', 'NOUN', 'ADP', 'DET', 'NOUN', 'NOUN', 'SPACE']",[],1,0,24,1
US2937464A,1957-01-11,Tag with fastening wire,"['PROPN', 'ADP', 'VERB', 'NOUN', 'SPACE']",[],1,0,5,1
US2937507A,1955-09-16,Method and apparatus for utilizing hot and cold side of refrigeration for the dehydration of heat sensitive materials,"['PROPN', 'CCONJ', 'NOUN', 'ADP', 'VERB', 'ADJ', 'CCONJ', 'ADJ', 'NOUN', 'ADP', 'NOUN', 'ADP', 'DET', 'NOUN', 'ADP', 'NOUN', 'ADJ', 'NOUN', 'SPACE']",[],1,0,19,1
US2937571A,1957-10-08,Optical lens mount,"['ADJ', 'NOUN', 'PROPN', 'SPACE']",[],1,0,4,1
US2938970A,1957-02-01,Sequence timer,"['PROPN', 'NOUN', 'SPACE']",[],1,0,3,1
US2939661A,1957-07-25,Hanger bracket,"['PROPN', 'NOUN', 'SPACE']",[],1,0,3,1
US2940186A,1959-07-01,Detachable top lift for lady's heel with screw fastener,"['ADJ', 'ADJ', 'NOUN', 'ADP', 'NOUN', 'PART', 'NOUN', 'ADP', 'PROPN', 'PROPN', 'SPACE']",[],1,0,11,1
US2940554A,1958-12-23,Railway wheel tread brake unit,"['PROPN', 'NOUN', 'NOUN', 'NOUN', 'NOUN', 'SPACE']",[],1,0,6,1
US2940891A,1956-08-23,Method of producing endless fibre webs having irregular surfaces,"['PROPN', 'ADP', 'VERB', 'ADJ', 'NOUN', 'NOUN', 'VERB', 'ADJ', 'NOUN', 'SPACE']",[],1,0,10,1
US2940948A,1955-05-12,Preparation of polyvinyl alcohol,"['NOUN', 'ADP', 'PROPN', 'NOUN', 'SPACE']",[],1,0,5,1
US2941692A,1958-06-09,Brush rest and wiper for paint can,"['PROPN', 'NOUN', 'CCONJ', 'NOUN', 'ADP', 'NOUN', 'AUX', 'SPACE']",[],1,0,8,1
US2941765A,1958-11-25,Kite construction,"['PROPN', 'NOUN', 'SPACE']",[],1,0,3,1
US2941911A,1955-11-15,Method of forming continuous structures of polytetrafluoroethylene,"['PROPN', 'ADP', 'VERB', 'ADJ', 'NOUN', 'ADP', 'NOUN', 'SPACE']",[],1,0,8,1
US2942453A,1954-07-19,Wall construction and bond,"['PROPN', 'NOUN', 'CCONJ', 'NOUN', 'SPACE']",[],1,0,5,1
US2942521A,1958-02-14,Headlight reflector for highways,"['PROPN', 'NOUN', 'ADP', 'NOUN', 'SPACE']",[],1,0,5,1
US2944171A,1957-01-04,Intermediate ring squirrel cage rotor,"['PROPN', 'NOUN', 'NOUN', 'NOUN', 'NOUN', 'SPACE']",[],1,0,6,1
US2944310A,1958-02-13,Method of continuous casting,"['PROPN', 'ADP', 'ADJ', 'NOUN', 'SPACE']",[],1,0,5,1
US2944337A,1955-02-18,Method of forming flexible tubing,"['PROPN', 'ADP', 'VERB', 'ADJ', 'NOUN', 'SPACE']",[],1,0,6,1
US2944557A,1956-12-20,Plating apparatus,"['PROPN', 'NOUN', 'SPACE']",[],1,0,3,1
US2945262A,1955-08-23,Method of forming hollow reinforced plastic bodies,"['PROPN', 'ADP', 'VERB', 'ADJ', 'VERB', 'NOUN', 'NOUN', 'SPACE']",[],1,0,8,1
US2945416A,1949-06-02,Range finder of the overlapping image type for cameras and the like,"['PROPN', 'NOUN', 'ADP', 'DET', 'VERB', 'NOUN', 'NOUN', 'ADP', 'NOUN', 'CCONJ', 'DET', 'ADJ', 'SPACE']",[],1,0,13,1
US2945417A,1958-05-12,Apparatus and mechanism for concentrating solar rays on objects to be tested,"['PROPN', 'CCONJ', 'NOUN', 'ADP', 'VERB', 'ADJ', 'NOUN', 'ADP', 'NOUN', 'PART', 'AUX', 'VERB', 'SPACE']",[],1,0,13,1
US2946070A,1956-01-17,Method of making turned slippers,"['PROPN', 'ADP', 'VERB', 'VERB', 'NOUN', 'SPACE']",[],1,0,6,1
US2946379A,1960-07-26,Cover for the suction box of paper,"['VERB', 'ADP', 'DET', 'NOUN', 'PROPN', 'ADP', 'NOUN']",[],1,0,7,1
US2946397A,1958-02-06,Ladder mount for vehicles,"['PROPN', 'PROPN', 'ADP', 'NOUN', 'SPACE']",[],1,0,5,1
US2946464A,1956-07-11,Apparatus for handling stands of pipe,"['PROPN', 'ADP', 'VERB', 'NOUN', 'ADP', 'NOUN', 'SPACE']",[],1,0,7,1
US2947143A,1952-10-15,Baffle arrangement for combustion equipment,"['PROPN', 'NOUN', 'ADP', 'NOUN', 'NOUN', 'SPACE']",[],1,0,6,1
US2948142A,1957-05-17,Apparatus for impelling objects within a pipeline,"['PROPN', 'ADP', 'VERB', 'NOUN', 'ADP', 'DET', 'NOUN', 'SPACE']",[],1,0,8,1
US2948321A,1958-07-09,Method of and means for prolonging the life of pneumatic tires,"['PROPN', 'ADP', 'CCONJ', 'VERB', 'ADP', 'VERB', 'DET', 'NOUN', 'ADP', 'ADJ', 'NOUN', 'SPACE']",[],1,0,12,1
US2949473A,1956-04-18,Dihydropyran compounds,"['PROPN', 'VERB', 'SPACE']",[],1,0,3,1
US2949579A,1957-12-27,Transistor amplifier with a.v.c.,"['NOUN', 'ADV', 'ADP', 'PROPN', 'PUNCT', 'SPACE']",[],1,0,6,1
US2949701A,1955-09-14,Apparatus for aligning glass forming molds,"['PROPN', 'ADP', 'VERB', 'NOUN', 'VERB', 'NOUN', 'SPACE']",[],1,0,7,1
US2949706A,1957-01-22,Apparatus for forming broach type tools,"['PROPN', 'ADP', 'VERB', 'PROPN', 'NOUN', 'NOUN', 'SPACE']",[],1,0,7,1
US2950334A,1957-11-04,Process of preparing o-divinylbenzene,"['PROPN', 'ADP', 'VERB', 'NOUN', 'NOUN', 'ADJ', 'SPACE']",[],1,0,7,1
US2950350A,1957-03-12,Crossbar switch,"['PROPN', 'VERB', 'SPACE']",['LOC'],1,0,3,1
US2950881A,1956-04-16,Balloon and gondola assembly,"['NOUN', 'CCONJ', 'PROPN', 'NOUN', 'SPACE']",[],1,0,5,1
US2951495A,1956-04-26,Apparatus for dividing a source of fluid into three or more parts,"['PROPN', 'ADP', 'VERB', 'DET', 'NOUN', 'ADP', 'NOUN', 'ADP', 'NUM', 'CCONJ', 'ADJ', 'NOUN', 'SPACE']",['CARDINAL'],1,0,13,1
US2952525A,1955-10-20,Method of manufacturing heavy water,"['PROPN', 'ADP', 'VERB', 'ADJ', 'NOUN', 'SPACE']",[],1,0,6,1
US2952714A,1957-12-30,Method of controlling alkane oxychlorination process,"['PROPN', 'ADP', 'VERB', 'PROPN', 'NOUN', 'NOUN', 'SPACE']",[],1,0,7,1
US2953484A,1957-07-22,Cobalt-chromium electrical resistance device,"['PROPN', 'PUNCT', 'NOUN', 'ADJ', 'NOUN', 'NOUN', 'SPACE']",[],1,0,7,1
US2953668A,1959-05-14,Reversible contrast illuminated control indicator,"['ADJ', 'NOUN', 'VERB', 'NOUN', 'PROPN', 'SPACE']",[],1,0,6,1
US2953841A,1954-04-27,Spray valves,"['PROPN', 'VERB', 'SPACE']",[],1,0,3,1
US2953848A,1958-07-01,Vehicle boxing,"['PROPN', 'VERB', 'SPACE']",[],1,0,3,1
US2954377A,1957-11-28,Dichloro-s-triazine derivatives and process for their production,"['PROPN', 'PUNCT', 'PRON', 'PUNCT', 'NOUN', 'NOUN', 'CCONJ', 'NOUN', 'ADP', 'PRON', 'NOUN', 'SPACE']",['ORG'],1,0,12,1
US2954986A,1958-07-18,Suspension system for tandem axled vehicles,"['NOUN', 'NOUN', 'ADP', 'PROPN', 'VERB', 'NOUN', 'SPACE']",['ORG'],1,0,7,1
US2955386A,1956-12-04,Method of forming a seal for tubular glass enclosures,"['PROPN', 'ADP', 'VERB', 'DET', 'NOUN', 'ADP', 'ADJ', 'NOUN', 'VERB', 'SPACE']",[],1,0,10,1
US2955654A,1957-12-05,Barrel assembly for use in fracturing oil wells,"['PROPN', 'NOUN', 'ADP', 'NOUN', 'ADP', 'VERB', 'NOUN', 'NOUN', 'SPACE']",['ORG'],1,0,9,1
US2956033A,1952-10-03,"Lignin-phenol-formaldehyde resins, and method of preparation","['PROPN', 'PUNCT', 'NOUN', 'PUNCT', 'NOUN', 'NOUN', 'PUNCT', 'CCONJ', 'NOUN', 'ADP', 'NOUN', 'SPACE']",[],1,0,12,1
US2956994A,1955-02-04,Method of polymerizing ethylene,"['PROPN', 'ADP', 'VERB', 'NOUN', 'SPACE']",[],1,0,5,1
US2957546A,1957-04-23,Railway journal box vent,"['PROPN', 'PROPN', 'PROPN', 'PROPN', 'SPACE']",[],1,0,5,1
US2957905A,1958-08-11,Organo-phosphorus compounds,"['PROPN', 'PUNCT', 'NOUN', 'VERB', 'SPACE']",[],1,0,5,1
US2958113A,1955-02-21,Needled batt,"['PROPN', 'PROPN', 'SPACE']",[],1,0,3,1
US2959147A,1959-10-06,Rat guards,"['PROPN', 'VERB', 'SPACE']",[],1,0,3,1
US2959313A,1957-08-01,Fork lift stacker,"['PROPN', 'NOUN', 'NOUN', 'SPACE']",[],1,0,4,1
US2960530A,1959-09-30,Method for the preparation of compounds having boron-sulfur bonds,"['PROPN', 'ADP', 'DET', 'NOUN', 'ADP', 'NOUN', 'VERB', 'NOUN', 'PUNCT', 'NOUN', 'NOUN', 'SPACE']",[],1,0,12,1
US2960574A,1954-07-12,Electric pulse code modulation systems,"['ADJ', 'NOUN', 'PROPN', 'PROPN', 'NOUN', 'SPACE']",[],1,0,6,1
US2960732A,1957-10-03,Multistory building,"['PROPN', 'VERB', 'SPACE']",[],1,0,3,1
US2960769A,1959-07-10,Scalpel handle,"['PROPN', 'VERB', 'SPACE']",[],1,0,3,1
US2961982A,1958-01-24,Means for forming a tufted fabric having different heights of tufting thereon,"['PROPN', 'ADP', 'VERB', 'DET', 'VERB', 'NOUN', 'VERB', 'ADJ', 'NOUN', 'ADP', 'VERB', 'PROPN', 'SPACE']",[],1,0,13,1
US2962031A,1958-03-19,Apparatus for treating hair,"['PROPN', 'ADP', 'VERB', 'NOUN', 'SPACE']",[],1,0,5,1
US2962563A,1954-09-03,Toy electric railway current collector means,"['PROPN', 'ADJ', 'NOUN', 'ADJ', 'NOUN', 'VERB', 'SPACE']",[],1,0,7,1
US2962894A,1957-06-25,Apparatus for automatically testing and metering oil field production,"['PROPN', 'ADP', 'ADV', 'VERB', 'CCONJ', 'VERB', 'NOUN', 'NOUN', 'NOUN', 'SPACE']",[],1,0,10,1
US2963016A,1956-01-26,Catapult type bait caster,"['PROPN', 'NOUN', 'NOUN', 'PROPN', 'SPACE']",[],1,0,5,1
US2963951A,1955-04-29,Shutter mechanism for cameras,"['PROPN', 'NOUN', 'ADP', 'NOUN', 'SPACE']",[],1,0,5,1
US2964476A,1960-12-13,Process for producing a metal-lubricant,"['PROPN', 'ADP', 'VERB', 'DET', 'NOUN', 'PUNCT', 'NOUN']",[],1,0,7,1
US2964488A,1956-04-11,Process of polymerizing methyl alphachloroacrylate in the presence of a condensation product of nonyl phenol and ethylene oxide,"['PROPN', 'ADP', 'VERB', 'NOUN', 'NOUN', 'ADP', 'DET', 'NOUN', 'ADP', 'DET', 'NOUN', 'NOUN', 'ADP', 'ADJ', 'NOUN', 'CCONJ', 'NOUN', 'NOUN', 'SPACE']",[],1,0,19,1
US2964494A,1958-05-08,Poly-alpha-olefin composition containing nu-methyl-4'-hydroxybenzanilide,"['ADJ', 'PUNCT', 'NOUN', 'PUNCT', 'NOUN', 'NOUN', 'VERB', 'PROPN', 'PROPN', 'NOUN', 'SPACE']",[],1,0,11,1
US2964525A,1960-12-13,Method of producing chlorocyanuric,"['PROPN', 'ADP', 'VERB', 'ADJ']",[],1,0,4,1
US2964679A,1959-06-26,Arc plasma generator,"['PROPN', 'NOUN', 'NOUN', 'SPACE']",[],1,0,4,1
US2964681A,1958-12-16,Arc circuit control,"['PROPN', 'NOUN', 'NOUN', 'SPACE']",[],1,0,4,1
US2964695A,1957-06-20,Impedance controlled magnetic amplifier,"['PROPN', 'VERB', 'ADJ', 'ADP', 'SPACE']",[],1,0,5,1
US2964699A,1957-09-09,Probe device for flaw detection,"['NOUN', 'NOUN', 'ADP', 'PROPN', 'PROPN', 'SPACE']",[],1,0,6,1
US2964887A,1958-02-24,Apparatus for polishing,"['PROPN', 'ADP', 'VERB', 'SPACE']",[],1,0,4,1
US2965301A,1955-03-16,Ohm's law computer unit,"['PROPN', 'PART', 'NOUN', 'NOUN', 'NOUN', 'SPACE']",[],1,0,6,1
US2965708A,1954-09-29,Tape recording,"['PROPN', 'VERB', 'SPACE']",[],1,0,3,1
US2965915A,1959-10-14,Windshield wiper blade assembly,"['PROPN', 'NOUN', 'NOUN', 'NOUN', 'SPACE']",[],1,0,5,1
US2966348A,1956-06-05,Furnace arrangement,"['PROPN', 'NOUN', 'SPACE']",[],1,0,3,1
US2966803A,1960-04-01,Toroidal gyroscope,"['PROPN', 'VERB', 'SPACE']",[],1,0,3,1
US2967115A,1958-07-25,Method of depositing silicon on a silica coated substrate,"['PROPN', 'ADP', 'VERB', 'NOUN', 'ADP', 'DET', 'PROPN', 'VERB', 'PROPN', 'SPACE']",[],1,0,10,1
US2967301A,1957-10-15,Selective directional slotted waveguide antenna,"['ADJ', 'ADJ', 'VERB', 'PROPN', 'PROPN', 'SPACE']",[],1,0,6,1
US2967306A,1956-09-11,Weatherproof garment for hunters,"['PROPN', 'NOUN', 'ADP', 'NOUN', 'SPACE']",[],1,0,5,1
US2968862A,1955-07-25,Method of manufacturing magnetic cores,"['PROPN', 'ADP', 'VERB', 'ADJ', 'NOUN', 'SPACE']",[],1,0,6,1
US2969165A,1959-02-16,Hinge and box assembly,"['PROPN', 'CCONJ', 'NOUN', 'NOUN', 'SPACE']",[],1,0,5,1
US2969448A,1959-03-03,Heater vaporizer element support,"['PROPN', 'NOUN', 'NOUN', 'NOUN', 'SPACE']",[],1,0,5,1
US2969639A,1957-12-18,Method for developing thrust by the combustion of bipropellants,"['PROPN', 'ADP', 'VERB', 'NOUN', 'ADP', 'DET', 'NOUN', 'ADP', 'NOUN', 'SPACE']",[],1,0,10,1
US2969728A,1957-05-06,Method of embossing,"['PROPN', 'ADP', 'VERB', 'SPACE']",[],1,0,4,1
US2969986A,1956-09-07,Fertilizer spreader,"['PROPN', 'NOUN', 'SPACE']",[],1,0,3,1
US2970068A,1955-03-07,Method of making a composite stock,"['PROPN', 'ADP', 'VERB', 'DET', 'ADJ', 'NOUN', 'SPACE']",[],1,0,7,1
US2970083A,1958-03-06,Two phase deodorant-antiperspirant stick,"['NUM', 'NOUN', 'NOUN', 'PUNCT', 'PROPN', 'NOUN', 'SPACE']",['CARDINAL'],1,0,7,1
US2970088A,1959-01-16,Method for the cultivation of microorganisms,"['PROPN', 'ADP', 'DET', 'NOUN', 'ADP', 'NOUN', 'SPACE']",[],1,0,7,1
US2970241A,1958-01-08,Backward wave tube amplifieroscillator,"['PROPN', 'NOUN', 'NOUN', 'NOUN', 'SPACE']",[],1,0,5,1
US2970784A,1956-10-19,Method of deleaving and bursting continuous form stationery,"['PROPN', 'ADP', 'VERB', 'CCONJ', 'VERB', 'ADJ', 'NOUN', 'NOUN', 'SPACE']",[],1,0,9,1
US2971259A,1959-07-10,Method and apparatus for determining the position of sewer leaks,"['PROPN', 'CCONJ', 'NOUN', 'ADP', 'VERB', 'DET', 'NOUN', 'ADP', 'NOUN', 'NOUN', 'SPACE']",[],1,0,11,1
US2971710A,1957-05-03,Apparatus for continuously reeling strand material,"['PROPN', 'ADP', 'ADV', 'VERB', 'NOUN', 'NOUN', 'SPACE']",[],1,0,7,1
US2971945A,1956-12-19,"Polymers of allyl 3, 4-epoxy-2-hydroxyalkanoates","['NOUN', 'ADP', 'PROPN', 'NUM', 'PUNCT', 'NUM', 'PUNCT', 'SPACE', 'PUNCT', 'NOUN', 'SPACE']","['CARDINAL', 'CARDINAL']",1,0,11,1
US2971956A,1956-04-30,Beta-(cyclic amino)-alpha-hydroxy-alkanals,"['PROPN', 'PROPN', 'PUNCT', 'ADJ', 'PUNCT', 'NOUN', 'SPACE']",[],1,0,7,1
US2972328A,1957-07-25,Tilting mechanism for outboard motors,"['VERB', 'NOUN', 'ADP', 'PROPN', 'NOUN', 'SPACE']",[],1,0,6,1
US2972567A,1957-07-11,Method of producing clinical dextran,"['PROPN', 'ADP', 'VERB', 'ADJ', 'NOUN', 'SPACE']",[],1,0,6,1
US2972740A,1955-04-25,Shaft position digitizer,"['PROPN', 'NOUN', 'NOUN', 'SPACE']",['ORG'],1,0,4,1
US2972997A,1956-04-09,Apparatus for cleaning surfaces,"['PROPN', 'ADP', 'VERB', 'NOUN', 'SPACE']",[],1,0,5,1
