patent_number,date,title,spacy_pos,spacy_label,is_prpn_spacy,is_person_spacy,spacy_pos_len,tokens,bad_endings
US2933619A,1953-03-25,"Semi-conductor device comprising an anode, a cathode and a control electrode","['ADJ', 'ADJ', 'NOUN', 'NOUN', 'VERB', 'DET', 'NOUN', 'PUNCT', 'DET', 'NOUN', 'CCONJ', 'DET', 'NOUN', 'ADP']",[],0,0,15,"['semi-conductor', 'device', 'comprising', 'an', 'anode,', 'a', 'cathode', 'and', 'a', 'control', 'electrode']",1
US2933672A,1955-03-28,Magnetic amplifier,"['ADJ', 'ADP']",[],0,0,3,"['magnetic', 'amplifier']",1
US2933788A,1957-12-12,Ingot mold insert mat,"['NOUN', 'NOUN', 'NOUN', 'ADP']",[],0,0,5,"['ingot', 'mold', 'insert', 'mat']",1
US2933829A,1958-02-25,Scale model assembly jig,"['NOUN', 'NOUN', 'NOUN', 'ADP']",[],0,0,5,"['scale', 'model', 'assembly', 'jig']",1
US2933850A,1957-11-04,Furniture leg build up,"['NOUN', 'NOUN', 'VERB', 'ADP']",[],0,0,5,"['furniture', 'leg', 'build', 'up']",1
US2933928A,1956-06-26,Power take-off,"['NOUN', 'VERB', 'PUNCT', 'ADP']",[],0,0,5,"['power', 'take-off']",1
US2934032A,1956-08-15,Methods for holding buttons for sewing and holding means therefor,"['NOUN', 'ADP', 'VERB', 'NOUN', 'ADP', 'NOUN', 'CCONJ', 'NOUN', 'NOUN', 'ADP']",[],0,0,11,"['methods', 'for', 'holding', 'buttons', 'for', 'sewing', 'and', 'holding', 'means', 'therefor']",1
US2934088A,1957-05-29,Valves and bodies therefor,"['NOUN', 'CCONJ', 'NOUN', 'ADP']",[],0,0,5,"['valves', 'and', 'bodies', 'therefor']",1
US2934139A,1957-06-05,Side coiling articulated partition and drive mechanism therefor,"['NOUN', 'NOUN', 'VERB', 'NOUN', 'CCONJ', 'VERB', 'NOUN', 'ADP']",[],0,0,9,"['side', 'coiling', 'articulated', 'partition', 'and', 'drive', 'mechanism', 'therefor']",1
US2934167A,1955-10-12,Purification of boron trichloride,"['NOUN', 'ADP', 'NOUN', 'ADP']",[],0,0,5,"['purification', 'of', 'boron', 'trichloride']",1
US2934218A,1956-07-06,Automatic device for transferring workpieces from one machine-tool to another,"['ADJ', 'NOUN', 'ADP', 'VERB', 'NOUN', 'ADP', 'NUM', 'NOUN', 'PUNCT', 'NOUN', 'ADP', 'DET']",['CARDINAL'],0,0,13,"['automatic', 'device', 'for', 'transferring', 'workpieces', 'from', 'one', 'machine-tool', 'to', 'another']",1
US2934313A,1957-02-04,Gate valve and seat assembly therefor,"['NOUN', 'NOUN', 'CCONJ', 'NOUN', 'NOUN', 'ADP']",[],0,0,7,"['gate', 'valve', 'and', 'seat', 'assembly', 'therefor']",1
US2934324A,1957-02-07,Heat exchange and control therefor,"['NOUN', 'NOUN', 'CCONJ', 'NOUN', 'ADP']",[],0,0,6,"['heat', 'exchange', 'and', 'control', 'therefor']",1
US2934372A,1958-01-16,Vehicle body and structural elements therefor,"['NOUN', 'NOUN', 'CCONJ', 'ADJ', 'NOUN', 'ADP']",[],0,0,7,"['vehicle', 'body', 'and', 'structural', 'elements', 'therefor']",1
US2934412A,1956-07-12,Prilling of ammonium nitrate,"['NOUN', 'ADP', 'NOUN', 'ADP']",[],0,0,5,"['prilling', 'of', 'ammonium', 'nitrate']",1
US2934450A,1955-12-29,Chromium complexes of fluorocarbon acids and articles coated therewith,"['NOUN', 'NOUN', 'ADP', 'NOUN', 'NOUN', 'CCONJ', 'NOUN', 'VERB', 'ADP']",[],0,0,10,"['chromium', 'complexes', 'of', 'fluorocarbon', 'acids', 'and', 'articles', 'coated', 'therewith']",1
US2934464A,1958-12-18,Organosiloxane resin compositions and glass laminates impregnated therewith,"['NOUN', 'NOUN', 'NOUN', 'CCONJ', 'NOUN', 'NOUN', 'VERB', 'ADP']",[],0,0,9,"['organosiloxane', 'resin', 'compositions', 'and', 'glass', 'laminates', 'impregnated', 'therewith']",1
US2934468A,1956-07-30,Fortified rosin size and paper sized therewith,"['ADJ', 'NOUN', 'NOUN', 'CCONJ', 'NOUN', 'VERB', 'ADP']",[],0,0,8,"['fortified', 'rosin', 'size', 'and', 'paper', 'sized', 'therewith']",1
US2934508A,1957-07-31,Polymerizable compositions and resins made therefrom,"['ADJ', 'NOUN', 'CCONJ', 'NOUN', 'VERB', 'ADP']",[],0,0,7,"['polymerizable', 'compositions', 'and', 'resins', 'made', 'therefrom']",1
US2934512A,1954-09-20,"Coating composition of methyl methacrylate polymer, copper bronze pigment, and transparent colored pigment and article coated therewith","['VERB', 'NOUN', 'ADP', 'NOUN', 'ADJ', 'NOUN', 'PUNCT', 'NOUN', 'NOUN', 'NOUN', 'PUNCT', 'CCONJ', 'ADJ', 'ADJ', 'NOUN', 'CCONJ', 'NOUN', 'VERB', 'ADP']",[],0,0,20,"['coating', 'composition', 'of', 'methyl', 'methacrylate', 'polymer,', 'copper', 'bronze', 'pigment,', 'and', 'transparent', 'colored', 'pigment', 'and', 'article', 'coated', 'therewith']",1
US2934525A,1956-03-21,"Acrylyloxy triazines, method of making same, and polymerization products therefrom","['ADJ', 'NOUN', 'PUNCT', 'NOUN', 'ADP', 'VERB', 'ADJ', 'PUNCT', 'CCONJ', 'NOUN', 'NOUN', 'ADP']",[],0,0,13,"['acrylyloxy', 'triazines,', 'method', 'of', 'making', 'same,', 'and', 'polymerization', 'products', 'therefrom']",1
US2934589A,1957-02-06,Electrical lead-through,"['ADJ', 'NOUN', 'PUNCT', 'ADP']",[],0,0,5,"['electrical', 'lead-through']",1
US2934603A,1951-07-12,Electronic relay and the control of arrangements therewith,"['ADJ', 'NOUN', 'CCONJ', 'DET', 'NOUN', 'ADP', 'NOUN', 'ADP']",[],0,0,9,"['electronic', 'relay', 'and', 'the', 'control', 'of', 'arrangements', 'therewith']",1
US2934684A,1958-01-27,Rectifier stack and spacing contact washer therefor,"['ADJ', 'NOUN', 'CCONJ', 'VERB', 'NOUN', 'NOUN', 'ADP']",['PERSON'],0,1,8,"['rectifier', 'stack', 'and', 'spacing', 'contact', 'washer', 'therefor']",1
US2934709A,1954-09-22,High-fidelity wide-band amplifier,"['ADJ', 'PUNCT', 'NOUN', 'ADJ', 'PUNCT', 'NOUN', 'ADP']",[],0,0,8,"['high-fidelity', 'wide-band', 'amplifier']",1
US2934713A,1954-09-17,Anode-follower amplifier,"['NOUN', 'PUNCT', 'NOUN', 'ADP']",['ORG'],0,0,5,"['anode-follower', 'amplifier']",1
US2934714A,1957-08-26,Power amplifier,"['NOUN', 'ADP']",[],0,0,3,"['power', 'amplifier']",1
US2934715A,1956-09-17,Grid bias control for class-b amplifier,"['NOUN', 'NOUN', 'NOUN', 'ADP', 'NOUN', 'PUNCT', 'NOUN', 'ADP']",[],0,0,9,"['grid', 'bias', 'control', 'for', 'class-b', 'amplifier']",1
US2934879A,1956-04-23,Corn harvester and stalk cutters therefor,"['NOUN', 'NOUN', 'CCONJ', 'NOUN', 'NOUN', 'ADP']",[],0,0,7,"['corn', 'harvester', 'and', 'stalk', 'cutters', 'therefor']",1
US2934954A,1955-07-13,Humidity indicating device and low pressure static seal therefor,"['NOUN', 'VERB', 'NOUN', 'CCONJ', 'ADJ', 'NOUN', 'ADJ', 'NOUN', 'ADP']",[],0,0,10,"['humidity', 'indicating', 'device', 'and', 'low', 'pressure', 'static', 'seal', 'therefor']",1
US2935231A,1958-02-17,Collapsible tube and insert therefor,"['ADJ', 'NOUN', 'CCONJ', 'NOUN', 'ADP']",[],0,0,6,"['collapsible', 'tube', 'and', 'insert', 'therefor']",1
US2935238A,1958-01-30,Collapsible pyramid structures and blanks therefor,"['ADJ', 'NOUN', 'NOUN', 'CCONJ', 'NOUN', 'ADP']",[],0,0,7,"['collapsible', 'pyramid', 'structures', 'and', 'blanks', 'therefor']",1
US2935284A,1958-01-23,Window bracket support for air conditioners and like,"['NOUN', 'NOUN', 'NOUN', 'ADP', 'NOUN', 'NOUN', 'CCONJ', 'ADP']",[],0,0,9,"['window', 'bracket', 'support', 'for', 'air', 'conditioners', 'and', 'like']",1
US2935295A,1951-01-26,Throttle configuration varying apparatus and control means therefor,"['NOUN', 'NOUN', 'VERB', 'NOUN', 'CCONJ', 'NOUN', 'VERB', 'ADP']",[],0,0,9,"['throttle', 'configuration', 'varying', 'apparatus', 'and', 'control', 'means', 'therefor']",1
US2935336A,1958-02-04,Mud guards and mounting structures therefor,"['NOUN', 'NOUN', 'CCONJ', 'VERB', 'NOUN', 'ADP']",[],0,0,7,"['mud', 'guards', 'and', 'mounting', 'structures', 'therefor']",1
US2935425A,1954-12-29,Chemical nickel plating processes and baths therefor,"['NOUN', 'NOUN', 'NOUN', 'NOUN', 'CCONJ', 'NOUN', 'ADP']",['ORG'],0,0,8,"['chemical', 'nickel', 'plating', 'processes', 'and', 'baths', 'therefor']",1
US2935455A,1958-01-08,Metal polishing compositions and electropolishing of metals therewith,"['NOUN', 'NOUN', 'NOUN', 'CCONJ', 'NOUN', 'ADP', 'NOUN', 'ADP']",[],0,0,9,"['metal', 'polishing', 'compositions', 'and', 'electropolishing', 'of', 'metals', 'therewith']",1
US2935506A,1956-09-04,New dyestuffs and process for dyeing therewith,"['ADJ', 'NOUN', 'CCONJ', 'NOUN', 'ADP', 'VERB', 'ADP']",[],0,0,8,"['new', 'dyestuffs', 'and', 'process', 'for', 'dyeing', 'therewith']",1
US2935633A,1957-09-25,Radiation emitting target cooler,"['NOUN', 'VERB', 'NOUN', 'ADP']",[],0,0,5,"['radiation', 'emitting', 'target', 'cooler']",1
US2935640A,1954-03-24,Traveling wave amplifier,"['VERB', 'NOUN', 'ADP']",[],0,0,4,"['traveling', 'wave', 'amplifier']",1
US2935687A,1956-08-01,Logarithmic video amplifier,"['ADJ', 'NOUN', 'ADP']",[],0,0,4,"['logarithmic', 'video', 'amplifier']",1
US2935695A,1958-04-02,Plural channel wide band amplifier,"['ADJ', 'NOUN', 'ADJ', 'NOUN', 'ADP']",[],0,0,6,"['plural', 'channel', 'wide', 'band', 'amplifier']",1
US2935943A,1958-03-31,Moored mine and magnetically actuated firing means therefor,"['VERB', 'NOUN', 'CCONJ', 'ADV', 'VERB', 'NOUN', 'NOUN', 'ADP']",[],0,0,9,"['moored', 'mine', 'and', 'magnetically', 'actuated', 'firing', 'means', 'therefor']",1
US2935997A,1957-06-17,Automatic shut-off valve and controls therefor,"['ADJ', 'VERB', 'PUNCT', 'ADP', 'NOUN', 'CCONJ', 'NOUN', 'ADP']",[],0,0,9,"['automatic', 'shut-off', 'valve', 'and', 'controls', 'therefor']",1
US2935998A,1957-09-19,Automatic shut-off valve and controls therefor,"['ADJ', 'VERB', 'PUNCT', 'ADP', 'NOUN', 'CCONJ', 'NOUN', 'ADP']",[],0,0,9,"['automatic', 'shut-off', 'valve', 'and', 'controls', 'therefor']",1
US2936345A,1954-07-06,High efficiency direct current power amplifier,"['ADJ', 'NOUN', 'ADJ', 'ADJ', 'NOUN', 'ADP']",[],0,0,7,"['high', 'efficiency', 'direct', 'current', 'power', 'amplifier']",1
US2936424A,1955-04-28,Transistor amplifier,"['NOUN', 'ADP']",[],0,0,3,"['transistor', 'amplifier']",1
US2936563A,1956-09-26,Rotary lawnmower and attachment therefor,"['ADJ', 'NOUN', 'CCONJ', 'NOUN', 'ADP']",[],0,0,6,"['rotary', 'lawnmower', 'and', 'attachment', 'therefor']",1
US2936568A,1957-09-11,Spinning ring and holder therefor,"['VERB', 'NOUN', 'CCONJ', 'NOUN', 'ADP']",[],0,0,6,"['spinning', 'ring', 'and', 'holder', 'therefor']",1
US2936741A,1957-05-01,Temperature stabilized fluid heater and a composition of matter for the storage of heat therefor,"['NOUN', 'VERB', 'ADJ', 'NOUN', 'CCONJ', 'DET', 'NOUN', 'ADP', 'NOUN', 'ADP', 'DET', 'NOUN', 'ADP', 'NOUN', 'ADP']",[],0,0,16,"['temperature', 'stabilized', 'fluid', 'heater', 'and', 'a', 'composition', 'of', 'matter', 'for', 'the', 'storage', 'of', 'heat', 'therefor']",1
US2936864A,1956-06-21,Transmission drive mechanism for vehicles and the control system therefor,"['NOUN', 'NOUN', 'NOUN', 'ADP', 'NOUN', 'CCONJ', 'DET', 'NOUN', 'NOUN', 'ADP']",[],0,0,11,"['transmission', 'drive', 'mechanism', 'for', 'vehicles', 'and', 'the', 'control', 'system', 'therefor']",1
US2936870A,1954-09-22,Account sheet and office machine to be used therewith,"['NOUN', 'NOUN', 'CCONJ', 'NOUN', 'NOUN', 'PART', 'AUX', 'VERB', 'ADP']",[],0,0,10,"['account', 'sheet', 'and', 'office', 'machine', 'to', 'be', 'used', 'therewith']",1
US2937011A,1957-08-23,Aircraft air conditioning system and temperature control means therefor,"['NOUN', 'NOUN', 'NOUN', 'NOUN', 'CCONJ', 'NOUN', 'NOUN', 'VERB', 'ADP']",[],0,0,10,"['aircraft', 'air', 'conditioning', 'system', 'and', 'temperature', 'control', 'means', 'therefor']",1
US2937067A,1956-10-26,New process for the coloration of synthetic materials and the industrial products resulting therefrom,"['ADJ', 'NOUN', 'ADP', 'DET', 'NOUN', 'ADP', 'ADJ', 'NOUN', 'CCONJ', 'DET', 'ADJ', 'NOUN', 'VERB', 'ADP']",[],0,0,15,"['new', 'process', 'for', 'the', 'coloration', 'of', 'synthetic', 'materials', 'and', 'the', 'industrial', 'products', 'resulting', 'therefrom']",1
US2937085A,1954-01-11,"Composite photosensitive plate, and method of making printing plate therefrom","['ADJ', 'ADJ', 'NOUN', 'PUNCT', 'CCONJ', 'NOUN', 'ADP', 'VERB', 'NOUN', 'NOUN', 'ADP']",[],0,0,12,"['composite', 'photosensitive', 'plate,', 'and', 'method', 'of', 'making', 'printing', 'plate', 'therefrom']",1
US2937189A,1957-11-12,Production of pyromellitic dianhydride,"['NOUN', 'ADP', 'ADJ', 'ADP']",[],0,0,5,"['production', 'of', 'pyromellitic', 'dianhydride']",1
US2937190A,1958-03-10,Carbamylanthraquinone compounds and materials dyed therewith,"['NOUN', 'VERB', 'CCONJ', 'NOUN', 'VERB', 'ADP']",[],0,0,7,"['carbamylanthraquinone', 'compounds', 'and', 'materials', 'dyed', 'therewith']",1
US2937215A,1957-01-07,Isomerization process and preparation of feed stream therefor,"['NOUN', 'NOUN', 'CCONJ', 'NOUN', 'ADP', 'NOUN', 'NOUN', 'ADP']",[],0,0,9,"['isomerization', 'process', 'and', 'preparation', 'of', 'feed', 'stream', 'therefor']",1
US2937230A,1954-05-28,"Resinous reaction products of unsaturated polyesters organopolysiloxanes, and unsaturated monomers and electrical members insulated therewith","['ADJ', 'NOUN', 'NOUN', 'ADP', 'ADJ', 'NOUN', 'NOUN', 'PUNCT', 'CCONJ', 'ADJ', 'NOUN', 'CCONJ', 'ADJ', 'NOUN', 'VERB', 'ADP']",[],0,0,17,"['resinous', 'reaction', 'products', 'of', 'unsaturated', 'polyesters', 'organopolysiloxanes,', 'and', 'unsaturated', 'monomers', 'and', 'electrical', 'members', 'insulated', 'therewith']",1
US2937326A,1954-06-21,Electrically controlled force amplifier,"['ADV', 'VERB', 'NOUN', 'ADP']",[],0,0,5,"['electrically', 'controlled', 'force', 'amplifier']",1
US2937331A,1954-04-19,Magnetic amplifier,"['ADJ', 'ADP']",[],0,0,3,"['magnetic', 'amplifier']",1
US2937351A,1956-02-13,Magnetic amplifier,"['ADJ', 'ADP']",[],0,0,3,"['magnetic', 'amplifier']",1
US2937498A,1953-01-13,Mechanically controlled multistage combustion chambers for gas-impulsetype engines and improved discharge control therefor,"['ADV', 'VERB', 'NOUN', 'NOUN', 'NOUN', 'ADP', 'NOUN', 'PUNCT', 'NOUN', 'NOUN', 'CCONJ', 'VERB', 'NOUN', 'NOUN', 'ADP']",[],0,0,16,"['mechanically', 'controlled', 'multistage', 'combustion', 'chambers', 'for', 'gas-impulsetype', 'engines', 'and', 'improved', 'discharge', 'control', 'therefor']",1
US2937758A,1956-08-10,Holder for clothing and like,"['NOUN', 'ADP', 'NOUN', 'CCONJ', 'ADP']",[],0,0,6,"['holder', 'for', 'clothing', 'and', 'like']",1
US2937806A,1953-02-12,Axial flow compressor construction and bladed rotors therefor,"['ADJ', 'NOUN', 'VERB', 'NOUN', 'CCONJ', 'ADJ', 'NOUN', 'ADP']",[],0,0,9,"['axial', 'flow', 'compressor', 'construction', 'and', 'bladed', 'rotors', 'therefor']",1
US2937902A,1956-08-01,Resilient trim member and securing means therefor,"['ADJ', 'VERB', 'NOUN', 'CCONJ', 'NOUN', 'NOUN', 'ADP']",[],0,0,8,"['resilient', 'trim', 'member', 'and', 'securing', 'means', 'therefor']",1
US2937944A,1957-11-20,Xerographic light-sensitive member and process therefor,"['ADJ', 'ADJ', 'PUNCT', 'ADJ', 'NOUN', 'CCONJ', 'NOUN', 'ADP']",[],0,0,9,"['xerographic', 'light-sensitive', 'member', 'and', 'process', 'therefor']",1
US2937950A,1954-10-14,Thixotropic treating composition and a method of treating concrete pouring forms therewith,"['NOUN', 'VERB', 'NOUN', 'CCONJ', 'DET', 'NOUN', 'ADP', 'VERB', 'NOUN', 'VERB', 'NOUN', 'ADP']",[],0,0,13,"['thixotropic', 'treating', 'composition', 'and', 'a', 'method', 'of', 'treating', 'concrete', 'pouring', 'forms', 'therewith']",1
US2937954A,1956-04-03,Putty powder and putty compositions made therefrom,"['ADJ', 'NOUN', 'CCONJ', 'ADJ', 'NOUN', 'VERB', 'ADP']",[],0,0,8,"['putty', 'powder', 'and', 'putty', 'compositions', 'made', 'therefrom']",1
US2937975A,1958-08-18,Steroid halohydrins and process therefor,"['NOUN', 'NOUN', 'CCONJ', 'NOUN', 'ADP']",[],0,0,6,"['steroid', 'halohydrins', 'and', 'process', 'therefor']",1
US2938012A,1958-03-07,Cross-linking of ethylene polymers with peroxide catalyst and composition therefor,"['NOUN', 'NOUN', 'NOUN', 'ADP', 'NOUN', 'NOUN', 'ADP', 'NOUN', 'NOUN', 'CCONJ', 'NOUN', 'ADP']",[],0,0,13,"['cross-linking', 'of', 'ethylene', 'polymers', 'with', 'peroxide', 'catalyst', 'and', 'composition', 'therefor']",1
US2938113A,1956-03-17,Radio receiving set and housing therefor,"['NOUN', 'VERB', 'NOUN', 'CCONJ', 'NOUN', 'ADP']",[],0,0,7,"['radio', 'receiving', 'set', 'and', 'housing', 'therefor']",1
US2938272A,1957-06-24,Gauge apparatus and a transfer mechanism therefor,"['NOUN', 'NOUN', 'CCONJ', 'DET', 'NOUN', 'NOUN', 'ADP']",['ORG'],0,0,8,"['gauge', 'apparatus', 'and', 'a', 'transfer', 'mechanism', 'therefor']",1
US2938311A,1958-03-24,Plane blade grinding jig,"['NOUN', 'NOUN', 'VERB', 'ADP']",[],0,0,5,"['plane', 'blade', 'grinding', 'jig']",1
US2938390A,1956-04-30,Integrating accelerometer,"['VERB', 'ADP']",[],0,0,3,"['integrating', 'accelerometer']",1
US2938475A,1957-10-28,Incinerator burner and controls therefor,"['NOUN', 'NOUN', 'CCONJ', 'NOUN', 'ADP']",[],0,0,6,"['incinerator', 'burner', 'and', 'controls', 'therefor']",1
US2938531A,1957-12-30,Air eliminator valve and float therefor,"['NOUN', 'NOUN', 'NOUN', 'CCONJ', 'VERB', 'ADP']",[],0,0,7,"['air', 'eliminator', 'valve', 'and', 'float', 'therefor']",1
US2938749A,1956-01-20,Vehicle closure and operating mechanism therefor,"['NOUN', 'NOUN', 'CCONJ', 'NOUN', 'NOUN', 'ADP']",[],0,0,7,"['vehicle', 'closure', 'and', 'operating', 'mechanism', 'therefor']",1
US2938880A,1955-05-09,"Cured epoxy resin composition containing boron trifluoride complex of a monoethylamine and piperidine, method of curing said composition and glass fibers impregnated therewith","['VERB', 'NOUN', 'NOUN', 'NOUN', 'VERB', 'NOUN', 'NOUN', 'NOUN', 'ADP', 'DET', 'NOUN', 'CCONJ', 'NOUN', 'PUNCT', 'NOUN', 'ADP', 'VERB', 'VERB', 'NOUN', 'CCONJ', 'NOUN', 'NOUN', 'VERB', 'ADP']",[],0,0,25,"['cured', 'epoxy', 'resin', 'composition', 'containing', 'boron', 'trifluoride', 'complex', 'of', 'a', 'monoethylamine', 'and', 'piperidine,', 'method', 'of', 'curing', 'said', 'composition', 'and', 'glass', 'fibers', 'impregnated', 'therewith']",1
US2938901A,1954-08-06,Surgical dusting powder and process therefor,"['ADJ', 'NOUN', 'NOUN', 'CCONJ', 'NOUN', 'ADP']",[],0,0,7,"['surgical', 'dusting', 'powder', 'and', 'process', 'therefor']",1
US2939151A,1959-03-12,Garment belt foundation kit and belts made therefrom,"['NOUN', 'NOUN', 'NOUN', 'NOUN', 'CCONJ', 'NOUN', 'VERB', 'ADP']",[],0,0,9,"['garment', 'belt', 'foundation', 'kit', 'and', 'belts', 'made', 'therefrom']",1
US2939449A,1955-06-16,Launching device and rocket propelled missile therefor,"['VERB', 'NOUN', 'CCONJ', 'NOUN', 'VERB', 'NOUN', 'ADP']",[],0,0,8,"['launching', 'device', 'and', 'rocket', 'propelled', 'missile', 'therefor']",1
US2939497A,1958-06-02,Portable traveling saw and control means therefor,"['ADJ', 'NOUN', 'NOUN', 'CCONJ', 'NOUN', 'VERB', 'ADP']",[],0,0,8,"['portable', 'traveling', 'saw', 'and', 'control', 'means', 'therefor']",1
US2939517A,1957-03-27,Articles of furniture and supports therefor,"['NOUN', 'ADP', 'NOUN', 'CCONJ', 'VERB', 'ADP']",[],0,0,7,"['articles', 'of', 'furniture', 'and', 'supports', 'therefor']",1
US2939544A,1957-05-27,Methods and means for treating emulsified well streams and condensing vapors evolved therefrom,"['NOUN', 'CCONJ', 'VERB', 'ADP', 'VERB', 'VERB', 'ADV', 'NOUN', 'CCONJ', 'VERB', 'NOUN', 'VERB', 'ADP']",[],0,0,14,"['methods', 'and', 'means', 'for', 'treating', 'emulsified', 'well', 'streams', 'and', 'condensing', 'vapors', 'evolved', 'therefrom']",1
US2939554A,1955-04-22,Space decks and components therefor,"['NOUN', 'NOUN', 'CCONJ', 'NOUN', 'ADP']",[],0,0,6,"['space', 'decks', 'and', 'components', 'therefor']",1
US2939641A,1957-06-28,Armature winding jig,"['VERB', 'NOUN', 'ADP']",[],0,0,4,"['armature', 'winding', 'jig']",1
US2939819A,1957-01-25,"21-alkyl-17beta-hydroxy-17alpha-pregn-20-ynes, therapeutic compositions comprising same, and process therefor","['NUM', 'PUNCT', 'NOUN', 'PUNCT', 'NOUN', 'PUNCT', 'NOUN', 'PUNCT', 'NOUN', 'PUNCT', 'ADJ', 'NOUN', 'VERB', 'ADJ', 'PUNCT', 'CCONJ', 'NOUN', 'ADP']",['CARDINAL'],0,0,19,"['21-alkyl-17beta-hydroxy-17alpha-pregn-20-ynes,', 'therapeutic', 'compositions', 'comprising', 'same,', 'and', 'process', 'therefor']",1
US2939856A,1958-03-11,Modified phenol-formaldehyde resin compositions and process of treating fibrous glass material therewith,"['VERB', 'NOUN', 'PUNCT', 'NOUN', 'NOUN', 'NOUN', 'CCONJ', 'NOUN', 'ADP', 'VERB', 'ADJ', 'NOUN', 'NOUN', 'ADP']",[],0,0,15,"['modified', 'phenol-formaldehyde', 'resin', 'compositions', 'and', 'process', 'of', 'treating', 'fibrous', 'glass', 'material', 'therewith']",1
US2940051A,1955-08-17,Neutralized transistor amplifier,"['ADJ', 'NOUN', 'ADP']",['PERSON'],0,1,4,"['neutralized', 'transistor', 'amplifier']",1
US2940063A,1957-04-01,Back-up warning system and timing circuit therefor,"['ADV', 'PUNCT', 'ADP', 'NOUN', 'NOUN', 'CCONJ', 'VERB', 'NOUN', 'ADP']",[],0,0,10,"['back-up', 'warning', 'system', 'and', 'timing', 'circuit', 'therefor']",1
US2940119A,1954-01-15,Pipe ejector-pull out,"['NOUN', 'NOUN', 'PUNCT', 'VERB', 'ADP']",[],0,0,6,"['pipe', 'ejector-pull', 'out']",1
US2940152A,1956-03-14,Concrete form and chamfer corner strip therefor,"['ADJ', 'NOUN', 'CCONJ', 'VERB', 'NOUN', 'NOUN', 'ADP']",[],0,0,8,"['concrete', 'form', 'and', 'chamfer', 'corner', 'strip', 'therefor']",1
US2940203A,1958-10-27,Fishing lure retriever,"['NOUN', 'VERB', 'ADP']",[],0,0,4,"['fishing', 'lure', 'retriever']",1
US2940210A,1957-12-04,Sewing machine lid and anti-skid cover therefor,"['NOUN', 'NOUN', 'NOUN', 'CCONJ', 'ADJ', 'ADJ', 'ADJ', 'NOUN', 'ADP']",[],0,0,10,"['sewing', 'machine', 'lid', 'and', 'anti-skid', 'cover', 'therefor']",1
US2940331A,1959-03-16,Automatic motive fluid cut-off,"['ADJ', 'ADJ', 'NOUN', 'VERB', 'PUNCT', 'ADP']",[],0,0,7,"['automatic', 'motive', 'fluid', 'cut-off']",1
US2940336A,1957-01-11,Transmission and control therefor,"['NOUN', 'CCONJ', 'NOUN', 'ADP']",[],0,0,5,"['transmission', 'and', 'control', 'therefor']",1
US2940350A,1956-08-23,Plural slitter cutters and the mounting means therefor,"['ADJ', 'NOUN', 'NOUN', 'CCONJ', 'DET', 'VERB', 'NOUN', 'ADP']",[],0,0,9,"['plural', 'slitter', 'cutters', 'and', 'the', 'mounting', 'means', 'therefor']",1
US2940407A,1957-01-15,Power-driven sewing machines and stop motion devices therefor,"['NOUN', 'PUNCT', 'VERB', 'NOUN', 'NOUN', 'CCONJ', 'VERB', 'NOUN', 'NOUN', 'ADP']",[],0,0,11,"['power-driven', 'sewing', 'machines', 'and', 'stop', 'motion', 'devices', 'therefor']",1
US2940478A,1956-06-13,Slide fastener and tape therefor,"['NOUN', 'NOUN', 'CCONJ', 'NOUN', 'ADP']",[],0,0,6,"['slide', 'fastener', 'and', 'tape', 'therefor']",1
US2940583A,1956-03-19,Conveyor and actuating device therefor,"['NOUN', 'CCONJ', 'VERB', 'NOUN', 'ADP']",[],0,0,6,"['conveyor', 'and', 'actuating', 'device', 'therefor']",1
US2940600A,1956-06-05,Combined shelf and hanger means and improved support therefor,"['ADJ', 'NOUN', 'CCONJ', 'NOUN', 'VERB', 'CCONJ', 'VERB', 'NOUN', 'ADP']",[],0,0,10,"['combined', 'shelf', 'and', 'hanger', 'means', 'and', 'improved', 'support', 'therefor']",1
US2940703A,1954-08-04,Ribbon parachute and automatic release means therefor,"['NOUN', 'ADJ', 'CCONJ', 'ADJ', 'NOUN', 'VERB', 'ADP']",[],0,0,8,"['ribbon', 'parachute', 'and', 'automatic', 'release', 'means', 'therefor']",1
US2940875A,1956-06-19,Silicone-coated fibrous products and process therefor,"['NOUN', 'PUNCT', 'VERB', 'ADJ', 'NOUN', 'CCONJ', 'NOUN', 'ADP']",[],0,0,9,"['silicone-coated', 'fibrous', 'products', 'and', 'process', 'therefor']",1
US2940888A,1955-10-11,Thermoplastic rod adhesives and method of bonding metallic sheet material therewith,"['ADJ', 'NOUN', 'NOUN', 'CCONJ', 'NOUN', 'ADP', 'VERB', 'ADJ', 'NOUN', 'NOUN', 'ADP']",[],0,0,12,"['thermoplastic', 'rod', 'adhesives', 'and', 'method', 'of', 'bonding', 'metallic', 'sheet', 'material', 'therewith']",1
US2940896A,1956-02-23,Quaternary ammonium and phosphoramide ester attractants and insect control therewith,"['ADJ', 'NOUN', 'CCONJ', 'NOUN', 'NOUN', 'NOUN', 'CCONJ', 'VERB', 'NOUN', 'ADP']",['PERSON'],0,1,11,"['quaternary', 'ammonium', 'and', 'phosphoramide', 'ester', 'attractants', 'and', 'insect', 'control', 'therewith']",1
US2940902A,1952-01-03,Process for the prodction of cosmetic creams and thickening agents therefor,"['NOUN', 'ADP', 'DET', 'NOUN', 'ADP', 'ADJ', 'NOUN', 'CCONJ', 'VERB', 'NOUN', 'ADP']",[],0,0,12,"['process', 'for', 'the', 'prodction', 'of', 'cosmetic', 'creams', 'and', 'thickening', 'agents', 'therefor']",1
US2940934A,1953-06-22,Electrostatic developer composition and method therefor,"['ADJ', 'NOUN', 'NOUN', 'CCONJ', 'NOUN', 'ADP']",[],0,0,7,"['electrostatic', 'developer', 'composition', 'and', 'method', 'therefor']",1
US2940936A,1953-04-07,Preparing sulfonated products from sulfur trioxide,"['VERB', 'VERB', 'NOUN', 'ADP', 'NOUN', 'ADP']",[],0,0,7,"['preparing', 'sulfonated', 'products', 'from', 'sulfur', 'trioxide']",1
US2940943A,1957-02-25,Resinous coating composition comprising nitrocellulose and aldehyde modified amide polymer and metallic surface coated therewith,"['ADJ', 'NOUN', 'NOUN', 'VERB', 'NOUN', 'CCONJ', 'NOUN', 'VERB', 'ADP', 'NOUN', 'CCONJ', 'ADJ', 'NOUN', 'VERB', 'ADP']",[],0,0,16,"['resinous', 'coating', 'composition', 'comprising', 'nitrocellulose', 'and', 'aldehyde', 'modified', 'amide', 'polymer', 'and', 'metallic', 'surface', 'coated', 'therewith']",1
US2940950A,1957-08-28,Blended methacrylate coating compositions and articles coated therewith,"['VERB', 'NOUN', 'NOUN', 'NOUN', 'CCONJ', 'NOUN', 'VERB', 'ADP']",[],0,0,9,"['blended', 'methacrylate', 'coating', 'compositions', 'and', 'articles', 'coated', 'therewith']",1
US2940967A,1955-07-11,Process for the preparation of androsterone and intermediates therefor,"['NOUN', 'ADP', 'DET', 'NOUN', 'ADP', 'NOUN', 'CCONJ', 'NOUN', 'ADP']",[],0,0,10,"['process', 'for', 'the', 'preparation', 'of', 'androsterone', 'and', 'intermediates', 'therefor']",1
US2941067A,1958-05-07,Welding apparatus and flexible dam for use therewith,"['NOUN', 'NOUN', 'CCONJ', 'ADJ', 'NOUN', 'ADP', 'NOUN', 'ADP']",[],0,0,9,"['welding', 'apparatus', 'and', 'flexible', 'dam', 'for', 'use', 'therewith']",1
US2941085A,1959-09-14,Phase sensitive amplifier,"['NOUN', 'ADJ', 'ADP']",[],0,0,4,"['phase', 'sensitive', 'amplifier']",1
US2941093A,1956-01-30,Phase sensitive amplifier,"['NOUN', 'ADJ', 'ADP']",[],0,0,4,"['phase', 'sensitive', 'amplifier']",1
