patent_number,date,title,spacy_pos,spacy_label,is_prpn_spacy,is_person_spacy,spacy_pos_len,bad_endings
US3816361A,1970-07-31,Treating rubber to enhance fiber bonding,"['VERB', 'NOUN', 'PART', 'VERB', 'NOUN', 'NOUN']",[],0,0,7,1
US3816407A,1970-12-16,N-substituted azabicyclononanes,"['NOUN', 'PUNCT', 'VERB', 'NOUN']",[],0,0,5,1
US3816608A,1967-10-05,Preparation of beryllium hydride by pyrolysis of a di-tertiary-alkyl beryllium etherate,"['NOUN', 'ADP', 'NOUN', 'NOUN', 'ADP', 'NOUN', 'ADP', 'DET', 'ADJ', 'PUNCT', 'ADJ', 'PUNCT', 'NOUN', 'NOUN', 'VERB']",[],0,0,16,1
US3816655A,1971-10-29,Optical device for telecine systems,"['ADJ', 'NOUN', 'ADP', 'NOUN', 'NOUN']",[],0,0,6,1
US3816767A,1973-03-23,Schmitt trigger circuit,"['NOUN', 'NOUN', 'NOUN']",['PERSON'],0,1,4,1
US3816785A,1972-06-29,Dispensing targets for ion beam particle generators,"['VERB', 'NOUN', 'ADP', 'NOUN', 'NOUN', 'NOUN', 'NOUN']",[],0,0,8,1
US3816840A,1973-04-20,Electrographic recording process and apparatus using conductive toner subject to a capacitive force,"['ADJ', 'NOUN', 'NOUN', 'CCONJ', 'NOUN', 'VERB', 'ADJ', 'NOUN', 'NOUN', 'ADP', 'DET', 'ADJ', 'NOUN']",[],0,0,14,1
US3816841A,1971-10-13,Device for the automatic stop setting of photographic cameras,"['NOUN', 'ADP', 'DET', 'ADJ', 'NOUN', 'NOUN', 'ADP', 'ADJ', 'NOUN']",[],0,0,10,1
US3816850A,1971-11-12,Magnetic recording method and apparatus using a multi-layer recording technique,"['ADJ', 'NOUN', 'NOUN', 'CCONJ', 'NOUN', 'VERB', 'DET', 'ADJ', 'ADJ', 'ADJ', 'NOUN', 'NOUN']",[],0,0,13,1
US3817048A,1971-07-13,Dewatering sludges,"['VERB', 'NOUN']",[],0,0,3,1
US3817121A,1970-04-10,Synchronizing installation for change-speed transmissions,"['ADJ', 'NOUN', 'ADP', 'NOUN', 'PUNCT', 'NOUN', 'NOUN']",[],0,0,8,1
US3817255A,1973-01-02,Brassiere with yieldable side panel construction,"['ADV', 'ADP', 'ADJ', 'NOUN', 'NOUN', 'NOUN']",[],0,0,7,1
US3817485A,1970-11-04,Control damper construction,"['NOUN', 'NOUN', 'NOUN']",[],0,0,4,1
US3817522A,1971-04-19,Force focusing golf club,"['NOUN', 'VERB', 'NOUN', 'NOUN']",[],0,0,5,1
US3818055A,1972-02-24,"17-(aralkylaminoalkyl)androstan-3b-ols, 5 derivatives thereof, ethers and esters corresponding","['NUM', 'PUNCT', 'NOUN', 'PUNCT', 'NUM', 'NOUN', 'ADV', 'PUNCT', 'NOUN', 'CCONJ', 'NOUN', 'VERB']","['CARDINAL', 'CARDINAL']",0,0,13,1
US3818122A,1973-05-29,Flexible printed circuit interconnecting cable,"['ADJ', 'VERB', 'NOUN', 'VERB', 'NOUN']",[],0,0,6,1
US3818208A,1972-09-15,Electrical element in a beverage container,"['ADJ', 'NOUN', 'ADP', 'DET', 'NOUN', 'NOUN']",[],0,0,7,1
US3818326A,1971-06-23,Rotary sensor using magnets resistance devices for detecting the rotation of a mechanical system,"['ADJ', 'NOUN', 'VERB', 'NOUN', 'NOUN', 'NOUN', 'ADP', 'VERB', 'DET', 'NOUN', 'ADP', 'DET', 'ADJ', 'NOUN']",[],0,0,15,1
US3818421A,1972-04-10,Connection for rigid coaxial transmission line,"['NOUN', 'ADP', 'ADJ', 'ADJ', 'NOUN', 'NOUN']",[],0,0,7,1
US3818427A,1972-02-16,"Process for recording acoustic, synthetic and microwave holograms","['NOUN', 'ADP', 'VERB', 'ADJ', 'PUNCT', 'ADJ', 'CCONJ', 'NOUN', 'NOUN']",[],0,0,10,1
US3818471A,1972-06-14,Seismic intrusion line sensor,"['ADJ', 'NOUN', 'NOUN', 'NOUN']",[],0,0,5,1
US3818514A,1971-08-09,Femoral prosthesis with removable protective sheath,"['ADJ', 'NOUN', 'ADP', 'ADJ', 'ADJ', 'NOUN']",[],0,0,7,1
US3818667A,1971-03-22,Louvered screen support member for particulate material,"['VERB', 'NOUN', 'NOUN', 'NOUN', 'ADP', 'NOUN', 'NOUN']",[],0,0,8,1
US3818747A,1971-12-15,Driving mechanisms having multiple maltese driving gear,"['VERB', 'NOUN', 'VERB', 'ADJ', 'ADJ', 'VERB', 'NOUN']",[],0,0,8,1
US3818826A,1972-07-28,Recessed keyboard imprinter,"['VERB', 'NOUN', 'NOUN']",[],0,0,4,1
US3818829A,1972-05-12,Portable imprinter including means for providing imprinting pressure compensation,"['ADJ', 'NOUN', 'VERB', 'NOUN', 'ADP', 'VERB', 'VERB', 'NOUN', 'NOUN']",[],0,0,10,1
US3818995A,1972-06-13,Two way plow with articulated center wheel and automatically lockable rear wheel,"['NUM', 'NOUN', 'NOUN', 'ADP', 'VERB', 'NOUN', 'NOUN', 'CCONJ', 'ADV', 'ADJ', 'ADJ', 'NOUN']",['CARDINAL'],0,0,13,1
US3819223A,1972-11-28,Kamp-top,"['NOUN', 'PUNCT', 'NOUN']",[],0,0,4,1
US3819496A,1972-02-21,Stabilizer systems for light-curable polyesters,"['NOUN', 'NOUN', 'ADP', 'ADJ', 'PUNCT', 'ADJ', 'NOUN']",[],0,0,8,1
US3820170A,1973-04-10,Water conserving methods and apparatus for flush toilets,"['NOUN', 'NOUN', 'NOUN', 'CCONJ', 'NOUN', 'ADP', 'ADJ', 'NOUN']",[],0,0,9,1
US3820176A,1972-11-15,Patient handling table,"['NOUN', 'NOUN', 'NOUN']",[],0,0,4,1
US3820265A,1972-11-16,Animated display,"['ADJ', 'NOUN']",[],0,0,3,1
US3820629A,1973-02-02,Acoustical louver for earthmoving vehicles,"['ADJ', 'ADV', 'ADP', 'ADJ', 'NOUN']",[],0,0,6,1
US3820779A,1972-04-24,Sheet delivery apparatus,"['NOUN', 'NOUN', 'NOUN']",[],0,0,4,1
US3821178A,1972-05-23,Process for the bulk polymerization of acrylonitrile,"['NOUN', 'ADP', 'DET', 'ADJ', 'NOUN', 'ADP', 'NOUN']",[],0,0,8,1
US3821405A,1968-02-19,Oral treatment of seborrhea and compositions for use in said treatment,"['ADJ', 'NOUN', 'ADP', 'NOUN', 'CCONJ', 'NOUN', 'ADP', 'NOUN', 'ADP', 'VERB', 'NOUN']",[],0,0,12,1
US3821419A,1969-09-17,Intermediates in brewing,"['VERB', 'ADP', 'VERB']",[],0,0,4,1
US3821435A,1967-10-17,Dehydrated vegetables,"['VERB', 'NOUN']",[],0,0,3,1
US3821473A,1969-06-20,Sound reproduction system with driven and undriven speakers and motional feedback,"['ADJ', 'NOUN', 'NOUN', 'ADP', 'ADJ', 'CCONJ', 'ADJ', 'NOUN', 'CCONJ', 'ADJ', 'NOUN']",[],0,0,12,1
US3821874A,1972-10-10,Cartoning machine for cartons having liners,"['VERB', 'NOUN', 'ADP', 'NOUN', 'VERB', 'NOUN']",[],0,0,7,1
US3821875A,1973-02-15,Container sealing apparatus,"['NOUN', 'NOUN', 'NOUN']",[],0,0,4,1
US3821952A,1973-01-11,Adjustable chiropractic table,"['ADJ', 'ADJ', 'NOUN']",[],0,0,4,1
US3822009A,1973-02-01,Item transporting system,"['NOUN', 'VERB', 'NOUN']",[],0,0,4,1
US3822092A,1972-03-30,Photographic transparency support with rotatable sound track carrier,"['ADJ', 'NOUN', 'NOUN', 'ADP', 'ADJ', 'NOUN', 'NOUN', 'NOUN']",[],0,0,9,1
US3822177A,1971-06-01,Thermoplastic pellets and method of producing shaped articles therefrom,"['ADJ', 'NOUN', 'CCONJ', 'NOUN', 'ADP', 'VERB', 'VERB', 'NOUN', 'ADP']",[],0,0,10,1
US3822270A,1971-08-09,"Pyrylium dyes having a fused,rigidized nitrogen-containing ring","['NOUN', 'NOUN', 'VERB', 'DET', 'VERB', 'PUNCT', 'VERB', 'NOUN', 'PUNCT', 'VERB', 'NOUN']",['GPE'],0,0,12,1
US3822344A,1967-04-28,Pharmaceutical compositions providing potassium chloride in aqueous solution,"['ADJ', 'NOUN', 'VERB', 'NOUN', 'NOUN', 'ADP', 'ADJ', 'NOUN']",[],0,0,9,1
US3822433A,1973-03-12,Electric mop,"['ADJ', 'VERB']",[],0,0,3,1
US3822585A,1972-09-05,Leak tester for batteries,"['VERB', 'ADJ', 'ADP', 'NOUN']",[],0,0,5,1
US3822586A,1972-08-01,Electrical circuit means for use in acoustic emission detecting and/or recording apparatus,"['ADJ', 'NOUN', 'VERB', 'ADP', 'NOUN', 'ADP', 'ADJ', 'NOUN', 'VERB', 'CCONJ', 'VERB', 'NOUN']",[],0,0,13,1
US3822587A,1970-11-24,Axial force measuring method utilizing ultrasonic wave,"['ADJ', 'NOUN', 'VERB', 'NOUN', 'VERB', 'ADJ', 'NOUN']",[],0,0,8,1
US3822629A,1972-08-09,Slide bar apparatus for guitar,"['NOUN', 'NOUN', 'NOUN', 'ADP', 'NOUN']",[],0,0,6,1
US3822689A,1972-03-08,Side dressing device,"['NOUN', 'NOUN', 'NOUN']",[],0,0,4,1
US3822803A,1973-03-22,Material handling equipment,"['NOUN', 'NOUN', 'NOUN']",[],0,0,4,1
US3822888A,1970-12-08,Trip actuation device for an automatic record player,"['NOUN', 'NOUN', 'NOUN', 'ADP', 'DET', 'ADJ', 'NOUN', 'NOUN']",[],0,0,9,1
US3823149A,1970-06-04,"3a,4,5,9b-tetrahydro-3,5-ethanonaphth(2,1-d)oxazol-2(3h)-ones","['NUM', 'PUNCT', 'NOUN', 'PUNCT', 'SPACE', 'PUNCT', 'NOUN']",['CARDINAL'],0,0,8,1
US3823355A,1971-11-12,Contactless switch device,"['ADJ', 'NOUN', 'NOUN']",[],0,0,4,1
US3823512A,1971-03-12,Automatic centrifugal barrel finishing apparatus,"['ADJ', 'ADJ', 'NOUN', 'NOUN', 'NOUN']",[],0,0,6,1
US3823879A,1973-03-23,Kitchen composter,"['NOUN', 'NOUN']",[],0,0,3,1
US3824166A,1971-12-30,Trace gas analyzer,"['NOUN', 'NOUN', 'NOUN']",[],0,0,4,1
US3824430A,1972-08-23,Circuit arrangement for recognition of a defect caused by phase breakdown or ground short in the current supply of a three-phase motor,"['NOUN', 'NOUN', 'ADP', 'NOUN', 'ADP', 'DET', 'NOUN', 'VERB', 'ADP', 'NOUN', 'NOUN', 'CCONJ', 'NOUN', 'ADJ', 'ADP', 'DET', 'ADJ', 'NOUN', 'ADP', 'DET', 'NUM', 'PUNCT', 'NOUN', 'NOUN']",['CARDINAL'],0,0,25,1
US3824475A,1973-02-01,Scanning radio receiver,"['VERB', 'NOUN', 'NOUN']",[],0,0,4,1
US3824477A,1969-03-03,Ground sensitive control for electrical apparatus,"['NOUN', 'ADJ', 'NOUN', 'ADP', 'ADJ', 'NOUN']",[],0,0,7,1
US3824680A,1968-03-28,Nuclear radiation detector and method of manufacturing same,"['ADJ', 'NOUN', 'NOUN', 'CCONJ', 'NOUN', 'ADP', 'VERB', 'ADJ']",[],0,0,9,1
US3824686A,1972-05-12,A method of terminating a semi-rigid coaxial cable,"['DET', 'NOUN', 'ADP', 'VERB', 'DET', 'ADJ', 'ADJ', 'ADJ', 'ADJ', 'NOUN']",[],0,0,11,1
US3824697A,1972-08-10,Sight assembly,"['NOUN', 'NOUN']",[],0,0,3,1
US3825149A,1972-12-06,Easy opening container having shoulders to safeguard all severed edges,"['ADJ', 'NOUN', 'NOUN', 'VERB', 'NOUN', 'PART', 'VERB', 'DET', 'VERB', 'NOUN']",[],0,0,11,1
US3825187A,1973-06-29,System for supplying washing machine nozzles,"['NOUN', 'ADP', 'VERB', 'NOUN', 'NOUN', 'NOUN']",[],0,0,7,1
US3825426A,1971-11-10,Development of exposed photographic silver halide elements,"['NOUN', 'ADP', 'VERB', 'ADJ', 'ADJ', 'NOUN', 'NOUN']",[],0,0,8,1
US3825452A,1968-10-04,Liquid explosive for well fracturing,"['ADJ', 'ADJ', 'ADP', 'ADV', 'VERB']",[],0,0,6,1
US3825646A,1972-04-14,Process for the manufacturing of rackets for tennis and other similar games,"['NOUN', 'ADP', 'DET', 'NOUN', 'ADP', 'NOUN', 'ADP', 'NOUN', 'CCONJ', 'ADJ', 'ADJ', 'NOUN']",[],0,0,13,1
US3825846A,1973-04-23,Signal isolator having feedback control,"['ADJ', 'NOUN', 'VERB', 'NOUN', 'NOUN']",['ORG'],0,0,6,1
US3825972A,1973-04-23,Shag rug fluffer,"['NOUN', 'NOUN', 'NOUN']",[],0,0,4,1
US3826028A,1970-07-24,Information storage and retrieval system and apparatus,"['NOUN', 'NOUN', 'CCONJ', 'NOUN', 'NOUN', 'CCONJ', 'NOUN']",[],0,0,8,1
US3826168A,1973-06-14,"Power-operated, multi-die punch","['NOUN', 'PUNCT', 'VERB', 'PUNCT', 'ADJ', 'ADJ', 'VERB', 'VERB']",[],0,0,9,1
US3826349A,1970-05-06,Live storage conveyor system,"['ADJ', 'NOUN', 'NOUN', 'NOUN']",[],0,0,5,1
US3826591A,1971-06-02,Centrifugal marine propeller,"['ADJ', 'ADJ', 'NOUN']",['GPE'],0,0,4,1
US3826672A,1966-04-21,Non-electrostatic method for producing electrographic image,"['ADJ', 'ADJ', 'ADJ', 'NOUN', 'ADP', 'VERB', 'ADJ', 'NOUN']",[],0,0,9,1
US3827081A,1971-06-24,Device for the displacement of magnetic read/write heads,"['NOUN', 'ADP', 'DET', 'NOUN', 'ADP', 'ADJ', 'NOUN', 'SYM', 'VERB', 'NOUN']",[],0,0,11,1
US3827287A,1972-07-05,Methods of and apparatus for measuring the thickness of successive sections of a cable jacket,"['NOUN', 'ADP', 'CCONJ', 'NOUN', 'ADP', 'VERB', 'DET', 'NOUN', 'ADP', 'ADJ', 'NOUN', 'ADP', 'DET', 'NOUN', 'NOUN']",[],0,0,16,1
US3827290A,1973-03-06,Stream table study center,"['VERB', 'NOUN', 'NOUN', 'NOUN']",[],0,0,5,1
US3827578A,1972-09-25,Rotary grain distribution system,"['ADJ', 'NOUN', 'NOUN', 'NOUN']",[],0,0,5,1
US3827713A,1971-12-08,Passive seat belt assembly for automobile or the like,"['ADJ', 'NOUN', 'NOUN', 'NOUN', 'ADP', 'NOUN', 'CCONJ', 'DET', 'ADJ']",[],0,0,10,1
US3827835A,1971-12-03,Low speed rotary fluid apparatus with elastic sealing liner,"['ADJ', 'NOUN', 'ADJ', 'ADJ', 'NOUN', 'ADP', 'ADJ', 'NOUN', 'NOUN']",[],0,0,10,1
US3827889A,1966-06-06,Thermally developable light sensitive material,"['ADV', 'ADJ', 'ADJ', 'ADJ', 'NOUN']",[],0,0,6,1
US3827894A,1972-12-13,Cementitious coating containing non-abrasive filler,"['ADJ', 'NOUN', 'VERB', 'ADJ', 'ADJ', 'ADJ', 'NOUN']",[],0,0,8,1
US3827897A,1971-06-09,Process of obtaining a dry and powdery mixture of hydrated lime and plaster,"['NOUN', 'ADP', 'VERB', 'DET', 'ADJ', 'CCONJ', 'NOUN', 'NOUN', 'ADP', 'ADJ', 'NOUN', 'CCONJ', 'NOUN']",[],0,0,14,1
US3827971A,1969-02-10,Reforming with platinum-lead catalyst,"['VERB', 'ADP', 'NOUN', 'PUNCT', 'NOUN', 'NOUN']",[],0,0,7,1
US3828048A,1970-10-14,Alkylsulfonic derivatives of quinine alkaloids,"['ADJ', 'NOUN', 'ADP', 'NOUN', 'VERB']",[],0,0,6,1
US3828084A,1971-12-29,Phosphosulfurized surface active materials and method of producing same,"['VERB', 'NOUN', 'ADJ', 'NOUN', 'CCONJ', 'NOUN', 'ADP', 'VERB', 'ADJ']",[],0,0,10,1
US3828208A,1972-01-31,Driver circuit using diodes to control the minority carrier storage effect in switched transistors,"['NOUN', 'NOUN', 'VERB', 'NOUN', 'PART', 'VERB', 'DET', 'NOUN', 'NOUN', 'NOUN', 'NOUN', 'ADP', 'VERB', 'NOUN']",[],0,0,15,1
US3828244A,1973-06-14,Coaxial line to microwave coupler,"['ADJ', 'NOUN', 'PART', 'VERB', 'NOUN']",[],0,0,6,1
US3828359A,1972-12-26,Template for a graphic forming device,"['NOUN', 'ADP', 'DET', 'ADJ', 'VERB', 'NOUN']",[],0,0,7,1
US3828591A,1972-08-14,Lock assembly,"['VERB', 'NOUN']",[],0,0,3,1
US3828596A,1971-12-29,Automatic control system for draw-forming with vibratory energy,"['ADJ', 'NOUN', 'NOUN', 'ADP', 'NOUN', 'PUNCT', 'NOUN', 'ADP', 'ADJ', 'NOUN']",[],0,0,11,1
US3828674A,1972-03-01,Printing press ink suppression apparatus,"['VERB', 'NOUN', 'NOUN', 'NOUN', 'NOUN']",[],0,0,6,1
US3828715A,1972-06-23,Air cushion type fender for use with a quay-wall,"['NOUN', 'NOUN', 'NOUN', 'NOUN', 'ADP', 'NOUN', 'ADP', 'DET', 'NOUN', 'PUNCT', 'NOUN']",[],0,0,12,1
US3828882A,1973-08-24,Steering mechanism for articulated vehicle,"['NOUN', 'NOUN', 'ADP', 'VERB', 'NOUN']",[],0,0,6,1
US3829141A,1972-11-28,Motor vehicle bumper,"['NOUN', 'NOUN', 'NOUN']",[],0,0,4,1
US3829201A,1973-06-28,Cushioning mount for a lens in the rim of an ophthalmic mounting,"['NOUN', 'NOUN', 'ADP', 'DET', 'NOUN', 'ADP', 'DET', 'NOUN', 'ADP', 'DET', 'ADJ', 'VERB']",[],0,0,13,1
US3829444A,1972-02-22,"4-azidocarbonylphthalic anhydride,4-isocyanatophthalic anhydride,and 4-lower alkoxycarbonamido phthalic anhydride","['NUM', 'PUNCT', 'ADJ', 'ADJ', 'PUNCT', 'NOUN', 'NOUN', 'PUNCT', 'CCONJ', 'NUM', 'PUNCT', 'ADJ', 'NOUN', 'NOUN', 'ADP']","['CARDINAL', 'CARDINAL']",0,0,16,1
US3829763A,1973-05-04,Automotive voltage and continuity tester,"['ADJ', 'NOUN', 'CCONJ', 'NOUN', 'NOUN']",[],0,0,6,1
US3830048A,1973-08-31,Rotary cutter unit for grape harvesters,"['ADJ', 'NOUN', 'NOUN', 'ADP', 'NOUN', 'NOUN']",[],0,0,7,1
US3830125A,1973-03-15,Cutting attachment for fiberglass rods,"['VERB', 'NOUN', 'ADP', 'NOUN', 'NOUN']",[],0,0,6,1
US3830161A,1973-07-06,Flume boat ride with a double downchute,"['NOUN', 'NOUN', 'VERB', 'ADP', 'DET', 'ADJ', 'NOUN']",['NORP'],0,0,8,1
US3830340A,1972-04-14,Clamping stand,"['VERB', 'VERB']",[],0,0,3,1
US3830368A,1973-01-10,Liquid filter,"['ADJ', 'NOUN']",[],0,0,3,1
US3830450A,1972-12-15,Dual purpose circulation control airfoil,"['ADJ', 'NOUN', 'NOUN', 'NOUN', 'NOUN']",[],0,0,6,1
US3830542A,1972-04-27,Movable tailgate for a truck,"['ADJ', 'VERB', 'ADP', 'DET', 'NOUN']",[],0,0,6,1
US3831238A,1973-03-26,Rolling pin,"['VERB', 'NOUN']",[],0,0,3,1
US3831280A,1972-05-23,Strapping severing tool,"['VERB', 'NOUN', 'NOUN']",[],0,0,4,1
US3831404A,1971-08-14,Web supporting drum,"['NOUN', 'VERB', 'NOUN']",[],0,0,4,1
US3831565A,1973-09-10,Engine,['NOUN'],[],0,0,2,1
US3831723A,1973-04-18,Electromagnetic spring-wound clutch,"['ADJ', 'NOUN', 'PUNCT', 'NOUN', 'VERB']",[],0,0,6,1
US3831772A,1973-03-08,Logging grapple and hauling assembly,"['VERB', 'NOUN', 'CCONJ', 'VERB', 'NOUN']",[],0,0,6,1
US3831786A,1971-10-19,Material handling apparatus,"['NOUN', 'NOUN', 'NOUN']",[],0,0,4,1
US3832050A,1971-02-12,Indicating mechanism for a projection apparatus,"['VERB', 'NOUN', 'ADP', 'DET', 'NOUN', 'NOUN']",[],0,0,7,1
US3832198A,1972-05-22,Gelatin composition containing a halomethyl ketone of benzyloxycarbonyl phenylalanine,"['ADJ', 'NOUN', 'VERB', 'DET', 'NOUN', 'NOUN', 'ADP', 'NOUN', 'NOUN']",['NORP'],0,0,10,1
US3832207A,1971-12-29,Calcium sulfite compositions for plastic composite,"['NOUN', 'NOUN', 'NOUN', 'ADP', 'ADJ', 'NOUN']",[],0,0,7,1
US3832419A,1973-03-23,Organopolysiloxane-polycarbonate block copolymers,"['NOUN', 'PUNCT', 'NOUN', 'NOUN', 'NOUN']",[],0,0,6,1
US3832435A,1970-07-03,Process for the manufacture of crimped fibers and filaments of linear high molecular weight polymers,"['NOUN', 'ADP', 'DET', 'NOUN', 'ADP', 'VERB', 'NOUN', 'CCONJ', 'NOUN', 'ADP', 'ADJ', 'ADJ', 'ADJ', 'NOUN', 'NOUN']",[],0,0,16,1
US3832472A,1972-03-17,Wheat product,"['NOUN', 'NOUN']",[],0,0,3,1
US3832530A,1972-01-04,Object identifying apparatus,"['NOUN', 'VERB', 'NOUN']",[],0,0,4,1
US3832851A,1972-11-03,Hydraulic actuator,"['ADJ', 'NOUN']",[],0,0,3,1
US3832853A,1973-03-26,Wind and solar energy conversion system for multi-story buildings,"['NOUN', 'CCONJ', 'ADJ', 'NOUN', 'NOUN', 'NOUN', 'ADP', 'ADJ', 'ADJ', 'ADJ', 'NOUN']",[],0,0,12,1
US3833019A,1971-12-30,Quick-connect fittings for a trickle type irrigation system,"['ADJ', 'PUNCT', 'ADJ', 'NOUN', 'ADP', 'DET', 'NOUN', 'NOUN', 'NOUN', 'NOUN']",[],0,0,11,1
US3833255A,1973-10-29,Combined load cover and windshield protector for dump truck,"['ADJ', 'NOUN', 'NOUN', 'CCONJ', 'NOUN', 'NOUN', 'ADP', 'NOUN', 'NOUN']",[],0,0,10,1
US3833343A,1971-04-28,Process for production of carbon-bearing scrap and product,"['NOUN', 'ADP', 'NOUN', 'ADP', 'NOUN', 'PUNCT', 'VERB', 'NOUN', 'CCONJ', 'NOUN']",[],0,0,11,1
US3833411A,1971-10-18,Articles coated with alkali-soluble polyester-type resins and method of producing them,"['NOUN', 'VERB', 'ADP', 'ADJ', 'PUNCT', 'ADJ', 'NOUN', 'PUNCT', 'NOUN', 'NOUN', 'CCONJ', 'NOUN', 'ADP', 'VERB', 'PRON']",[],0,0,16,1
US3833669A,1972-02-24,Manufacture of polyalkylene ethers,"['NOUN', 'ADP', 'NOUN', 'NOUN']",[],0,0,5,1
US3833970A,1971-05-24,Clipboard and novel hinge connections,"['NOUN', 'CCONJ', 'ADJ', 'NOUN', 'NOUN']",[],0,0,6,1
US3834021A,1973-01-24,Precision instrument system,"['NOUN', 'NOUN', 'NOUN']",[],0,0,4,1
US3834223A,1973-03-13,Device for measuring the laterial forces required to release a ski boot from a ski toe clamp,"['NOUN', 'ADP', 'VERB', 'DET', 'ADJ', 'NOUN', 'VERB', 'PART', 'VERB', 'DET', 'NOUN', 'NOUN', 'ADP', 'DET', 'NOUN', 'NOUN', 'NOUN']",[],0,0,18,1
US3834226A,1971-08-16,Disposable temperature indicator,"['ADJ', 'NOUN', 'NOUN']",[],0,0,4,1
US3834451A,1973-04-13,Air conditioning system with multiple function heat exchanger,"['NOUN', 'NOUN', 'NOUN', 'ADP', 'ADJ', 'NOUN', 'NOUN', 'NOUN']",[],0,0,9,1
US3835076A,1972-11-30,Aqueous sealer composition of an epoxy ester resin of a maleinized drying oil fatty acid and an epoxy resin and an acrylic-epoxy ester graft copolymer,"['ADJ', 'NOUN', 'NOUN', 'ADP', 'DET', 'NOUN', 'NOUN', 'NOUN', 'ADP', 'DET', 'ADJ', 'VERB', 'NOUN', 'NOUN', 'NOUN', 'CCONJ', 'DET', 'NOUN', 'NOUN', 'CCONJ', 'DET', 'NOUN', 'PUNCT', 'NOUN', 'NOUN', 'NOUN', 'NOUN']",[],0,0,28,1
US3835079A,1968-05-10,"Hot melt compositions comprising styrene-isobutylene copolymer,wax,and a primary resin","['ADJ', 'VERB', 'NOUN', 'VERB', 'ADJ', 'PUNCT', 'NOUN', 'NOUN', 'PUNCT', 'NOUN', 'PUNCT', 'CCONJ', 'DET', 'ADJ', 'NOUN']",[],0,0,16,1
US3835162A,1972-10-25,Synthesis of citraconic anhydride,"['NOUN', 'ADP', 'ADJ', 'ADP']",[],0,0,5,1
US3835204A,1971-06-28,Hydroxyalkylphosphonate carbamates,"['ADJ', 'VERB']",[],0,0,3,1
US3835216A,1971-10-28,Methods for production of alkali metal polysilicates,"['NOUN', 'ADP', 'NOUN', 'ADP', 'ADJ', 'NOUN', 'NOUN']",[],0,0,8,1
US3835279A,1973-06-26,Electrical switch with adjustable actuating arm,"['ADJ', 'NOUN', 'ADP', 'ADJ', 'NOUN', 'NOUN']",[],0,0,7,1
US3835313A,1973-04-10,Arrangement for compensating for changes in the operating characteristics of a measuring element,"['NOUN', 'ADP', 'VERB', 'ADP', 'NOUN', 'ADP', 'DET', 'VERB', 'NOUN', 'ADP', 'DET', 'VERB', 'NOUN']",[],0,0,14,1
US3835341A,1973-06-25,Selectable multi-window x-ray tube,"['ADJ', 'ADJ', 'ADJ', 'ADJ', 'NOUN', 'NOUN', 'NOUN', 'NOUN']",[],0,0,9,1
US3835880A,1973-08-10,Dishwasher fill system,"['NOUN', 'NOUN', 'NOUN']",[],0,0,4,1
US3835941A,1973-08-20,Hole drilling apparatus with dirt receiving and storing means,"['NOUN', 'NOUN', 'NOUN', 'ADP', 'NOUN', 'VERB', 'CCONJ', 'VERB', 'VERB']",[],0,0,10,1
US3836007A,1972-05-16,Eyeglass display holder,"['NOUN', 'NOUN', 'NOUN']",['PERSON'],0,1,4,1
US3836012A,1973-07-09,Removable outrigger assembly with rotatable jack,"['ADJ', 'NOUN', 'NOUN', 'ADP', 'ADJ', 'NOUN']",['PERSON'],0,1,7,1
US3836146A,1972-09-13,Baseball base ground fastening device,"['NOUN', 'NOUN', 'NOUN', 'VERB', 'NOUN']",[],0,0,6,1
US3836568A,1970-12-28,Process for production of lower alkyl esters of cis-chrysanthemum monocarboxylic acid,"['NOUN', 'ADP', 'NOUN', 'ADP', 'ADJ', 'NOUN', 'NOUN', 'ADP', 'NOUN', 'PUNCT', 'ADJ', 'NOUN', 'NOUN']",[],0,0,14,1
US3836653A,1967-02-07,"Pharmaceutical compositions containing a 5-phenyl-7-bromo-1h-1,5-benzodiazepine-2,4-(3h,5h)-dione","['ADJ', 'NOUN', 'VERB', 'DET', 'NUM', 'PUNCT', 'SPACE', 'PUNCT', 'NOUN', 'PUNCT', 'NOUN']",['CARDINAL'],0,0,12,1
US3836710A,1971-12-09,Pattern discrimination system using television,"['ADJ', 'NOUN', 'NOUN', 'VERB', 'NOUN']",[],0,0,6,1
US3836747A,1973-02-26,Gas welding cable and gun therefor,"['NOUN', 'NOUN', 'NOUN', 'CCONJ', 'NOUN', 'ADP']",[],0,0,7,1
US3837160A,1971-08-17,Battery driven clock with a self-regulating escapement system and a plastics material housing,"['NOUN', 'VERB', 'NOUN', 'ADP', 'DET', 'NOUN', 'PUNCT', 'VERB', 'NOUN', 'NOUN', 'CCONJ', 'DET', 'NOUN', 'NOUN', 'NOUN']",[],0,0,16,1
US3837195A,1973-02-08,Magnetic pin lock,"['ADJ', 'NOUN', 'VERB']",[],0,0,4,1
US3837557A,1973-03-27,Press for repairing pallet deckboards,"['NOUN', 'ADP', 'VERB', 'NOUN', 'NOUN']",[],0,0,6,1
US3837628A,1968-01-29,Induction system,"['NOUN', 'NOUN']",[],0,0,3,1
US3837697A,1972-12-18,Adjustable multi-leg load-carrying sling apparatus,"['ADJ', 'ADJ', 'ADJ', 'ADJ', 'NOUN', 'PUNCT', 'VERB', 'NOUN', 'NOUN']",[],0,0,10,1
US3837751A,1973-02-26,Fountain brush,"['NOUN', 'NOUN']",[],0,0,3,1
US3837802A,1968-03-28,Process for dyeing,"['NOUN', 'ADP', 'VERB']",[],0,0,4,1
US3837982A,1970-09-03,Wire woven fabric for pneumatic tires,"['ADJ', 'VERB', 'NOUN', 'ADP', 'ADJ', 'NOUN']",[],0,0,7,1
US3838148A,1971-04-16,Process for the industrial preparation of desoxyribonucleic acids of high molecular weight,"['NOUN', 'ADP', 'DET', 'ADJ', 'NOUN', 'ADP', 'ADJ', 'NOUN', 'ADP', 'ADJ', 'ADJ', 'NOUN']",[],0,0,13,1
US3838247A,1974-03-25,Welding helmet,"['NOUN', 'NOUN']",[],0,0,3,1
US3838274A,1973-03-30,Electro-optical article positioning system,"['NOUN', 'PUNCT', 'ADJ', 'NOUN', 'VERB', 'NOUN']",['GPE'],0,0,7,1
US3838430A,1972-01-05,Printing apparatus for multiple-point recorder with selectable number printing,"['NOUN', 'NOUN', 'ADP', 'ADJ', 'PUNCT', 'NOUN', 'NOUN', 'ADP', 'ADJ', 'NOUN', 'VERB']",[],0,0,12,1
US3838811A,1973-04-04,Burner control circuit,"['ADJ', 'NOUN', 'NOUN']",[],0,0,4,1
US3839413A,1967-08-26,Surface-active compounds,"['NOUN', 'PUNCT', 'ADJ', 'VERB']",[],0,0,5,1
US3839596A,1973-05-07,Flexible airtight stranded wire,"['ADJ', 'NOUN', 'VERB', 'NOUN']",[],0,0,5,1
US3839597A,1973-03-22,Interactive manual preset controls for a color television receiver,"['ADJ', 'ADJ', 'ADJ', 'NOUN', 'ADP', 'DET', 'NOUN', 'NOUN', 'NOUN']",[],0,0,10,1
US3839616A,1972-02-14,Method and device for producing heating of moisture-containing objects,"['NOUN', 'CCONJ', 'NOUN', 'ADP', 'VERB', 'NOUN', 'ADP', 'NOUN', 'PUNCT', 'VERB', 'NOUN']",[],0,0,12,1
US3839786A,1972-12-04,Process for manufacturing high-voltage fuse,"['NOUN', 'ADP', 'VERB', 'ADJ', 'PUNCT', 'NOUN', 'NOUN']",[],0,0,8,1
US3839788A,1971-07-06,Eviscerating and skinning knife,"['VERB', 'CCONJ', 'VERB', 'NOUN']",[],0,0,5,1
US3840094A,1973-03-16,Brake mechanism for skid steer vehicle,"['NOUN', 'NOUN', 'ADP', 'NOUN', 'NOUN', 'NOUN']",[],0,0,7,1
US3840100A,1973-02-02,Unidirectional coupling apparatus,"['ADJ', 'NOUN', 'NOUN']",[],0,0,4,1
US3840232A,1973-01-19,Frangible flying target,"['ADJ', 'VERB', 'NOUN']",[],0,0,4,1
US3840245A,1971-12-08,Hydropneumatic type suspension unit of a motor vehicle suspension system,"['ADJ', 'NOUN', 'NOUN', 'NOUN', 'ADP', 'DET', 'NOUN', 'NOUN', 'NOUN', 'NOUN']",[],0,0,11,1
US3840344A,1972-06-06,Carbon black production,"['NOUN', 'ADJ', 'NOUN']",[],0,0,4,1
US3840618A,1955-04-15,Resin composition,"['NOUN', 'NOUN']",[],0,0,3,1
US3840943A,1973-01-29,Reversible locking paper clip,"['ADJ', 'VERB', 'NOUN', 'NOUN']",[],0,0,5,1
US3841008A,1973-03-19,Stretcher frame,"['ADJ', 'NOUN']",['PERSON'],0,1,3,1
US3841104A,1973-09-10,Removable dock,"['ADJ', 'VERB']",[],0,0,3,1
US3841202A,1972-03-20,Control valve and method,"['NOUN', 'NOUN', 'CCONJ', 'VERB']",[],0,0,5,1
US3841418A,1971-12-28,Hammer drills,"['NOUN', 'VERB']",[],0,0,3,1
US3841498A,1972-07-31,Device for turning and transporting heavy workpieces,"['NOUN', 'ADP', 'VERB', 'CCONJ', 'VERB', 'ADJ', 'NOUN']",[],0,0,8,1
US3841523A,1972-12-04,Dispenser for feed grains and the like,"['NOUN', 'ADP', 'NOUN', 'NOUN', 'CCONJ', 'DET', 'ADJ']",[],0,0,8,1
US3841568A,1972-02-07,Streamlined flow in fluids,"['ADJ', 'NOUN', 'ADP', 'NOUN']",[],0,0,5,1
US3841691A,1970-06-10,Mobile housing unit,"['ADJ', 'NOUN', 'NOUN']",[],0,0,4,1
US3841693A,1972-10-11,Tilt cab latch device,"['NOUN', 'NOUN', 'NOUN', 'NOUN']",[],0,0,5,1
US3841705A,1973-09-27,Stimulation of production well for in situ metal mining,"['NOUN', 'ADP', 'NOUN', 'NOUN', 'ADP', 'ADP', 'ADJ', 'NOUN', 'NOUN']",[],0,0,10,1
US3841787A,1973-09-05,Axial flow turbine structure,"['ADJ', 'NOUN', 'NOUN', 'NOUN']",[],0,0,5,1
US3841880A,1973-04-03,Silver halide emulsion containing ketomethylene photographic color-forming couplers,"['ADJ', 'NOUN', 'NOUN', 'VERB', 'ADJ', 'ADJ', 'NOUN', 'PUNCT', 'VERB', 'NOUN']",[],0,0,11,1
US3842502A,1973-12-21,Shaving unit for safety razor,"['ADJ', 'NOUN', 'ADP', 'NOUN', 'NOUN']",[],0,0,6,1
US3842507A,1973-08-08,Recording instrument for determining rate of penetration in a borehole,"['VERB', 'NOUN', 'ADP', 'VERB', 'NOUN', 'ADP', 'NOUN', 'ADP', 'DET', 'NOUN']",[],0,0,11,1
