patent_number,date,title,spacy_pos,spacy_label,is_prpn_spacy,is_person_spacy,spacy_pos_len
US3829862A,1973-04-20,Ridge scan antenna,"['PROPN', 'PROPN', 'PROPN', 'SPACE']",['PERSON'],1,1,4
US3829880A,1973-01-05,Schottky barrier plasma thyristor circuit,"['PROPN', 'NOUN', 'NOUN', 'NOUN', 'NOUN', 'SPACE']",['PERSON'],1,1,6
US3829896A,1972-11-08,Bias means for batch fabricated magnetic head and method of manufacture thereof,"['PROPN', 'VERB', 'ADP', 'NOUN', 'VERB', 'ADJ', 'NOUN', 'CCONJ', 'NOUN', 'ADP', 'PROPN', 'ADV', 'SPACE']",['PERSON'],1,1,13
US3829897A,1973-05-04,Cartridge clamp,"['PROPN', 'VERB', 'SPACE']",['PERSON'],1,1,3
US3830000A,1973-05-16,Cartridge expelling mechanism for firearms,"['PROPN', 'ADJ', 'NOUN', 'ADP', 'NOUN', 'SPACE']",['PERSON'],1,1,6
US3830051A,1973-04-02,Yarn guiding flyer mechanism for a textile yarn processing machine,"['NOUN', 'VERB', 'NOUN', 'NOUN', 'ADP', 'DET', 'NOUN', 'NOUN', 'NOUN', 'NOUN', 'SPACE']",['PERSON'],0,1,11
US3830071A,1972-10-13,Jack-up drilling platform,"['PROPN', 'PUNCT', 'ADP', 'NOUN', 'NOUN', 'SPACE']",['PERSON'],1,1,6
US3830092A,1972-08-10,Meter proving apparatus,"['NOUN', 'NOUN', 'NOUN', 'SPACE']",['PERSON'],0,1,4
US3830100A,1973-02-22,Strain gauge transducer transient voltage protection,"['PROPN', 'NOUN', 'NOUN', 'NOUN', 'NOUN', 'NOUN', 'SPACE']",['PERSON'],1,1,7
US3830157A,1972-10-31,Cartridge case,"['PROPN', 'NOUN', 'SPACE']",['PERSON'],1,1,3
US3830163A,1972-11-29,Monorail vehicle switching arrangement,"['NOUN', 'NOUN', 'NOUN', 'NOUN', 'SPACE']",['PERSON'],0,1,5
US3830267A,1972-05-25,Filler nozzle vapor seal and collector,"['NOUN', 'NOUN', 'NOUN', 'NOUN', 'CCONJ', 'NOUN', 'SPACE']",['PERSON'],0,1,7
US3830386A,1972-02-22,Bin dumper,"['NOUN', 'X', 'SPACE']",['PERSON'],0,1,3
US3830428A,1972-02-23,Plasma torches,"['PROPN', 'VERB', 'SPACE']",['PERSON'],1,1,3
US3830452A,1973-06-22,Monorail traverse system,"['NOUN', 'NOUN', 'NOUN', 'SPACE']",['PERSON'],0,1,4
US3830478A,1973-01-10,Continuous metal wire annealing furnace,"['ADJ', 'NOUN', 'NOUN', 'VERB', 'NOUN', 'SPACE']",['PERSON'],0,1,6
US3830496A,1971-10-14,Bat,"['PROPN', 'SPACE']",['PERSON'],1,1,2
US3830545A,1973-08-01,Shield tunneling machine with orbiting cutterhead,"['NOUN', 'NOUN', 'NOUN', 'ADP', 'VERB', 'NOUN', 'SPACE']",['PERSON'],0,1,7
US3830584A,1972-12-22,Turret system for machine tool,"['PROPN', 'NOUN', 'ADP', 'NOUN', 'NOUN', 'SPACE']",['PERSON'],1,1,6
US3830617A,1971-09-14,Melt spinning apparatus,"['PROPN', 'NOUN', 'NOUN', 'SPACE']",['PERSON'],1,1,4
US3830654A,1970-01-30,OPTICAL DEVICES UTILIZING SINGLE CRYSTAL GaP OR GaAs FILMS EPITAXIALLY GROWN ON CaF{11 {11 SUBSTRATES AND METHOD OF FABRICATING SAME,"['PROPN', 'NOUN', 'VERB', 'ADJ', 'PROPN', 'NOUN', 'CCONJ', 'PROPN', 'PROPN', 'PROPN', 'NOUN', 'ADP', 'PROPN', 'PUNCT', 'NUM', 'NOUN', 'CCONJ', 'PROPN', 'ADP', 'NOUN', 'ADJ', 'SPACE']","['PERSON', 'CARDINAL']",1,1,22
US3830731A,1972-03-20,Vacuum residuum and vacuum gas oil desulfurization,"['PROPN', 'PROPN', 'CCONJ', 'NOUN', 'NOUN', 'NOUN', 'NOUN', 'SPACE']",['PERSON'],1,1,8
US3830761A,1971-10-26,Vinyl chloride-ethylene-vinyl acetate resin binders,"['NOUN', 'NOUN', 'PUNCT', 'NOUN', 'PUNCT', 'NOUN', 'PROPN', 'NOUN', 'NOUN', 'SPACE']",['PERSON'],1,1,10
US3830839A,1968-03-07,Imidoyl ureas,"['ADJ', 'NOUN', 'SPACE']",['PERSON'],0,1,3
US3830848A,1970-10-01,Diphenyl derivatives,"['PROPN', 'VERB', 'SPACE']",['PERSON'],1,1,3
US3830876A,1970-10-26,Dicyclopentadienyl iron compositions and methods for curing polyester resins,"['ADJ', 'NOUN', 'NOUN', 'CCONJ', 'NOUN', 'ADP', 'VERB', 'NOUN', 'NOUN', 'SPACE']",['PERSON'],0,1,10
US3830882A,1972-11-16,Semicarbazono phosphorus compounds,"['PROPN', 'NOUN', 'VERB', 'SPACE']",['PERSON'],1,1,4
US3830885A,1968-09-27,"Dialkyl n,n-dialkoxymethylcarbamylphosphonates","['PROPN', 'PROPN', 'PUNCT', 'NOUN', 'PUNCT', 'VERB', 'SPACE']",['PERSON'],1,1,7
US3830901A,1968-09-09,Continuous process for extruding cellular thermoplastics,"['ADJ', 'NOUN', 'ADP', 'VERB', 'ADJ', 'NOUN', 'SPACE']",['PERSON'],0,1,7
US3830935A,1972-07-24,Method for the control of the douglas fir beetle,"['PROPN', 'ADP', 'DET', 'NOUN', 'ADP', 'DET', 'PROPN', 'PROPN', 'PROPN', 'SPACE']",['PERSON'],1,1,10
US3831099A,1972-01-27,Controller having gain selectable independently of controller output,"['PROPN', 'VERB', 'NOUN', 'ADJ', 'ADV', 'ADP', 'NOUN', 'NOUN', 'SPACE']",['PERSON'],1,1,9
US3831123A,1973-10-31,Yoke removal from a bonded yoke-cathode ray tube assembly,"['NOUN', 'NOUN', 'ADP', 'DET', 'VERB', 'NOUN', 'PUNCT', 'NOUN', 'NOUN', 'NOUN', 'PROPN', 'SPACE']",['PERSON'],1,1,12
US3831369A,1972-08-11,Yarn structure and method of making same,"['NOUN', 'NOUN', 'CCONJ', 'NOUN', 'ADP', 'VERB', 'ADJ', 'SPACE']",['PERSON'],0,1,8
US3831401A,1973-08-30,Slip clutch for outboard motor,"['PROPN', 'VERB', 'ADP', 'PROPN', 'NOUN', 'SPACE']",['PERSON'],1,1,6
US3831444A,1972-01-26,Yarn quality assessment method and apparatus therefor,"['NOUN', 'NOUN', 'NOUN', 'NOUN', 'CCONJ', 'NOUN', 'VERB', 'SPACE']",['PERSON'],0,1,8
US3831466A,1972-02-08,Glass blade and glass blade blank,"['NOUN', 'NOUN', 'CCONJ', 'NOUN', 'NOUN', 'ADJ', 'SPACE']",['PERSON'],0,1,7
US3831516A,1971-10-26,Continuous press,"['ADJ', 'NOUN', 'SPACE']",['PERSON'],0,1,3
US3831585A,1972-07-19,Retrograde renal biopsy device,"['PROPN', 'ADJ', 'NOUN', 'NOUN', 'SPACE']",['PERSON'],1,1,5
US3831729A,1971-11-30,Solenoid having increased throw capability,"['PROPN', 'AUX', 'VERB', 'NOUN', 'NOUN', 'SPACE']",['PERSON'],1,1,6
US3831738A,1973-08-01,Bottle orientation apparatus,"['NOUN', 'NOUN', 'NOUN', 'SPACE']",['PERSON'],0,1,4
US3831784A,1972-05-15,Carton magazine and means for loading the same,"['PROPN', 'NOUN', 'CCONJ', 'VERB', 'ADP', 'VERB', 'DET', 'ADJ', 'SPACE']",['PERSON'],1,1,9
US3831818A,1972-05-15,Fertilizer distributor,"['PROPN', 'NOUN', 'SPACE']",['PERSON'],1,1,3
US3831833A,1972-09-25,Dispensing carton,"['VERB', 'NOUN', 'SPACE']",['PERSON'],0,1,3
US3831874A,1971-09-22,Yarn drive roller,"['PROPN', 'NOUN', 'NOUN', 'SPACE']",['PERSON'],1,1,4
US3831876A,1972-12-11,Continuous unwinding apparatus for web material,"['ADJ', 'ADJ', 'NOUN', 'ADP', 'NOUN', 'NOUN', 'SPACE']",['PERSON'],0,1,7
US3831891A,1972-03-07,Rod supports,"['PROPN', 'VERB', 'SPACE']",['PERSON'],1,1,3
US3831892A,1973-09-04,Jack lock,"['PROPN', 'VERB', 'SPACE']",['PERSON'],1,1,3
US3831901A,1972-10-19,Vehicle jack with locking means,"['PROPN', 'NOUN', 'ADP', 'NOUN', 'VERB', 'SPACE']",['PERSON'],1,1,6
US3831953A,1970-01-05,Solenoid operated valve assembly,"['ADJ', 'VERB', 'NOUN', 'NOUN', 'SPACE']",['PERSON'],0,1,5
US3832009A,1971-06-07,Antiskid control system,"['PROPN', 'NOUN', 'NOUN', 'SPACE']",['PERSON'],1,1,4
US3832012A,1972-01-21,Antiskid braking circuit,"['PROPN', 'VERB', 'NOUN', 'SPACE']",['PERSON'],1,1,4
US3832025A,1972-11-20,Cartridge tape player door mounting assembly,"['PROPN', 'NOUN', 'NOUN', 'VERB', 'VERB', 'NOUN', 'SPACE']",['PERSON'],1,1,7
US3832030A,1973-05-23,Delay equalizers for multimode optical fibers,"['VERB', 'NOUN', 'ADP', 'PROPN', 'ADJ', 'NOUN', 'SPACE']",['PERSON'],1,1,7
US3832148A,1971-12-08,Bimetallic material for electronic tube applications,"['PROPN', 'NOUN', 'ADP', 'ADJ', 'NOUN', 'NOUN', 'SPACE']",['PERSON'],1,1,7
US3832208A,1972-03-09,Nacreous pigments treated with methacrylatochromic chloride for improved humidity resistance,"['ADJ', 'NOUN', 'VERB', 'ADP', 'ADJ', 'NOUN', 'ADP', 'ADJ', 'NOUN', 'NOUN', 'SPACE']",['PERSON'],0,1,11
US3832286A,1971-02-03,Sisomicin and methods for its production,"['PROPN', 'CCONJ', 'NOUN', 'ADP', 'PRON', 'NOUN', 'SPACE']",['PERSON'],1,1,7
US3832332A,1971-10-22,Polyamide polymer of diamino methyl adamantane and dicarboxylic acid,"['NOUN', 'NOUN', 'ADP', 'PROPN', 'PROPN', 'PROPN', 'CCONJ', 'ADJ', 'NOUN', 'SPACE']","['ORG', 'PERSON']",1,1,10
US3832343A,1971-09-22,Process for obtaining an extract of arnica montana,"['NOUN', 'ADP', 'VERB', 'DET', 'NOUN', 'ADP', 'NOUN', 'PROPN', 'SPACE']",['PERSON'],1,1,9
US3832372A,1972-10-12,Continuous process for preparing aromatic isocyanates,"['ADJ', 'NOUN', 'ADP', 'VERB', 'ADJ', 'NOUN', 'SPACE']",['PERSON'],0,1,7
US3832409A,1970-10-29,Aldehyde condensation products of fluoroaliphatic phenols,"['NOUN', 'NOUN', 'NOUN', 'ADP', 'ADJ', 'NOUN', 'SPACE']",['PERSON'],0,1,7
US3832449A,1971-03-18,Crystalline zeolite zsm{14 12,"['PROPN', 'VERB', 'PROPN', 'NUM', 'SPACE']","['ORG', 'PERSON', 'CARDINAL']",1,1,5
US3832583A,1973-03-08,Squirrel cage motor with improved rotor bar securing arrangement,"['NOUN', 'NOUN', 'NOUN', 'ADP', 'VERB', 'NOUN', 'NOUN', 'VERB', 'NOUN', 'SPACE']",['PERSON'],0,1,10
US3832637A,1973-06-22,Fsk modem,"['PROPN', 'NOUN', 'SPACE']",['PERSON'],1,1,3
US3832658A,1973-07-23,Solenoid actuated switch,"['PROPN', 'ADJ', 'VERB', 'SPACE']",['PERSON'],1,1,4
US3832717A,1972-03-03,Dish reflector for a high gain antenna,"['ADJ', 'NOUN', 'ADP', 'DET', 'ADJ', 'NOUN', 'NOUN', 'SPACE']",['PERSON'],0,1,8
US3832806A,1971-12-01,Multiedge lapping,"['PROPN', 'VERB', 'SPACE']",['PERSON'],1,1,3
US3832879A,1972-03-15,Bending machines,"['VERB', 'NOUN', 'SPACE']",['PERSON'],0,1,3
US3832912A,1973-02-22,Handlebar safety shield,"['NOUN', 'NOUN', 'NOUN', 'SPACE']",['PERSON'],0,1,4
US3833038A,1973-05-07,Drapery pin inserter,"['PROPN', 'PROPN', 'PROPN', 'SPACE']","['PERSON', 'NORP']",1,1,4
US3833077A,1971-02-12,Diamond drills,"['NOUN', 'VERB', 'SPACE']",['PERSON'],0,1,3
US3833105A,1970-05-15,Printer head assembly,"['NOUN', 'NOUN', 'NOUN', 'SPACE']",['PERSON'],0,1,4
US3833231A,1972-02-01,Chuck,"['PROPN', 'SPACE']",['PERSON'],1,1,2
US3833232A,1970-06-11,Chuck jaw insert assembly,"['PROPN', 'PROPN', 'PROPN', 'PROPN', 'SPACE']",['PERSON'],1,1,5
US3833351A,1973-02-15,Continuous preparation of pure metals by hydrogen reduction,"['ADJ', 'NOUN', 'ADP', 'ADJ', 'NOUN', 'ADP', 'NOUN', 'NOUN', 'SPACE']",['PERSON'],0,1,9
US3833370A,1973-01-05,Color diffusion transfer with development controlling polymeric salt,"['NOUN', 'NOUN', 'NOUN', 'ADP', 'NOUN', 'VERB', 'ADJ', 'NOUN', 'SPACE']",['PERSON'],0,1,9
US3833395A,1972-09-11,Continuous form computer print-out document protection system,"['ADJ', 'NOUN', 'NOUN', 'NOUN', 'PUNCT', 'ADP', 'NOUN', 'NOUN', 'NOUN', 'SPACE']",['PERSON'],0,1,10
US3833459A,1970-02-20,Felt backing for vinyl floor covering having a binder comprised of synthetic rubber latex and a reactive thermoset resin,"['NOUN', 'NOUN', 'ADP', 'NOUN', 'NOUN', 'VERB', 'VERB', 'DET', 'NOUN', 'VERB', 'ADP', 'ADJ', 'NOUN', 'NOUN', 'CCONJ', 'DET', 'ADJ', 'NOUN', 'NOUN', 'SPACE']",['PERSON'],0,1,20
US3833523A,1970-02-13,Rigid cellular materials having a good mechanical strength at low temperatures,"['ADJ', 'ADJ', 'NOUN', 'VERB', 'DET', 'ADJ', 'ADJ', 'NOUN', 'ADP', 'ADJ', 'NOUN', 'SPACE']",['PERSON'],0,1,12
US3833597A,1971-06-09,Quaternary ammonium compounds,"['ADJ', 'NOUN', 'VERB', 'SPACE']",['PERSON'],0,1,4
US3833640A,1968-07-29,"Prostaglandin e1,f1,and a1 analogs","['PROPN', 'PROPN', 'PROPN', 'VERB', 'SPACE']",['PERSON'],1,1,5
US3833642A,1969-04-30,Alkenyloxy benzoic acid and esters thereof,"['PROPN', 'ADJ', 'NOUN', 'CCONJ', 'NOUN', 'ADV', 'SPACE']",['PERSON'],1,1,7
US3833693A,1970-05-26,Dispensing of a material into a mould,"['VERB', 'ADP', 'DET', 'NOUN', 'ADP', 'DET', 'NOUN', 'SPACE']",['PERSON'],0,1,8
US3833727A,1972-03-06,Hydralazine and beta-adrenergic blocking agent compositions for treating hypertension,"['NOUN', 'CCONJ', 'NOUN', 'PUNCT', 'NOUN', 'VERB', 'NOUN', 'NOUN', 'ADP', 'VERB', 'NOUN', 'SPACE']",['PERSON'],0,1,12
US3833738A,1971-01-25,Alfalfa extract process,"['PROPN', 'NOUN', 'NOUN', 'SPACE']",['PERSON'],1,1,4
US3833809A,1973-05-09,Neutron logging of formation porosity and chlorinity,"['NOUN', 'NOUN', 'ADP', 'NOUN', 'NOUN', 'CCONJ', 'NOUN', 'SPACE']",['PERSON'],0,1,8
US3833860A,1972-04-20,Amplifier system having pseudo summing junction,"['ADJ', 'NOUN', 'VERB', 'NOUN', 'VERB', 'NOUN', 'SPACE']",['PERSON'],0,1,7
US3833875A,1972-12-07,Fuse receptacle,"['PROPN', 'NOUN', 'SPACE']",['PERSON'],1,1,3
US3833919A,1972-10-12,Multilevel conductor structure and method,"['ADJ', 'NOUN', 'NOUN', 'CCONJ', 'VERB', 'SPACE']",['PERSON'],0,1,6
US3834020A,1971-11-19,Shears,"['NOUN', 'SPACE']",['PERSON'],0,1,2
US3834157A,1973-02-05,Spinner de-icing for gas turbine engines,"['PROPN', 'NOUN', 'ADJ', 'NOUN', 'ADP', 'NOUN', 'NOUN', 'NOUN', 'SPACE']",['PERSON'],1,1,9
US3834186A,1973-11-09,Knit contour unit for a knitting machine,"['ADJ', 'NOUN', 'NOUN', 'ADP', 'DET', 'NOUN', 'NOUN', 'SPACE']",['PERSON'],0,1,8
US3834188A,1971-06-08,Spring loaded pattern drum for ease of pattern jack insertion,"['NOUN', 'ADJ', 'NOUN', 'NOUN', 'ADP', 'NOUN', 'ADP', 'NOUN', 'PROPN', 'NOUN', 'SPACE']",['PERSON'],1,1,11
US3834266A,1973-11-23,Cartridge string guitar assembly,"['PROPN', 'NOUN', 'PROPN', 'NOUN', 'SPACE']",['PERSON'],1,1,5
US3834267A,1973-09-27,Capo for five string banjo,"['PROPN', 'ADP', 'NUM', 'NOUN', 'NOUN', 'SPACE']","['PERSON', 'CARDINAL']",1,1,6
US3834276A,1970-09-08,Rams,"['NOUN', 'SPACE']",['PERSON'],0,1,2
US3834311A,1971-06-01,Cartridge,"['PROPN', 'SPACE']",['PERSON'],1,1,2
US3834314A,1972-12-29,Puller sabot ammunition with slip seal,"['PROPN', 'PROPN', 'NOUN', 'ADP', 'PROPN', 'VERB', 'SPACE']",['PERSON'],1,1,7
US3834347A,1971-06-16,Tablet coating apparatus,"['PROPN', 'NOUN', 'NOUN', 'SPACE']",['PERSON'],1,1,4
US3834433A,1971-11-22,Cartridge-actuated device for inflating tires and the like,"['PROPN', 'PUNCT', 'VERB', 'NOUN', 'ADP', 'VERB', 'NOUN', 'CCONJ', 'DET', 'ADJ', 'SPACE']",['PERSON'],1,1,11
US3834445A,1971-09-20,Continuous casting mold having a breakout sensing and control device,"['ADJ', 'NOUN', 'NOUN', 'VERB', 'DET', 'NOUN', 'NOUN', 'CCONJ', 'NOUN', 'NOUN', 'SPACE']",['PERSON'],0,1,11
US3834446A,1972-04-10,Mould for electroslag remelting of metals,"['NOUN', 'ADP', 'NOUN', 'NOUN', 'ADP', 'NOUN', 'SPACE']",['PERSON'],0,1,7
US3834468A,1971-05-07,Hammer-drill,"['NOUN', 'PUNCT', 'NOUN', 'SPACE']",['PERSON'],0,1,4
US3834669A,1973-02-12,Knockdown jack assembly,"['PROPN', 'PROPN', 'PROPN', 'SPACE']",['PERSON'],1,1,4
US3834705A,1973-09-26,Footsie bird game device,"['PROPN', 'NOUN', 'NOUN', 'NOUN', 'SPACE']",['PERSON'],1,1,5
US3834720A,1973-02-07,Self-centering jaw chuck,"['NOUN', 'PUNCT', 'VERB', 'NOUN', 'PROPN', 'SPACE']",['PERSON'],1,1,6
US3834725A,1972-03-18,Trolley adapted to hold or to exhibit things or articles of different kinds,"['PROPN', 'VERB', 'PART', 'VERB', 'CCONJ', 'PART', 'VERB', 'NOUN', 'CCONJ', 'NOUN', 'ADP', 'ADJ', 'NOUN', 'SPACE']",['PERSON'],1,1,14
US3834818A,1972-03-29,Continuous measurement of the fineness of a pulverulent material,"['ADJ', 'NOUN', 'ADP', 'DET', 'NOUN', 'ADP', 'DET', 'ADJ', 'NOUN', 'SPACE']",['PERSON'],0,1,10
US3834831A,1973-01-23,Blade shank cooling arrangement,"['NOUN', 'NOUN', 'VERB', 'NOUN', 'SPACE']",['PERSON'],0,1,5
US3834833A,1972-02-18,Blade construction for axial-flow turbo-machines and method of protecting turbo-machine blades against stress corrosion cracking,"['PROPN', 'NOUN', 'ADP', 'ADJ', 'PUNCT', 'NOUN', 'NOUN', 'PUNCT', 'NOUN', 'CCONJ', 'NOUN', 'ADP', 'VERB', 'NOUN', 'PUNCT', 'NOUN', 'NOUN', 'ADP', 'NOUN', 'NOUN', 'VERB', 'SPACE']",['PERSON'],1,1,22
US3834911A,1972-05-31,Glass composition and method of making,"['NOUN', 'NOUN', 'CCONJ', 'NOUN', 'ADP', 'VERB', 'SPACE']",['PERSON'],0,1,7
US3834980A,1969-06-17,Glass-filled thermoplastic pellets suitable for blending with thermoplastic,"['PROPN', 'PUNCT', 'VERB', 'ADJ', 'NOUN', 'ADJ', 'ADP', 'VERB', 'ADP', 'ADJ', 'SPACE']",['PERSON'],1,1,11
US3835075A,1971-06-29,Butadiene resins and process for preparation,"['ADJ', 'NOUN', 'CCONJ', 'NOUN', 'ADP', 'NOUN', 'SPACE']",['PERSON'],0,1,7
US3835101A,1972-04-13,"Melt blends of carboxylic acid terminated,low molecular weight polyamide and polyvalent metal compounds","['PROPN', 'NOUN', 'ADP', 'ADJ', 'NOUN', 'VERB', 'PUNCT', 'ADJ', 'ADJ', 'NOUN', 'NOUN', 'CCONJ', 'NOUN', 'NOUN', 'VERB', 'SPACE']",['PERSON'],1,1,16
US3835110A,1972-02-08,Vasopressin peptides having psychopharmacological activity,"['PROPN', 'NOUN', 'VERB', 'ADJ', 'NOUN', 'SPACE']",['PERSON'],1,1,6
US3835116A,1973-06-25,Vinyl halide plastisol compositions containing a carboxylic polymer,"['NOUN', 'NOUN', 'NOUN', 'NOUN', 'VERB', 'DET', 'ADJ', 'NOUN', 'SPACE']",['PERSON'],0,1,9
US3835230A,1972-05-02,D.c. arc furnace for steelmaking,"['PROPN', 'PUNCT', 'PROPN', 'PROPN', 'ADP', 'VERB', 'SPACE']",['PERSON'],1,1,7
US3835406A,1972-10-02,Neutralized amplifier circuit,"['ADJ', 'NOUN', 'NOUN', 'SPACE']",['PERSON'],0,1,4
US3835409A,1973-09-25,Amplifier distortion circuit for electric guitars,"['ADJ', 'NOUN', 'NOUN', 'ADP', 'ADJ', 'NOUN', 'SPACE']",['PERSON'],0,1,7
US3835432A,1973-02-12,Fuse holder,"['PROPN', 'NOUN', 'SPACE']",['PERSON'],1,1,3
US3835459A,1972-03-06,BIREFRINGENCE READ Bi{11 Ti{11 O{11 {11 DISPLAY AND MEMORY DEVICE,"['PROPN', 'VERB', 'ADP', 'PROPN', 'PROPN', 'PUNCT', 'NUM', 'NOUN', 'CCONJ', 'PROPN', 'NOUN', 'SPACE']","['PERSON', 'DATE']",1,1,12
US3835462A,1972-06-07,Fishing rod beeper,"['NOUN', 'NOUN', 'NOUN', 'SPACE']",['PERSON'],0,1,4
US3835681A,1973-03-16,Continuous rolling mill,"['ADJ', 'NOUN', 'NOUN', 'SPACE']",['PERSON'],0,1,4
US3835695A,1972-01-20,Meter proving apparatus and method,"['NOUN', 'NOUN', 'NOUN', 'CCONJ', 'NOUN', 'SPACE']",['PERSON'],0,1,6
US3835718A,1972-07-24,Impeller mechanism,"['PROPN', 'NOUN', 'SPACE']",['PERSON'],1,1,3
US3835842A,1972-07-03,Endoscope with continuous irrigation,"['VERB', 'ADP', 'ADJ', 'NOUN', 'SPACE']",['PERSON'],0,1,5
US3835879A,1973-04-09,Hose rack assembly,"['PROPN', 'VERB', 'NOUN', 'SPACE']",['PERSON'],1,1,4
US3835917A,1972-11-27,Continuous casting of non-ferrous metals,"['ADJ', 'NOUN', 'ADP', 'ADJ', 'ADJ', 'ADJ', 'NOUN', 'SPACE']",['PERSON'],0,1,8
US3835975A,1971-09-10,Printer head assembly,"['NOUN', 'NOUN', 'NOUN', 'SPACE']",['PERSON'],0,1,4
US3835989A,1972-04-27,Carton with two covers,"['NOUN', 'ADP', 'NUM', 'VERB', 'SPACE']","['PERSON', 'CARDINAL']",0,1,5
US3836007A,1972-05-16,Eyeglass display holder,"['NOUN', 'NOUN', 'NOUN', 'SPACE']",['PERSON'],0,1,4
US3836012A,1973-07-09,Removable outrigger assembly with rotatable jack,"['ADJ', 'NOUN', 'NOUN', 'ADP', 'ADJ', 'NOUN', 'SPACE']",['PERSON'],0,1,7
US3836020A,1972-11-11,Container/cargo handling plant,"['PROPN', 'SYM', 'NOUN', 'NOUN', 'NOUN', 'SPACE']",['PERSON'],1,1,6
US3836045A,1972-11-14,Dispensing container of folded disposable towels,"['ADJ', 'NOUN', 'ADP', 'VERB', 'ADJ', 'NOUN', 'SPACE']",['PERSON'],0,1,7
US3836049A,1973-07-12,Clasp,"['NOUN', 'SPACE']",['PERSON'],0,1,2
US3836086A,1972-07-19,Yarn winding apparatus and method,"['PROPN', 'NOUN', 'NOUN', 'CCONJ', 'NOUN', 'SPACE']",['PERSON'],1,1,6
US3836097A,1972-12-04,Silencer,"['PROPN', 'SPACE']",['PERSON'],1,1,2
US3836197A,1972-11-24,Recliner with vertically movable headrest,"['PROPN', 'ADP', 'ADV', 'ADJ', 'NOUN', 'SPACE']",['PERSON'],1,1,6
US3836208A,1971-11-12,Antiskid control system,"['PROPN', 'NOUN', 'NOUN', 'SPACE']",['PERSON'],1,1,4
US3836215A,1973-02-15,Shaft vibration dampening means and method,"['NOUN', 'NOUN', 'NOUN', 'NOUN', 'CCONJ', 'VERB', 'SPACE']",['PERSON'],0,1,7
US3836224A,1972-11-03,Holdgram memory readout system,"['PROPN', 'NOUN', 'NOUN', 'NOUN', 'SPACE']",['PERSON'],1,1,5
US3836234A,1972-05-17,Fully closing iris diaphragm,"['ADV', 'VERB', 'PROPN', 'PROPN', 'SPACE']",['PERSON'],1,1,5
US3836255A,1972-04-06,Spectrometric substance analyzer employing temperature modulation,"['ADJ', 'NOUN', 'NOUN', 'VERB', 'NOUN', 'NOUN', 'SPACE']",['PERSON'],0,1,7
US3836324A,1973-08-06,Continuous rotary heat treating furnace,"['ADJ', 'ADJ', 'NOUN', 'VERB', 'NOUN', 'SPACE']",['PERSON'],0,1,6
US3836375A,1972-04-06,TiO{11 {13 P{11 O{11 {13 Na{11 O{13 WO{11 {11 OPTICAL GLASSES AND METHOD,"['PROPN', 'PUNCT', 'NUM', 'PROPN', 'PROPN', 'PUNCT', 'NUM', 'NOUN', 'PROPN', 'PROPN', 'PUNCT', 'NUM', 'PROPN', 'NOUN', 'CCONJ', 'PROPN', 'SPACE']","['PERSON', 'CARDINAL', 'ORG', 'CARDINAL', 'ORG']",1,1,17
US3836389A,1966-06-09,Glass coated electrical steel sheet and articles prepared therefrom,"['PROPN', 'VERB', 'ADJ', 'NOUN', 'NOUN', 'CCONJ', 'NOUN', 'VERB', 'ADP', 'SPACE']",['PERSON'],1,1,10
US3836432A,1969-09-25,Continuous process for the hydrolysis of raffinose,"['ADJ', 'NOUN', 'ADP', 'DET', 'NOUN', 'ADP', 'ADJ', 'SPACE']",['PERSON'],0,1,8
US3836486A,1971-01-13,Vinyl chloride polymer recovery process,"['NOUN', 'NOUN', 'NOUN', 'NOUN', 'NOUN', 'SPACE']",['PERSON'],0,1,6
US3836490A,1970-10-08,Flameproof polycarbonates containing an alkali metal salt soluble in the polycarbonate melt,"['NOUN', 'NOUN', 'VERB', 'DET', 'ADJ', 'NOUN', 'NOUN', 'ADJ', 'ADP', 'DET', 'NOUN', 'NOUN', 'SPACE']",['PERSON'],0,1,13
US3836510A,1972-12-27,Vinyl halide terpolymer and bulk process for preparation,"['NOUN', 'NOUN', 'NOUN', 'CCONJ', 'ADJ', 'NOUN', 'ADP', 'NOUN', 'SPACE']",['PERSON'],0,1,9
US3836535A,1970-08-27,N-methyl-n'-(2-amino ethyl sulfonyl)-piperazine,"['NOUN', 'PUNCT', 'NOUN', 'PUNCT', 'NOUN', 'PUNCT', 'NOUN', 'NOUN', 'PROPN', 'SPACE']",['PERSON'],1,1,10
US3836594A,1969-11-27,Hydrocarbon conversion process and silica and/or alumina-containing catalyst therefor,"['NOUN', 'NOUN', 'NOUN', 'CCONJ', 'PROPN', 'CCONJ', 'PROPN', 'PUNCT', 'VERB', 'NOUN', 'ADP', 'SPACE']",['PERSON'],1,1,12
US3836642A,1966-02-22,Granaticin b and method of preparing same,"['PROPN', 'PROPN', 'CCONJ', 'NOUN', 'ADP', 'VERB', 'ADJ', 'SPACE']",['PERSON'],1,1,8
US3836785A,1970-07-15,Neutron generator having a target on which a beam of hydrogen ions is incident,"['NOUN', 'NOUN', 'VERB', 'DET', 'NOUN', 'ADP', 'PRON', 'DET', 'NOUN', 'ADP', 'NOUN', 'NOUN', 'AUX', 'NOUN', 'SPACE']",['PERSON'],0,1,15
US3836868A,1973-06-27,"LAER GLASS HOST COMPOSITIONS COMPRISING TeO{11 , B{11 0{11 ZnO","['VERB', 'PROPN', 'NOUN', 'NOUN', 'VERB', 'PROPN', 'PUNCT', 'PROPN', 'NOUN', 'PROPN', 'SPACE']",['PERSON'],1,1,11
US3836871A,1973-06-27,"LASER GLASS HOST COMPOSITIONS COMPRISING TeO{11 , Li{11 O AND ZnO","['NOUN', 'PROPN', 'NOUN', 'VERB', 'PROPN', 'PROPN', 'PUNCT', 'PROPN', 'INTJ', 'CCONJ', 'PROPN', 'SPACE']",['PERSON'],1,1,12
US3836872A,1973-09-21,Avalanche diode oscillator,"['NOUN', 'NOUN', 'NOUN', 'SPACE']",['PERSON'],0,1,4
US3836883A,1971-12-08,Fuse and resistor device,"['NOUN', 'CCONJ', 'NOUN', 'NOUN', 'SPACE']",['PERSON'],0,1,5
US3836892A,1972-06-29,D.c. stable electronic storage utilizing a.c. stable storage cell,"['PROPN', 'PUNCT', 'ADJ', 'ADJ', 'NOUN', 'VERB', 'PROPN', 'PROPN', 'ADJ', 'NOUN', 'NOUN', 'SPACE']",['PERSON'],1,1,12
US3836951A,1960-05-05,Heterodyne autocorrelation guidance system,"['PROPN', 'NOUN', 'NOUN', 'NOUN', 'SPACE']",['PERSON'],1,1,5
US3837002A,1972-05-12,Glass mold semiconductor device,"['NOUN', 'NOUN', 'NOUN', 'NOUN', 'SPACE']",['PERSON'],0,1,5
US3837034A,1972-09-22,Painter{40 s caddy,"['PROPN', 'PART', 'NOUN', 'SPACE']",['PERSON'],1,1,4
US3837053A,1972-02-01,Yarn winding mechanism in a stuffer crimper,"['NOUN', 'NOUN', 'NOUN', 'ADP', 'DET', 'ADJ', 'NOUN', 'SPACE']",['PERSON'],0,1,8
US3837060A,1972-10-31,Armor joint jack,"['PROPN', 'ADJ', 'PROPN', 'SPACE']",['PERSON'],1,1,4
US3837077A,1972-09-18,Shears for cutting a filling thread in a weaving machine,"['NOUN', 'ADP', 'VERB', 'DET', 'NOUN', 'NOUN', 'ADP', 'DET', 'NOUN', 'NOUN', 'SPACE']",['PERSON'],0,1,11
US3837304A,1970-05-01,Deep implantation of a volatile fungicide,"['ADJ', 'NOUN', 'ADP', 'DET', 'ADJ', 'NOUN', 'SPACE']",['PERSON'],0,1,7
US3837346A,1973-02-12,Foley catheter containing cholesterol,"['PROPN', 'NOUN', 'VERB', 'NOUN', 'SPACE']",['PERSON'],1,1,5
US3837350A,1972-03-21,Tension (bobby) pin,"['NOUN', 'PUNCT', 'PROPN', 'PUNCT', 'PROPN', 'SPACE']",['PERSON'],1,1,6
US3837390A,1971-05-13,Continuous casting machine embodying a self-aligning and flexing guide-roll rack,"['ADJ', 'VERB', 'NOUN', 'VERB', 'DET', 'NOUN', 'PUNCT', 'VERB', 'CCONJ', 'VERB', 'NOUN', 'PUNCT', 'NOUN', 'NOUN', 'SPACE']",['PERSON'],0,1,15
US3837391A,1971-02-01,Continuous casting apparatus,"['ADJ', 'NOUN', 'NOUN', 'SPACE']",['PERSON'],0,1,4
US3837468A,1973-07-16,Glass container inspection system,"['NOUN', 'NOUN', 'NOUN', 'NOUN', 'SPACE']",['PERSON'],0,1,5
US3837661A,1972-06-21,Chuck sleeve,"['PROPN', 'VERB', 'SPACE']",['PERSON'],1,1,3
US3837892A,1972-01-28,Glass fiber reinforced elastomers,"['NOUN', 'NOUN', 'VERB', 'NOUN', 'SPACE']",['PERSON'],0,1,5
US3837897A,1972-05-04,Glass fiber reinforced elastomers,"['NOUN', 'NOUN', 'VERB', 'NOUN', 'SPACE']",['PERSON'],0,1,5
US3837898A,1972-06-19,Glass fiber size composition,"['NOUN', 'NOUN', 'NOUN', 'NOUN', 'SPACE']",['PERSON'],0,1,5
US3837941A,1967-12-04,Reaction of beryllium alkyl compounds with mixture of b{11 h{11 {11 and b{11 h{11,"['NOUN', 'ADP', 'PROPN', 'PROPN', 'VERB', 'ADP', 'NOUN', 'ADP', 'PROPN', 'PROPN', 'PUNCT', 'NUM', 'CCONJ', 'PROPN', 'PROPN', 'SPACE']",['PERSON'],1,1,16
US3837981A,1971-05-10,Epoxy tape,"['NOUN', 'NOUN', 'SPACE']",['PERSON'],0,1,3
US3837997A,1971-03-16,Boron nitride products,"['NOUN', 'NOUN', 'NOUN', 'SPACE']",['PERSON'],0,1,4
US3838038A,1971-12-14,Continuous conversion and regeneration process,"['ADJ', 'NOUN', 'CCONJ', 'NOUN', 'NOUN', 'SPACE']",['PERSON'],0,1,6
US3838039A,1971-12-14,Continuous conversion and regeneration process,"['ADJ', 'NOUN', 'CCONJ', 'NOUN', 'NOUN', 'SPACE']",['PERSON'],0,1,6
US3838087A,1971-07-26,Resin manufacture,"['NOUN', 'VERB', 'SPACE']",['PERSON'],0,1,3
US3838096A,1971-12-06,Glass fiber-reinforced plastics and process for producing the same,"['NOUN', 'NOUN', 'PUNCT', 'VERB', 'NOUN', 'CCONJ', 'NOUN', 'ADP', 'VERB', 'DET', 'ADJ', 'SPACE']",['PERSON'],0,1,12
US3838139A,1971-08-16,Continuous mass styrene-type monomer polymerization process,"['ADJ', 'NOUN', 'ADJ', 'PUNCT', 'NOUN', 'NOUN', 'NOUN', 'NOUN', 'SPACE']",['PERSON'],0,1,9
US3838176A,1971-02-16,"Epoxy substituted 2,4-dienethioates","['PROPN', 'VERB', 'NUM', 'PUNCT', 'NOUN', 'SPACE']","['PERSON', 'CARDINAL']",1,1,6
US3838191A,1970-02-09,Continuous process for scrubbing so2 from a gas stream containing so2 and o2,"['ADJ', 'NOUN', 'ADP', 'VERB', 'PUNCT', 'ADP', 'DET', 'NOUN', 'NOUN', 'VERB', 'ADV', 'CCONJ', 'PROPN', 'SPACE']",['PERSON'],1,1,14
US3838280A,1972-02-25,Amplifier and quadrupole mass spectrometer utilizing same,"['ADV', 'CCONJ', 'ADJ', 'NOUN', 'NOUN', 'VERB', 'ADJ', 'SPACE']",['PERSON'],0,1,8
