patent_number,date,title,spacy_pos,spacy_label,is_prpn_spacy,is_person_spacy,spacy_pos_len
US3871819A,1968-03-06,Continuous liquid treatment of textile materials,"['ADJ', 'ADJ', 'NOUN', 'ADP', 'NOUN', 'NOUN', 'SPACE']",['PERSON'],0,1,7
US3871916A,1974-04-22,Nonaqueous cell utilizing a 3me20x-based electrolyte,"['ADJ', 'NOUN', 'VERB', 'DET', 'ADV', 'PUNCT', 'VERB', 'NOUN', 'SPACE']","['CARDINAL', 'PERSON']",0,1,9
US3872092A,1973-01-29,"Novel {66 {hu 9,11{b -Gonadiene-5{60 -ols","['NOUN', 'PUNCT', 'NUM', 'PUNCT', 'PROPN', 'PROPN', 'PROPN', 'PUNCT', 'SPACE']","['CARDINAL', 'PERSON']",1,1,9
US3872155A,1970-06-19,Esters of brominated dipentaerythritol,"['NOUN', 'ADP', 'VERB', 'PROPN', 'SPACE']",['PERSON'],1,1,5
US3872160A,1970-06-24,Cis 6-hydroxy-hexenoate,"['PROPN', 'NUM', 'PUNCT', 'NOUN', 'PUNCT', 'ADJ', 'SPACE']",['PERSON'],1,1,7
US3872170A,1971-03-29,Continuous manufacture of an aqueous choline chloride solution,"['ADJ', 'NOUN', 'ADP', 'DET', 'ADJ', 'NOUN', 'NOUN', 'NOUN', 'SPACE']",['PERSON'],0,1,9
US3872184A,1972-04-27,"O-alkyl-s-alkyl-s-{8 1,2-bis(alkoxyalkoxy, benzyloxy, alkylamino) carbonyl ethyl{9 dithiophosphates","['NOUN', 'PUNCT', 'NOUN', 'PUNCT', 'PRON', 'PUNCT', 'NOUN', 'PUNCT', 'PROPN', 'PROPN', 'PUNCT', 'PROPN', 'PUNCT', 'PROPN', 'PUNCT', 'PROPN', 'PUNCT', 'PROPN', 'NOUN', 'VERB', 'SPACE']",['PERSON'],1,1,21
US3872257A,1974-03-11,Multiplex and demultiplex apparatus for digital-type signals,"['PROPN', 'CCONJ', 'PROPN', 'NOUN', 'ADP', 'ADJ', 'PUNCT', 'NOUN', 'NOUN', 'SPACE']",['PERSON'],1,1,10
US3872461A,1972-10-26,Waveform and symbol display system,"['NOUN', 'CCONJ', 'NOUN', 'NOUN', 'NOUN', 'SPACE']",['PERSON'],0,1,6
US3872540A,1973-08-07,Sweeper pickup head,"['NOUN', 'NOUN', 'VERB', 'SPACE']",['PERSON'],0,1,4
US3872647A,1973-03-22,Carton loader,"['PROPN', 'NOUN', 'SPACE']",['PERSON'],1,1,3
US3872761A,1973-12-03,Mitre box with improved indexing means,"['PROPN', 'PROPN', 'ADP', 'ADJ', 'NOUN', 'VERB', 'SPACE']",['PERSON'],1,1,7
US3872769A,1973-07-23,Cartridge actuated flame system,"['PROPN', 'VERB', 'NOUN', 'NOUN', 'SPACE']",['PERSON'],1,1,5
US3872860A,1973-12-13,Pelvic traction belt,"['PROPN', 'PROPN', 'NOUN', 'SPACE']",['PERSON'],1,1,4
US3872913A,1969-12-15,Continuous method and apparatus for upwards casting,"['ADJ', 'NOUN', 'CCONJ', 'NOUN', 'ADP', 'ADV', 'VERB', 'SPACE']",['PERSON'],0,1,8
US3872914A,1974-02-01,Continuous ingot casting machine,"['ADJ', 'NOUN', 'VERB', 'NOUN', 'SPACE']",['PERSON'],0,1,5
US3873005A,1972-11-10,Dispensing closure with spout mounted in closure skirt,"['VERB', 'NOUN', 'ADP', 'NOUN', 'VERB', 'ADP', 'NOUN', 'NOUN', 'SPACE']",['PERSON'],0,1,9
US3873043A,1973-01-17,Yarn guide- and monitoring apparatus for a bobbin creel,"['PROPN', 'NOUN', 'CCONJ', 'NOUN', 'NOUN', 'ADP', 'DET', 'NOUN', 'NOUN', 'SPACE']",['PERSON'],1,1,10
US3873070A,1972-11-08,Continuous mixing machines,"['ADJ', 'NOUN', 'NOUN', 'SPACE']",['PERSON'],0,1,4
US3873072A,1971-08-02,Melt extrusion,"['PROPN', 'NOUN', 'SPACE']",['PERSON'],1,1,3
US3873181A,1969-05-19,Infrared correlation method using thermochromics having a hysteresis property,"['ADJ', 'NOUN', 'NOUN', 'VERB', 'NOUN', 'VERB', 'DET', 'NOUN', 'NOUN', 'SPACE']",['PERSON'],0,1,10
US3873237A,1972-12-30,Impeller wheel for torque converter or fluid coupling,"['PROPN', 'NOUN', 'ADP', 'NOUN', 'NOUN', 'CCONJ', 'ADJ', 'NOUN', 'SPACE']",['PERSON'],1,1,9
US3873264A,1974-03-04,Bottle coating sensitizer and method thereof,"['NOUN', 'NOUN', 'NOUN', 'CCONJ', 'NOUN', 'ADV', 'SPACE']",['PERSON'],0,1,7
US3873292A,1974-03-18,Glass casting apparatus and method,"['NOUN', 'NOUN', 'NOUN', 'CCONJ', 'NOUN', 'SPACE']",['PERSON'],0,1,6
US3873329A,1973-07-02,Glass-ceramic article,"['PROPN', 'PUNCT', 'ADJ', 'NOUN', 'SPACE']",['PERSON'],1,1,5
US3873394A,1968-06-17,Carton closing and labeling method and apparatus,"['PROPN', 'NOUN', 'CCONJ', 'NOUN', 'NOUN', 'CCONJ', 'NOUN', 'SPACE']",['PERSON'],1,1,8
US3873485A,1974-04-01,Moldable aqueous plastic mass of polyethylene oxide fumed silica and polyglycol,"['ADJ', 'ADJ', 'NOUN', 'NOUN', 'ADP', 'NOUN', 'NOUN', 'VERB', 'PROPN', 'CCONJ', 'ADJ', 'SPACE']",['PERSON'],1,1,12
US3873486A,1967-02-24,Resin compositions,"['NOUN', 'NOUN', 'SPACE']",['PERSON'],0,1,3
US3873527A,1972-12-15,Quaternary ammonium salts of 17-propargylamines of steroidal dithioketals,"['ADJ', 'NOUN', 'NOUN', 'ADP', 'NUM', 'PUNCT', 'NOUN', 'ADP', 'NOUN', 'NOUN', 'SPACE']","['PERSON', 'CARDINAL']",0,1,11
US3873544A,1971-08-05,Cyanoalkylamino-s-triazines,"['PROPN', 'PUNCT', 'NOUN', 'PUNCT', 'NOUN', 'SPACE']",['PERSON'],1,1,6
US3873570A,1970-11-27,Lactones,"['NOUN', 'SPACE']",['PERSON'],0,1,2
US3873583A,1971-04-29,Quaternary ammonium compounds,"['ADJ', 'NOUN', 'VERB', 'SPACE']",['PERSON'],0,1,4
US3873590A,1969-09-15,Methyl esters of organic sulfonic acid oligomers,"['PROPN', 'NOUN', 'ADP', 'ADJ', 'ADJ', 'NOUN', 'NOUN', 'SPACE']",['PERSON'],1,1,8
US3873616A,1972-12-22,(Aminoalkoxy) phenylacetamides and derivatives thereof,"['PUNCT', 'PROPN', 'PUNCT', 'NOUN', 'CCONJ', 'NOUN', 'ADV', 'SPACE']",['PERSON'],1,1,8
US3873728A,1972-04-18,Method of feeding ruminants a high-energy feedstuff admixed with a NPN supplement,"['PROPN', 'ADP', 'VERB', 'NOUN', 'DET', 'ADJ', 'PUNCT', 'NOUN', 'NOUN', 'VERB', 'ADP', 'DET', 'PROPN', 'NOUN', 'SPACE']",['PERSON'],1,1,15
US3873733A,1972-03-13,Method of producing a pelleted slow release NPN feed for ruminants,"['PROPN', 'ADP', 'VERB', 'DET', 'ADJ', 'ADJ', 'NOUN', 'ADJ', 'NOUN', 'ADP', 'NOUN', 'SPACE']",['PERSON'],1,1,12
US3873734A,1972-02-04,Method of producing a pelleted slow-release NPN feed for ruminants,"['PROPN', 'ADP', 'VERB', 'DET', 'ADJ', 'ADJ', 'PUNCT', 'NOUN', 'ADJ', 'NOUN', 'ADP', 'NOUN', 'SPACE']",['PERSON'],1,1,13
US3873855A,1971-08-10,Waveform generator producing output current variations as a function of predetermined input and control signal values,"['NOUN', 'NOUN', 'VERB', 'NOUN', 'ADJ', 'NOUN', 'ADP', 'DET', 'NOUN', 'ADP', 'VERB', 'NOUN', 'CCONJ', 'NOUN', 'NOUN', 'NOUN', 'SPACE']",['PERSON'],0,1,17
US3873978A,1973-03-16,Keyboard circuit,"['PROPN', 'NOUN', 'SPACE']",['PERSON'],1,1,3
US3874024A,1973-09-13,Hose coupling arrangement for pneumatically actuated floor care appliances,"['PROPN', 'NOUN', 'NOUN', 'ADP', 'ADV', 'VERB', 'NOUN', 'NOUN', 'NOUN', 'SPACE']",['PERSON'],1,1,10
US3874104A,1973-11-08,Cartridge casing extraction mechanism for revolvers,"['PROPN', 'NOUN', 'NOUN', 'NOUN', 'ADP', 'NOUN', 'SPACE']",['PERSON'],1,1,7
US3874115A,1974-02-11,Nonspill flexible package for shipping and storing cut flowers or the like,"['PROPN', 'ADJ', 'NOUN', 'ADP', 'NOUN', 'CCONJ', 'VERB', 'VERB', 'NOUN', 'CCONJ', 'DET', 'ADJ', 'SPACE']",['PERSON'],1,1,13
US3874159A,1971-01-29,Yarn process,"['PROPN', 'NOUN', 'SPACE']",['PERSON'],1,1,3
US3874201A,1973-12-10,Knit fabric incorporating a fancy warp stitch weave,"['ADJ', 'NOUN', 'VERB', 'DET', 'ADJ', 'NOUN', 'VERB', 'VERB', 'SPACE']",['PERSON'],0,1,9
US3874359A,1974-07-01,Crossbow with coiled spring force developing means for projecting an article,"['VERB', 'ADP', 'VERB', 'NOUN', 'NOUN', 'VERB', 'NOUN', 'ADP', 'VERB', 'DET', 'NOUN', 'SPACE']",['PERSON'],0,1,12
US3874489A,1973-07-13,Glass rod and reel construction,"['PROPN', 'NOUN', 'CCONJ', 'VERB', 'NOUN', 'SPACE']",['PERSON'],1,1,6
US3874507A,1973-12-12,Cartridge card tray,"['PROPN', 'NOUN', 'VERB', 'SPACE']",['PERSON'],1,1,4
US3874562A,1972-11-10,Dispensing closure with pump parts and container using the same,"['VERB', 'NOUN', 'ADP', 'NOUN', 'NOUN', 'CCONJ', 'NOUN', 'VERB', 'DET', 'ADJ', 'SPACE']",['PERSON'],0,1,11
US3874578A,1974-04-19,Jaw member-die member assembly,"['PROPN', 'NOUN', 'PUNCT', 'NOUN', 'NOUN', 'NOUN', 'SPACE']",['PERSON'],1,1,7
US3874612A,1972-08-05,Yarn tensioning device,"['NOUN', 'VERB', 'NOUN', 'SPACE']",['PERSON'],0,1,4
US3874613A,1972-10-16,Yarn tensioning device,"['NOUN', 'VERB', 'NOUN', 'SPACE']",['PERSON'],0,1,4
US3874744A,1972-11-10,Antiskid device for pressure-medium operated brakes,"['PROPN', 'NOUN', 'ADP', 'NOUN', 'PUNCT', 'NOUN', 'VERB', 'NOUN', 'SPACE']",['PERSON'],1,1,9
US3874816A,1973-10-23,Windmill blade,"['PROPN', 'NOUN', 'SPACE']",['PERSON'],1,1,3
US3874819A,1972-05-12,Francis type runner for pump turbine,"['PROPN', 'NOUN', 'NOUN', 'ADP', 'NOUN', 'NOUN', 'SPACE']",['PERSON'],1,1,7
US3874834A,1972-03-21,Continuous extrusion machine for manufacturing plastic nets,"['ADJ', 'NOUN', 'NOUN', 'ADP', 'VERB', 'NOUN', 'NOUN', 'SPACE']",['PERSON'],0,1,8
US3874866A,1973-04-16,Glass feeder tube operating mechanism,"['NOUN', 'NOUN', 'NOUN', 'NOUN', 'NOUN', 'SPACE']",['PERSON'],0,1,6
US3874890A,1972-09-09,Nacreous pigments and process for the production thereof,"['ADJ', 'NOUN', 'CCONJ', 'NOUN', 'ADP', 'DET', 'NOUN', 'ADV', 'SPACE']",['PERSON'],0,1,9
US3874903A,1972-01-31,Epoxy resins,"['NOUN', 'VERB', 'SPACE']",['PERSON'],0,1,3
US3874920A,1973-06-28,Boron silicide method for making thermally oxidized boron doped poly-crystalline silicon having minimum resistivity,"['NOUN', 'ADJ', 'NOUN', 'ADP', 'VERB', 'ADV', 'VERB', 'NOUN', 'VERB', 'ADJ', 'PUNCT', 'NOUN', 'NOUN', 'VERB', 'NOUN', 'NOUN', 'SPACE']",['PERSON'],0,1,17
US3874981A,1971-07-14,Resin sheet having an appearance of carpet or velvet and process therefor,"['NOUN', 'NOUN', 'VERB', 'DET', 'NOUN', 'ADP', 'NOUN', 'CCONJ', 'NOUN', 'CCONJ', 'NOUN', 'ADP', 'SPACE']",['PERSON'],0,1,13
US3875084A,1971-12-30,Polyvinyl halide thioether polymers,"['ADJ', 'NOUN', 'NOUN', 'NOUN', 'SPACE']",['PERSON'],0,1,5
US3875102A,1969-09-15,Polyvinyl chloride plasticized with methyl esters of organic sulfonic acid oligomer,"['ADJ', 'NOUN', 'VERB', 'ADP', 'NOUN', 'NOUN', 'ADP', 'ADJ', 'ADJ', 'NOUN', 'ADJ', 'SPACE']",['PERSON'],0,1,12
US3875108A,1970-12-18,"Deep dyeable, lusterous, and fire-retardant linear polyester composition","['ADJ', 'NOUN', 'PUNCT', 'ADJ', 'PUNCT', 'CCONJ', 'NOUN', 'PUNCT', 'ADJ', 'ADJ', 'NOUN', 'NOUN', 'SPACE']","['PERSON', 'ORG']",0,1,13
US3875114A,1973-06-18,Amidomethylene modified aromatic carbocyclic polymers and methods for making the same,"['VERB', 'VERB', 'ADJ', 'NOUN', 'NOUN', 'CCONJ', 'NOUN', 'ADP', 'VERB', 'DET', 'ADJ', 'SPACE']",['PERSON'],0,1,12
US3875164A,1973-05-14,Melt extruded high moisture barrier polyvinyl chloride film,"['PROPN', 'VERB', 'ADJ', 'NOUN', 'NOUN', 'ADJ', 'NOUN', 'NOUN', 'SPACE']",['PERSON'],1,1,9
US3875197A,1968-07-15,Amido-methyl-polyglycol formals,"['PROPN', 'PUNCT', 'NOUN', 'PUNCT', 'NOUN', 'NOUN', 'SPACE']",['PERSON'],1,1,7
US3875311A,1973-07-02,Calorie-free dipeptide sweetening composition,"['NOUN', 'PUNCT', 'ADJ', 'NOUN', 'VERB', 'NOUN', 'SPACE']",['PERSON'],0,1,7
US3875458A,1974-06-10,Dimmer for discharge lamp utilizing a pulse enabling circuit,"['NOUN', 'ADP', 'NOUN', 'NOUN', 'VERB', 'DET', 'ADV', 'VERB', 'NOUN', 'SPACE']",['PERSON'],0,1,10
US3875510A,1973-10-05,Synchro testing calibrating device,"['NOUN', 'NOUN', 'VERB', 'NOUN', 'SPACE']",['PERSON'],0,1,5
US3875523A,1973-05-21,Amplifier circuit for graphical recorder,"['ADJ', 'NOUN', 'ADP', 'ADJ', 'NOUN', 'SPACE']",['PERSON'],0,1,6
US3875600A,1974-05-31,Survival kit,"['PROPN', 'VERB', 'SPACE']",['PERSON'],1,1,3
US3875605A,1973-08-01,Rug shampooer,"['PROPN', 'VERB', 'SPACE']",['PERSON'],1,1,3
US3875736A,1974-08-20,Continuous cam clock,"['ADJ', 'NOUN', 'VERB', 'SPACE']",['PERSON'],0,1,4
US3876003A,1973-10-29,Drill stem testing methods and apparatus utilizing inflatable packer elements,"['VERB', 'NOUN', 'NOUN', 'NOUN', 'CCONJ', 'NOUN', 'VERB', 'ADJ', 'NOUN', 'NOUN', 'SPACE']",['PERSON'],0,1,11
US3876064A,1973-09-19,Bobbin conveying and alignment mechanism,"['PROPN', 'NOUN', 'CCONJ', 'NOUN', 'NOUN', 'SPACE']",['PERSON'],1,1,6
US3876072A,1973-08-20,Dispensing carton,"['VERB', 'NOUN', 'SPACE']",['PERSON'],0,1,3
US3876278A,1972-10-11,Fuse holder contact,"['NOUN', 'NOUN', 'NOUN', 'SPACE']",['PERSON'],0,1,4
US3876315A,1974-02-13,Split body housing for writing instruments,"['ADJ', 'NOUN', 'NOUN', 'ADP', 'VERB', 'NOUN', 'SPACE']",['PERSON'],0,1,7
US3876405A,1973-08-02,Glass fiber coating process,"['NOUN', 'NOUN', 'NOUN', 'NOUN', 'SPACE']",['PERSON'],0,1,5
US3876443A,1968-04-17,Satin white-clay compositions and methods of manufacture,"['PROPN', 'ADJ', 'PUNCT', 'NOUN', 'NOUN', 'CCONJ', 'NOUN', 'ADP', 'NOUN', 'SPACE']",['PERSON'],1,1,10
US3876481A,1972-10-18,"Glass compositions, fibers and methods of making same","['NOUN', 'NOUN', 'PUNCT', 'NOUN', 'CCONJ', 'NOUN', 'ADP', 'VERB', 'ADJ', 'SPACE']",['PERSON'],0,1,10
US3876544A,1971-11-26,Electrogalvanic filter cell,"['ADJ', 'NOUN', 'NOUN', 'SPACE']",['PERSON'],0,1,4
US3876547A,1973-08-01,Butterfly conveyor clip for flat bed filter,"['NOUN', 'NOUN', 'NOUN', 'ADP', 'ADJ', 'NOUN', 'NOUN', 'SPACE']",['PERSON'],0,1,8
US3876591A,1973-11-19,Arylene sulfide polymers,"['ADJ', 'NOUN', 'NOUN', 'SPACE']",['PERSON'],0,1,4
US3876592A,1973-11-19,Arylene sulfide polymers,"['ADJ', 'NOUN', 'NOUN', 'SPACE']",['PERSON'],0,1,4
US3876593A,1965-04-30,Aziridinyl polyolefins and method of preparing same,"['PROPN', 'NOUN', 'CCONJ', 'NOUN', 'ADP', 'VERB', 'ADJ', 'SPACE']",['PERSON'],1,1,8
US3876607A,1972-09-13,Epoxy compositions,"['NOUN', 'NOUN', 'SPACE']",['PERSON'],0,1,3
US3876618A,1971-08-19,Oxazolidinone modified triglycidyl ether of trihydroxy triphenyl methane and derivatives thereof,"['PROPN', 'VERB', 'NOUN', 'ADV', 'ADP', 'ADJ', 'NOUN', 'NOUN', 'CCONJ', 'NOUN', 'ADV', 'SPACE']",['PERSON'],1,1,12
US3876627A,1971-07-14,Quaternary ammonium phenylazo cationic dyestuffs containing an unsaturable group on the quaternary nitrogen,"['ADJ', 'NOUN', 'NOUN', 'ADJ', 'NOUN', 'VERB', 'DET', 'ADJ', 'NOUN', 'ADP', 'DET', 'ADJ', 'NOUN', 'SPACE']",['PERSON'],0,1,14
US3876714A,1970-02-20,"Chloroprene removal from pyrolyzed 1,2-dichlorethane","['NOUN', 'NOUN', 'ADP', 'ADJ', 'NUM', 'PUNCT', 'NOUN', 'SPACE']","['PERSON', 'CARDINAL']",0,1,8
US3876772A,1970-11-10,"Methods of increasing the attraction of the gypsy moth, porthetria dispar l","['NOUN', 'ADP', 'VERB', 'DET', 'NOUN', 'ADP', 'DET', 'ADJ', 'NOUN', 'PUNCT', 'PROPN', 'PROPN', 'PROPN', 'SPACE']",['PERSON'],1,1,14
US3876948A,1973-01-26,Fuse alarm indicator,"['PROPN', 'NOUN', 'NOUN', 'SPACE']",['PERSON'],1,1,4
US3876955A,1973-07-16,Biasing circuit for differential amplifier,"['NOUN', 'NOUN', 'ADP', 'ADJ', 'ADP', 'SPACE']",['PERSON'],0,1,6
US3876968A,1974-02-12,Glass heating fabric,"['NOUN', 'NOUN', 'NOUN', 'SPACE']",['PERSON'],0,1,4
US3876987A,1972-04-26,Multiprocessor computer systems,"['PROPN', 'NOUN', 'NOUN', 'SPACE']",['PERSON'],1,1,4
US3876999A,1973-04-18,Unitary combustion detector and fire alarm,"['ADJ', 'NOUN', 'NOUN', 'CCONJ', 'NOUN', 'NOUN', 'SPACE']",['PERSON'],0,1,7
US3877024A,1973-08-27,Synchro to pulse width converter for an avionics system,"['NOUN', 'PART', 'ADV', 'VERB', 'NOUN', 'ADP', 'DET', 'NOUN', 'NOUN', 'SPACE']",['PERSON'],0,1,10
US3877242A,1973-10-11,Harvest control unit for an ice-making machine,"['PROPN', 'NOUN', 'NOUN', 'ADP', 'DET', 'NOUN', 'PUNCT', 'VERB', 'NOUN', 'SPACE']",['PERSON'],1,1,10
US3877276A,1973-12-28,Mill roll changing system including a cantilevered roll assembly,"['NOUN', 'NOUN', 'VERB', 'NOUN', 'VERB', 'DET', 'VERB', 'NOUN', 'NOUN', 'SPACE']",['PERSON'],0,1,10
US3877323A,1973-01-09,Turret indexing machine,"['NOUN', 'NOUN', 'NOUN', 'SPACE']",['PERSON'],0,1,4
US3877483A,1974-05-10,Solenoid operated four port valve,"['PROPN', 'VERB', 'NUM', 'NOUN', 'NOUN', 'SPACE']","['PERSON', 'CARDINAL']",1,1,6
US3877561A,1971-10-04,"Cartridge for the carbon ribbon of a typewriter, calculating machine, accounting machine or like office machines","['PROPN', 'ADP', 'DET', 'NOUN', 'NOUN', 'ADP', 'DET', 'NOUN', 'PUNCT', 'VERB', 'NOUN', 'PUNCT', 'NOUN', 'NOUN', 'CCONJ', 'ADP', 'NOUN', 'NOUN', 'SPACE']",['PERSON'],1,1,19
US3877610A,1974-02-01,Hot melt cartridge adhesive gun,"['ADJ', 'VERB', 'NOUN', 'PROPN', 'NOUN', 'SPACE']",['PERSON'],1,1,6
US3877642A,1974-08-09,Freezing nucleant,"['VERB', 'ADJ', 'SPACE']",['PERSON'],0,1,3
US3877684A,1973-01-11,Continuous annealing furnace,"['ADJ', 'VERB', 'NOUN', 'SPACE']",['PERSON'],0,1,4
US3877705A,1971-11-19,Diamond scanning element,"['NOUN', 'NOUN', 'NOUN', 'SPACE']",['PERSON'],0,1,4
US3877751A,1973-07-30,Split back dental chair apparatus,"['VERB', 'ADV', 'ADJ', 'NOUN', 'NOUN', 'SPACE']",['PERSON'],0,1,6
US3877855A,1973-05-04,Slipform with longitudinally movable form sections,"['VERB', 'ADP', 'ADV', 'ADJ', 'NOUN', 'NOUN', 'SPACE']",['PERSON'],0,1,7
US3877919A,1973-09-26,Traction Rolls for Use in Glass Making,"['PROPN', 'PROPN', 'ADP', 'PROPN', 'ADP', 'PROPN', 'VERB', 'SPACE']",['PERSON'],1,1,8
US3877931A,1973-07-20,Continuous preparation of pure metals by gaseous reduction,"['ADJ', 'NOUN', 'ADP', 'ADJ', 'NOUN', 'ADP', 'ADJ', 'NOUN', 'SPACE']",['PERSON'],0,1,9
US3877963A,1973-01-10,Reversal liquid developing using a development electrode and corona charging,"['NOUN', 'NOUN', 'VERB', 'VERB', 'DET', 'NOUN', 'NOUN', 'CCONJ', 'NOUN', 'VERB', 'SPACE']",['PERSON'],0,1,11
US3878009A,1972-02-04,Glass fiber reinforced gypsum building components and method,"['NOUN', 'NOUN', 'VERB', 'NOUN', 'NOUN', 'NOUN', 'CCONJ', 'NOUN', 'SPACE']",['PERSON'],0,1,9
US3878027A,1972-07-03,"Continuous, laminated-platen press for pressing glue-coated press charges","['ADJ', 'PUNCT', 'VERB', 'PUNCT', 'ADJ', 'NOUN', 'ADP', 'VERB', 'NOUN', 'PUNCT', 'VERB', 'NOUN', 'NOUN', 'SPACE']",['PERSON'],0,1,14
US3878067A,1972-07-03,Electrolyte and method for electrodepositing of bright nickel-iron alloy deposits,"['PROPN', 'CCONJ', 'NOUN', 'ADP', 'VERB', 'ADP', 'ADJ', 'NOUN', 'PUNCT', 'NOUN', 'NOUN', 'NOUN', 'SPACE']",['PERSON'],1,1,13
US3878113A,1973-03-14,Polyphenylene sulfide bonded solid film lubricant,"['NOUN', 'NOUN', 'VERB', 'ADJ', 'NOUN', 'NOUN', 'SPACE']",['PERSON'],0,1,7
US3878132A,1972-11-15,Epoxy resins which are glycidyl ethers of glycerine,"['NOUN', 'NOUN', 'PRON', 'AUX', 'ADJ', 'NOUN', 'ADP', 'NOUN', 'SPACE']",['PERSON'],0,1,9
US3878141A,1972-02-24,Wellbore fluid loss additive composition,"['ADJ', 'ADJ', 'NOUN', 'ADJ', 'NOUN', 'SPACE']",['PERSON'],0,1,6
US3878169A,1971-04-19,Photodegradable polyesters prepared from ketonic dicarboxylic acids,"['ADJ', 'NOUN', 'VERB', 'ADP', 'ADJ', 'NOUN', 'NOUN', 'SPACE']",['PERSON'],0,1,8
US3878176A,1973-11-19,Arylene sulfide polymers,"['ADJ', 'NOUN', 'NOUN', 'SPACE']",['PERSON'],0,1,4
US3878189A,1973-07-02,"Azo dye compounds from amino-1,2-benzisothiazolon-1,1-dioxides","['PROPN', 'NOUN', 'VERB', 'ADP', 'PROPN', 'PUNCT', 'NOUN', 'PUNCT', 'NOUN', 'SPACE']",['PERSON'],1,1,10
US3878199A,1973-07-23,"Hydroxyalkyl derivatives of 1,3,5-triazacycloheptane-2,4-diones","['PROPN', 'NOUN', 'ADP', 'NUM', 'PUNCT', 'NOUN', 'PUNCT', 'VERB', 'SPACE']","['PERSON', 'CARDINAL']",1,1,9
US3878239A,1972-05-09,Prostaglandin D compounds production,"['NOUN', 'PROPN', 'VERB', 'NOUN', 'SPACE']",['PERSON'],1,1,5
US3878304A,1974-08-22,Method of producing a pelleted slow-release NPN feed for ruminants from waste polysaccharide materials,"['PROPN', 'ADP', 'VERB', 'DET', 'ADJ', 'ADJ', 'PUNCT', 'NOUN', 'ADJ', 'NOUN', 'ADP', 'NOUN', 'ADP', 'NOUN', 'NOUN', 'NOUN', 'SPACE']",['PERSON'],1,1,17
US3878343A,1973-05-07,Shockproof telephone set,"['ADJ', 'NOUN', 'VERB', 'SPACE']",['PERSON'],0,1,4
US3878354A,1973-06-01,Welding gun chuck assembly,"['NOUN', 'NOUN', 'PROPN', 'NOUN', 'SPACE']",['PERSON'],1,1,5
US3878417A,1971-10-13,Ray transmitting window,"['PROPN', 'VERB', 'NOUN', 'SPACE']",['PERSON'],1,1,4
US3878445A,1972-09-01,A. C. motor control apparatus and method,"['NOUN', 'PROPN', 'NOUN', 'NOUN', 'NOUN', 'CCONJ', 'NOUN', 'SPACE']",['PERSON'],1,1,8
US3878497A,1974-02-07,Fuse link assembly suitable for use in automotive electrical system,"['NOUN', 'NOUN', 'NOUN', 'ADJ', 'ADP', 'NOUN', 'ADP', 'ADJ', 'ADJ', 'NOUN', 'SPACE']",['PERSON'],0,1,11
US3878571A,1973-03-02,Urine collection device,"['NOUN', 'NOUN', 'NOUN', 'SPACE']",['PERSON'],0,1,4
US3878587A,1972-01-19,Yarn clamp for a textile machine,"['NOUN', 'NOUN', 'ADP', 'DET', 'NOUN', 'NOUN', 'SPACE']",['PERSON'],0,1,7
US3878650A,1973-10-04,Glass grinding machine,"['NOUN', 'VERB', 'NOUN', 'SPACE']",['PERSON'],0,1,4
US3878823A,1973-09-24,Carburetor venturi vacuum and engine manifold vacuum controlled exhaust gas recirculating,"['PROPN', 'PROPN', 'PROPN', 'CCONJ', 'PROPN', 'PROPN', 'PROPN', 'VERB', 'NOUN', 'NOUN', 'NOUN', 'SPACE']",['PERSON'],1,1,12
US3878947A,1973-12-28,Volumetric feeder for rotary furnaces,"['NOUN', 'NOUN', 'ADP', 'ADJ', 'NOUN', 'SPACE']",['PERSON'],0,1,6
US3878960A,1972-06-12,Glass container with a shrunk-on plastic protective cover,"['NOUN', 'NOUN', 'ADP', 'DET', 'NOUN', 'PUNCT', 'ADP', 'ADJ', 'ADJ', 'NOUN', 'SPACE']",['PERSON'],0,1,11
US3878973A,1973-10-31,Metered dose dispenser,"['PROPN', 'NOUN', 'NOUN', 'SPACE']",['PERSON'],1,1,4
US3878976A,1972-08-10,"Dispensing pushbutton cap, particularly for aerosol containers","['VERB', 'NOUN', 'NOUN', 'PUNCT', 'ADV', 'ADP', 'NOUN', 'NOUN', 'SPACE']",['PERSON'],0,1,9
US3879094A,1973-08-15,Radial Bearings,"['ADJ', 'PROPN', 'SPACE']",['PERSON'],1,1,3
US3879143A,1972-10-13,Scaffold and like structures,"['NOUN', 'CCONJ', 'ADP', 'NOUN', 'SPACE']",['PERSON'],0,1,5
US3879207A,1972-04-05,Glass for a fibre-optical element,"['NOUN', 'ADP', 'DET', 'NOUN', 'PUNCT', 'ADJ', 'NOUN', 'SPACE']",['PERSON'],0,1,8
US3879295A,1973-08-17,Vacutainer with positive separation barrier,"['NOUN', 'ADP', 'ADJ', 'NOUN', 'NOUN', 'SPACE']",['PERSON'],0,1,6
US3879333A,1973-04-04,Vinyl polymer compositions,"['NOUN', 'NOUN', 'NOUN', 'SPACE']",['PERSON'],0,1,4
US3879352A,1973-02-06,"Continuous process for polymerizing {60 ,{60 -disubstituted-{62 -propiolactones","['ADJ', 'NOUN', 'ADP', 'VERB', 'PUNCT', 'NUM', 'PUNCT', 'PUNCT', 'NUM', 'NOUN', 'VERB', 'SPACE']","['PERSON', 'CARDINAL', 'CARDINAL']",0,1,12
US3879355A,1973-11-29,Arylene sulfide polymer cured with the aid of certain compounds,"['ADJ', 'NOUN', 'NOUN', 'VERB', 'ADP', 'DET', 'NOUN', 'ADP', 'ADJ', 'NOUN', 'SPACE']",['PERSON'],0,1,11
US3879376A,1971-05-10,"Chitosan derivative, method of making the same and cosmetic composition containing the same","['PROPN', 'NOUN', 'PUNCT', 'NOUN', 'ADP', 'VERB', 'DET', 'ADJ', 'CCONJ', 'ADJ', 'NOUN', 'VERB', 'DET', 'ADJ', 'SPACE']",['PERSON'],1,1,15
US3879382A,1971-08-27,Process for the recovery of D- or L-{60 -amino-{68 -caprolactam hydrochloride of enhanced optical purity from mixtures of D- and L-{60 -amino-{68 -caprolactam hydrochloride,"['NOUN', 'ADP', 'DET', 'NOUN', 'ADP', 'PROPN', 'CCONJ', 'PROPN', 'PUNCT', 'NOUN', 'NOUN', 'ADP', 'VERB', 'ADJ', 'NOUN', 'ADP', 'NOUN', 'ADP', 'PROPN', 'CCONJ', 'PROPN', 'PUNCT', 'NOUN', 'NOUN', 'SPACE']","['PERSON', 'PERSON']",1,1,25
US3879437A,1971-02-02,Prostaglandin F{HD 3{B {331 {0 analogs,"['PROPN', 'PROPN', 'NUM', 'PUNCT', 'NUM', 'SYM', 'NUM', 'VERB', 'SPACE']","['PERSON', 'CARDINAL']",1,1,9
US3879445A,1972-04-19,Monohaloalkenyl benzoates and trihaloalkyl benzoates,"['ADJ', 'NOUN', 'CCONJ', 'PROPN', 'VERB', 'SPACE']",['PERSON'],1,1,6
US3879480A,1967-12-07,Vinyl chloride process,"['NOUN', 'NOUN', 'NOUN', 'SPACE']",['PERSON'],0,1,4
US3879482A,1969-06-09,Vinyl chloride process,"['NOUN', 'NOUN', 'NOUN', 'SPACE']",['PERSON'],0,1,4
US3879498A,1971-08-31,Dialkyl 1-acryloyloxy-2-alkenyl-1-phosphonates and dialkyl 1-methacryloxy-2-alkenyl-1-phosphonates,"['PROPN', 'NUM', 'PUNCT', 'SPACE', 'PUNCT', 'SPACE', 'PUNCT', 'NOUN', 'CCONJ', 'NOUN', 'NUM', 'PUNCT', 'SPACE', 'PUNCT', 'SPACE', 'PUNCT', 'NOUN', 'SPACE']",['PERSON'],1,1,18
US3879547A,1970-07-16,Process for obtaining an anti-hypertensive principle from {i anacardium occidentale {b L.,"['NOUN', 'ADP', 'VERB', 'DET', 'ADJ', 'ADJ', 'ADJ', 'NOUN', 'ADP', 'PUNCT', 'PROPN', 'NOUN', 'PROPN', 'PUNCT', 'X', 'PROPN', 'SPACE']",['PERSON'],1,1,17
US3879602A,1973-06-11,Keyboard,"['PROPN', 'SPACE']",['PERSON'],1,1,2
US3879642A,1972-12-22,Memorizer for counting system,"['PROPN', 'ADP', 'VERB', 'NOUN', 'SPACE']",['PERSON'],1,1,5
US3879778A,1974-10-07,Fuse clamp file,"['PROPN', 'NOUN', 'NOUN', 'SPACE']",['PERSON'],1,1,4
US3879818A,1972-07-11,Coffin kit,"['NOUN', 'NOUN', 'SPACE']",['PERSON'],0,1,3
US3879833A,1974-01-25,Fuse extractor for use with fuse links having a flexible lead extending therefrom,"['NOUN', 'NOUN', 'ADP', 'NOUN', 'ADP', 'NOUN', 'NOUN', 'VERB', 'DET', 'ADJ', 'NOUN', 'VERB', 'ADP', 'SPACE']",['PERSON'],0,1,14
US3879966A,1972-08-31,Continuous yarn dyeing machines,"['ADJ', 'NOUN', 'NOUN', 'NOUN', 'SPACE']",['PERSON'],0,1,5
US3879996A,1973-10-04,Meter translation devices for torque measuring wrenches and the like,"['NOUN', 'NOUN', 'NOUN', 'ADP', 'NOUN', 'NOUN', 'NOUN', 'CCONJ', 'DET', 'ADJ', 'SPACE']",['PERSON'],0,1,11
US3880001A,1974-03-25,Yarn tension or break monitoring apparatus,"['NOUN', 'NOUN', 'CCONJ', 'VERB', 'NOUN', 'NOUN', 'SPACE']",['PERSON'],0,1,7
US3880044A,1973-07-05,Muzzle attachment for accelerating a projectle,"['NOUN', 'NOUN', 'ADP', 'VERB', 'DET', 'NOUN', 'SPACE']",['PERSON'],0,1,7
US3880083A,1967-05-19,Bimetallic mass stabilized flechette,"['PROPN', 'NOUN', 'VERB', 'NOUN', 'SPACE']",['PERSON'],1,1,5
US3880110A,1973-07-30,Shaft operation monitor,"['NOUN', 'NOUN', 'VERB', 'SPACE']",['PERSON'],0,1,4
US3880113A,1973-07-05,Rod end coating apparatus,"['PROPN', 'NOUN', 'NOUN', 'NOUN', 'SPACE']",['PERSON'],1,1,5
US3880126A,1973-05-10,Split cylinder engine and method of operation,"['ADJ', 'NOUN', 'NOUN', 'CCONJ', 'NOUN', 'ADP', 'NOUN', 'SPACE']",['PERSON'],0,1,8
US3880188A,1973-11-15,Hose retractor for an appliance,"['ADJ', 'NOUN', 'ADP', 'DET', 'NOUN', 'SPACE']",['PERSON'],0,1,6
US3880307A,1973-02-27,Bin address memory system,"['NOUN', 'NOUN', 'NOUN', 'NOUN', 'SPACE']",['PERSON'],0,1,5
US3880365A,1972-10-23,Mill,"['NOUN', 'SPACE']",['PERSON'],0,1,2
US3880370A,1973-11-26,Jig device for wrapping and packaging ear sets,"['PROPN', 'NOUN', 'ADP', 'NOUN', 'CCONJ', 'NOUN', 'NOUN', 'VERB', 'SPACE']",['PERSON'],1,1,9
US3880437A,1971-11-25,Chuck for machine tools,"['PROPN', 'ADP', 'NOUN', 'NOUN', 'SPACE']",['PERSON'],1,1,5
US3880495A,1969-03-17,Stereo viewing apparatus,"['NOUN', 'NOUN', 'NOUN', 'SPACE']",['PERSON'],0,1,4
US3880533A,1972-10-13,Scaffold and like structures,"['NOUN', 'CCONJ', 'ADP', 'NOUN', 'SPACE']",['PERSON'],0,1,5
