patent_number,date,title,spacy_pos,spacy_label,is_prpn_spacy,is_person_spacy,spacy_pos_len,bad_endings
US3811891A,1972-06-27,Silver halide photographic element containing a vinylsulfonyl compound hardener and an acrylic urea as formaldehyde scavenger,"['ADJ', 'NOUN', 'ADJ', 'NOUN', 'VERB', 'DET', 'NOUN', 'NOUN', 'NOUN', 'CCONJ', 'DET', 'NOUN', 'NOUN', 'ADP', 'NOUN', 'NOUN', 'SPACE']",[],0,0,17,1
US3811938A,1972-06-09,Production of barium titanate ceramics having a positive temperature coefficient of electrical resistance,"['NOUN', 'ADP', 'NOUN', 'NOUN', 'NOUN', 'VERB', 'DET', 'ADJ', 'NOUN', 'NOUN', 'ADP', 'ADJ', 'NOUN', 'SPACE']",[],0,0,14,1
US3812282A,1973-01-11,Tearable insulation sheath for cables,"['ADJ', 'NOUN', 'NOUN', 'ADP', 'NOUN', 'SPACE']",[],0,0,6,1
US3812446A,1972-07-10,Electric lamp or fuse socket,"['ADJ', 'NOUN', 'CCONJ', 'NOUN', 'NOUN', 'SPACE']",[],0,0,6,1
US3812453A,1972-04-17,Electric terminal connector,"['ADJ', 'NOUN', 'NOUN', 'SPACE']",[],0,0,4,1
US3812476A,1971-11-16,Memory device,"['NOUN', 'NOUN', 'SPACE']",[],0,0,3,1
US3812672A,1972-02-10,Supercharged ejector ramjet aircraft engine,"['VERB', 'NOUN', 'NOUN', 'NOUN', 'NOUN', 'SPACE']",[],0,0,6,1
US3812673A,1970-07-24,Forced draft cooling system for an exhaust gas purifying device,"['ADJ', 'NOUN', 'VERB', 'NOUN', 'ADP', 'DET', 'NOUN', 'NOUN', 'VERB', 'NOUN', 'SPACE']",[],0,0,11,1
US3812674A,1972-10-13,Admission control system and means,"['NOUN', 'NOUN', 'NOUN', 'CCONJ', 'VERB', 'SPACE']",[],0,0,6,1
US3812728A,1973-05-29,Spraying machine,"['VERB', 'NOUN', 'SPACE']",[],0,0,3,1
US3812772A,1970-09-28,Ventilator,"['NOUN', 'SPACE']",[],0,0,2,1
US3812862A,1973-10-29,Waist-supporting garment,"['NOUN', 'PUNCT', 'VERB', 'NOUN', 'SPACE']",[],0,0,5,1
US3812953A,1970-10-29,Driving or idler drum for article feeding belt,"['VERB', 'CCONJ', 'ADJ', 'NOUN', 'ADP', 'NOUN', 'VERB', 'NOUN', 'SPACE']",[],0,0,9,1
US3813036A,1973-05-08,Heating system,"['NOUN', 'NOUN', 'SPACE']",[],0,0,3,1
US3813253A,1969-06-23,Dry mixtures for producing acidresistant cement and mortar compositions,"['ADJ', 'NOUN', 'ADP', 'VERB', 'ADJ', 'NOUN', 'CCONJ', 'NOUN', 'NOUN', 'SPACE']",[],0,0,10,1
US3813637A,1972-06-28,Retainers for electrical components,"['NOUN', 'ADP', 'ADJ', 'NOUN', 'SPACE']",[],0,0,5,1
US3813851A,1970-12-15,Process and apparatus for at least partly removing by gravity a particulate component from a liquid dispersion,"['NOUN', 'CCONJ', 'NOUN', 'ADP', 'ADV', 'ADJ', 'ADV', 'VERB', 'ADP', 'NOUN', 'DET', 'NOUN', 'NOUN', 'ADP', 'DET', 'ADJ', 'NOUN', 'SPACE']",[],0,0,18,1
US3813980A,1972-09-28,Trimming apparatus,"['VERB', 'NOUN', 'SPACE']",[],0,0,3,1
US3814158A,1970-04-03,Run flat device for tires,"['VERB', 'ADJ', 'NOUN', 'ADP', 'NOUN', 'SPACE']",[],0,0,6,1
US3814222A,1973-01-29,Differential and brake assembly with parking brake for differential outputs,"['ADJ', 'CCONJ', 'NOUN', 'NOUN', 'ADP', 'NOUN', 'NOUN', 'ADP', 'ADJ', 'NOUN', 'SPACE']",[],0,0,11,1
US3814354A,1973-05-14,Landing wheel rotating device for aircraft,"['VERB', 'NOUN', 'VERB', 'NOUN', 'ADP', 'NOUN', 'SPACE']",[],0,0,7,1
US3814428A,1973-04-13,Rotational energy absorbing target and projectile,"['ADJ', 'NOUN', 'NOUN', 'NOUN', 'CCONJ', 'VERB', 'SPACE']",[],0,0,7,1
US3814849A,1972-10-13,Leakage current compensating circuit for semiconductor image sensor,"['NOUN', 'ADJ', 'NOUN', 'NOUN', 'ADP', 'NOUN', 'NOUN', 'NOUN', 'SPACE']",[],0,0,9,1
US3815067A,1972-08-04,Chokes or reactors,"['NOUN', 'CCONJ', 'NOUN', 'SPACE']",[],0,0,4,1
US3815110A,1970-02-02,Warning alarm for providing an alarm upon operating means being unintentionally connected to a power source,"['VERB', 'NOUN', 'ADP', 'VERB', 'DET', 'NOUN', 'SCONJ', 'NOUN', 'NOUN', 'AUX', 'ADV', 'VERB', 'ADP', 'DET', 'NOUN', 'NOUN', 'SPACE']",[],0,0,17,1
US3815268A,1971-08-04,Ballast regulator control means,"['ADJ', 'NOUN', 'NOUN', 'VERB', 'SPACE']",[],0,0,5,1
US3815387A,1972-04-03,Cleaning machine,"['VERB', 'NOUN', 'SPACE']",[],0,0,3,1
US3815476A,1969-08-25,Gas powered driving unit for surgical instrument,"['NOUN', 'VERB', 'VERB', 'NOUN', 'ADP', 'ADJ', 'NOUN', 'SPACE']",[],0,0,8,1
US3815513A,1972-10-06,Vehicle retaining arrangement for a monobeam type of transportation system,"['NOUN', 'VERB', 'NOUN', 'ADP', 'DET', 'ADJ', 'NOUN', 'ADP', 'NOUN', 'NOUN', 'SPACE']",[],0,0,11,1
US3815659A,1972-09-29,Process for casting molten metal,"['NOUN', 'ADP', 'VERB', 'ADJ', 'NOUN', 'SPACE']",[],0,0,6,1
US3815905A,1972-05-19,Baseball base,"['NOUN', 'NOUN', 'SPACE']",[],0,0,3,1
US3816099A,1971-03-01,Process for producing metallic iron concentrates and titanium oxide concentrates from titaniferous ores,"['NOUN', 'ADP', 'VERB', 'ADJ', 'NOUN', 'NOUN', 'CCONJ', 'NOUN', 'NOUN', 'NOUN', 'ADP', 'ADJ', 'NOUN', 'SPACE']",[],0,0,14,1
US3816123A,1971-11-26,Photographic processes and products employing 8-quinolinol phthaleins as optical filter agents,"['ADJ', 'NOUN', 'CCONJ', 'NOUN', 'VERB', 'NUM', 'PUNCT', 'NOUN', 'NOUN', 'ADP', 'ADJ', 'NOUN', 'NOUN', 'SPACE']",['CARDINAL'],0,0,14,1
US3816233A,1970-10-01,Manufacture of urethane foam sheets,"['NOUN', 'ADP', 'NOUN', 'NOUN', 'NOUN', 'SPACE']",[],0,0,6,1
US3816263A,1971-03-16,Biological test,"['ADJ', 'NOUN', 'SPACE']",[],0,0,3,1
US3816382A,1969-09-08,Polyalkenamers and process for the preparation thereof,"['NOUN', 'CCONJ', 'NOUN', 'ADP', 'DET', 'NOUN', 'ADV', 'SPACE']",[],0,0,8,1
US3816420A,1971-10-15,"3,6-dialkylisothiazolo(3,4-d)pyrimidin-4(5h)-ones","['NOUN', 'PUNCT', 'NOUN', 'PUNCT', 'NOUN', 'SPACE']",[],0,0,6,1
US3816488A,1968-08-15,Increasing the selectivity and yield in the production of carboxylic acids,"['VERB', 'DET', 'NOUN', 'CCONJ', 'NOUN', 'ADP', 'DET', 'NOUN', 'ADP', 'ADJ', 'NOUN', 'SPACE']",[],0,0,12,1
US3816546A,1972-04-12,"Vapor phase conversion of acetone to 3,5-xylenol in a single stage","['NOUN', 'NOUN', 'NOUN', 'ADP', 'NOUN', 'ADP', 'NUM', 'PUNCT', 'NOUN', 'ADP', 'DET', 'ADJ', 'NOUN', 'SPACE']",[],0,0,14,1
US3816610A,1969-04-25,Palatable foamed rodent control material,"['ADJ', 'VERB', 'ADJ', 'NOUN', 'NOUN', 'SPACE']",[],0,0,6,1
US3816683A,1972-05-26,Gas blast synchronous breaker with gas biased contacts,"['NOUN', 'NOUN', 'ADJ', 'NOUN', 'ADP', 'NOUN', 'VERB', 'NOUN', 'SPACE']",[],0,0,9,1
US3816757A,1972-05-11,Timer switch apparatus,"['NOUN', 'NOUN', 'NOUN', 'SPACE']",[],0,0,4,1
US3816758A,1971-04-14,Digital logic circuit,"['ADJ', 'NOUN', 'NOUN', 'SPACE']",['ORG'],0,0,4,1
US3817019A,1973-04-06,Digital clock and alarm,"['ADJ', 'NOUN', 'CCONJ', 'NOUN', 'SPACE']",['ORG'],0,0,5,1
US3817135A,1972-10-30,Flange punch positioning apparatus,"['ADJ', 'NOUN', 'NOUN', 'NOUN', 'SPACE']",[],0,0,5,1
US3817389A,1973-01-15,Filter device in tubular fitting for medical injection equipment and the like,"['NOUN', 'NOUN', 'ADP', 'ADJ', 'NOUN', 'ADP', 'ADJ', 'NOUN', 'NOUN', 'CCONJ', 'DET', 'ADJ', 'SPACE']",[],0,0,13,1
US3817819A,1968-10-18,Fibrous insert for reinforcing foam plastic products and process for the production of these foam plastic products,"['ADJ', 'NOUN', 'ADP', 'VERB', 'NOUN', 'NOUN', 'NOUN', 'CCONJ', 'NOUN', 'ADP', 'DET', 'NOUN', 'ADP', 'DET', 'ADJ', 'NOUN', 'NOUN', 'SPACE']",[],0,0,18,1
US3817824A,1972-10-02,Terpene recovery process including control of a digester relief outlet,"['NOUN', 'NOUN', 'NOUN', 'VERB', 'NOUN', 'ADP', 'DET', 'NOUN', 'NOUN', 'NOUN', 'SPACE']",[],0,0,11,1
US3817916A,1971-06-15,Oxidation resistant polymeric compositions prepared from 3,"['NOUN', 'ADJ', 'ADJ', 'NOUN', 'VERB', 'ADP', 'NUM']",['CARDINAL'],0,0,7,1
US3817955A,1970-08-24,Preparation of polymers using complexes of organomagnesiums with certain hydrides as catalysts,"['NOUN', 'ADP', 'NOUN', 'VERB', 'NOUN', 'ADP', 'NOUN', 'ADP', 'ADJ', 'NOUN', 'ADP', 'NOUN', 'SPACE']",[],0,0,13,1
US3818142A,1972-02-08,Device for production of switching order information for transmission of pcm words,"['NOUN', 'ADP', 'NOUN', 'ADP', 'VERB', 'NOUN', 'NOUN', 'ADP', 'NOUN', 'ADP', 'NOUN', 'NOUN', 'SPACE']",[],0,0,13,1
US3818189A,1972-08-01,Data card reader,"['NOUN', 'NOUN', 'NOUN', 'SPACE']",[],0,0,4,1
US3818297A,1973-02-02,Motor control apparatus,"['NOUN', 'NOUN', 'NOUN', 'SPACE']",[],0,0,4,1
US3818321A,1973-04-09,Voltage regulator,"['NOUN', 'NOUN', 'SPACE']",[],0,0,3,1
US3818370A,1970-05-14,Photosensitive solid oscillator,"['ADJ', 'ADJ', 'NOUN', 'SPACE']",[],0,0,4,1
US3818373A,1973-01-08,Single pockels cell double pulsing scheme,"['ADJ', 'NOUN', 'NOUN', 'ADJ', 'VERB', 'NOUN', 'SPACE']",[],0,0,7,1
US3818382A,1970-10-20,Surface wave delay line structures having reduced temperature coefficient of delay time,"['NOUN', 'NOUN', 'NOUN', 'NOUN', 'NOUN', 'AUX', 'VERB', 'NOUN', 'NOUN', 'ADP', 'NOUN', 'NOUN', 'SPACE']",[],0,0,13,1
US3818573A,1973-05-30,Implement for affixing metal pick to flower stem,"['VERB', 'ADP', 'VERB', 'NOUN', 'NOUN', 'PART', 'VERB', 'VERB', 'SPACE']",[],0,0,9,1
US3818655A,1972-08-21,Conditioning unit with modular construction,"['NOUN', 'NOUN', 'ADP', 'ADJ', 'NOUN', 'SPACE']",[],0,0,6,1
US3818799A,1972-10-30,Control system for an impact device,"['NOUN', 'NOUN', 'ADP', 'DET', 'NOUN', 'NOUN', 'SPACE']",[],0,0,7,1
US3819033A,1972-10-10,Expandable spectacle case,"['ADJ', 'NOUN', 'NOUN', 'SPACE']",[],0,0,4,1
US3819074A,1972-09-13,Boat loading apparatus,"['NOUN', 'NOUN', 'NOUN', 'SPACE']",[],0,0,4,1
US3819623A,1968-04-12,"3,7-disubstituted cephalosporin compounds","['NUM', 'PUNCT', 'VERB', 'NOUN', 'VERB', 'SPACE']",['CARDINAL'],0,0,6,1
US3819695A,1971-04-28,Process for preparation of methylterephthalic acid and 4-methylisophthalic acid,"['NOUN', 'ADP', 'NOUN', 'ADP', 'ADJ', 'NOUN', 'CCONJ', 'NUM', 'PUNCT', 'ADJ', 'NOUN', 'SPACE']",['CARDINAL'],0,0,12,1
US3819802A,1968-02-12,Process for treating waste sulfite liquor,"['NOUN', 'ADP', 'VERB', 'NOUN', 'NOUN', 'NOUN', 'SPACE']",[],0,0,7,1
US3819939A,1971-09-15,Digital light deflector,"['ADJ', 'ADJ', 'NOUN', 'SPACE']",['ORG'],0,0,4,1
US3820046A,1973-10-15,Auxiliary switch for molded-case circuit breaker,"['ADJ', 'NOUN', 'ADP', 'VERB', 'PUNCT', 'NOUN', 'NOUN', 'NOUN', 'SPACE']",[],0,0,9,1
US3820053A,1972-10-02,Electrical connector,"['ADJ', 'NOUN', 'SPACE']",[],0,0,3,1
US3820100A,1972-09-27,Presence detector having automatic digital tuning,"['NOUN', 'NOUN', 'VERB', 'ADJ', 'ADJ', 'NOUN', 'SPACE']",[],0,0,7,1
US3820142A,1973-03-12,Camera,"['NOUN', 'SPACE']",[],0,0,2,1
US3820278A,1972-12-12,Pasteurization atmosphere control system,"['NOUN', 'NOUN', 'NOUN', 'NOUN', 'SPACE']",[],0,0,5,1
US3820357A,1972-09-19,Universal joint,"['ADJ', 'NOUN', 'SPACE']",[],0,0,3,1
US3820449A,1972-07-25,Ejection means for apparatus for processing food stuff,"['NOUN', 'VERB', 'ADP', 'NOUN', 'ADP', 'VERB', 'NOUN', 'NOUN', 'SPACE']",[],0,0,9,1
US3820453A,1972-12-04,Bale orienting mechanism,"['NOUN', 'NOUN', 'NOUN', 'SPACE']",[],0,0,4,1
US3820642A,1972-06-29,Vend control circuit with improved deposit refund and accumulation means,"['VERB', 'NOUN', 'NOUN', 'ADP', 'ADJ', 'NOUN', 'NOUN', 'CCONJ', 'NOUN', 'VERB', 'SPACE']",[],0,0,11,1
US3820869A,1971-12-28,Focussed image holographic memory,"['VERB', 'NOUN', 'ADJ', 'NOUN', 'SPACE']",[],0,0,5,1
US3821120A,1972-08-21,Process for promoting an oxide for use in a pyrotechnic composition,"['NOUN', 'ADP', 'VERB', 'DET', 'NOUN', 'ADP', 'NOUN', 'ADP', 'DET', 'ADJ', 'NOUN', 'SPACE']",[],0,0,12,1
US3821793A,1972-06-08,Visual simulator employing two color television system,"['ADJ', 'NOUN', 'VERB', 'NUM', 'NOUN', 'NOUN', 'NOUN', 'SPACE']",['CARDINAL'],0,0,8,1
US3821799A,1970-11-24,Magnetic recording and reproducing apparatus which prevents erasing during tape loading,"['ADJ', 'NOUN', 'CCONJ', 'VERB', 'NOUN', 'PRON', 'VERB', 'VERB', 'ADP', 'NOUN', 'NOUN', 'SPACE']",[],0,0,12,1
US3821888A,1973-05-14,Pre-loading apparatus,"['ADJ', 'ADJ', 'VERB', 'NOUN', 'SPACE']",[],0,0,5,1
US3822243A,1971-11-22,"Surface-coating compositions containing 1,1-dialkyl-2-(substituted indazolyl-n1-methyl)hydrazines","['NOUN', 'PUNCT', 'NOUN', 'NOUN', 'VERB', 'NUM', 'PUNCT', 'VERB', 'ADJ', 'PUNCT', 'NOUN', 'PUNCT', 'NOUN', 'SPACE']",['CARDINAL'],0,0,14,1
US3822401A,1971-07-06,Mean square transducer,"['VERB', 'ADJ', 'NOUN', 'SPACE']",[],0,0,4,1
US3822842A,1971-06-15,Reeling device,"['VERB', 'NOUN', 'SPACE']",[],0,0,3,1
US3823049A,1972-08-03,Reinforced web making machine,"['VERB', 'NOUN', 'VERB', 'NOUN', 'SPACE']",[],0,0,5,1
US3823067A,1971-08-02,Shaped nuclear fissionable bodies,"['VERB', 'ADJ', 'ADJ', 'NOUN', 'SPACE']",[],0,0,5,1
US3823088A,1972-05-19,Polluted water purification,"['ADJ', 'NOUN', 'NOUN', 'SPACE']",[],0,0,4,1
US3823122A,1971-10-01,Synthetic rubbers,"['ADJ', 'NOUN', 'SPACE']",[],0,0,3,1
US3823519A,1972-07-27,Aircraft hanger,"['NOUN', 'NOUN', 'SPACE']",[],0,0,3,1
US3823520A,1969-03-20,Steel structure for prefabricated buildings,"['NOUN', 'NOUN', 'ADP', 'ADJ', 'NOUN', 'SPACE']",[],0,0,6,1
US3823599A,1972-12-08,Test apparatus for the evaluation of rolling lubricants,"['NOUN', 'NOUN', 'ADP', 'DET', 'NOUN', 'ADP', 'NOUN', 'NOUN', 'SPACE']",[],0,0,9,1
US3823657A,1972-02-17,Steam pressure cooker with safety device,"['NOUN', 'NOUN', 'NOUN', 'ADP', 'NOUN', 'NOUN', 'SPACE']",[],0,0,7,1
US3823745A,1972-11-06,Flame-resistant conduit covering,"['NOUN', 'PUNCT', 'ADJ', 'NOUN', 'VERB', 'SPACE']",[],0,0,6,1
US3823811A,1971-12-07,Conveyor means for paper or plastics tube sections in the manufacture of bags,"['NOUN', 'VERB', 'ADP', 'NOUN', 'CCONJ', 'NOUN', 'NOUN', 'NOUN', 'ADP', 'DET', 'NOUN', 'ADP', 'NOUN', 'SPACE']",[],0,0,14,1
US3823903A,1972-03-03,Dual length pendulum shock absorbing system,"['ADJ', 'NOUN', 'ADJ', 'NOUN', 'VERB', 'NOUN', 'SPACE']",[],0,0,7,1
US3823969A,1971-10-25,Pneumatic shock absorbing bumper,"['ADJ', 'NOUN', 'VERB', 'NOUN', 'SPACE']",[],0,0,5,1
US3824059A,1972-06-16,Molding machine for producing concrete products,"['NOUN', 'NOUN', 'ADP', 'VERB', 'ADJ', 'NOUN', 'SPACE']",[],0,0,7,1
US3824211A,1970-11-13,"Polyesters of 4,4'-hexafluoroisopropylidene diphenol","['NOUN', 'ADP', 'NUM', 'NOUN', 'SPACE']",[],0,0,5,1
US3824212A,1972-01-21,Process for preparing higher molecular weight polyepoxide products by reacting a polyepoxide with a phenol in presence of tetraalkylammonium halides,"['NOUN', 'ADP', 'VERB', 'ADJ', 'ADJ', 'NOUN', 'NOUN', 'NOUN', 'ADP', 'VERB', 'DET', 'NOUN', 'ADP', 'DET', 'NOUN', 'ADP', 'NOUN', 'ADP', 'NOUN', 'VERB', 'SPACE']",[],0,0,21,1
US3824213A,1973-04-16,Acid-interchange reaction for forming halogenated aromatic polyesters,"['NOUN', 'PUNCT', 'NOUN', 'NOUN', 'ADP', 'VERB', 'VERB', 'ADJ', 'NOUN', 'SPACE']",[],0,0,10,1
US3824258A,1972-02-28,3-oxabicyclo-(10.3.0)pentadecene-(6) and its preparation,"['NUM', 'PUNCT', 'NOUN', 'PUNCT', 'CCONJ', 'PRON', 'NOUN', 'SPACE']",['CARDINAL'],0,0,8,1
US3824326A,1972-06-09,Vibrato signal generating apparatus for an electronic musical instrument,"['NOUN', 'NOUN', 'NOUN', 'NOUN', 'ADP', 'DET', 'ADJ', 'ADJ', 'NOUN', 'SPACE']",[],0,0,10,1
US3824432A,1972-09-06,Battery igniter,"['NOUN', 'NOUN', 'SPACE']",[],0,0,3,1
US3824510A,1973-07-19,Mechanical interlock for electric switches,"['ADJ', 'NOUN', 'ADP', 'ADJ', 'NOUN', 'SPACE']",[],0,0,6,1
US3824778A,1972-09-25,Heating procedure in a false twist texturizing process,"['NOUN', 'NOUN', 'ADP', 'DET', 'ADJ', 'NOUN', 'NOUN', 'NOUN', 'SPACE']",[],0,0,9,1
US3824987A,1971-01-25,Operating theatres,"['VERB', 'VERB', 'SPACE']",[],0,0,3,1
US3825154A,1972-01-17,Fluid dispensing system,"['ADJ', 'VERB', 'NOUN', 'SPACE']",[],0,0,4,1
US3825558A,1971-06-24,Substituted aminopropoxy-2-indolinones,"['VERB', 'SPACE', 'PUNCT', 'NOUN', 'SPACE']",[],0,0,5,1
US3825841A,1971-01-08,Digital system including a pulse counter for selectively interconnecting a source of energy and a plurality of energizeable elements,"['ADJ', 'NOUN', 'VERB', 'DET', 'NOUN', 'NOUN', 'ADP', 'ADV', 'VERB', 'DET', 'NOUN', 'ADP', 'NOUN', 'CCONJ', 'DET', 'NOUN', 'ADP', 'ADJ', 'NOUN', 'SPACE']",['ORG'],0,0,20,1
US3826117A,1972-12-01,Door securing apparatus,"['NOUN', 'VERB', 'NOUN', 'SPACE']",[],0,0,4,1
US3826169A,1973-08-03,Cut-off knife for corrugators,"['VERB', 'PUNCT', 'ADP', 'NOUN', 'ADP', 'NOUN', 'SPACE']",[],0,0,7,1
US3826179A,1972-10-20,Differential pressure responsive damper,"['ADJ', 'NOUN', 'ADJ', 'NOUN', 'SPACE']",[],0,0,5,1
US3826370A,1973-05-29,Rotary filter apparatus having means for controlling the level of filtrate,"['ADJ', 'NOUN', 'NOUN', 'VERB', 'NOUN', 'ADP', 'VERB', 'DET', 'NOUN', 'ADP', 'ADJ', 'SPACE']",['GPE'],0,0,12,1
US3826371A,1972-12-21,Aquarium cleaning device,"['NOUN', 'NOUN', 'NOUN', 'SPACE']",[],0,0,4,1
US3826383A,1972-05-31,Automatic handling apparatus,"['ADJ', 'NOUN', 'NOUN', 'SPACE']",[],0,0,4,1
US3826829A,1970-11-17,Slush beverages containing fine-grained ice crystals,"['ADJ', 'NOUN', 'VERB', 'ADV', 'PUNCT', 'VERB', 'NOUN', 'NOUN', 'SPACE']",[],0,0,9,1
US3826864A,1973-04-13,Special effect generator for a simulator visual system,"['ADJ', 'NOUN', 'NOUN', 'ADP', 'DET', 'NOUN', 'ADJ', 'NOUN', 'SPACE']",[],0,0,9,1
US3827093A,1972-08-23,Marking float,"['VERB', 'NOUN', 'SPACE']",[],0,0,3,1
US3827110A,1972-09-18,Rigid fastener,"['ADJ', 'NOUN', 'SPACE']",[],0,0,3,1
US3827286A,1971-07-29,Device for blood sedimentation rate estimation,"['NOUN', 'ADP', 'NOUN', 'NOUN', 'NOUN', 'NOUN', 'SPACE']",[],0,0,7,1
US3827474A,1973-01-30,Power column latch,"['NOUN', 'NOUN', 'VERB', 'SPACE']",[],0,0,4,1
US3827606A,1973-06-27,Pump immobilizing means,"['ADJ', 'NOUN', 'VERB', 'SPACE']",[],0,0,4,1
US3827646A,1973-01-05,Elevator mechanism for reducing web tension and controlling elevator descent,"['NOUN', 'NOUN', 'ADP', 'VERB', 'NOUN', 'NOUN', 'CCONJ', 'VERB', 'NOUN', 'NOUN', 'SPACE']",[],0,0,11,1
US3827764A,1972-02-10,Combined braking and trim-correction devices for road vehicles,"['VERB', 'VERB', 'CCONJ', 'NOUN', 'PUNCT', 'NOUN', 'NOUN', 'ADP', 'NOUN', 'NOUN', 'SPACE']",[],0,0,11,1
US3827977A,1969-11-25,Composition for inhibiting scale formation in oil well brines,"['NOUN', 'ADP', 'VERB', 'NOUN', 'NOUN', 'ADP', 'NOUN', 'NOUN', 'VERB', 'SPACE']",[],0,0,10,1
US3828256A,1971-05-13,Self contained test probe employing high input impedance,"['NOUN', 'VERB', 'NOUN', 'NOUN', 'VERB', 'ADJ', 'NOUN', 'NOUN', 'SPACE']",[],0,0,9,1
US3828323A,1972-05-18,Data recording and printing apparatus,"['NOUN', 'NOUN', 'CCONJ', 'NOUN', 'NOUN', 'SPACE']",[],0,0,6,1
US3828744A,1973-04-19,Internal combustion engine crank case oil vapor condensing means,"['ADJ', 'NOUN', 'NOUN', 'NOUN', 'NOUN', 'NOUN', 'NOUN', 'VERB', 'VERB', 'SPACE']",[],0,0,10,1
US3828938A,1972-12-20,Luffing crane,"['ADJ', 'NOUN', 'SPACE']",[],0,0,3,1
US3828940A,1971-09-03,"Spreader list, trim and skew adjustment means","['NOUN', 'NOUN', 'PUNCT', 'VERB', 'CCONJ', 'VERB', 'NOUN', 'VERB', 'SPACE']",[],0,0,9,1
US3829222A,1972-03-27,Device to introduce an optic measuring index at photoelectric detection of photographic plates,"['NOUN', 'PART', 'VERB', 'DET', 'NOUN', 'VERB', 'NOUN', 'ADP', 'ADJ', 'NOUN', 'ADP', 'ADJ', 'NOUN', 'SPACE']",[],0,0,14,1
US3829383A,1972-03-07,Detergent builder and sequestering agent,"['NOUN', 'NOUN', 'CCONJ', 'NOUN', 'NOUN', 'SPACE']",[],0,0,6,1
US3829526A,1973-04-20,Hydrogenated polyphenols as sulfur solubilizers in polythiol sealants,"['VERB', 'NOUN', 'ADP', 'NOUN', 'NOUN', 'ADP', 'ADJ', 'NOUN', 'SPACE']",[],0,0,9,1
US3829586A,1970-01-02,Slime control compositions and their use,"['NOUN', 'NOUN', 'NOUN', 'CCONJ', 'PRON', 'NOUN', 'SPACE']",[],0,0,7,1
US3829592A,1970-09-02,Membrane substance concentrates,"['NOUN', 'NOUN', 'VERB', 'SPACE']",[],0,0,4,1
US3829594A,1971-02-12,Preparation of non-sticky cheese ribbons,"['NOUN', 'ADP', 'ADJ', 'ADJ', 'ADJ', 'NOUN', 'NOUN', 'SPACE']",[],0,0,8,1
US3829646A,1972-03-04,Push-button control member with push-through coupling,"['NOUN', 'PUNCT', 'NOUN', 'NOUN', 'NOUN', 'ADP', 'NOUN', 'PUNCT', 'ADP', 'VERB', 'SPACE']",[],0,0,11,1
US3829736A,1971-10-25,Reactive energy static compensator to protect thyristor rectifiers,"['ADJ', 'NOUN', 'NOUN', 'NOUN', 'PART', 'VERB', 'NOUN', 'NOUN', 'SPACE']",[],0,0,9,1
US3829763A,1973-05-04,Automotive voltage and continuity tester,"['ADJ', 'NOUN', 'CCONJ', 'NOUN', 'NOUN', 'SPACE']",[],0,0,6,1
US3829875A,1972-11-24,Photographic camera for use with roll film,"['ADJ', 'NOUN', 'ADP', 'NOUN', 'ADP', 'NOUN', 'NOUN', 'SPACE']",[],0,0,8,1
US3829906A,1973-01-08,Hospital patient care unit,"['NOUN', 'NOUN', 'NOUN', 'NOUN', 'SPACE']",[],0,0,5,1
US3830037A,1972-09-21,Packaging machine,"['NOUN', 'NOUN', 'SPACE']",[],0,0,3,1
US3830258A,1969-04-25,Transmission control mechanism,"['NOUN', 'NOUN', 'NOUN', 'SPACE']",[],0,0,4,1
US3830263A,1973-06-07,Strap applying tool,"['NOUN', 'VERB', 'NOUN', 'SPACE']",[],0,0,4,1
US3830328A,1973-06-29,Parking brake apply mechanism,"['NOUN', 'NOUN', 'VERB', 'NOUN', 'SPACE']",[],0,0,5,1
US3830373A,1970-06-30,Corrugated drainage tube with restraining screen,"['ADJ', 'NOUN', 'NOUN', 'ADP', 'VERB', 'NOUN', 'SPACE']",[],0,0,7,1
US3830543A,1973-11-19,Dump vehicle,"['VERB', 'NOUN', 'SPACE']",[],0,0,3,1
US3830847A,1966-11-04,Selective oxidation of olefins,"['ADJ', 'NOUN', 'ADP', 'NOUN', 'SPACE']",[],0,0,5,1
US3830931A,1972-11-06,Carnitine and its use in the treatment of arrhythmia and impaired cardiac function,"['NOUN', 'CCONJ', 'PRON', 'NOUN', 'ADP', 'DET', 'NOUN', 'ADP', 'NOUN', 'CCONJ', 'VERB', 'ADJ', 'NOUN', 'SPACE']",[],0,0,14,1
US3831163A,1972-09-27,Inertia-tilt switch,"['NOUN', 'PUNCT', 'NOUN', 'NOUN', 'SPACE']",[],0,0,5,1
US3831493A,1972-06-19,Propulsion nozzle and actuator system employed therein,"['NOUN', 'NOUN', 'CCONJ', 'NOUN', 'NOUN', 'VERB', 'ADV', 'SPACE']",[],0,0,8,1
US3831768A,1972-11-24,Variable height garment rack,"['ADJ', 'NOUN', 'NOUN', 'VERB', 'SPACE']",[],0,0,5,1
US3831845A,1973-08-17,Fluid delivery system,"['ADJ', 'NOUN', 'NOUN', 'SPACE']",[],0,0,4,1
US3831883A,1972-10-03,Reel driving device for a web transporting apparatus,"['NOUN', 'VERB', 'NOUN', 'ADP', 'DET', 'NOUN', 'VERB', 'NOUN', 'SPACE']",[],0,0,9,1
US3832061A,1972-02-18,Spectrometers,"['NOUN', 'SPACE']",[],0,0,2,1
US3832085A,1972-10-04,Automotive fan shroud,"['ADJ', 'NOUN', 'NOUN', 'SPACE']",[],0,0,4,1
US3832177A,1969-06-16,Process for the preparation of printing plate of photosensitive resin,"['NOUN', 'ADP', 'DET', 'NOUN', 'ADP', 'VERB', 'NOUN', 'ADP', 'ADJ', 'NOUN', 'SPACE']",[],0,0,11,1
US3832304A,1972-03-03,Hydrocracked lubes stabilized with aromatic azo compounds,"['VERB', 'NOUN', 'VERB', 'ADP', 'ADJ', 'NOUN', 'NOUN', 'SPACE']",[],0,0,8,1
US3832980A,1972-05-27,"Combined hydraulic speed-change, cooling and lubricating system in rotary engine","['ADJ', 'ADJ', 'NOUN', 'PUNCT', 'NOUN', 'PUNCT', 'VERB', 'CCONJ', 'VERB', 'NOUN', 'ADP', 'ADJ', 'NOUN', 'SPACE']",[],0,0,14,1
US3832998A,1973-01-30,Intravenous feeding apparatus,"['ADJ', 'NOUN', 'NOUN', 'SPACE']",[],0,0,4,1
US3833109A,1971-03-17,Universal typewriter ribbon spool,"['ADJ', 'NOUN', 'NOUN', 'NOUN', 'SPACE']",[],0,0,5,1
US3833275A,1972-03-24,Footstep bearing,"['NOUN', 'VERB', 'SPACE']",[],0,0,3,1
US3833461A,1971-05-17,Cyclonic digester system and process,"['ADJ', 'NOUN', 'NOUN', 'CCONJ', 'NOUN', 'SPACE']",[],0,0,6,1
US3833527A,1972-12-18,Hemicellulose reaction products,"['ADJ', 'NOUN', 'NOUN', 'SPACE']",[],0,0,4,1
US3833538A,1972-06-06,Polystyrene plastic compositions containing bis-phenoxy flame retardants,"['ADJ', 'NOUN', 'NOUN', 'VERB', 'ADJ', 'PUNCT', 'NOUN', 'NOUN', 'NOUN', 'SPACE']",[],0,0,10,1
US3833855A,1973-09-28,Coherent filter,"['ADJ', 'NOUN', 'SPACE']",[],0,0,3,1
US3833994A,1972-12-07,Device for making digit winding loops in memory storage matrices,"['NOUN', 'ADP', 'VERB', 'NOUN', 'VERB', 'NOUN', 'ADP', 'NOUN', 'NOUN', 'NOUN', 'SPACE']",[],0,0,11,1
US3834022A,1973-07-12,Low-profile floating blade scissors or shears,"['ADJ', 'PUNCT', 'NOUN', 'VERB', 'NOUN', 'NOUN', 'CCONJ', 'NOUN', 'SPACE']",[],0,0,9,1
US3834206A,1973-04-06,Portable press for reducing the size of tubing,"['ADJ', 'NOUN', 'ADP', 'VERB', 'DET', 'NOUN', 'ADP', 'NOUN', 'SPACE']",[],0,0,9,1
US3834215A,1972-11-24,Portable hydraulic strip sealer and cutter,"['ADJ', 'ADJ', 'NOUN', 'NOUN', 'CCONJ', 'NOUN', 'SPACE']",[],0,0,7,1
US3834239A,1970-06-15,Differential pressure transducer for liquid metals,"['ADJ', 'NOUN', 'NOUN', 'ADP', 'ADJ', 'NOUN', 'SPACE']",[],0,0,7,1
US3834298A,1972-06-28,Brick unloader-stacker apparatus,"['NOUN', 'NOUN', 'PUNCT', 'NOUN', 'NOUN', 'SPACE']",[],0,0,6,1
US3834590A,1972-10-24,Microliter fluid delivery apparatus,"['ADJ', 'ADJ', 'NOUN', 'NOUN', 'SPACE']",[],0,0,5,1
US3834593A,1973-06-18,Adjustable granular material dispenser,"['ADJ', 'ADJ', 'NOUN', 'NOUN', 'SPACE']",[],0,0,5,1
US3834766A,1972-10-05,Wheel adapter,"['NOUN', 'NOUN', 'SPACE']",[],0,0,3,1
US3835038A,1970-01-12,Activated sewage plant and process,"['VERB', 'NOUN', 'NOUN', 'CCONJ', 'NOUN', 'SPACE']",[],0,0,6,1
US3835128A,1971-06-15,Cinnamanilides,"['NOUN', 'SPACE']",[],0,0,2,1
US3835184A,1970-07-15,Formamide derivatives,"['NOUN', 'VERB', 'SPACE']",[],0,0,3,1
US3835427A,1972-03-20,Solid-borne sound transducers,"['ADJ', 'PUNCT', 'ADJ', 'NOUN', 'NOUN', 'SPACE']",[],0,0,6,1
US3835744A,1973-03-12,Machine for forming holes in angle rings or the like,"['NOUN', 'ADP', 'VERB', 'NOUN', 'ADP', 'NOUN', 'NOUN', 'CCONJ', 'DET', 'ADJ', 'SPACE']",[],0,0,11,1
US3835767A,1972-05-17,Refuse compactor,"['VERB', 'NOUN', 'SPACE']",[],0,0,3,1
US3835963A,1972-02-18,Friction piece for bicycle rim brakes,"['NOUN', 'NOUN', 'ADP', 'NOUN', 'NOUN', 'NOUN', 'SPACE']",[],0,0,7,1
US3835965A,1973-02-20,Friction-type brake adjustment device,"['NOUN', 'PUNCT', 'NOUN', 'NOUN', 'NOUN', 'NOUN', 'SPACE']",[],0,0,7,1
US3836191A,1971-07-07,Driver cab of trucks,"['NOUN', 'NOUN', 'ADP', 'NOUN', 'SPACE']",[],0,0,5,1
US3836881A,1972-11-14,Double-tuned circuit device with adjustable coupling coefficient means,"['ADJ', 'PUNCT', 'VERB', 'NOUN', 'NOUN', 'ADP', 'ADJ', 'NOUN', 'NOUN', 'VERB', 'SPACE']",[],0,0,11,1
US3836884A,1972-01-19,Sequential activation of electrical apparatus,"['ADJ', 'NOUN', 'ADP', 'ADJ', 'NOUN', 'SPACE']",['GPE'],0,0,6,1
US3836964A,1967-10-18,Automatic data processor,"['ADJ', 'NOUN', 'NOUN', 'SPACE']",[],0,0,4,1
US3837005A,1972-01-14,Device for the protection of the eyes and face,"['NOUN', 'ADP', 'DET', 'NOUN', 'ADP', 'DET', 'NOUN', 'CCONJ', 'VERB', 'SPACE']",[],0,0,10,1
