patent_number,date,title,spacy_pos,spacy_label,is_prpn_spacy,is_person_spacy,spacy_pos_len,bad_endings
US3862872A,1970-08-18,Apparatus for making non-woven pile fabric,"['PROPN', 'ADP', 'VERB', 'ADJ', 'ADJ', 'ADJ', 'NOUN', 'NOUN', 'SPACE']",[],1,0,9,1
US3863372A,1972-08-31,Sign box with closure,"['PROPN', 'PROPN', 'ADP', 'NOUN', 'SPACE']",[],1,0,5,1
US3864460A,1973-07-12,Method for removing hydrogen sulfide from hydrocarbon gas streams without pollution of the atmosphere,"['PROPN', 'ADP', 'VERB', 'NOUN', 'NOUN', 'ADP', 'NOUN', 'NOUN', 'NOUN', 'ADP', 'NOUN', 'ADP', 'DET', 'NOUN', 'SPACE']",[],1,0,15,1
US3865372A,1974-01-18,Graduated stick and tethered ball,"['PROPN', 'NOUN', 'CCONJ', 'VERB', 'NOUN', 'SPACE']",[],1,0,6,1
US3865382A,1973-05-30,Method of making a three-dimensional sheet puzzle,"['PROPN', 'ADP', 'VERB', 'DET', 'NUM', 'PUNCT', 'ADJ', 'NOUN', 'NOUN', 'SPACE']",['CARDINAL'],1,0,10,1
US3865541A,1971-09-27,Method for processing colemanite ore,"['PROPN', 'ADP', 'VERB', 'NOUN', 'NOUN', 'SPACE']",[],1,0,6,1
US3865651A,1972-03-10,Method of manufacturing series gate type matrix circuits,"['PROPN', 'ADP', 'VERB', 'PROPN', 'PROPN', 'PROPN', 'NOUN', 'NOUN', 'SPACE']",[],1,0,9,1
US3865927A,1970-09-15,Method and apparatus for reacting sulfur dioxide and natural gas,"['PROPN', 'CCONJ', 'NOUN', 'ADP', 'VERB', 'NOUN', 'NOUN', 'CCONJ', 'ADJ', 'NOUN', 'SPACE']",[],1,0,11,1
US3865942A,1971-04-28,Method of increasing cerebral blood flow,"['PROPN', 'ADP', 'VERB', 'ADJ', 'NOUN', 'VERB', 'SPACE']",[],1,0,7,1
US3865944A,1972-02-10,Tetrahydropyridine insect repellent,"['PROPN', 'PROPN', 'VERB', 'SPACE']",[],1,0,4,1
US3866308A,1973-03-30,Method of making a column for chromatography,"['PROPN', 'ADP', 'VERB', 'DET', 'NOUN', 'ADP', 'NOUN', 'SPACE']",[],1,0,8,1
US3866417A,1973-02-09,Gas turbine engine augmenter liner coolant flow control system,"['NOUN', 'NOUN', 'NOUN', 'ADJ', 'NOUN', 'NOUN', 'PROPN', 'NOUN', 'NOUN', 'SPACE']",[],1,0,10,1
US3866662A,1971-11-16,Method of casting quiet steel in molds,"['PROPN', 'ADP', 'VERB', 'ADJ', 'NOUN', 'ADP', 'NOUN', 'SPACE']",[],1,0,8,1
US3866737A,1971-01-15,Method and apparatus for the continuous transfer of longitudinally extending workpieces,"['PROPN', 'CCONJ', 'NOUN', 'ADP', 'DET', 'ADJ', 'NOUN', 'ADP', 'ADV', 'VERB', 'NOUN', 'SPACE']",[],1,0,12,1
US3867193A,1970-12-28,Process of producing a thin film circuit,"['PROPN', 'ADP', 'VERB', 'DET', 'ADJ', 'NOUN', 'NOUN', 'SPACE']",[],1,0,8,1
US3867882A,1973-04-19,"Apparatus for printing labels directly onto packages, containers and the like","['PROPN', 'ADP', 'NOUN', 'NOUN', 'ADV', 'ADP', 'NOUN', 'PUNCT', 'NOUN', 'CCONJ', 'DET', 'ADJ', 'SPACE']",[],1,0,13,1
US3869435A,1971-11-19,Method for cross-linking rubber,"['PROPN', 'ADP', 'ADJ', 'ADJ', 'VERB', 'NOUN', 'SPACE']",[],1,0,7,1
US3869526A,1972-06-13,Bis(phosphates),"['PROPN', 'PUNCT', 'SPACE']",[],1,0,3,1
US3870442A,1972-06-07,Apparatus for applying refractory covering to skid rail,"['PROPN', 'ADP', 'VERB', 'NOUN', 'NOUN', 'PART', 'VERB', 'NOUN', 'SPACE']",[],1,0,9,1
US3870500A,1973-07-20,Apparatus for bending glass sheets,"['PROPN', 'ADP', 'VERB', 'NOUN', 'NOUN', 'SPACE']",[],1,0,6,1
US3870571A,1973-01-31,Method for surface treatment of intermediate products which are being flame scarfed,"['PROPN', 'ADP', 'NOUN', 'NOUN', 'ADP', 'ADJ', 'NOUN', 'PRON', 'AUX', 'AUX', 'NOUN', 'VERB', 'SPACE']",[],1,0,13,1
US3870858A,1973-11-09,Thermostat mounting,"['PROPN', 'VERB', 'SPACE']",['GPE'],1,0,3,1
US3872030A,1973-02-06,Mix-mulling process for improved hydrotreating catalyst and resulting product,"['PROPN', 'PUNCT', 'ADJ', 'NOUN', 'ADP', 'ADJ', 'NOUN', 'NOUN', 'CCONJ', 'VERB', 'NOUN', 'SPACE']",[],1,0,12,1
US3872118A,1973-07-18,Preparation of sodium dichloroisocyanurate dihydrate composition,"['NOUN', 'ADP', 'NOUN', 'PROPN', 'NOUN', 'NOUN', 'SPACE']",[],1,0,7,1
US3872411A,1971-11-17,Quartz crystal resonator and a method for fabrication thereof,"['PROPN', 'NOUN', 'NOUN', 'CCONJ', 'DET', 'NOUN', 'ADP', 'NOUN', 'ADV', 'SPACE']",['ORG'],1,0,10,1
US3873090A,1973-12-17,Graphite shaft connection to golf club hosel,"['NOUN', 'NOUN', 'NOUN', 'ADP', 'NOUN', 'NOUN', 'PROPN', 'SPACE']",[],1,0,8,1
US3873461A,1972-04-21,Method of producing solid solutions of magnetic oxides,"['PROPN', 'ADP', 'VERB', 'ADJ', 'NOUN', 'ADP', 'ADJ', 'NOUN', 'SPACE']",[],1,0,9,1
US3873606A,1973-05-14,"Sulfone salts deriving from 2,5-dihydroxy benzene monosulfonic and 2,5-dihydroxy benzene disulfonic acids","['NOUN', 'VERB', 'VERB', 'ADP', 'NUM', 'PUNCT', 'NOUN', 'NOUN', 'PROPN', 'CCONJ', 'NUM', 'PUNCT', 'NOUN', 'NOUN', 'NOUN', 'NOUN', 'SPACE']","['CARDINAL', 'CARDINAL']",1,0,17,1
US3873988A,1973-01-16,Apparatus for processing photographic sheet material,"['PROPN', 'ADP', 'VERB', 'ADJ', 'NOUN', 'NOUN', 'SPACE']",[],1,0,7,1
US3874647A,1973-01-26,Toggle clamp with positive latch and clamp actuating handle,"['PROPN', 'VERB', 'ADP', 'ADJ', 'NOUN', 'CCONJ', 'NOUN', 'VERB', 'VERB', 'SPACE']",[],1,0,10,1
US3875268A,1974-02-27,Condenser apparatus,"['PROPN', 'NOUN', 'SPACE']",[],1,0,3,1
US3876044A,1971-04-09,"Shock absorber, piston and valve structure","['NOUN', 'NOUN', 'PUNCT', 'PROPN', 'CCONJ', 'VERB', 'NOUN', 'SPACE']",[],1,0,8,1
US3876184A,1972-10-02,Anchor winch,"['PROPN', 'NOUN', 'SPACE']",['LOC'],1,0,3,1
US3876298A,1973-05-29,Shutter and slide clamp control mechanism for a rear-screen projector,"['PROPN', 'CCONJ', 'VERB', 'NOUN', 'NOUN', 'NOUN', 'ADP', 'DET', 'ADJ', 'PUNCT', 'NOUN', 'NOUN', 'SPACE']",['ORG'],1,0,13,1
US3876473A,1973-01-26,Method of fabricating a composite intermetallic-type superconductor,"['PROPN', 'ADP', 'VERB', 'DET', 'ADJ', 'ADJ', 'PUNCT', 'NOUN', 'NOUN', 'SPACE']",[],1,0,10,1
US3876477A,1965-09-15,Fluorocarbon solid propellant with burning rate modifier,"['PROPN', 'ADJ', 'NOUN', 'ADP', 'VERB', 'NOUN', 'NOUN', 'SPACE']",[],1,0,8,1
US3876694A,1972-08-07,Method for the oxycarbonylation of olefins,"['PROPN', 'ADP', 'DET', 'NOUN', 'ADP', 'NOUN', 'SPACE']",[],1,0,7,1
US3877322A,1974-07-01,Indexer with diaphragm type disc brake,"['PROPN', 'ADP', 'PROPN', 'NOUN', 'NOUN', 'NOUN', 'SPACE']",[],1,0,7,1
US3877394A,1974-05-09,Pneumatically controlled railroad box car door latching device,"['ADV', 'VERB', 'NOUN', 'PROPN', 'NOUN', 'NOUN', 'VERB', 'NOUN', 'SPACE']",[],1,0,9,1
US3877568A,1973-12-03,Apron conveyor for quarry equipment and the like,"['PROPN', 'NOUN', 'ADP', 'PROPN', 'NOUN', 'CCONJ', 'DET', 'ADJ', 'SPACE']",['ORG'],1,0,9,1
US3877578A,1972-09-18,"Separation process for flint, amber, and green glass particles from a mixture of the three colors","['NOUN', 'NOUN', 'ADP', 'NOUN', 'PUNCT', 'PROPN', 'PUNCT', 'CCONJ', 'ADJ', 'NOUN', 'NOUN', 'ADP', 'DET', 'NOUN', 'ADP', 'DET', 'NUM', 'NOUN', 'SPACE']",['CARDINAL'],1,0,19,1
US3877895A,1972-03-23,Method and apparatus for removing water vapor from high pressure steam lines,"['PROPN', 'CCONJ', 'NOUN', 'ADP', 'VERB', 'NOUN', 'NOUN', 'ADP', 'ADJ', 'NOUN', 'NOUN', 'NOUN', 'SPACE']",[],1,0,13,1
US3878130A,1972-03-03,"Catalytically active substance for the conversion of higher hydrocarbons comprising Co, La, Ni, and U","['ADV', 'ADJ', 'NOUN', 'ADP', 'DET', 'NOUN', 'ADP', 'ADJ', 'NOUN', 'VERB', 'PROPN', 'PUNCT', 'PROPN', 'PUNCT', 'PROPN', 'PUNCT', 'CCONJ', 'VERB', 'SPACE']","['ORG', 'PRODUCT']",1,0,19,1
US3879157A,1972-06-27,Roller press,"['PROPN', 'NOUN', 'SPACE']",[],1,0,3,1
US3879309A,1973-01-17,Detergent bar made from mixed fatty acid derivatives,"['PROPN', 'NOUN', 'VERB', 'ADP', 'ADJ', 'ADJ', 'NOUN', 'NOUN', 'SPACE']",[],1,0,9,1
US3879609A,1971-09-20,Device for the determination of concentrations of fissile and/or fertile materials by means of x-ray fluorescence spectrometry,"['NOUN', 'ADP', 'DET', 'NOUN', 'ADP', 'NOUN', 'ADP', 'NOUN', 'CCONJ', 'ADJ', 'NOUN', 'ADP', 'NOUN', 'ADP', 'NOUN', 'NOUN', 'NOUN', 'PROPN', 'NOUN', 'SPACE']",[],1,0,20,1
US3879844A,1972-08-15,Razor blades,"['PROPN', 'VERB', 'SPACE']",[],1,0,3,1
US3879965A,1971-01-18,Apparatus for vapor treating textile material,"['PROPN', 'ADP', 'NOUN', 'VERB', 'NOUN', 'NOUN', 'SPACE']",[],1,0,7,1
US3880637A,1972-07-07,Method and apparatus for producing ampoules,"['PROPN', 'CCONJ', 'NOUN', 'ADP', 'VERB', 'NOUN', 'SPACE']",[],1,0,7,1
US3880688A,1971-03-01,Method and apparatus for the continuous production of ring-shaped pieces of reinforced rubber,"['PROPN', 'CCONJ', 'NOUN', 'ADP', 'DET', 'ADJ', 'NOUN', 'ADP', 'NOUN', 'PUNCT', 'VERB', 'NOUN', 'ADP', 'VERB', 'NOUN', 'SPACE']",[],1,0,16,1
US3880888A,1972-06-16,"3,4,7-Trimethyl-2-oxo,-1,6-dioxaspiro(4,5)dec-3-ene","['NUM', 'PUNCT', 'NUM', 'PUNCT', 'NOUN', 'PUNCT', 'PROPN', 'PUNCT', 'PROPN', 'SPACE']",[],1,0,10,1
US3881171A,1973-12-03,Vault protected with electronic time and combination lock,"['PROPN', 'VERB', 'ADP', 'ADJ', 'NOUN', 'CCONJ', 'NOUN', 'VERB', 'SPACE']",['ORG'],1,0,9,1
US3881471A,1974-05-20,Hydrotherapy foot bath,"['PROPN', 'NOUN', 'NOUN', 'SPACE']",[],1,0,4,1
US3881897A,1972-11-24,Apparatus for separating fluids,"['PROPN', 'ADP', 'VERB', 'NOUN', 'SPACE']",[],1,0,5,1
US3882079A,1973-01-29,Method for preparing pigmented polyethylene terephthalate,"['PROPN', 'ADP', 'VERB', 'VERB', 'NOUN', 'VERB', 'SPACE']",[],1,0,7,1
US3883124A,1972-10-16,Apparatus for de-slagging casting ladles,"['PROPN', 'ADP', 'NOUN', 'ADJ', 'VERB', 'NOUN', 'NOUN', 'SPACE']",[],1,0,8,1
US3886070A,1972-02-18,Method for combatting pollution using a chromium complex,"['PROPN', 'ADP', 'VERB', 'NOUN', 'VERB', 'DET', 'NOUN', 'NOUN', 'SPACE']",[],1,0,9,1
US3886140A,1972-05-30,Penicillin derivatives,"['PROPN', 'VERB', 'SPACE']",[],1,0,3,1
US3886624A,1972-07-14,Vacuum type sweeper,"['PROPN', 'NOUN', 'NOUN', 'SPACE']",['GPE'],1,0,4,1
US3887589A,1968-03-28,"2,5-Diethyl-4-hydroxy-2,3,-dihydrofuran-3-one","['NUM', 'PUNCT', 'NUM', 'PUNCT', 'PROPN', 'PUNCT', 'NUM', 'SPACE']",['CARDINAL'],1,0,8,1
US3888418A,1973-02-20,"Devices, systems and methods employing knitted fabric mulch","['NOUN', 'PUNCT', 'NOUN', 'CCONJ', 'NOUN', 'VERB', 'VERB', 'NOUN', 'PROPN', 'SPACE']",['GPE'],1,0,10,1
US3888673A,1972-08-21,Method and apparatus for making electroluminescent screens for color cathode ray tubes,"['PROPN', 'CCONJ', 'NOUN', 'ADP', 'VERB', 'ADJ', 'NOUN', 'ADP', 'NOUN', 'NOUN', 'NOUN', 'NOUN', 'SPACE']",[],1,0,13,1
US3889506A,1974-03-25,Method and apparatus for forming a tubular billet about a mandrel using multi-directional stress,"['PROPN', 'CCONJ', 'NOUN', 'ADP', 'VERB', 'DET', 'ADJ', 'NOUN', 'ADP', 'DET', 'NOUN', 'VERB', 'ADJ', 'ADJ', 'ADJ', 'NOUN', 'SPACE']",[],1,0,17,1
US3889572A,1972-09-23,Firearm construction,"['PROPN', 'NOUN', 'SPACE']",['ORG'],1,0,3,1
US3890297A,1973-03-29,Process for n-acylating novenamine,"['PROPN', 'ADP', 'ADV', 'PUNCT', 'VERB', 'NOUN', 'SPACE']",[],1,0,7,1
US3890718A,1972-07-27,Method for determining astronomic north by gyrocompass,"['PROPN', 'ADP', 'VERB', 'ADJ', 'NOUN', 'ADP', 'NOUN', 'SPACE']",[],1,0,8,1
US3890807A,1972-12-02,"Driving mechanism for knitting needle displacement in warp knitting machines, such as raschel machines, particularly","['VERB', 'NOUN', 'ADP', 'VERB', 'NOUN', 'NOUN', 'ADP', 'NOUN', 'NOUN', 'NOUN', 'PUNCT', 'ADJ', 'ADP', 'PROPN', 'NOUN', 'PUNCT', 'ADV', 'SPACE']",[],1,0,18,1
US3890924A,1972-05-30,Apparatus for waxing a thread,"['PROPN', 'ADP', 'VERB', 'DET', 'NOUN', 'SPACE']",[],1,0,6,1
US3890955A,1972-02-23,Vacuum indicator,"['PROPN', 'NOUN', 'SPACE']",[],1,0,3,1
US3892313A,1972-03-10,Magazine strip for ornamental nail driving apparatus,"['PROPN', 'NOUN', 'ADP', 'ADJ', 'NOUN', 'NOUN', 'NOUN', 'SPACE']",[],1,0,8,1
US3892935A,1974-07-24,Wall switch extension,"['PROPN', 'NOUN', 'NOUN', 'SPACE']",[],1,0,4,1
US3893170A,1973-09-18,Digital phase control circuit,"['ADJ', 'NOUN', 'NOUN', 'PROPN', 'SPACE']",['ORG'],1,0,5,1
US3893386A,1973-10-04,Box baling machine and cart,"['PROPN', 'NOUN', 'NOUN', 'CCONJ', 'NOUN', 'SPACE']",[],1,0,6,1
US3893537A,1970-07-03,Apparatus for control of a vehicle constant speed mechanism,"['PROPN', 'ADP', 'NOUN', 'ADP', 'DET', 'NOUN', 'ADJ', 'NOUN', 'NOUN', 'SPACE']",[],1,0,10,1
US3894522A,1973-11-26,Piston apparatus,"['PROPN', 'NOUN', 'SPACE']",['ORG'],1,0,3,1
US3894637A,1972-11-15,Apparatus for handling pipe joints coated with mastic material,"['PROPN', 'ADP', 'VERB', 'NOUN', 'NOUN', 'VERB', 'ADP', 'ADJ', 'NOUN', 'SPACE']",[],1,0,10,1
US3894901A,1972-04-08,Method of making hoses and profiled belts in a continuous process,"['PROPN', 'ADP', 'VERB', 'NOUN', 'CCONJ', 'ADJ', 'NOUN', 'ADP', 'DET', 'ADJ', 'NOUN', 'SPACE']",[],1,0,12,1
US3895137A,1973-12-03,Method of plating articles having small clearances or crevices,"['PROPN', 'ADP', 'VERB', 'NOUN', 'VERB', 'ADJ', 'NOUN', 'CCONJ', 'NOUN', 'SPACE']",[],1,0,10,1
US3895698A,1972-06-12,Brake control apparatus,"['PROPN', 'NOUN', 'NOUN', 'SPACE']",['ORG'],1,0,4,1
US3895870A,1971-06-01,Laser dimension comparator,"['PROPN', 'NOUN', 'NOUN', 'SPACE']",[],1,0,4,1
US3897382A,1972-07-14,"Method for the acid hydrolysis of acrylonitrile containing polymers, hydrogels and fibers of products prepared by said method","['PROPN', 'ADP', 'DET', 'ADJ', 'NOUN', 'ADP', 'NOUN', 'VERB', 'NOUN', 'PUNCT', 'NOUN', 'CCONJ', 'NOUN', 'ADP', 'NOUN', 'VERB', 'ADP', 'VERB', 'PROPN', 'SPACE']",[],1,0,20,1
US3897433A,1973-09-28,"1,7-Dihydro-1,3,7-tri-lower-alkyl-2H-pyrrolo {8 2,3-d{9 {0 pyrimidine-2,4(3H)-diones","['NUM', 'PUNCT', 'PROPN', 'PUNCT', 'ADJ', 'ADJ', 'ADJ', 'PUNCT', 'ADV', 'PUNCT', 'NOUN', 'PUNCT', 'NUM', 'NUM', 'PUNCT', 'NOUN', 'PUNCT', 'NUM', 'NOUN', 'SPACE']","['CARDINAL', 'TIME', 'CARDINAL']",1,0,20,1
US3897545A,1972-03-21,Process for catalytically reacting gases having a high SO{HD 2 {B content using different catalysts,"['PROPN', 'ADP', 'ADV', 'VERB', 'NOUN', 'VERB', 'DET', 'ADJ', 'NOUN', 'NUM', 'PUNCT', 'NOUN', 'NOUN', 'VERB', 'ADJ', 'NOUN', 'SPACE']",[],1,0,17,1
US3898071A,1970-06-23,Method of limiting growth of lawn grass and increasing sugar content in cane,"['PROPN', 'ADP', 'VERB', 'NOUN', 'ADP', 'NOUN', 'NOUN', 'CCONJ', 'VERB', 'NOUN', 'NOUN', 'ADP', 'NOUN', 'SPACE']",[],1,0,14,1
US3898116A,1972-11-09,Method and apparatus for manufacturing a structure for a green tire,"['PROPN', 'CCONJ', 'NOUN', 'ADP', 'VERB', 'DET', 'NOUN', 'ADP', 'DET', 'ADJ', 'NOUN', 'SPACE']",[],1,0,12,1
US3898214A,1974-07-22,Benzazepine diones,"['PROPN', 'VERB', 'SPACE']",[],1,0,3,1
US3898421A,1972-08-18,Push button switch with elastic conductive sheet,"['PROPN', 'NOUN', 'NOUN', 'ADP', 'ADJ', 'ADJ', 'NOUN', 'SPACE']",[],1,0,8,1
US3899027A,1970-06-19,Method of cleaning and stimulating a water well,"['PROPN', 'ADP', 'VERB', 'CCONJ', 'VERB', 'DET', 'NOUN', 'ADV', 'SPACE']",[],1,0,9,1
US3899550A,1973-02-21,Method for alkoxylation of chlorides and bromides of trivalent phosphorus,"['PROPN', 'ADP', 'NOUN', 'ADP', 'NOUN', 'CCONJ', 'NOUN', 'ADP', 'NOUN', 'NOUN', 'SPACE']",[],1,0,11,1
US3899582A,1970-04-21,Aromatic imidocarbonate composition and method of use for combatting fungi,"['ADJ', 'ADJ', 'NOUN', 'CCONJ', 'NOUN', 'ADP', 'NOUN', 'ADP', 'VERB', 'PROPN', 'SPACE']",[],1,0,11,1
US3899699A,1972-12-19,Brushless linear DC motor actuator,"['PROPN', 'ADJ', 'PROPN', 'NOUN', 'NOUN', 'SPACE']",['GPE'],1,0,6,1
US3800225A,1971-09-24,Differential pulse-code modulation,"['ADJ', 'NOUN', 'PUNCT', 'NOUN', 'NOUN', 'SPACE']",[],0,0,6,1
US3800410A,1970-10-15,Sensor and method of manufacture,"['NOUN', 'CCONJ', 'NOUN', 'ADP', 'VERB', 'SPACE']",[],0,0,6,1
US3800728A,1971-08-17,Means for attaching staysails to stays,"['NOUN', 'ADP', 'VERB', 'NOUN', 'PART', 'VERB', 'SPACE']",[],0,0,7,1
US3800990A,1972-01-17,Collapsible container for auto trunk,"['ADJ', 'NOUN', 'ADP', 'NOUN', 'NOUN', 'SPACE']",[],0,0,6,1
US3801272A,1967-02-27,Wool treating process,"['NOUN', 'NOUN', 'NOUN', 'SPACE']",[],0,0,4,1
US3801376A,1971-08-16,Auxiliary electrolyte system,"['ADJ', 'ADJ', 'NOUN', 'SPACE']",[],0,0,4,1
US3801597A,1971-05-31,"2,3-dihydro-4h-thieno(3,2-c)(1)benzopyran-4-ones","['NUM', 'PUNCT', 'NUM', 'PUNCT', 'SPACE', 'PUNCT', 'NOUN', 'PUNCT', 'NOUN', 'SPACE']",['CARDINAL'],0,0,10,1
US3801627A,1972-08-21,Alpha-acyloxyacetic acid production,"['NOUN', 'PUNCT', 'ADJ', 'NOUN', 'NOUN', 'SPACE']",[],0,0,6,1
US3801758A,1973-03-19,Multiple switch assembly with external slide member allowing actuation of only one switch at a time,"['ADJ', 'NOUN', 'NOUN', 'ADP', 'ADJ', 'NOUN', 'NOUN', 'VERB', 'NOUN', 'ADP', 'ADV', 'NUM', 'NOUN', 'ADP', 'DET', 'NOUN', 'SPACE']",['CARDINAL'],0,0,17,1
US3801766A,1973-01-22,Switching means for an electro-surgical device including particular contact means and particular printed-circuit mounting means,"['NOUN', 'NOUN', 'ADP', 'DET', 'X', 'PUNCT', 'ADJ', 'NOUN', 'VERB', 'ADJ', 'NOUN', 'NOUN', 'CCONJ', 'ADJ', 'VERB', 'PUNCT', 'NOUN', 'NOUN', 'VERB', 'SPACE']",[],0,0,20,1
US3801767A,1972-12-11,Pull-apart safety switch with magnetic means for machines,"['VERB', 'PUNCT', 'NOUN', 'NOUN', 'NOUN', 'ADP', 'ADJ', 'NOUN', 'ADP', 'NOUN', 'SPACE']",[],0,0,11,1
US3801780A,1972-11-06,Fault detection systems for conveyors,"['NOUN', 'NOUN', 'NOUN', 'ADP', 'NOUN', 'SPACE']",[],0,0,6,1
US3801951A,1972-10-24,Track light system,"['NOUN', 'NOUN', 'NOUN', 'SPACE']",[],0,0,4,1
US3802053A,1970-08-03,Nutplate riveting attachment device,"['VERB', 'VERB', 'ADJ', 'NOUN', 'SPACE']",[],0,0,5,1
US3802240A,1972-04-12,Device for the conical tapering of circular cross sectioned elongated workpieces,"['NOUN', 'ADP', 'DET', 'ADJ', 'NOUN', 'ADP', 'ADJ', 'NOUN', 'ADJ', 'VERB', 'VERB', 'SPACE']",[],0,0,12,1
US3802348A,1970-07-16,Track welding system,"['NOUN', 'NOUN', 'NOUN', 'SPACE']",[],0,0,4,1
US3802489A,1971-05-18,Regenerative air preheater with stationary cylindrical regenerative chamber,"['ADJ', 'NOUN', 'NOUN', 'ADP', 'ADJ', 'ADJ', 'ADJ', 'NOUN', 'SPACE']",[],0,0,9,1
US3802618A,1972-03-10,Send and return envelope,"['VERB', 'CCONJ', 'VERB', 'NOUN', 'SPACE']",[],0,0,5,1
US3802781A,1972-08-15,Extensometers,"['NOUN', 'SPACE']",[],0,0,2,1
US3803084A,1968-03-23,Process for the production of high-polymer organo-siloxanes,"['NOUN', 'ADP', 'DET', 'NOUN', 'ADP', 'ADJ', 'PUNCT', 'NOUN', 'NOUN', 'PUNCT', 'NOUN', 'SPACE']",[],0,0,12,1
US3803139A,1970-10-21,Sparingly soluble heterocyclic compounds,"['ADV', 'ADJ', 'NOUN', 'VERB', 'SPACE']",[],0,0,5,1
US3803470A,1972-01-18,Speed servo for a permanent magnet direct current motor,"['NOUN', 'NOUN', 'ADP', 'DET', 'ADJ', 'NOUN', 'ADJ', 'ADJ', 'NOUN', 'SPACE']",[],0,0,10,1
US3803976A,1971-08-30,Automatic pistol,"['ADJ', 'NOUN', 'SPACE']",[],0,0,3,1
US3803981A,1972-01-17,Independent drive sub-spindle mounted for eccentric adjustment in prime spindle,"['ADJ', 'NOUN', 'ADJ', 'ADJ', 'ADJ', 'VERB', 'ADP', 'ADJ', 'NOUN', 'ADP', 'ADJ', 'NOUN', 'SPACE']",[],0,0,13,1
US3804208A,1971-02-10,Cage apparatus rising and falling on a wall surface,"['NOUN', 'NOUN', 'VERB', 'CCONJ', 'VERB', 'ADP', 'DET', 'NOUN', 'NOUN', 'SPACE']",[],0,0,10,1
US3804298A,1972-07-25,Gravimetric feeder,"['ADJ', 'NOUN', 'SPACE']",['GPE'],0,0,3,1
US3804440A,1972-10-17,Rotary locking bolt,"['ADJ', 'NOUN', 'NOUN', 'SPACE']",['GPE'],0,0,4,1
US3804670A,1971-10-20,Displacement rinsing apparatus,"['ADJ', 'NOUN', 'NOUN', 'SPACE']",[],0,0,4,1
US3804710A,1970-12-09,Nuclear reactor fuel element,"['ADJ', 'NOUN', 'NOUN', 'NOUN', 'SPACE']",[],0,0,5,1
US3804935A,1972-10-16,Process for making a particle board,"['NOUN', 'ADP', 'VERB', 'DET', 'NOUN', 'NOUN', 'SPACE']",[],0,0,7,1
US3805018A,1973-03-12,Portable food storage and warmer carrying case,"['ADJ', 'NOUN', 'NOUN', 'CCONJ', 'ADJ', 'VERB', 'NOUN', 'SPACE']",[],0,0,8,1
US3805039A,1972-11-30,High reliability system employing subelement redundancy,"['ADJ', 'NOUN', 'NOUN', 'VERB', 'NOUN', 'VERB', 'SPACE']",[],0,0,7,1
US3805043A,1972-10-11,Serial-parallel binary multiplication using pairwise addition,"['ADJ', 'PUNCT', 'ADJ', 'ADJ', 'NOUN', 'VERB', 'NOUN', 'NOUN', 'SPACE']",[],0,0,9,1
US3805047A,1972-07-06,Flashing jewel pendant,"['VERB', 'NOUN', 'ADJ', 'SPACE']",[],0,0,4,1
US3805381A,1972-08-22,Hair styling device,"['NOUN', 'NOUN', 'NOUN', 'SPACE']",[],0,0,4,1
US3805387A,1972-05-22,Fiber razor blade,"['NOUN', 'NOUN', 'NOUN', 'SPACE']",[],0,0,4,1
US3805629A,1972-06-01,Devices for linear and rotational movements,"['NOUN', 'ADP', 'ADJ', 'CCONJ', 'ADJ', 'NOUN', 'SPACE']",[],0,0,7,1
US3805684A,1970-12-27,Motor vehicle body ventilation,"['NOUN', 'NOUN', 'NOUN', 'NOUN', 'SPACE']",[],0,0,5,1
US3806021A,1972-03-17,Pipe centering apparatus,"['NOUN', 'VERB', 'NOUN', 'SPACE']",[],0,0,4,1
US3806076A,1972-07-03,Construction apparatus,"['NOUN', 'NOUN', 'SPACE']",[],0,0,3,1
US3806229A,1970-06-27,Image display apparatus,"['NOUN', 'NOUN', 'NOUN', 'SPACE']",[],0,0,4,1
US3806492A,1970-08-03,Flame retardant compositions of matter,"['NOUN', 'ADJ', 'NOUN', 'ADP', 'NOUN', 'SPACE']",[],0,0,6,1
US3806572A,1969-09-10,Production of asbestos products,"['NOUN', 'ADP', 'NOUN', 'NOUN', 'SPACE']",[],0,0,5,1
US3806630A,1972-08-21,Encapsulated splice assembly for buried cables,"['VERB', 'NOUN', 'NOUN', 'ADP', 'VERB', 'NOUN', 'SPACE']",[],0,0,7,1
US3806636A,1972-11-15,Light valve projector with reduced cross-coupling between colors,"['NOUN', 'NOUN', 'NOUN', 'ADP', 'VERB', 'NOUN', 'NOUN', 'NOUN', 'ADP', 'NOUN', 'SPACE']",[],0,0,11,1
US3806781A,1971-06-29,Electric oscillation maintenance circuit for motor element oscillations,"['ADJ', 'NOUN', 'NOUN', 'NOUN', 'ADP', 'NOUN', 'NOUN', 'NOUN', 'SPACE']",[],0,0,9,1
US3806809A,1972-11-09,High frequency interference simulator and method of identifying causation of undesired non-linear intermodulation interference,"['ADJ', 'NOUN', 'NOUN', 'NOUN', 'CCONJ', 'NOUN', 'ADP', 'VERB', 'NOUN', 'ADP', 'ADJ', 'ADJ', 'ADJ', 'ADJ', 'NOUN', 'VERB', 'SPACE']",[],0,0,17,1
US3806872A,1973-05-10,Address interrupt and current status display,"['NOUN', 'ADJ', 'CCONJ', 'ADJ', 'NOUN', 'VERB', 'SPACE']",[],0,0,7,1
US3807114A,1972-11-08,Ceiling suspension runner,"['NOUN', 'NOUN', 'NOUN', 'SPACE']",[],0,0,4,1
US3807393A,1972-03-01,Surgical retractor,"['ADJ', 'NOUN', 'SPACE']",[],0,0,3,1
US3807527A,1973-03-14,Pulse converter for exhaust system,"['ADJ', 'NOUN', 'ADP', 'NOUN', 'NOUN', 'SPACE']",[],0,0,6,1
US3807740A,1972-08-29,Space flight board game apparatus,"['NOUN', 'NOUN', 'NOUN', 'NOUN', 'NOUN', 'SPACE']",[],0,0,6,1
US3807794A,1972-12-29,Lumbar support mechanism,"['NOUN', 'NOUN', 'NOUN', 'SPACE']",['GPE'],0,0,4,1
US3807822A,1972-10-02,Cabinet shelf construction,"['NOUN', 'NOUN', 'NOUN', 'SPACE']",[],0,0,4,1
US3807825A,1972-12-05,Twin file,"['NOUN', 'NOUN', 'SPACE']",[],0,0,3,1
US3807866A,1972-04-21,Ring laser gyroscope having a constant output beat-frequency,"['NOUN', 'NOUN', 'VERB', 'VERB', 'DET', 'ADJ', 'NOUN', 'NOUN', 'PUNCT', 'NOUN', 'SPACE']",[],0,0,11,1
US3807898A,1970-03-14,Bladed rotor assemblies,"['ADJ', 'NOUN', 'NOUN', 'SPACE']",[],0,0,4,1
US3807925A,1972-11-28,Nozzle for injection molding,"['NOUN', 'ADP', 'NOUN', 'VERB', 'SPACE']",[],0,0,5,1
US3807970A,1964-09-09,Drill proof plate for safes,"['VERB', 'NOUN', 'NOUN', 'ADP', 'NOUN', 'SPACE']",[],0,0,6,1
US3808089A,1971-08-17,Process and composition for manufacturing top liner and the like from printed and coated stock,"['NOUN', 'CCONJ', 'NOUN', 'ADP', 'VERB', 'ADJ', 'NOUN', 'CCONJ', 'DET', 'INTJ', 'ADP', 'VERB', 'CCONJ', 'VERB', 'NOUN', 'SPACE']",[],0,0,16,1
US3808283A,1973-06-04,Process for the dimerization of cyclopentenes,"['NOUN', 'ADP', 'DET', 'NOUN', 'ADP', 'NOUN', 'SPACE']",[],0,0,7,1
US3808363A,1970-12-23,Conversational data terminal having a function repeat capability,"['ADJ', 'NOUN', 'NOUN', 'VERB', 'DET', 'NOUN', 'NOUN', 'NOUN', 'SPACE']",[],0,0,9,1
US3808449A,1971-07-20,Safety device for protecting hydraulic circuits having a branch circuit,"['NOUN', 'NOUN', 'ADP', 'VERB', 'ADJ', 'NOUN', 'VERB', 'DET', 'NOUN', 'NOUN', 'SPACE']",[],0,0,11,1
US3808499A,1969-03-24,Auxiliary lighting system,"['ADJ', 'NOUN', 'NOUN', 'SPACE']",[],0,0,4,1
US3808754A,1972-08-24,Folding contoured wall,"['VERB', 'VERB', 'NOUN', 'SPACE']",[],0,0,4,1
US3808867A,1971-05-25,Portable rod or true bender,"['ADJ', 'NOUN', 'CCONJ', 'ADJ', 'NOUN', 'SPACE']",[],0,0,6,1
US3808907A,1972-06-09,Shift lever device for speed change gear transmission train of a bicycle,"['VERB', 'NOUN', 'NOUN', 'ADP', 'NOUN', 'NOUN', 'NOUN', 'NOUN', 'NOUN', 'ADP', 'DET', 'NOUN', 'SPACE']",[],0,0,13,1
US3809022A,1972-11-15,Rotary power translation machine,"['ADJ', 'NOUN', 'NOUN', 'NOUN', 'SPACE']",[],0,0,5,1
US3809145A,1971-06-15,Process for the production of permanent magnets,"['NOUN', 'ADP', 'DET', 'NOUN', 'ADP', 'ADJ', 'NOUN', 'SPACE']",[],0,0,8,1
US3809224A,1972-02-14,Compartmented pouch,"['VERB', 'NOUN', 'SPACE']",[],0,0,3,1
US3809435A,1973-03-23,Friction keepers for wheels and structures utilizing them,"['NOUN', 'VERB', 'ADP', 'NOUN', 'CCONJ', 'NOUN', 'VERB', 'PRON', 'SPACE']",[],0,0,9,1
US3809813A,1970-11-05,Telephone alarm signalling system,"['NOUN', 'NOUN', 'VERB', 'NOUN', 'SPACE']",[],0,0,5,1
US3809883A,1972-06-12,Universal trouble light support,"['ADJ', 'NOUN', 'NOUN', 'NOUN', 'SPACE']",[],0,0,5,1
US3809886A,1971-11-26,Dynamic tomography with movable table,"['ADJ', 'NOUN', 'ADP', 'ADJ', 'NOUN', 'SPACE']",[],0,0,6,1
US3810194A,1972-06-23,Liquid jet printer having a droplet detecting device,"['ADJ', 'NOUN', 'NOUN', 'VERB', 'DET', 'ADJ', 'NOUN', 'NOUN', 'SPACE']",[],0,0,9,1
US3810372A,1971-11-05,Die,"['VERB', 'SPACE']",[],0,0,2,1
US3810571A,1973-04-12,Self-centering rolls,"['NOUN', 'PUNCT', 'VERB', 'NOUN', 'SPACE']",[],0,0,5,1
US3810632A,1972-05-30,Golf putting practice devices,"['NOUN', 'VERB', 'NOUN', 'NOUN', 'SPACE']",[],0,0,5,1
US3810906A,1965-04-19,N1-heteroacylated phenylhydrazines,"['NOUN', 'PUNCT', 'VERB', 'NOUN', 'SPACE']",['CARDINAL'],0,0,5,1
US3810989A,1970-11-16,Control of confused flour beetles using geranyl phenyl ethers,"['NOUN', 'ADP', 'ADJ', 'NOUN', 'NOUN', 'VERB', 'NOUN', 'NOUN', 'NOUN', 'SPACE']",[],0,0,10,1
US3811149A,1972-08-31,Adjustable gate hinge,"['ADJ', 'NOUN', 'VERB', 'SPACE']",[],0,0,4,1
US3811506A,1973-02-12,Tar sand recovery method,"['ADJ', 'NOUN', 'NOUN', 'NOUN', 'SPACE']",[],0,0,5,1
US3811802A,1972-12-06,Slurry pump cleanout mechanism,"['NOUN', 'VERB', 'NOUN', 'NOUN', 'SPACE']",[],0,0,5,1
