patent_number,date,title,spacy_pos,spacy_label,is_prpn_spacy,is_person_spacy,spacy_pos_len
US3854669A,1972-02-11,Cartridge for endless coil of tape,"['PROPN', 'ADP', 'ADJ', 'NOUN', 'ADP', 'NOUN', 'SPACE']",['PERSON'],1,1,7
US3854738A,1973-05-31,Monoski,"['PROPN', 'SPACE']",['PERSON'],1,1,2
US3854921A,1972-09-05,Glass mold cooling systems,"['NOUN', 'NOUN', 'VERB', 'NOUN', 'SPACE']",['PERSON'],0,1,5
US3854951A,1971-03-17,"Method for making a radiation sensitive recording material containing a spiropyran compound, an hx-donor a binder, and ethyl acetate as solvent","['PROPN', 'ADP', 'VERB', 'DET', 'NOUN', 'ADJ', 'NOUN', 'NOUN', 'VERB', 'DET', 'ADJ', 'NOUN', 'PUNCT', 'DET', 'ADJ', 'PUNCT', 'NOUN', 'DET', 'NOUN', 'PUNCT', 'CCONJ', 'NOUN', 'PROPN', 'ADP', 'NOUN', 'SPACE']",['PERSON'],1,1,26
US3854971A,1968-04-17,Satin white-clay compositions and methods of manufacture,"['PROPN', 'ADJ', 'PUNCT', 'NOUN', 'NOUN', 'CCONJ', 'NOUN', 'ADP', 'NOUN', 'SPACE']",['PERSON'],1,1,10
US3855126A,1972-08-14,Continuous incremental feed filtration process and apparatus,"['ADJ', 'ADJ', 'NOUN', 'NOUN', 'NOUN', 'CCONJ', 'VERB', 'SPACE']",['PERSON'],0,1,8
US3855204A,1972-10-27,"Process for preparing adenosine-5{40 -carboxylic acid, ethyl ester","['NOUN', 'ADP', 'VERB', 'SPACE', 'NOUN', 'NOUN', 'PUNCT', 'PROPN', 'NOUN', 'SPACE']",['PERSON'],1,1,10
US3855235A,1973-07-16,Quaternary ammonium derivatives of bisimidazoline compounds,"['ADJ', 'NOUN', 'NOUN', 'ADP', 'NOUN', 'VERB', 'SPACE']",['PERSON'],0,1,7
US3855260A,1972-12-22,Melt preparation of s-methyl n-(methyl-carbamoyl)oxy)thioacetimidate,"['PROPN', 'NOUN', 'ADP', 'NOUN', 'PUNCT', 'NOUN', 'PROPN', 'PUNCT', 'PROPN', 'SPACE']",['PERSON'],1,1,10
US3855288A,1972-06-12,Methylolphosphoric triamides,"['PROPN', 'NOUN', 'SPACE']",['PERSON'],1,1,3
US3855290A,1971-03-03,Quaternary halides of gluconamides,"['PROPN', 'NOUN', 'ADP', 'NOUN', 'SPACE']",['PERSON'],1,1,5
US3855364A,1973-01-05,Phosphate esters of hydroxyalkyl acrylates and hydroxyalkyl methacrylates,"['PROPN', 'NOUN', 'ADP', 'PROPN', 'NOUN', 'CCONJ', 'PROPN', 'VERB', 'SPACE']","['PERSON', 'PERSON']",1,1,9
US3855367A,1972-10-25,Venturi anti-siltation system,"['PROPN', 'ADJ', 'ADJ', 'ADJ', 'NOUN', 'SPACE']",['PERSON'],1,1,6
US3855458A,1973-08-21,Flow meter,"['NOUN', 'NOUN', 'SPACE']",['PERSON'],0,1,3
US3855479A,1969-01-03,Ray diagnosis apparatus,"['PROPN', 'NOUN', 'NOUN', 'SPACE']",['PERSON'],1,1,4
US3855545A,1973-06-27,"Laser glass host compositions comprising teo{11 , bao, li{11 o","['PROPN', 'NOUN', 'NOUN', 'NOUN', 'VERB', 'PROPN', 'PUNCT', 'PROPN', 'PUNCT', 'PROPN', 'PROPN', 'SPACE']",['PERSON'],1,1,12
US3855612A,1972-01-03,Schottky barrier diode semiconductor structure and method,"['PROPN', 'NOUN', 'NOUN', 'NOUN', 'NOUN', 'CCONJ', 'VERB', 'SPACE']",['PERSON'],1,1,8
US3855616A,1973-10-01,Phase shift reducing digital signal recording having no d.c. component,"['NOUN', 'NOUN', 'VERB', 'ADJ', 'NOUN', 'NOUN', 'VERB', 'DET', 'PROPN', 'PUNCT', 'NOUN', 'SPACE']",['PERSON'],1,1,12
US3855648A,1972-08-22,Striker mechanism for plumbing fixtures,"['NOUN', 'NOUN', 'ADP', 'NOUN', 'VERB', 'SPACE']",['PERSON'],0,1,6
US3855686A,1973-11-27,Cartridge link guide assembly,"['PROPN', 'NOUN', 'NOUN', 'PROPN', 'SPACE']",['PERSON'],1,1,5
US3855715A,1973-10-05,Boot zipper,"['NOUN', 'NOUN', 'SPACE']",['PERSON'],0,1,3
US3855902A,1972-11-21,Cylinder piston unit for a power operated revolving chuck,"['NOUN', 'NOUN', 'NOUN', 'ADP', 'DET', 'NOUN', 'VERB', 'PROPN', 'PROPN', 'SPACE']",['PERSON'],1,1,10
US3855917A,1973-10-15,Truss plate press,"['ADJ', 'NOUN', 'NOUN', 'SPACE']",['PERSON'],0,1,4
US3855931A,1967-09-01,Salvo ammunition for multiple bore open chamber gun,"['PROPN', 'NOUN', 'ADP', 'ADJ', 'NOUN', 'ADJ', 'NOUN', 'NOUN', 'SPACE']",['PERSON'],1,1,9
US3856001A,1973-08-24,Laryngoscope blade,"['PROPN', 'NOUN', 'SPACE']",['PERSON'],1,1,3
US3856045A,1973-03-08,Vacuum control valve,"['PROPN', 'NOUN', 'VERB', 'SPACE']",['PERSON'],1,1,4
US3856052A,1972-07-31,Hose structure,"['PROPN', 'NOUN', 'SPACE']",['PERSON'],1,1,3
US3856054A,1972-07-28,Glass polymer composites,"['NOUN', 'NOUN', 'VERB', 'SPACE']",['PERSON'],0,1,4
US3856096A,1973-11-09,Drill string and drill collar therefor,"['PROPN', 'NOUN', 'CCONJ', 'VERB', 'NOUN', 'ADP', 'SPACE']",['PERSON'],1,1,7
US3856140A,1973-04-02,Yarn palette,"['PROPN', 'NOUN', 'SPACE']",['PERSON'],1,1,3
US3856171A,1973-05-18,Cap for container,"['PROPN', 'ADP', 'NOUN', 'SPACE']",['PERSON'],1,1,4
US3856192A,1973-06-18,Stereo tape cartridge rack,"['NOUN', 'NOUN', 'NOUN', 'VERB', 'SPACE']",['PERSON'],0,1,5
US3856366A,1973-01-08,Gyroscope universal flexure suspension assembly,"['ADJ', 'ADJ', 'NOUN', 'NOUN', 'NOUN', 'SPACE']",['PERSON'],0,1,6
US3856406A,1973-11-23,Heterodyne laser absorption spectrometer,"['PROPN', 'NOUN', 'NOUN', 'NOUN', 'SPACE']",['PERSON'],1,1,5
US3856445A,1972-01-07,Spinneret with yarn separator,"['PROPN', 'ADP', 'NOUN', 'NOUN', 'SPACE']",['PERSON'],1,1,5
US3856480A,1973-02-16,Diamond joined to metal,"['PROPN', 'VERB', 'PART', 'VERB', 'SPACE']",['PERSON'],1,1,5
US3856496A,1973-01-26,Glass melting furnace and process,"['NOUN', 'VERB', 'NOUN', 'CCONJ', 'VERB', 'SPACE']",['PERSON'],0,1,6
US3856498A,1972-03-07,Glassware coating apparatus and process therefor,"['PROPN', 'NOUN', 'NOUN', 'CCONJ', 'NOUN', 'ADP', 'SPACE']",['PERSON'],1,1,7
US3856560A,1971-09-01,Arylene sulfide polymer coating compositions,"['ADJ', 'NOUN', 'NOUN', 'NOUN', 'NOUN', 'SPACE']",['PERSON'],0,1,6
US3856579A,1972-12-04,Sputtered magnetic materials comprising rare-earth metals and method of preparation,"['ADJ', 'ADJ', 'NOUN', 'VERB', 'ADJ', 'PUNCT', 'NOUN', 'NOUN', 'CCONJ', 'NOUN', 'ADP', 'NOUN', 'SPACE']",['PERSON'],0,1,13
US3856672A,1972-12-04,Continuous wet oxidation system for the home,"['ADJ', 'ADJ', 'NOUN', 'NOUN', 'ADP', 'DET', 'NOUN', 'SPACE']",['PERSON'],0,1,8
US3856708A,1972-04-10,Alumina catalyst support,"['PROPN', 'NOUN', 'NOUN', 'SPACE']",['PERSON'],1,1,4
US3856713A,1973-06-11,Elastomeric poly(aryloxyphosphazene) copolymers,"['PROPN', 'PROPN', 'PUNCT', 'NOUN', 'SPACE']",['PERSON'],1,1,5
US3856729A,1971-04-15,Butadiene rubber composition,"['ADJ', 'NOUN', 'NOUN', 'SPACE']",['PERSON'],0,1,4
US3856735A,1972-10-19,Incorporation of high molecular weight fluorocarbon polymer in arylene sulfide polymer,"['NOUN', 'ADP', 'ADJ', 'ADJ', 'NOUN', 'NOUN', 'NOUN', 'ADP', 'PROPN', 'PROPN', 'PROPN', 'SPACE']",['PERSON'],1,1,12
US3856736A,1972-10-19,Incorporation of high molecular weight fluorocarbon polymer in arylene sulfide polymer,"['NOUN', 'ADP', 'ADJ', 'ADJ', 'NOUN', 'NOUN', 'NOUN', 'ADP', 'PROPN', 'PROPN', 'PROPN', 'SPACE']",['PERSON'],1,1,12
US3856784A,1971-11-16,"Alkylaminoalkyl 4-hydroxy-2-methyl-2h-1,2-benzothiazine-3-carboxylate 1,1-dioxides and n-alkylaminoalkyl-4-hydroxy-2-methyl-2h-1,2-benzothiazine-3-carboxamide 1,1-dioxides","['PROPN', 'NUM', 'PUNCT', 'SPACE', 'PUNCT', 'ADJ', 'PUNCT', 'SPACE', 'PUNCT', 'NOUN', 'NUM', 'PUNCT', 'NOUN', 'CCONJ', 'NOUN', 'PUNCT', 'SPACE', 'PUNCT', 'SPACE', 'PUNCT', 'ADJ', 'PUNCT', 'SPACE', 'PUNCT', 'NOUN', 'NOUN', 'PUNCT', 'NOUN', 'SPACE']",['PERSON'],1,1,29
US3856788A,1971-04-19,Dyestuff and method of making and using same,"['PROPN', 'CCONJ', 'NOUN', 'ADP', 'VERB', 'CCONJ', 'VERB', 'ADJ', 'SPACE']",['PERSON'],1,1,9
US3856796A,1972-04-19,Hydroxyalkyl-substituted-amino-quinolines and nitrates thereof,"['PROPN', 'PUNCT', 'VERB', 'PUNCT', 'NOUN', 'PUNCT', 'NOUN', 'CCONJ', 'NOUN', 'ADV', 'SPACE']",['PERSON'],1,1,11
US3856894A,1970-12-26,Vinyl chloride polymer composition containing a cross-linked methyl methacrylate copolymer,"['NOUN', 'NOUN', 'NOUN', 'NOUN', 'VERB', 'DET', 'ADJ', 'ADJ', 'VERB', 'NOUN', 'ADJ', 'NOUN', 'SPACE']",['PERSON'],0,1,13
US3856896A,1973-02-09,Alkyl propargyl phosphonates,"['PROPN', 'NOUN', 'VERB', 'SPACE']",['PERSON'],1,1,4
US3856945A,1970-12-30,Method of reducing serum cholesterol level with extract of konjac mannan,"['PROPN', 'ADP', 'VERB', 'NOUN', 'NOUN', 'NOUN', 'ADP', 'NOUN', 'ADP', 'PROPN', 'PROPN', 'SPACE']",['PERSON'],1,1,12
US3856990A,1971-10-22,Continuous film drive for a telecine equipment,"['ADJ', 'NOUN', 'NOUN', 'ADP', 'DET', 'NOUN', 'NOUN', 'SPACE']",['PERSON'],0,1,8
US3857027A,1972-05-19,D.c. modules employed for simulating electric power system for loadflow and transient stability studies,"['PROPN', 'PUNCT', 'NOUN', 'VERB', 'ADP', 'VERB', 'ADJ', 'NOUN', 'NOUN', 'ADP', 'NOUN', 'CCONJ', 'ADJ', 'NOUN', 'NOUN', 'SPACE']",['PERSON'],1,1,16
US3857073A,1973-04-10,Capacitor with polypropylene dielectric,"['NOUN', 'ADP', 'PROPN', 'PROPN', 'SPACE']",['PERSON'],1,1,5
US3857106A,1970-09-04,Amplifier with n-port signal excitation,"['ADV', 'ADP', 'CCONJ', 'PUNCT', 'NOUN', 'NOUN', 'NOUN', 'SPACE']",['PERSON'],0,1,8
US3857111A,1973-03-20,Syllabic adaptative delta modulation system,"['ADJ', 'ADJ', 'NOUN', 'NOUN', 'NOUN', 'SPACE']",['PERSON'],0,1,6
US3857143A,1974-03-11,Yarn measuring cutter,"['PROPN', 'VERB', 'NOUN', 'SPACE']",['PERSON'],1,1,4
US3857226A,1973-10-11,Thatcher,"['PROPN', 'SPACE']",['PERSON'],1,1,2
US3857271A,1972-05-02,Bending machine for rod or strip material,"['VERB', 'NOUN', 'ADP', 'NOUN', 'CCONJ', 'PROPN', 'NOUN', 'SPACE']",['PERSON'],1,1,8
US3857320A,1973-01-29,Node suspended flexible rocket,"['PROPN', 'VERB', 'ADJ', 'NOUN', 'SPACE']",['PERSON'],1,1,5
US3857360A,1971-06-18,Uhf channel indicating mechanism,"['PROPN', 'NOUN', 'VERB', 'NOUN', 'SPACE']",['PERSON'],1,1,5
US3857447A,1974-01-11,Bulldozer blade with vibrating ripper shank,"['PROPN', 'NOUN', 'ADP', 'VERB', 'ADJ', 'VERB', 'SPACE']",['PERSON'],1,1,7
US3857455A,1973-05-21,Row centering guide control device for bush bean harvester,"['NOUN', 'VERB', 'NOUN', 'NOUN', 'NOUN', 'ADP', 'PROPN', 'NOUN', 'VERB', 'SPACE']",['PERSON'],1,1,10
US3857522A,1971-12-01,Continuous yarn winding apparatus,"['ADJ', 'NOUN', 'NOUN', 'NOUN', 'SPACE']",['PERSON'],0,1,5
US3857523A,1972-03-31,Yarn take-up,"['NOUN', 'VERB', 'PUNCT', 'ADP', 'SPACE']",['PERSON'],0,1,5
US3857547A,1974-03-18,Automatically compensating jack construction,"['ADV', 'VERB', 'PROPN', 'NOUN', 'SPACE']",['PERSON'],1,1,5
US3857548A,1973-06-28,Pantograph-type jack,"['NOUN', 'PUNCT', 'NOUN', 'NOUN', 'SPACE']",['PERSON'],0,1,5
US3857614A,1973-10-12,Air brake antiskid control,"['NOUN', 'NOUN', 'NOUN', 'NOUN', 'SPACE']",['PERSON'],0,1,5
US3857617A,1973-04-30,Split chevron track shoes for track belts,"['PROPN', 'PROPN', 'NOUN', 'NOUN', 'ADP', 'NOUN', 'NOUN', 'SPACE']",['PERSON'],1,1,8
US3857646A,1972-09-25,Sag rod end connection,"['PROPN', 'PROPN', 'NOUN', 'NOUN', 'SPACE']",['PERSON'],1,1,5
US3857762A,1968-12-09,Continuous analysis for copper concentration,"['ADJ', 'NOUN', 'ADP', 'NOUN', 'NOUN', 'SPACE']",['PERSON'],0,1,6
US3857794A,1969-02-28,Oxygen control by injection of a reducing gas in a catalyst regenerator,"['NOUN', 'NOUN', 'ADP', 'NOUN', 'ADP', 'DET', 'VERB', 'NOUN', 'ADP', 'DET', 'NOUN', 'NOUN', 'SPACE']",['PERSON'],0,1,13
US3857843A,1972-09-11,"Cyclopropyl 1,2,4-oxadiazolyldiazines","['PROPN', 'NUM', 'PUNCT', 'NOUN', 'SPACE']",['PERSON'],1,1,5
US3857852A,1972-10-19,Crackle finish coating of arylene sulfide polymer containing a fluorocarbon polymer,"['NOUN', 'VERB', 'NOUN', 'ADP', 'NOUN', 'NOUN', 'NOUN', 'VERB', 'DET', 'NOUN', 'NOUN', 'SPACE']","['ORG', 'PERSON']",0,1,12
US3857903A,1972-10-18,"Continuous process for the preparation of 2,5-dimethyl-2,4-hexadiene","['ADJ', 'NOUN', 'ADP', 'DET', 'NOUN', 'ADP', 'NUM', 'PUNCT', 'NOUN', 'PUNCT', 'NOUN', 'SPACE']","['PERSON', 'QUANTITY']",0,1,12
US3857936A,1971-05-26,Melinacidin,"['PROPN', 'SPACE']",['PERSON'],1,1,2
US3858013A,1973-03-02,Yarn sensing device,"['NOUN', 'VERB', 'NOUN', 'SPACE']",['PERSON'],0,1,4
US3858066A,1973-03-29,Non-commutating superconducting d. c. machine,"['ADJ', 'ADJ', 'ADJ', 'VERB', 'PROPN', 'PROPN', 'PROPN', 'SPACE']",['PERSON'],1,1,8
US3858088A,1973-06-15,D. c. flasher,"['PROPN', 'PROPN', 'VERB', 'SPACE']",['PERSON'],1,1,4
US3858100A,1972-05-04,D.c. motor speed control system through phase control and phase locking circuit,"['PROPN', 'PUNCT', 'NOUN', 'NOUN', 'NOUN', 'NOUN', 'ADP', 'NOUN', 'NOUN', 'CCONJ', 'NOUN', 'VERB', 'NOUN', 'SPACE']",['PERSON'],1,1,14
US3858142A,1972-06-22,Fuse and method of making same,"['NOUN', 'CCONJ', 'NOUN', 'ADP', 'VERB', 'ADJ', 'SPACE']",['PERSON'],0,1,7
US3858228A,1973-10-04,Gyroscopic holder for camera,"['ADJ', 'NOUN', 'ADP', 'NOUN', 'SPACE']",['PERSON'],0,1,5
US3858247A,1973-04-24,Scalp anchor for hairpiece,"['PROPN', 'NOUN', 'ADP', 'NOUN', 'SPACE']",['PERSON'],1,1,5
US3858300A,1972-09-29,Jackscrew device,"['PROPN', 'NOUN', 'SPACE']",['PERSON'],1,1,3
US3858378A,1972-03-29,Glass-to-metal seal,"['PROPN', 'PUNCT', 'ADP', 'PUNCT', 'NOUN', 'NOUN', 'SPACE']",['PERSON'],1,1,7
US3858424A,1972-01-28,Split type multistage rolling mill,"['NOUN', 'NOUN', 'NOUN', 'NOUN', 'NOUN', 'SPACE']",['PERSON'],0,1,6
US3858538A,1973-09-26,Slide fastener presser foot,"['NOUN', 'NOUN', 'NOUN', 'NOUN', 'SPACE']",['PERSON'],0,1,5
US3858539A,1973-09-26,Slide fastener presser foot assembly,"['NOUN', 'NOUN', 'NOUN', 'NOUN', 'NOUN', 'SPACE']",['PERSON'],0,1,6
US3858582A,1972-12-13,Cartridge vaccine injector,"['PROPN', 'NOUN', 'NOUN', 'SPACE']",['PERSON'],1,1,4
US3858587A,1974-02-05,Magna-tip,"['PROPN', 'PUNCT', 'PROPN', 'SPACE']",['PERSON'],1,1,4
US3858665A,1973-04-30,Bulldozer frame with strut stress limiter,"['PROPN', 'VERB', 'ADP', 'PROPN', 'PROPN', 'PROPN', 'SPACE']",['PERSON'],1,1,7
US3858666A,1972-09-28,Continuous rotation rock drill,"['ADJ', 'NOUN', 'NOUN', 'NOUN', 'SPACE']",['PERSON'],0,1,5
US3858698A,1973-05-16,Unitary spring for stroking transmission servo motor,"['ADJ', 'NOUN', 'ADP', 'VERB', 'NOUN', 'PROPN', 'NOUN', 'SPACE']",['PERSON'],1,1,8
US3858716A,1973-11-08,Spinner assembly mechanism,"['NOUN', 'NOUN', 'NOUN', 'SPACE']",['PERSON'],0,1,4
US3858726A,1972-05-16,Eyeglass holder,"['NOUN', 'NOUN', 'SPACE']",['PERSON'],0,1,3
US3858749A,1968-06-20,Dirt receptacle,"['NOUN', 'NOUN', 'SPACE']",['PERSON'],0,1,3
US3858755A,1973-04-02,Meter box with cover having biased snap-lock,"['PROPN', 'PROPN', 'ADP', 'NOUN', 'AUX', 'VERB', 'ADJ', 'PUNCT', 'NOUN', 'SPACE']",['PERSON'],1,1,10
US3858793A,1973-02-28,Cartridge centrifuge,"['PROPN', 'NOUN', 'SPACE']",['PERSON'],1,1,3
US3858816A,1971-10-29,Yarn bundle with piecing end and method of forming same,"['PROPN', 'NOUN', 'ADP', 'VERB', 'NOUN', 'CCONJ', 'NOUN', 'ADP', 'VERB', 'ADJ', 'SPACE']",['PERSON'],1,1,11
US3858829A,1969-04-21,Cartridge for a coil of flexible strip material,"['PROPN', 'ADP', 'DET', 'NOUN', 'ADP', 'ADJ', 'PROPN', 'NOUN', 'SPACE']",['PERSON'],1,1,9
US3858847A,1972-06-13,Double chain jack,"['ADJ', 'NOUN', 'PROPN', 'SPACE']",['PERSON'],1,1,4
US3858867A,1973-08-10,Automatic fluid operated spring loaded jack lock assembly,"['ADJ', 'NOUN', 'VERB', 'NOUN', 'VERB', 'PROPN', 'NOUN', 'NOUN', 'SPACE']","['DATE', 'PERSON']",1,1,9
US3858893A,1972-03-14,Self-centering and compensating chuck,"['NOUN', 'PUNCT', 'VERB', 'CCONJ', 'VERB', 'PROPN', 'SPACE']",['PERSON'],1,1,7
US3858952A,1973-09-04,Continuous towel dispenser,"['ADJ', 'VERB', 'NOUN', 'SPACE']",['PERSON'],0,1,4
US3858970A,1971-09-13,Continuous show slide projector,"['ADJ', 'VERB', 'NOUN', 'NOUN', 'SPACE']",['PERSON'],0,1,5
US3858978A,1973-08-10,Chuck for use in out-of-contact optical alignment and exposure apparatus,"['PROPN', 'ADP', 'NOUN', 'ADP', 'ADP', 'PUNCT', 'ADP', 'PUNCT', 'NOUN', 'ADJ', 'NOUN', 'CCONJ', 'NOUN', 'NOUN', 'SPACE']",['PERSON'],1,1,15
US3859031A,1973-05-10,Spinneret capillary metering plugs,"['PROPN', 'ADJ', 'ADJ', 'NOUN', 'SPACE']",['PERSON'],1,1,5
US3859053A,1972-10-27,Recombiner for dissociated hydrogen and oxygen,"['PROPN', 'ADP', 'VERB', 'NOUN', 'CCONJ', 'NOUN', 'SPACE']",['PERSON'],1,1,7
US3859379A,1973-03-19,"Epoxy composition containing phenolic novolacs tetra substituted borate anions and a phosphonium, arsonium, quaternary ammonium cation, or tetra substituted borates of imidazole","['NOUN', 'NOUN', 'VERB', 'ADJ', 'PROPN', 'PROPN', 'VERB', 'ADJ', 'NOUN', 'CCONJ', 'DET', 'NOUN', 'PUNCT', 'ADJ', 'PUNCT', 'ADJ', 'NOUN', 'NOUN', 'PUNCT', 'CCONJ', 'NOUN', 'VERB', 'NOUN', 'ADP', 'NOUN', 'SPACE']",['PERSON'],1,1,26
US3859413A,1972-08-09,Alumina recovery from oil shale residue,"['PROPN', 'NOUN', 'ADP', 'NOUN', 'NOUN', 'NOUN', 'SPACE']",['PERSON'],1,1,7
US3859439A,1970-05-26,"2,3-dihydro-5 -trifluoromethyl-1h-dibenzo(2,3:6,7) thiepino (4,5-c) pyrroles as cns-depressants","['NUM', 'PUNCT', 'SPACE', 'NOUN', 'NOUN', 'NOUN', 'PUNCT', 'PROPN', 'PUNCT', 'NUM', 'SYM', 'NOUN', 'PUNCT', 'NOUN', 'ADP', 'NOUN', 'NOUN', 'NOUN', 'SPACE']","['CARDINAL', 'PERSON']",1,1,19
US3859680A,1972-07-14,Marker for use in fresh and sea water,"['NOUN', 'ADP', 'NOUN', 'ADP', 'ADJ', 'CCONJ', 'NOUN', 'NOUN', 'SPACE']",['PERSON'],0,1,9
US3859695A,1973-01-05,Stuffer box control,"['PROPN', 'PROPN', 'NOUN', 'SPACE']",['PERSON'],1,1,4
US3859822A,1973-09-17,Split support frame for circular knitting machines,"['NOUN', 'NOUN', 'NOUN', 'ADP', 'ADJ', 'NOUN', 'NOUN', 'SPACE']",['PERSON'],0,1,8
US3859836A,1973-05-18,Straightener for a dispenser for coiled material,"['PROPN', 'ADP', 'DET', 'NOUN', 'ADP', 'VERB', 'NOUN', 'SPACE']",['PERSON'],1,1,8
US3859874A,1973-03-15,Plier type tool,"['NOUN', 'NOUN', 'NOUN', 'SPACE']",['PERSON'],0,1,4
US3860027A,1973-03-30,180{20 {0 Loop carrier for a slurry line,"['PROPN', 'PUNCT', 'NUM', 'NOUN', 'NOUN', 'ADP', 'DET', 'NOUN', 'NOUN', 'SPACE']","['DATE', 'PERSON']",1,1,10
US3860040A,1973-03-07,Hose construction,"['PROPN', 'NOUN', 'SPACE']",['PERSON'],1,1,3
US3860140A,1973-03-19,Balsa wood footing for lng tanks,"['NOUN', 'NOUN', 'NOUN', 'ADP', 'NOUN', 'NOUN', 'SPACE']",['PERSON'],0,1,7
US3860144A,1973-03-20,Cigarette control dispenser,"['PROPN', 'NOUN', 'NOUN', 'SPACE']",['PERSON'],1,1,4
US3860153A,1973-11-01,Coat hanger shoulder support attachment,"['PROPN', 'NOUN', 'VERB', 'NOUN', 'NOUN', 'SPACE']",['PERSON'],1,1,6
US3860161A,1972-02-07,Cartridge tool with pocket arranged under the barrel,"['PROPN', 'NOUN', 'ADP', 'NOUN', 'VERB', 'ADP', 'DET', 'NOUN', 'SPACE']",['PERSON'],1,1,9
US3860183A,1973-08-09,Jaw-type crusher,"['NOUN', 'PUNCT', 'NOUN', 'NOUN', 'SPACE']",['PERSON'],0,1,5
US3860238A,1974-02-05,Continuous racetrack having turnaround portions,"['ADJ', 'NOUN', 'VERB', 'NOUN', 'NOUN', 'SPACE']",['PERSON'],0,1,6
US3860251A,1973-05-29,Reed mounted chuck,"['PROPN', 'VERB', 'PROPN', 'SPACE']",['PERSON'],1,1,4
US3860264A,1973-01-15,Lean velocipede,"['ADJ', 'VERB', 'SPACE']",['PERSON'],0,1,3
US3860286A,1973-07-27,Split back dental chair apparatus,"['VERB', 'ADV', 'ADJ', 'NOUN', 'NOUN', 'SPACE']",['PERSON'],0,1,6
US3860347A,1973-08-06,Cuvette construction,"['PROPN', 'NOUN', 'SPACE']",['PERSON'],1,1,3
US3860368A,1973-04-04,Continuous action board press,"['ADJ', 'NOUN', 'NOUN', 'NOUN', 'SPACE']",['PERSON'],0,1,5
US3860408A,1973-12-12,Glass rod slug molding machine,"['PROPN', 'NOUN', 'VERB', 'NOUN', 'NOUN', 'SPACE']",['PERSON'],1,1,6
US3860431A,1972-04-28,Slip resistant composition for paper coating,"['VERB', 'ADJ', 'NOUN', 'ADP', 'NOUN', 'NOUN', 'SPACE']",['PERSON'],0,1,7
US3860491A,1973-06-11,Reflux splitter and control system therefor,"['NOUN', 'NOUN', 'CCONJ', 'NOUN', 'NOUN', 'ADP', 'SPACE']",['PERSON'],0,1,7
US3860699A,1973-02-06,Resin composition suitable for use in hair dressing preparations,"['NOUN', 'NOUN', 'ADJ', 'ADP', 'NOUN', 'ADP', 'NOUN', 'VERB', 'NOUN', 'SPACE']",['PERSON'],0,1,10
US3860710A,1966-07-26,Method of inhibiting viral lysis in nonhuman flora and fauna systems,"['PROPN', 'ADP', 'VERB', 'ADJ', 'NOUN', 'ADP', 'PROPN', 'PROPN', 'CCONJ', 'PROPN', 'NOUN', 'SPACE']",['PERSON'],1,1,12
US3860776A,1973-07-19,Momentary switch with wire spring components,"['PROPN', 'NOUN', 'ADP', 'NOUN', 'NOUN', 'NOUN', 'SPACE']",['PERSON'],1,1,7
US3860778A,1974-03-08,Melt welding by high frequency electrical current,"['PROPN', 'NOUN', 'ADP', 'ADJ', 'NOUN', 'ADJ', 'ADJ', 'SPACE']",['PERSON'],1,1,8
US3860882A,1971-05-10,Continuous condition measuring system,"['ADJ', 'NOUN', 'VERB', 'NOUN', 'SPACE']",['PERSON'],0,1,5
US3860894A,1974-05-17,Solenoid,"['ADJ', 'SPACE']",['PERSON'],0,1,2
US3860946A,1972-10-13,Space-charge-limited solid-state triode,"['NOUN', 'PUNCT', 'NOUN', 'PUNCT', 'VERB', 'ADJ', 'PUNCT', 'NOUN', 'VERB', 'SPACE']",['PERSON'],0,1,10
US3861038A,1973-10-25,Shears,"['NOUN', 'SPACE']",['PERSON'],0,1,2
US3861109A,1973-12-19,Continuous shear resistant timber girder,"['ADJ', 'NOUN', 'ADJ', 'NOUN', 'NOUN', 'SPACE']",['PERSON'],0,1,6
US3861422A,1973-10-24,Split-sleeve pipe device,"['NOUN', 'PUNCT', 'NOUN', 'NOUN', 'NOUN', 'SPACE']",['PERSON'],0,1,6
US3861582A,1973-04-16,Carton,"['PROPN', 'SPACE']",['PERSON'],1,1,2
US3861644A,1973-10-09,Solenoid valve,"['ADJ', 'VERB', 'SPACE']",['PERSON'],0,1,3
US3861647A,1973-10-16,Jack structure,"['PROPN', 'NOUN', 'SPACE']",['PERSON'],1,1,3
US3861693A,1973-08-20,Chuck,"['PROPN', 'SPACE']",['PERSON'],1,1,2
US3861694A,1972-11-14,Quick-change chuck assembly,"['ADJ', 'PUNCT', 'NOUN', 'PROPN', 'NOUN', 'SPACE']",['PERSON'],1,1,6
US3861917A,1972-02-22,Continuous tone lithographic plate and method of making,"['ADJ', 'NOUN', 'ADJ', 'NOUN', 'CCONJ', 'NOUN', 'ADP', 'VERB', 'SPACE']",['PERSON'],0,1,9
US3861926A,1969-07-28,Glass fiber compositions of R{HD 2{B O-ROZrO{HD 2{B SiO{HD 2{B,"['NOUN', 'NOUN', 'NOUN', 'ADP', 'PROPN', 'NUM', 'NOUN', 'PUNCT', 'NOUN', 'NUM', 'NOUN', 'NUM', 'SPACE']","['PERSON', 'CARDINAL']",1,1,13
US3862008A,1973-12-03,Process for deacetoxycephalosporin c.,"['PROPN', 'ADP', 'PROPN', 'PROPN', 'SPACE']",['PERSON'],1,1,5
US3862025A,1973-01-02,Melt cracking for lubricating oils,"['PROPN', 'VERB', 'ADP', 'VERB', 'NOUN', 'SPACE']",['PERSON'],1,1,6
US3862086A,1973-10-19,Vinyl chloride polymers containing potassium zinc cuprocyanide,"['NOUN', 'NOUN', 'NOUN', 'VERB', 'NOUN', 'NOUN', 'NOUN', 'SPACE']",['PERSON'],0,1,8
US3862095A,1973-11-19,Arylene sulfide polymers,"['ADJ', 'NOUN', 'NOUN', 'SPACE']",['PERSON'],0,1,4
US3862149A,1972-01-07,"Pyrrolo (3,4-b) pyrazine derivatives","['NOUN', 'PUNCT', 'NOUN', 'PUNCT', 'NOUN', 'PUNCT', 'NOUN', 'NOUN', 'SPACE']","['PERSON', 'CARDINAL']",0,1,9
US3862230A,1969-09-20,Continuous preparation of cyclohexanone oxime,"['ADJ', 'NOUN', 'ADP', 'PROPN', 'PROPN', 'SPACE']",['PERSON'],1,1,6
US3862315A,1972-11-20,Tetraamidino derivatives of antibiotic em-49,"['NOUN', 'NOUN', 'ADP', 'ADJ', 'NOUN', 'SPACE']",['PERSON'],0,1,6
US3862452A,1966-05-04,Hydrogel substitutes for tubular somatic organs,"['PROPN', 'VERB', 'ADP', 'ADJ', 'ADJ', 'NOUN', 'SPACE']",['PERSON'],1,1,7
US3862471A,1972-10-13,Viscera separator,"['NOUN', 'NOUN', 'SPACE']",['PERSON'],0,1,3
US3862506A,1973-04-05,Label holder,"['PROPN', 'NOUN', 'SPACE']",['PERSON'],1,1,3
US3862529A,1973-07-23,Ridge cap,"['NOUN', 'NOUN', 'SPACE']",['PERSON'],0,1,3
US3862571A,1973-08-06,Multielectrode capacitive liquid level sensing system,"['PROPN', 'ADJ', 'ADJ', 'NOUN', 'VERB', 'NOUN', 'SPACE']",['PERSON'],1,1,7
US3862577A,1973-08-15,Screw jack pinion gear and method of making same,"['NOUN', 'NOUN', 'NOUN', 'NOUN', 'CCONJ', 'NOUN', 'ADP', 'VERB', 'ADJ', 'SPACE']",['PERSON'],0,1,10
US3862612A,1972-12-01,Vessel Hulls,"['PROPN', 'PROPN', 'SPACE']",['PERSON'],1,1,3
US3862616A,1968-12-26,Dispensing unit for moistening material,"['ADJ', 'NOUN', 'ADP', 'NOUN', 'NOUN', 'SPACE']",['PERSON'],0,1,6
US3862699A,1973-12-13,Cap securing means for a container,"['PROPN', 'NOUN', 'VERB', 'ADP', 'DET', 'NOUN', 'SPACE']",['PERSON'],1,1,7
US3862711A,1970-07-29,Yarn feeding device for textile machines such as knitting machines and the like,"['NOUN', 'NOUN', 'NOUN', 'ADP', 'NOUN', 'NOUN', 'ADJ', 'ADP', 'NOUN', 'NOUN', 'CCONJ', 'DET', 'ADJ', 'SPACE']",['PERSON'],0,1,14
US3862712A,1973-08-27,Stapler,"['NOUN', 'SPACE']",['PERSON'],0,1,2
US3862743A,1973-06-18,Vertical stress-side load member screw jack,"['ADJ', 'NOUN', 'PUNCT', 'NOUN', 'NOUN', 'NOUN', 'PROPN', 'PROPN', 'SPACE']","['ORG', 'PERSON']",1,1,9
US3862770A,1973-07-02,Meter bar providing accommodation to variations in nipple spacing,"['NOUN', 'NOUN', 'VERB', 'NOUN', 'ADP', 'NOUN', 'ADP', 'NOUN', 'VERB', 'SPACE']",['PERSON'],0,1,10
US3862831A,1973-04-20,Glass fabrication process,"['NOUN', 'NOUN', 'NOUN', 'SPACE']",['PERSON'],0,1,4
US3862845A,1974-02-25,Alumina refractories having a permanent expansion upon heating,"['PROPN', 'VERB', 'VERB', 'DET', 'ADJ', 'NOUN', 'SCONJ', 'VERB', 'SPACE']",['PERSON'],1,1,9
US3862865A,1971-05-24,Sparkler composition,"['NOUN', 'NOUN', 'SPACE']",['PERSON'],0,1,3
US3862877A,1972-05-22,Clothlike tissue laminates,"['VERB', 'NOUN', 'VERB', 'SPACE']",['PERSON'],0,1,4
US3862882A,1972-09-25,Glass fiber reinforced elastomers,"['NOUN', 'NOUN', 'VERB', 'NOUN', 'SPACE']",['PERSON'],0,1,5
US3862951A,1971-09-02,2{40 Quinoldinyl glycerol compounds,"['PROPN', 'PROPN', 'NOUN', 'VERB', 'SPACE']",['PERSON'],1,1,5
US3863008A,1973-06-11,Somatostatin as stimulant of luteinizing hormone secretion,"['ADJ', 'ADP', 'ADJ', 'ADP', 'ADJ', 'NOUN', 'NOUN', 'SPACE']",['PERSON'],0,1,8
US3863078A,1972-06-30,Josephson device parametrons,"['PROPN', 'NOUN', 'NOUN', 'SPACE']",['PERSON'],1,1,4
US3863173A,1974-06-03,Amplifier circuit for minimizing voltage offset,"['ADJ', 'NOUN', 'ADP', 'VERB', 'NOUN', 'VERB', 'SPACE']",['PERSON'],0,1,7
US3863179A,1973-11-28,Ultra low power and ultra stable astable multivibrator,"['ADJ', 'ADJ', 'NOUN', 'CCONJ', 'ADJ', 'ADJ', 'ADJ', 'NOUN', 'SPACE']",['PERSON'],0,1,9
US3863250A,1973-01-30,Glass breakage detector,"['NOUN', 'NOUN', 'NOUN', 'SPACE']",['PERSON'],0,1,4
US3863299A,1972-05-17,Clasp for a bracelet,"['NOUN', 'ADP', 'DET', 'NOUN', 'SPACE']",['PERSON'],0,1,5
US3863309A,1974-01-25,Yarn texturing air jet,"['NOUN', 'VERB', 'NOUN', 'NOUN', 'SPACE']",['PERSON'],0,1,5
US3863325A,1973-05-25,Glass cloth in metal forging,"['NOUN', 'NOUN', 'ADP', 'NOUN', 'VERB', 'SPACE']",['PERSON'],0,1,6
US3863369A,1972-08-14,Label,"['PROPN', 'SPACE']",['PERSON'],1,1,2
US3863627A,1971-11-05,Mouth exploring device,"['NOUN', 'VERB', 'NOUN', 'SPACE']",['PERSON'],0,1,4
US3863635A,1974-02-22,Vacuum handpiece including integral vacuum valve,"['PROPN', 'NOUN', 'VERB', 'ADJ', 'NOUN', 'NOUN', 'SPACE']",['PERSON'],1,1,7
