patent_number,date,title,spacy_pos,spacy_label,is_prpn_spacy,is_person_spacy,spacy_pos_len,tokens,bad_endings
US3201263A,1963-04-17,Meat curing process and composition therefor,"['NOUN', 'NOUN', 'NOUN', 'CCONJ', 'NOUN', 'ADP']",[],0,0,7,"['meat', 'curing', 'process', 'and', 'composition', 'therefor']",1
US3201379A,1960-12-23,Three-component metal hydride-transition metal halide catalyst and olefin polymerization process therewith,"['NUM', 'PUNCT', 'NOUN', 'NOUN', 'NOUN', 'PUNCT', 'NOUN', 'NOUN', 'NOUN', 'NOUN', 'CCONJ', 'NOUN', 'NOUN', 'NOUN', 'ADP']",['CARDINAL'],0,0,16,"['three-component', 'metal', 'hydride-transition', 'metal', 'halide', 'catalyst', 'and', 'olefin', 'polymerization', 'process', 'therewith']",1
US3201423A,1961-12-08,Process for oxidizing alkyl benzenes to phthalic anhydride,"['NOUN', 'ADP', 'VERB', 'NOUN', 'NOUN', 'PART', 'VERB', 'ADP']",[],0,0,9,"['process', 'for', 'oxidizing', 'alkyl', 'benzenes', 'to', 'phthalic', 'anhydride']",1
US3201563A,1961-04-18,Welding electrode,"['NOUN', 'ADP']",[],0,0,3,"['welding', 'electrode']",1
US3201681A,1960-06-24,Supply circuit and abrupt current and voltage limiting means therefor,"['NOUN', 'NOUN', 'CCONJ', 'ADJ', 'ADJ', 'CCONJ', 'NOUN', 'VERB', 'NOUN', 'ADP']",[],0,0,11,"['supply', 'circuit', 'and', 'abrupt', 'current', 'and', 'voltage', 'limiting', 'means', 'therefor']",1
US3201694A,1961-12-14,"Phase-neutralized limiter, and transmitter neutralization therewith","['NOUN', 'PUNCT', 'VERB', 'NOUN', 'PUNCT', 'CCONJ', 'NOUN', 'NOUN', 'ADP']",[],0,0,10,"['phase-neutralized', 'limiter,', 'and', 'transmitter', 'neutralization', 'therewith']",1
US3201710A,1961-07-28,Wide band amplifier,"['ADJ', 'NOUN', 'ADP']",[],0,0,4,"['wide', 'band', 'amplifier']",1
US3201731A,1962-11-27,Transformer core and lamination therefor,"['NOUN', 'NOUN', 'CCONJ', 'NOUN', 'ADP']",[],0,0,6,"['transformer', 'core', 'and', 'lamination', 'therefor']",1
US3201738A,1962-11-30,Electrical heating element and insulation therefor,"['ADJ', 'NOUN', 'NOUN', 'CCONJ', 'NOUN', 'ADP']",[],0,0,7,"['electrical', 'heating', 'element', 'and', 'insulation', 'therefor']",1
US3201867A,1962-12-10,Holder for injector type razor blades to scrape with,"['NOUN', 'ADP', 'NOUN', 'NOUN', 'NOUN', 'NOUN', 'PART', 'VERB', 'ADP']",['ORG'],0,0,10,"['holder', 'for', 'injector', 'type', 'razor', 'blades', 'to', 'scrape', 'with']",1
US3201899A,1962-03-30,Remotely controlled toy and track arrangement therefor,"['ADV', 'VERB', 'NOUN', 'CCONJ', 'NOUN', 'NOUN', 'ADP']",[],0,0,8,"['remotely', 'controlled', 'toy', 'and', 'track', 'arrangement', 'therefor']",1
US3201992A,1961-11-30,Gauge casing having plastic hinged blow-out,"['NOUN', 'NOUN', 'VERB', 'NOUN', 'VERB', 'NOUN', 'PUNCT', 'ADP']",['ORG'],0,0,9,"['gauge', 'casing', 'having', 'plastic', 'hinged', 'blow-out']",1
US3202073A,1962-05-21,Pass tank for processing film and improved interlock therefor,"['VERB', 'NOUN', 'ADP', 'NOUN', 'NOUN', 'CCONJ', 'VERB', 'NOUN', 'ADP']",[],0,0,10,"['pass', 'tank', 'for', 'processing', 'film', 'and', 'improved', 'interlock', 'therefor']",1
US3202499A,1960-11-02,Herbicidal compositions and method for inhibiting the growth of plants therewith,"['ADJ', 'NOUN', 'CCONJ', 'NOUN', 'ADP', 'VERB', 'DET', 'NOUN', 'ADP', 'NOUN', 'ADP']",[],0,0,12,"['herbicidal', 'compositions', 'and', 'method', 'for', 'inhibiting', 'the', 'growth', 'of', 'plants', 'therewith']",1
US3202513A,1960-06-03,Photopolymerizable compositions containing stannous salts of acids and elements produced therefrom,"['ADJ', 'NOUN', 'VERB', 'ADJ', 'NOUN', 'ADP', 'NOUN', 'CCONJ', 'NOUN', 'VERB', 'ADP']",[],0,0,12,"['photopolymerizable', 'compositions', 'containing', 'stannous', 'salts', 'of', 'acids', 'and', 'elements', 'produced', 'therefrom']",1
US3202581A,1960-01-20,Liquid fluidized bed nuclear reactor and method for reducing particle abrasion therein,"['NOUN', 'VERB', 'NOUN', 'ADJ', 'NOUN', 'CCONJ', 'NOUN', 'ADP', 'VERB', 'NOUN', 'NOUN', 'ADP']",[],0,0,13,"['liquid', 'fluidized', 'bed', 'nuclear', 'reactor', 'and', 'method', 'for', 'reducing', 'particle', 'abrasion', 'therein']",1
US3202608A,1961-05-02,Lubricating compositions and polymeric additives therefor,"['VERB', 'NOUN', 'CCONJ', 'ADJ', 'NOUN', 'ADP']",[],0,0,7,"['lubricating', 'compositions', 'and', 'polymeric', 'additives', 'therefor']",1
US3202659A,1960-02-29,"2, 5, 8-trihydrazino-tri-s-triazine and process therefor","['NUM', 'PUNCT', 'NUM', 'PUNCT', 'NUM', 'PUNCT', 'NOUN', 'PUNCT', 'ADJ', 'PUNCT', 'NOUN', 'PUNCT', 'NOUN', 'CCONJ', 'NOUN', 'ADP']","['CARDINAL', 'DATE', 'CARDINAL']",0,0,17,"['2,', '5,', '8-trihydrazino-tri-s-triazine', 'and', 'process', 'therefor']",1
US3202748A,1962-03-07,Synthetic fibers containing protein and process therefor,"['ADJ', 'NOUN', 'VERB', 'NOUN', 'CCONJ', 'NOUN', 'ADP']",[],0,0,8,"['synthetic', 'fibers', 'containing', 'protein', 'and', 'process', 'therefor']",1
US3202803A,1961-04-13,"Bowling scoring and display device and means for gathering, storing, processing and reproducing information therefrom","['NOUN', 'NOUN', 'CCONJ', 'VERB', 'NOUN', 'CCONJ', 'VERB', 'ADP', 'NOUN', 'PUNCT', 'VERB', 'PUNCT', 'NOUN', 'CCONJ', 'VERB', 'NOUN', 'ADP']",[],0,0,18,"['bowling', 'scoring', 'and', 'display', 'device', 'and', 'means', 'for', 'gathering,', 'storing,', 'processing', 'and', 'reproducing', 'information', 'therefrom']",1
US3202907A,1961-05-25,Power amplifier,"['NOUN', 'ADP']",[],0,0,3,"['power', 'amplifier']",1
US3202925A,1960-03-25,Filter amplifier,"['NOUN', 'ADP']",[],0,0,3,"['filter', 'amplifier']",1
US3202927A,1960-10-26,Continuous operable negative feedback amplifier,"['ADJ', 'VERB', 'ADJ', 'NOUN', 'ADP']",['PERSON'],0,1,6,"['continuous', 'operable', 'negative', 'feedback', 'amplifier']",1
US3203057A,1963-03-13,"Process for making cores and molds, articles made thereby and binder compositions therefor","['NOUN', 'ADP', 'VERB', 'NOUN', 'CCONJ', 'NOUN', 'PUNCT', 'NOUN', 'VERB', 'ADV', 'CCONJ', 'VERB', 'NOUN', 'ADP']",[],0,0,15,"['process', 'for', 'making', 'cores', 'and', 'molds,', 'articles', 'made', 'thereby', 'and', 'binder', 'compositions', 'therefor']",1
US3203070A,1963-09-24,Mortar jig,"['NOUN', 'ADP']",[],0,0,3,"['mortar', 'jig']",1
US3203604A,1962-04-06,"Combination veshicle luggage carrier and sunshade, and mounting assembly therefor","['NOUN', 'NOUN', 'NOUN', 'NOUN', 'CCONJ', 'NOUN', 'PUNCT', 'CCONJ', 'VERB', 'NOUN', 'ADP']",[],0,0,12,"['combination', 'veshicle', 'luggage', 'carrier', 'and', 'sunshade,', 'and', 'mounting', 'assembly', 'therefor']",1
US3203702A,1963-01-14,Flail type material unloader,"['NOUN', 'NOUN', 'NOUN', 'ADP']",[],0,0,5,"['flail', 'type', 'material', 'unloader']",1
US3203891A,1963-03-15,Hydrocarbon purification process and catalyst therefor,"['NOUN', 'NOUN', 'NOUN', 'CCONJ', 'NOUN', 'ADP']",[],0,0,7,"['hydrocarbon', 'purification', 'process', 'and', 'catalyst', 'therefor']",1
US3204005A,1963-05-13,Hydrocarbon conversion process and catalyst therefor,"['NOUN', 'NOUN', 'NOUN', 'CCONJ', 'NOUN', 'ADP']",[],0,0,7,"['hydrocarbon', 'conversion', 'process', 'and', 'catalyst', 'therefor']",1
US3204106A,1960-12-28,Storage-type electroluminescent image amplifier,"['NOUN', 'PUNCT', 'NOUN', 'ADJ', 'NOUN', 'ADP']",[],0,0,7,"['storage-type', 'electroluminescent', 'image', 'amplifier']",1
US3204318A,1962-03-02,Foot cap for burial casket and liner therefor,"['NOUN', 'NOUN', 'ADP', 'NOUN', 'NOUN', 'CCONJ', 'NOUN', 'ADP']",[],0,0,9,"['foot', 'cap', 'for', 'burial', 'casket', 'and', 'liner', 'therefor']",1
US3204394A,1960-04-07,Guiding and retarding means for gaseous stream containing solid and liquid constituents to be separated therefrom,"['VERB', 'CCONJ', 'NOUN', 'NOUN', 'ADP', 'ADJ', 'NOUN', 'VERB', 'ADJ', 'CCONJ', 'ADJ', 'NOUN', 'PART', 'AUX', 'VERB', 'ADP']",[],0,0,17,"['guiding', 'and', 'retarding', 'means', 'for', 'gaseous', 'stream', 'containing', 'solid', 'and', 'liquid', 'constituents', 'to', 'be', 'separated', 'therefrom']",1
US3204410A,1962-11-28,Hydrostatic drive and control means therefor,"['ADJ', 'NOUN', 'CCONJ', 'NOUN', 'VERB', 'ADP']",[],0,0,7,"['hydrostatic', 'drive', 'and', 'control', 'means', 'therefor']",1
US3204420A,1962-09-06,Reversible refrigerating system and control therefor,"['ADJ', 'VERB', 'NOUN', 'CCONJ', 'NOUN', 'ADP']",[],0,0,7,"['reversible', 'refrigerating', 'system', 'and', 'control', 'therefor']",1
US3204483A,1963-08-12,Rotary drum strainer and driving gear therefor,"['ADJ', 'NOUN', 'NOUN', 'CCONJ', 'NOUN', 'NOUN', 'ADP']",[],0,0,8,"['rotary', 'drum', 'strainer', 'and', 'driving', 'gear', 'therefor']",1
US3204504A,1962-07-12,Positive grip cut-off,"['ADJ', 'NOUN', 'VERB', 'PUNCT', 'ADP']",[],0,0,6,"['positive', 'grip', 'cut-off']",1
US3204554A,1963-09-20,Printing machine and sheet ejector therefor,"['NOUN', 'NOUN', 'CCONJ', 'NOUN', 'NOUN', 'ADP']",[],0,0,7,"['printing', 'machine', 'and', 'sheet', 'ejector', 'therefor']",1
US3204759A,1963-11-29,Packaging assembly with rotatable container therein,"['NOUN', 'NOUN', 'ADP', 'ADJ', 'NOUN', 'ADP']",[],0,0,7,"['packaging', 'assembly', 'with', 'rotatable', 'container', 'therein']",1
US3204763A,1962-03-26,Pressure-sensitive adhesive tape roll and core therefor,"['NOUN', 'PUNCT', 'ADJ', 'ADJ', 'NOUN', 'NOUN', 'CCONJ', 'NOUN', 'ADP']",[],0,0,10,"['pressure-sensitive', 'adhesive', 'tape', 'roll', 'and', 'core', 'therefor']",1
US3204799A,1964-02-12,Container and closure therefor,"['NOUN', 'CCONJ', 'NOUN', 'ADP']",[],0,0,5,"['container', 'and', 'closure', 'therefor']",1
US3204823A,1963-09-24,Combined tube squeezer and support therefor,"['ADJ', 'NOUN', 'NOUN', 'CCONJ', 'NOUN', 'ADP']",[],0,0,7,"['combined', 'tube', 'squeezer', 'and', 'support', 'therefor']",1
US3204861A,1962-01-25,Pump and control therefor,"['VERB', 'CCONJ', 'NOUN', 'ADP']",[],0,0,5,"['pump', 'and', 'control', 'therefor']",1
US3204890A,1963-12-05,Helicopter and towed vehicle therefor,"['NOUN', 'CCONJ', 'ADJ', 'NOUN', 'ADP']",[],0,0,6,"['helicopter', 'and', 'towed', 'vehicle', 'therefor']",1
US3204918A,1962-04-23,Concrete wall form panel units and connecting means therefor,"['ADJ', 'NOUN', 'VERB', 'NOUN', 'NOUN', 'CCONJ', 'VERB', 'NOUN', 'ADP']",[],0,0,10,"['concrete', 'wall', 'form', 'panel', 'units', 'and', 'connecting', 'means', 'therefor']",1
US3205000A,1963-12-03,Automobile rain visor and supporting means therefor,"['NOUN', 'NOUN', 'NOUN', 'CCONJ', 'VERB', 'NOUN', 'ADP']",[],0,0,8,"['automobile', 'rain', 'visor', 'and', 'supporting', 'means', 'therefor']",1
US3205017A,1963-05-15,Power operated vacuum unloader,"['NOUN', 'VERB', 'NOUN', 'ADP']",[],0,0,5,"['power', 'operated', 'vacuum', 'unloader']",1
US3205051A,1962-05-25,Light-colored porcelain-enameled aluminum articles and clad-aluminum sheets therefor,"['ADJ', 'PUNCT', 'VERB', 'NOUN', 'PUNCT', 'VERB', 'NOUN', 'NOUN', 'CCONJ', 'VERB', 'PUNCT', 'NOUN', 'NOUN', 'ADP']",[],0,0,15,"['light-colored', 'porcelain-enameled', 'aluminum', 'articles', 'and', 'clad-aluminum', 'sheets', 'therefor']",1
US3205202A,1955-08-10,Process for improving the brightness of synthetic polymers and products resulting therefrom,"['NOUN', 'ADP', 'VERB', 'DET', 'NOUN', 'ADP', 'ADJ', 'NOUN', 'CCONJ', 'NOUN', 'VERB', 'ADP']",[],0,0,13,"['process', 'for', 'improving', 'the', 'brightness', 'of', 'synthetic', 'polymers', 'and', 'products', 'resulting', 'therefrom']",1
US3205292A,1959-06-25,Heating and melting process of vitreous materials and furnace therefor,"['NOUN', 'CCONJ', 'NOUN', 'NOUN', 'ADP', 'ADJ', 'NOUN', 'CCONJ', 'NOUN', 'ADP']",[],0,0,11,"['heating', 'and', 'melting', 'process', 'of', 'vitreous', 'materials', 'and', 'furnace', 'therefor']",1
US3205370A,1962-02-23,Stabilized optical maser amplifier,"['VERB', 'ADJ', 'NOUN', 'ADP']",[],0,0,5,"['stabilized', 'optical', 'maser', 'amplifier']",1
US3205600A,1963-08-05,"Day and night transparency, translucency and/or print and display frame therefor","['NOUN', 'CCONJ', 'NOUN', 'NOUN', 'PUNCT', 'NOUN', 'CCONJ', 'NOUN', 'CCONJ', 'NOUN', 'NOUN', 'ADP']",[],0,0,13,"['day', 'and', 'night', 'transparency,', 'translucency', 'and/or', 'print', 'and', 'display', 'frame', 'therefor']",1
US3205611A,1964-02-06,Hollow blocks and tubular connecting means therefor,"['ADJ', 'NOUN', 'CCONJ', 'ADJ', 'VERB', 'NOUN', 'ADP']",[],0,0,8,"['hollow', 'blocks', 'and', 'tubular', 'connecting', 'means', 'therefor']",1
US3205834A,1961-09-28,Cargo tie-down,"['NOUN', 'NOUN', 'PUNCT', 'ADP']",[],0,0,5,"['cargo', 'tie-down']",1
US3205962A,1961-01-25,Pneumatic tire having drive means contained within,"['ADJ', 'NOUN', 'VERB', 'NOUN', 'NOUN', 'VERB', 'ADP']",[],0,0,8,"['pneumatic', 'tire', 'having', 'drive', 'means', 'contained', 'within']",1
US3206073A,1963-02-13,Dispensing assembly for a container and a sheath therefor,"['VERB', 'NOUN', 'ADP', 'DET', 'NOUN', 'CCONJ', 'DET', 'NOUN', 'ADP']",['PERSON'],0,1,10,"['dispensing', 'assembly', 'for', 'a', 'container', 'and', 'a', 'sheath', 'therefor']",1
US3206308A,1959-12-28,Photographic stratum transfer process and developing compositions therefor,"['ADJ', 'NOUN', 'NOUN', 'NOUN', 'CCONJ', 'VERB', 'NOUN', 'ADP']",[],0,0,9,"['photographic', 'stratum', 'transfer', 'process', 'and', 'developing', 'compositions', 'therefor']",1
US3206312A,1962-06-12,Photographic film having antistatic agent therein,"['ADJ', 'NOUN', 'VERB', 'ADJ', 'NOUN', 'ADP']",[],0,0,7,"['photographic', 'film', 'having', 'antistatic', 'agent', 'therein']",1
US3206337A,1961-11-08,Cobalt-platinum alloy and magnets made therefrom,"['NOUN', 'PUNCT', 'NOUN', 'NOUN', 'CCONJ', 'NOUN', 'VERB', 'ADP']",[],0,0,9,"['cobalt-platinum', 'alloy', 'and', 'magnets', 'made', 'therefrom']",1
US3206538A,1962-06-14,Hermetic seal header with offset skirt-casing weld,"['ADJ', 'NOUN', 'NOUN', 'ADP', 'ADJ', 'NOUN', 'PUNCT', 'NOUN', 'ADP']",[],0,0,10,"['hermetic', 'seal', 'header', 'with', 'offset', 'skirt-casing', 'weld']",1
US3206597A,1962-09-27,Fluid analyzer and transducer circuit therefor,"['ADJ', 'NOUN', 'CCONJ', 'NOUN', 'NOUN', 'ADP']",[],0,0,7,"['fluid', 'analyzer', 'and', 'transducer', 'circuit', 'therefor']",1
US3206620A,1961-08-29,Logarithmic gain tuned amplifier,"['ADJ', 'NOUN', 'VERB', 'ADP']",[],0,0,5,"['logarithmic', 'gain', 'tuned', 'amplifier']",1
US3206624A,1961-08-31,Hypersonic plasma thermocouple,"['ADJ', 'VERB', 'DET']",['ORG'],0,0,4,"['hypersonic', 'plasma', 'thermocouple']",1
US3206691A,1961-09-06,Direct voltage amplifier,"['ADJ', 'NOUN', 'ADP']",[],0,0,4,"['direct', 'voltage', 'amplifier']",1
US3206943A,1962-02-09,Refrigerator having a movable refrigeration unit therein,"['NOUN', 'VERB', 'DET', 'ADJ', 'NOUN', 'NOUN', 'ADP']",[],0,0,8,"['refrigerator', 'having', 'a', 'movable', 'refrigeration', 'unit', 'therein']",1
US3207041A,1961-06-12,Hydraulically operated advancing roof support systems and monitoring systems therefor,"['ADV', 'VERB', 'VERB', 'NOUN', 'NOUN', 'NOUN', 'CCONJ', 'VERB', 'NOUN', 'ADP']",[],0,0,11,"['hydraulically', 'operated', 'advancing', 'roof', 'support', 'systems', 'and', 'monitoring', 'systems', 'therefor']",1
US3207049A,1960-11-07,Machine for forming plastic coated paperboard containers and erecting and deliveringmeans therefor,"['NOUN', 'ADP', 'VERB', 'ADJ', 'VERB', 'NOUN', 'NOUN', 'CCONJ', 'NOUN', 'CCONJ', 'NOUN', 'ADP']",[],0,0,13,"['machine', 'for', 'forming', 'plastic', 'coated', 'paperboard', 'containers', 'and', 'erecting', 'and', 'deliveringmeans', 'therefor']",1
US3207222A,1962-01-30,Locking device and running tool therefor,"['VERB', 'NOUN', 'CCONJ', 'VERB', 'NOUN', 'ADP']",[],0,0,7,"['locking', 'device', 'and', 'running', 'tool', 'therefor']",1
US3207230A,1963-03-07,Plow with rotary soil-working implement,"['VERB', 'ADP', 'ADJ', 'NOUN', 'PUNCT', 'VERB', 'ADP']",[],0,0,8,"['plow', 'with', 'rotary', 'soil-working', 'implement']",1
US3207391A,1962-04-24,Trouser topping apparatus and electrical control system therefor,"['NOUN', 'NOUN', 'NOUN', 'CCONJ', 'ADJ', 'NOUN', 'NOUN', 'ADP']",[],0,0,9,"['trouser', 'topping', 'apparatus', 'and', 'electrical', 'control', 'system', 'therefor']",1
US3207506A,1962-06-20,Copying apparatus and feeding mechanism therefor,"['NOUN', 'NOUN', 'CCONJ', 'NOUN', 'NOUN', 'ADP']",[],0,0,7,"['copying', 'apparatus', 'and', 'feeding', 'mechanism', 'therefor']",1
US3207581A,1961-11-14,Process for purifying boron trichloride,"['NOUN', 'ADP', 'VERB', 'NOUN', 'ADP']",[],0,0,6,"['process', 'for', 'purifying', 'boron', 'trichloride']",1
US3207602A,1961-12-29,Copysheet and method for making copies therefrom,"['NOUN', 'CCONJ', 'NOUN', 'ADP', 'VERB', 'NOUN', 'ADP']",[],0,0,8,"['copysheet', 'and', 'method', 'for', 'making', 'copies', 'therefrom']",1
US3207635A,1961-04-19,Tunnel diode and process therefor,"['NOUN', 'NOUN', 'CCONJ', 'NOUN', 'ADP']",[],0,0,6,"['tunnel', 'diode', 'and', 'process', 'therefor']",1
US3207653A,1961-07-28,New polyamides and laminates made therefrom,"['ADJ', 'NOUN', 'CCONJ', 'NOUN', 'VERB', 'ADP']",[],0,0,7,"['new', 'polyamides', 'and', 'laminates', 'made', 'therefrom']",1
US3207670A,1961-12-04,Gas cooled nuclear reactor with im-proved coolant flow path arrangement and fuel assembly therefor,"['NOUN', 'VERB', 'ADJ', 'NOUN', 'ADP', 'ADJ', 'PUNCT', 'VERB', 'NOUN', 'NOUN', 'NOUN', 'NOUN', 'CCONJ', 'NOUN', 'NOUN', 'ADP']",[],0,0,17,"['gas', 'cooled', 'nuclear', 'reactor', 'with', 'im-proved', 'coolant', 'flow', 'path', 'arrangement', 'and', 'fuel', 'assembly', 'therefor']",1
US3207733A,1962-04-20,Homopolymers of alpha-fluorostyrene and process therefor,"['NOUN', 'ADP', 'NOUN', 'PUNCT', 'NOUN', 'CCONJ', 'NOUN', 'ADP']",[],0,0,9,"['homopolymers', 'of', 'alpha-fluorostyrene', 'and', 'process', 'therefor']",1
US3207803A,1965-09-21,Desorption of molecular sieves by,"['NOUN', 'ADP', 'ADJ', 'NOUN', 'ADP']",[],0,0,5,"['desorption', 'of', 'molecular', 'sieves', 'by']",1
US3207925A,1962-06-13,Electronic digital computer clock read amplifier,"['ADJ', 'ADJ', 'NOUN', 'NOUN', 'VERB', 'ADP']",[],0,0,7,"['electronic', 'digital', 'computer', 'clock', 'read', 'amplifier']",1
US3207937A,1960-05-19,Thin film storage electrode,"['ADJ', 'NOUN', 'NOUN', 'ADP']",[],0,0,5,"['thin', 'film', 'storage', 'electrode']",1
US3208292A,1963-05-28,Variable force oscillator,"['ADJ', 'NOUN', 'ADP']",[],0,0,4,"['variable', 'force', 'oscillator']",1
US3208347A,1963-05-24,Rocket launchers and rear sight therefor,"['NOUN', 'NOUN', 'CCONJ', 'ADJ', 'NOUN', 'ADP']",[],0,0,7,"['rocket', 'launchers', 'and', 'rear', 'sight', 'therefor']",1
US3208579A,1962-07-09,"Machine adapted to turn bottles, flasks and the like articles upside down","['NOUN', 'VERB', 'PART', 'VERB', 'NOUN', 'PUNCT', 'NOUN', 'CCONJ', 'DET', 'ADJ', 'NOUN', 'ADV', 'ADP']",[],0,0,14,"['machine', 'adapted', 'to', 'turn', 'bottles,', 'flasks', 'and', 'the', 'like', 'articles', 'upside', 'down']",1
US3208846A,1960-02-09,Spark machining electrode,"['NOUN', 'NOUN', 'ADP']",['ORG'],0,0,4,"['spark', 'machining', 'electrode']",1
US3208860A,1962-07-31,Phototropic material and article made therefrom,"['ADJ', 'NOUN', 'CCONJ', 'NOUN', 'VERB', 'ADP']",[],0,0,7,"['phototropic', 'material', 'and', 'article', 'made', 'therefrom']",1
US3208904A,1962-05-23,Chlorinated camphene-dichlorocarbene adduct and use as insecticide,"['ADJ', 'NOUN', 'PUNCT', 'NOUN', 'NOUN', 'CCONJ', 'NOUN', 'ADP', 'ADP']",[],0,0,10,"['chlorinated', 'camphene-dichlorocarbene', 'adduct', 'and', 'use', 'as', 'insecticide']",1
US3208946A,1961-06-07,Lubricants and additives therefor,"['NOUN', 'CCONJ', 'NOUN', 'ADP']",[],0,0,5,"['lubricants', 'and', 'additives', 'therefor']",1
US3208968A,1961-10-23,Metal coordination complexes of o-hydroxybenzalphenylhydrazones and solid polymers stabhized therewith,"['NOUN', 'NOUN', 'NOUN', 'ADP', 'NOUN', 'NOUN', 'NOUN', 'CCONJ', 'ADJ', 'NOUN', 'VERB', 'ADP']",[],0,0,13,"['metal', 'coordination', 'complexes', 'of', 'o-hydroxybenzalphenylhydrazones', 'and', 'solid', 'polymers', 'stabhized', 'therewith']",1
US3209068A,1963-08-12,Appliance unit and combination plug and tool therefor,"['ADJ', 'NOUN', 'CCONJ', 'NOUN', 'NOUN', 'CCONJ', 'NOUN', 'ADP']",['ORG'],0,0,9,"['appliance', 'unit', 'and', 'combination', 'plug', 'and', 'tool', 'therefor']",1
US3209083A,1962-09-07,Direct-coupled transistor amplifier,"['ADV', 'PUNCT', 'VERB', 'NOUN', 'ADP']",[],0,0,6,"['direct-coupled', 'transistor', 'amplifier']",1
US3209364A,1961-07-27,Force amplifier,"['NOUN', 'ADP']",[],0,0,3,"['force', 'amplifier']",1
US3209722A,1963-11-29,Flag staff and socket therefor,"['NOUN', 'NOUN', 'CCONJ', 'NOUN', 'ADP']",[],0,0,6,"['flag', 'staff', 'and', 'socket', 'therefor']",1
US3209752A,1962-06-11,Parenteral fluid container and closure assembly therefor,"['ADJ', 'ADJ', 'NOUN', 'CCONJ', 'NOUN', 'NOUN', 'ADP']",['ORG'],0,0,8,"['parenteral', 'fluid', 'container', 'and', 'closure', 'assembly', 'therefor']",1
US3209774A,1962-09-28,Differential fluid amplifier,"['ADJ', 'NOUN', 'ADP']",[],0,0,4,"['differential', 'fluid', 'amplifier']",1
US3209882A,1964-04-06,Destructible tokens and meter system therefor,"['ADJ', 'NOUN', 'CCONJ', 'NOUN', 'NOUN', 'ADP']",[],0,0,7,"['destructible', 'tokens', 'and', 'meter', 'system', 'therefor']",1
US3209886A,1961-12-08,Veneer dryer unloader,"['NOUN', 'NOUN', 'ADP']",['PRODUCT'],0,0,4,"['veneer', 'dryer', 'unloader']",1
US3209971A,1963-11-12,Automobile top carrier and cases therefor,"['NOUN', 'ADJ', 'NOUN', 'CCONJ', 'NOUN', 'ADP']",[],0,0,7,"['automobile', 'top', 'carrier', 'and', 'cases', 'therefor']",1
US3210122A,1959-09-04,Continuous mining machine and control system therefor,"['ADJ', 'NOUN', 'NOUN', 'CCONJ', 'NOUN', 'NOUN', 'ADP']",['PERSON'],0,1,8,"['continuous', 'mining', 'machine', 'and', 'control', 'system', 'therefor']",1
US3210153A,1961-02-08,Process for the production of chlorine and alkali metal nitrate,"['NOUN', 'ADP', 'DET', 'NOUN', 'ADP', 'NOUN', 'CCONJ', 'ADJ', 'NOUN', 'ADP']",[],0,0,11,"['process', 'for', 'the', 'production', 'of', 'chlorine', 'and', 'alkali', 'metal', 'nitrate']",1
US3210170A,1960-07-05,Process for the production of gases from hydrocarbon oil and removal of carbon particles therefrom,"['NOUN', 'ADP', 'DET', 'NOUN', 'ADP', 'NOUN', 'ADP', 'NOUN', 'NOUN', 'CCONJ', 'NOUN', 'ADP', 'NOUN', 'NOUN', 'ADP']",[],0,0,16,"['process', 'for', 'the', 'production', 'of', 'gases', 'from', 'hydrocarbon', 'oil', 'and', 'removal', 'of', 'carbon', 'particles', 'therefrom']",1
US3210213A,1961-12-04,Welding electrode,"['NOUN', 'ADP']",[],0,0,3,"['welding', 'electrode']",1
US3210216A,1962-02-09,Brazing gold alloy and thermoelectric device produced therewith,"['VERB', 'NOUN', 'NOUN', 'CCONJ', 'NOUN', 'NOUN', 'VERB', 'ADP']",[],0,0,9,"['brazing', 'gold', 'alloy', 'and', 'thermoelectric', 'device', 'produced', 'therewith']",1
US3210235A,1963-04-08,Pulping of cellulose materials in the presence of free sulfur in a kraft pulping system and cyclic liquor recovery therefor,"['VERB', 'ADP', 'NOUN', 'NOUN', 'ADP', 'DET', 'NOUN', 'ADP', 'ADJ', 'NOUN', 'ADP', 'DET', 'NOUN', 'VERB', 'NOUN', 'CCONJ', 'ADJ', 'NOUN', 'NOUN', 'ADP']",[],0,0,21,"['pulping', 'of', 'cellulose', 'materials', 'in', 'the', 'presence', 'of', 'free', 'sulfur', 'in', 'a', 'kraft', 'pulping', 'system', 'and', 'cyclic', 'liquor', 'recovery', 'therefor']",1
US3210313A,1959-08-25,Esters of epsilon-dicarboximido-caproic acids and polyvinyl resins plasticized therewith,"['NOUN', 'ADP', 'NOUN', 'PUNCT', 'ADJ', 'PUNCT', 'ADJ', 'NOUN', 'CCONJ', 'ADJ', 'NOUN', 'VERB', 'ADP']",[],0,0,14,"['esters', 'of', 'epsilon-dicarboximido-caproic', 'acids', 'and', 'polyvinyl', 'resins', 'plasticized', 'therewith']",1
US3210367A,1965-10-05,Process fur preparing bl,"['NOUN', 'NOUN', 'VERB', 'ADP']",[],0,0,4,"['process', 'fur', 'preparing', 'bl']",1
US3210400A,1961-05-18,"Acetamido-aminocapronitrile, method of making and intermediates therefor","['NOUN', 'PUNCT', 'ADV', 'PUNCT', 'NOUN', 'ADP', 'VERB', 'CCONJ', 'VERB', 'ADP']",[],0,0,11,"['acetamido-aminocapronitrile,', 'method', 'of', 'making', 'and', 'intermediates', 'therefor']",1
US3210551A,1952-04-18,Electroluminescent image amplifier,"['ADJ', 'NOUN', 'ADP']",[],0,0,4,"['electroluminescent', 'image', 'amplifier']",1
US3210641A,1961-02-28,Power control circuit employing semiconductor switching means responsive to the saturation of a magnetic amplifier,"['NOUN', 'NOUN', 'NOUN', 'VERB', 'NOUN', 'NOUN', 'VERB', 'ADJ', 'ADP', 'DET', 'NOUN', 'ADP', 'DET', 'ADJ', 'ADP']",[],0,0,16,"['power', 'control', 'circuit', 'employing', 'semiconductor', 'switching', 'means', 'responsive', 'to', 'the', 'saturation', 'of', 'a', 'magnetic', 'amplifier']",1
US3210677A,1962-05-28,Unipolar-bipolar semiconductor amplifier,"['ADJ', 'PUNCT', 'ADJ', 'NOUN', 'ADP']",['ORG'],0,0,6,"['unipolar-bipolar', 'semiconductor', 'amplifier']",1
US3210750A,1961-03-23,Cable terminator with fault-current indicator therefor,"['NOUN', 'NOUN', 'ADP', 'NOUN', 'PUNCT', 'ADJ', 'NOUN', 'ADP']",[],0,0,9,"['cable', 'terminator', 'with', 'fault-current', 'indicator', 'therefor']",1
US3210785A,1964-06-05,Fishing rod retriever,"['NOUN', 'NOUN', 'ADP']",[],0,0,4,"['fishing', 'rod', 'retriever']",1
US3210881A,1962-12-19,Centrifugal free line projecting pole and line guide therefor,"['ADJ', 'ADJ', 'NOUN', 'VERB', 'NOUN', 'CCONJ', 'NOUN', 'NOUN', 'ADP']",['GPE'],0,0,10,"['centrifugal', 'free', 'line', 'projecting', 'pole', 'and', 'line', 'guide', 'therefor']",1
US3210902A,1958-03-25,Sealed fissured roof surface and method therefor,"['VERB', 'VERB', 'NOUN', 'NOUN', 'CCONJ', 'NOUN', 'ADP']",[],0,0,8,"['sealed', 'fissured', 'roof', 'surface', 'and', 'method', 'therefor']",1
US3211102A,1963-07-18,Self priming pump and automatic primer valve therefor,"['NOUN', 'NOUN', 'NOUN', 'CCONJ', 'ADJ', 'NOUN', 'NOUN', 'ADP']",[],0,0,9,"['self', 'priming', 'pump', 'and', 'automatic', 'primer', 'valve', 'therefor']",1
US3211170A,1962-12-12,Float valve with air cut-off,"['NOUN', 'NOUN', 'ADP', 'NOUN', 'VERB', 'PUNCT', 'ADP']",[],0,0,8,"['float', 'valve', 'with', 'air', 'cut-off']",1
US3211278A,1963-04-05,Impact idler,"['NOUN', 'ADP']",[],0,0,3,"['impact', 'idler']",1
US3211322A,1963-03-18,Container and closure therefor,"['NOUN', 'CCONJ', 'NOUN', 'ADP']",[],0,0,5,"['container', 'and', 'closure', 'therefor']",1
