patent_number,date,title,spacy_pos,spacy_label,is_prpn_spacy,is_person_spacy,spacy_pos_len,tokens,bad_endings
US3200003A,1962-01-11,Process for impregnating wood with pentachlorophenol and composition therefor,"['PROPN', 'ADP', 'VERB', 'NOUN', 'ADP', 'NOUN', 'CCONJ', 'NOUN', 'ADP']",[],1,0,10,"['process', 'for', 'impregnating', 'wood', 'with', 'pentachlorophenol', 'and', 'composition', 'therefor']",1
US3200177A,1963-04-04,Method of forming concrete articles and slip forming machine therefor,"['PROPN', 'ADP', 'VERB', 'ADJ', 'NOUN', 'CCONJ', 'VERB', 'VERB', 'NOUN', 'ADP']",[],1,0,11,"['method', 'of', 'forming', 'concrete', 'articles', 'and', 'slip', 'forming', 'machine', 'therefor']",1
US3201252A,1961-10-09,Gelatin compositions containing salts of half esters of sulfosuccinic acid as coating aids therefor,"['PROPN', 'NOUN', 'VERB', 'NOUN', 'ADP', 'ADJ', 'NOUN', 'ADP', 'ADJ', 'NOUN', 'ADP', 'VERB', 'NOUN', 'ADP']","['NORP', 'CARDINAL']",1,0,15,"['gelatin', 'compositions', 'containing', 'salts', 'of', 'half', 'esters', 'of', 'sulfosuccinic', 'acid', 'as', 'coating', 'aids', 'therefor']",1
US3201357A,1962-04-25,Vinylation reactions and mercuric salt cation exchange catalysts therefor,"['NOUN', 'NOUN', 'CCONJ', 'ADJ', 'NOUN', 'PROPN', 'NOUN', 'NOUN', 'ADP']",[],1,0,10,"['vinylation', 'reactions', 'and', 'mercuric', 'salt', 'cation', 'exchange', 'catalysts', 'therefor']",1
US3201368A,1960-10-25,Polyolefins stabilized with an (alkylphenol) monosulphide and a nickel alkoxide,"['PROPN', 'VERB', 'ADP', 'DET', 'PUNCT', 'NOUN', 'PUNCT', 'NOUN', 'CCONJ', 'DET', 'NOUN', 'ADP']",['ORG'],1,0,13,"['polyolefins', 'stabilized', 'with', 'an', '(alkylphenol)', 'monosulphide', 'and', 'a', 'nickel', 'alkoxide']",1
US3201393A,1962-01-31,"3-keto-5', 6'-dihydro androstane-[17, 16alpha-c]-pyrans and compounds produced therefrom","['NUM', 'PUNCT', 'SPACE', 'NOUN', 'PUNCT', 'NUM', 'PROPN', 'PUNCT', 'NOUN', 'PUNCT', 'NOUN', 'CCONJ', 'NOUN', 'VERB', 'ADP']","['QUANTITY', 'PRODUCT', 'CARDINAL']",1,0,16,"[""3-keto-5',"", ""6'-dihydro"", 'androstane-[17,', '16alpha-c]-pyrans', 'and', 'compounds', 'produced', 'therefrom']",1
US3201429A,1958-07-12,"17, 21-diesters of 6alpha, 16alpha-dimethyl-delta4-pregnen-17alpha-21-diol-3, 20-dione and process therefor","['NUM', 'PUNCT', 'NUM', 'PUNCT', 'NOUN', 'ADP', 'NUM', 'PUNCT', 'PROPN', 'PUNCT', 'NOUN', 'PUNCT', 'NOUN', 'PUNCT', 'NOUN', 'PUNCT', 'SPACE', 'PUNCT', 'NUM', 'PUNCT', 'NOUN', 'CCONJ', 'NOUN', 'ADP']","['CARDINAL', 'CARDINAL', 'CARDINAL', 'CARDINAL']",1,0,25,"['17,', '21-diesters', 'of', '6alpha,', '16alpha-dimethyl-delta4-pregnen-17alpha-21-diol-3,', '20-dione', 'and', 'process', 'therefor']",1
US3201516A,1961-02-06,Capsule-enclosed electro-acoustic transducer and transistor amplifier,"['PROPN', 'PUNCT', 'VERB', 'NOUN', 'PUNCT', 'ADJ', 'NOUN', 'CCONJ', 'NOUN', 'ADP']",[],1,0,11,"['capsule-enclosed', 'electro-acoustic', 'transducer', 'and', 'transistor', 'amplifier']",1
US3201672A,1960-05-23,Pulsating d.-c. bias circuit for transistorized servo amplifier,"['VERB', 'NOUN', 'PUNCT', 'PROPN', 'NOUN', 'ADP', 'VERB', 'NOUN', 'ADP']",[],1,0,10,"['pulsating', 'd.-c.', 'bias', 'circuit', 'for', 'transistorized', 'servo', 'amplifier']",1
US3202406A,1960-07-27,Furnace apparatus and conveyor therefor,"['PROPN', 'NOUN', 'CCONJ', 'NOUN', 'ADP']",['ORG'],1,0,6,"['furnace', 'apparatus', 'and', 'conveyor', 'therefor']",1
US3202475A,1963-05-15,Method for collecting zirconium tetrachloride,"['PROPN', 'ADP', 'VERB', 'NOUN', 'ADP']",[],1,0,6,"['method', 'for', 'collecting', 'zirconium', 'tetrachloride']",1
US3202644A,1964-12-11,Surface treated carbon black as polymerization catalyst and method of polymerization therewith,"['PROPN', 'VERB', 'NOUN', 'ADJ', 'ADP', 'NOUN', 'NOUN', 'CCONJ', 'NOUN', 'ADP', 'NOUN', 'ADP']",[],1,0,13,"['surface', 'treated', 'carbon', 'black', 'as', 'polymerization', 'catalyst', 'and', 'method', 'of', 'polymerization', 'therewith']",1
US3202645A,1964-12-16,Surface treated inorganic solid polymerization catalyst and method of polymerization therewith,"['PROPN', 'VERB', 'ADJ', 'ADJ', 'NOUN', 'NOUN', 'CCONJ', 'NOUN', 'ADP', 'NOUN', 'ADP']",[],1,0,12,"['surface', 'treated', 'inorganic', 'solid', 'polymerization', 'catalyst', 'and', 'method', 'of', 'polymerization', 'therewith']",1
US3203615A,1963-02-21,"Carton having a dispensing facility, and carton blank therefor","['PROPN', 'VERB', 'DET', 'VERB', 'NOUN', 'PUNCT', 'CCONJ', 'PROPN', 'PROPN', 'ADP']",['GPE'],1,0,11,"['carton', 'having', 'a', 'dispensing', 'facility,', 'and', 'carton', 'blank', 'therefor']",1
US3204826A,1964-05-12,Condiment holders and support therefor,"['PROPN', 'NOUN', 'CCONJ', 'NOUN', 'ADP']",[],1,0,6,"['condiment', 'holders', 'and', 'support', 'therefor']",1
US3205133A,1961-09-27,"Nu, nu'-bis-(heterocyclicaminoalkyl)-alkylenediamines and therapeutic uses therefor","['PROPN', 'PUNCT', 'NOUN', 'CCONJ', 'ADJ', 'NOUN', 'ADP']",[],1,0,8,"['nu,', ""nu'-bis-(heterocyclicaminoalkyl)-alkylenediamines"", 'and', 'therapeutic', 'uses', 'therefor']",1
US3205449A,1963-06-21,D.c. pumped electrostatically focused parametric amplifier,"['PROPN', 'PUNCT', 'VERB', 'ADV', 'VERB', 'ADJ', 'ADP']",['PERSON'],1,1,8,"['d.c.', 'pumped', 'electrostatically', 'focused', 'parametric', 'amplifier']",1
US3206371A,1962-12-28,Method of operating a reactor during start-up or shut-down,"['PROPN', 'ADP', 'VERB', 'DET', 'NOUN', 'ADP', 'NOUN', 'PUNCT', 'NOUN', 'CCONJ', 'VERB', 'PUNCT', 'ADP']",[],1,0,14,"['method', 'of', 'operating', 'a', 'reactor', 'during', 'start-up', 'or', 'shut-down']",1
US3207100A,1963-02-28,Shelf brackets and assemblies therewith,"['PROPN', 'NOUN', 'CCONJ', 'NOUN', 'ADP']",[],1,0,6,"['shelf', 'brackets', 'and', 'assemblies', 'therewith']",1
US3208134A,1961-11-30,Method of replacing worn parts in automobile assemblies and the tools therefor,"['PROPN', 'ADP', 'VERB', 'VERB', 'NOUN', 'ADP', 'NOUN', 'NOUN', 'CCONJ', 'DET', 'NOUN', 'CCONJ']",[],1,0,13,"['method', 'of', 'replacing', 'worn', 'parts', 'in', 'automobile', 'assemblies', 'and', 'the', 'tools', 'therefor']",1
US3208523A,1962-03-01,Method of recovering lost circulation in drilling wells and fluid therefor,"['PROPN', 'ADP', 'VERB', 'VERB', 'NOUN', 'ADP', 'VERB', 'NOUN', 'CCONJ', 'NOUN', 'ADP']",[],1,0,12,"['method', 'of', 'recovering', 'lost', 'circulation', 'in', 'drilling', 'wells', 'and', 'fluid', 'therefor']",1
US3209136A,1963-05-28,Remote control movement system including a unit for variably positioning a light source device and a controller therefor,"['PROPN', 'NOUN', 'NOUN', 'NOUN', 'VERB', 'DET', 'NOUN', 'ADP', 'ADV', 'VERB', 'DET', 'ADJ', 'NOUN', 'NOUN', 'CCONJ', 'DET', 'NOUN', 'ADP']",[],1,0,19,"['remote', 'control', 'movement', 'system', 'including', 'a', 'unit', 'for', 'variably', 'positioning', 'a', 'light', 'source', 'device', 'and', 'a', 'controller', 'therefor']",1
US3209495A,1962-08-27,Belt abrader,"['PROPN', 'ADP']",[],1,0,3,"['belt', 'abrader']",1
US3209650A,1963-04-30,Gun perforator and explosive projectile therefor,"['PROPN', 'NOUN', 'CCONJ', 'ADJ', 'NOUN', 'ADP']",[],1,0,7,"['gun', 'perforator', 'and', 'explosive', 'projectile', 'therefor']",1
US3209775A,1962-12-07,Bias device for pure fluid amplifier,"['PROPN', 'NOUN', 'ADP', 'ADJ', 'NOUN', 'ADP']",['PERSON'],1,1,7,"['bias', 'device', 'for', 'pure', 'fluid', 'amplifier']",1
US3209976A,1963-09-03,Hem pinning implement,"['PROPN', 'VERB', 'ADP']",['PERSON'],1,1,4,"['hem', 'pinning', 'implement']",1
US3210231A,1960-06-03,Apparatus for securing a plurality of units in abutting relationship with one another,"['PROPN', 'ADP', 'VERB', 'DET', 'NOUN', 'ADP', 'NOUN', 'ADP', 'VERB', 'NOUN', 'ADP', 'NUM', 'DET']",[],1,0,14,"['apparatus', 'for', 'securing', 'a', 'plurality', 'of', 'units', 'in', 'abutting', 'relationship', 'with', 'one', 'another']",1
US3210317A,1960-06-15,Crystalline polyolefins stabilized with tetrapropenylsuccinic anhydride,"['PROPN', 'NOUN', 'VERB', 'ADP', 'ADJ', 'ADP']",['ORG'],1,0,7,"['crystalline', 'polyolefins', 'stabilized', 'with', 'tetrapropenylsuccinic', 'anhydride']",1
US3210341A,1963-03-29,"9, 11-epoxy-6-fluoro-delta4, 16-pregnadienes and products produced therefrom","['NUM', 'PUNCT', 'NUM', 'PUNCT', 'SPACE', 'PUNCT', 'NOUN', 'PUNCT', 'PROPN', 'PUNCT', 'NUM', 'PUNCT', 'NOUN', 'CCONJ', 'NOUN', 'VERB', 'ADP']","['CARDINAL', 'CARDINAL', 'CARDINAL']",1,0,18,"['9,', '11-epoxy-6-fluoro-delta4,', '16-pregnadienes', 'and', 'products', 'produced', 'therefrom']",1
US3210398A,1963-01-14,Pentaerythritol bis-hydrogen thiophosphite and process therefor,"['PROPN', 'ADJ', 'PUNCT', 'NOUN', 'NOUN', 'CCONJ', 'NOUN', 'ADP']",['PERSON'],1,1,9,"['pentaerythritol', 'bis-hydrogen', 'thiophosphite', 'and', 'process', 'therefor']",1
US3210478A,1962-10-16,Communication switching system and outlet testing circuit arrangement therefor,"['NOUN', 'NOUN', 'NOUN', 'CCONJ', 'NOUN', 'PROPN', 'NOUN', 'NOUN', 'ADP']",[],1,0,10,"['communication', 'switching', 'system', 'and', 'outlet', 'testing', 'circuit', 'arrangement', 'therefor']",1
US3210587A,1962-10-16,Lamp mount and component therefor,"['PROPN', 'PROPN', 'CCONJ', 'NOUN', 'ADP']",[],1,0,6,"['lamp', 'mount', 'and', 'component', 'therefor']",1
US3210678A,1962-08-09,Feedback stabilized direct coupled amplifier,"['PROPN', 'VERB', 'ADJ', 'VERB', 'ADP']",[],1,0,6,"['feedback', 'stabilized', 'direct', 'coupled', 'amplifier']",1
US3211421A,1961-09-18,Rotary plug valve and seat therefor,"['PROPN', 'NOUN', 'NOUN', 'CCONJ', 'NOUN', 'ADP']",[],1,0,7,"['rotary', 'plug', 'valve', 'and', 'seat', 'therefor']",1
US3212181A,1962-05-14,Method of locating drill jig parts in making a drill jig,"['PROPN', 'ADP', 'NOUN', 'NOUN', 'ADP', 'NOUN', 'ADP', 'VERB', 'DET', 'NOUN', 'ADP']",[],1,0,12,"['method', 'of', 'locating', 'drill', 'jig', 'parts', 'in', 'making', 'a', 'drill', 'jig']",1
US3212428A,1960-04-21,Baling structure and venting means therefor,"['PROPN', 'NOUN', 'CCONJ', 'NOUN', 'NOUN', 'ADP']",[],1,0,7,"['baling', 'structure', 'and', 'venting', 'means', 'therefor']",1
US3212433A,1960-04-21,Baling structure and controls therefor,"['PROPN', 'NOUN', 'CCONJ', 'NOUN', 'ADP']",[],1,0,6,"['baling', 'structure', 'and', 'controls', 'therefor']",1
US3213044A,1957-01-22,Process of preparing a resinous microcapillary body and product obtained therefrom,"['PROPN', 'ADP', 'VERB', 'DET', 'ADJ', 'ADJ', 'NOUN', 'CCONJ', 'NOUN', 'VERB', 'ADP']",[],1,0,12,"['process', 'of', 'preparing', 'a', 'resinous', 'microcapillary', 'body', 'and', 'product', 'obtained', 'therefrom']",1
US3213434A,1961-06-12,Mono-selected matrix and storage element therefor,"['PROPN', 'PUNCT', 'VERB', 'NOUN', 'CCONJ', 'NOUN', 'NOUN', 'ADP']",[],1,0,9,"['mono-selected', 'matrix', 'and', 'storage', 'element', 'therefor']",1
US3214526A,1961-12-29,Echo suppressor with improved break-in,"['PROPN', 'NOUN', 'ADP', 'ADJ', 'NOUN', 'PUNCT', 'ADP']",['GPE'],1,0,8,"['echo', 'suppressor', 'with', 'improved', 'break-in']",1
US3214900A,1962-03-16,Beaded strand and connector therefor,"['PROPN', 'NOUN', 'CCONJ', 'NOUN', 'ADP']",[],1,0,6,"['beaded', 'strand', 'and', 'connector', 'therefor']",1
US3215540A,1962-11-02,Process of curing meat and composition therefor,"['PROPN', 'ADP', 'VERB', 'NOUN', 'CCONJ', 'NOUN', 'ADP']",[],1,0,8,"['process', 'of', 'curing', 'meat', 'and', 'composition', 'therefor']",1
US3215560A,1963-09-27,Method of cleaning hot air furnaces and duct systems associated therewith,"['PROPN', 'ADP', 'VERB', 'ADJ', 'NOUN', 'NOUN', 'CCONJ', 'NOUN', 'NOUN', 'VERB', 'ADP']",[],1,0,12,"['method', 'of', 'cleaning', 'hot', 'air', 'furnaces', 'and', 'duct', 'systems', 'associated', 'therewith']",1
US3215670A,1961-05-12,"Polymers of alkenyl epoxyhydrocarbyl ethers and conjugated diolefins, and cured products obtained therefrom","['NOUN', 'ADP', 'PROPN', 'NOUN', 'NOUN', 'CCONJ', 'VERB', 'NOUN', 'PUNCT', 'CCONJ', 'VERB', 'NOUN', 'VERB', 'ADP']",[],1,0,15,"['polymers', 'of', 'alkenyl', 'epoxyhydrocarbyl', 'ethers', 'and', 'conjugated', 'diolefins,', 'and', 'cured', 'products', 'obtained', 'therefrom']",1
US3215976A,1962-08-30,Method for surveying and searching the ocean bottom and recovering objects therefrom,"['PROPN', 'ADP', 'NOUN', 'CCONJ', 'VERB', 'DET', 'NOUN', 'NOUN', 'CCONJ', 'VERB', 'NOUN', 'ADP']",[],1,0,13,"['method', 'for', 'surveying', 'and', 'searching', 'the', 'ocean', 'bottom', 'and', 'recovering', 'objects', 'therefrom']",1
US3216774A,1964-04-01,Removable wall panel and separate cabinet simulating fireplace and flue therefor,"['ADJ', 'NOUN', 'PROPN', 'CCONJ', 'ADJ', 'NOUN', 'VERB', 'NOUN', 'CCONJ', 'NOUN', 'ADP']",[],1,0,12,"['removable', 'wall', 'panel', 'and', 'separate', 'cabinet', 'simulating', 'fireplace', 'and', 'flue', 'therefor']",1
US3216873A,1961-08-04,Method of etching photoengraving plates and etching solution used therefor,"['PROPN', 'ADP', 'VERB', 'NOUN', 'NOUN', 'CCONJ', 'VERB', 'NOUN', 'VERB', 'ADP']",[],1,0,11,"['method', 'of', 'etching', 'photoengraving', 'plates', 'and', 'etching', 'solution', 'used', 'therefor']",1
US3217774A,1961-01-06,Fastener and retaining means therefor,"['PROPN', 'CCONJ', 'VERB', 'NOUN', 'ADP']",[],1,0,6,"['fastener', 'and', 'retaining', 'means', 'therefor']",1
US3218014A,1963-05-31,Trash bag holder and trash bag therefor,"['PROPN', 'NOUN', 'NOUN', 'CCONJ', 'NOUN', 'NOUN', 'ADP']",[],1,0,8,"['trash', 'bag', 'holder', 'and', 'trash', 'bag', 'therefor']",1
US3218190A,1955-07-05,Method of preparing reenforced synthetic resinous articles and catalyst impregnated reenforcing matrix therefor,"['PROPN', 'ADP', 'VERB', 'VERB', 'ADJ', 'ADJ', 'NOUN', 'CCONJ', 'NOUN', 'VERB', 'NOUN', 'NOUN', 'ADP']",[],1,0,14,"['method', 'of', 'preparing', 'reenforced', 'synthetic', 'resinous', 'articles', 'and', 'catalyst', 'impregnated', 'reenforcing', 'matrix', 'therefor']",1
US3218232A,1962-11-09,Method for relieving depression and composition therefor,"['PROPN', 'ADP', 'VERB', 'NOUN', 'CCONJ', 'NOUN', 'ADP']",[],1,0,8,"['method', 'for', 'relieving', 'depression', 'and', 'composition', 'therefor']",1
US3218345A,1962-07-17,Poly (isocyanatoethyl) amines and process therefor,"['ADJ', 'PUNCT', 'PROPN', 'PUNCT', 'NOUN', 'CCONJ', 'NOUN', 'ADP']",[],1,0,9,"['poly', '(isocyanatoethyl)', 'amines', 'and', 'process', 'therefor']",1
US3218369A,1960-01-20,"Blend of brominated polygylcidyl ether, a liquid epoxycyclohexane resin and a liquidaliphatic polyglycidyl ether","['PROPN', 'ADP', 'VERB', 'PROPN', 'ADV', 'PUNCT', 'DET', 'ADJ', 'ADJ', 'NOUN', 'CCONJ', 'DET', 'ADJ', 'NOUN', 'ADP']",[],1,0,16,"['blend', 'of', 'brominated', 'polygylcidyl', 'ether,', 'a', 'liquid', 'epoxycyclohexane', 'resin', 'and', 'a', 'liquidaliphatic', 'polyglycidyl', 'ether']",1
US3218495A,1962-12-06,Arc tube mount and component therefor,"['PROPN', 'PROPN', 'PROPN', 'CCONJ', 'NOUN', 'ADP']",[],1,0,7,"['arc', 'tube', 'mount', 'and', 'component', 'therefor']",1
US3218566A,1960-03-11,Apparatus for stabilizing high-gain direct current transistorized summing amplifier,"['PROPN', 'ADP', 'VERB', 'ADJ', 'PUNCT', 'NOUN', 'ADJ', 'ADJ', 'VERB', 'NOUN', 'ADP']",[],1,0,12,"['apparatus', 'for', 'stabilizing', 'high-gain', 'direct', 'current', 'transistorized', 'summing', 'amplifier']",1
US3219199A,1962-06-01,Method for loading mine cars and loading apparatus therefor,"['PROPN', 'ADP', 'VERB', 'NOUN', 'NOUN', 'CCONJ', 'NOUN', 'NOUN', 'ADP']",[],1,0,10,"['method', 'for', 'loading', 'mine', 'cars', 'and', 'loading', 'apparatus', 'therefor']",1
US3219490A,1960-05-13,Method of extrusion and extrusion billet therefor,"['PROPN', 'ADP', 'NOUN', 'CCONJ', 'NOUN', 'NOUN', 'ADP']",[],1,0,8,"['method', 'of', 'extrusion', 'and', 'extrusion', 'billet', 'therefor']",1
US3219656A,1963-08-12,Alkylpolyalkoxyalkyl glucosides and process of preparation therefor,"['PROPN', 'VERB', 'CCONJ', 'NOUN', 'ADP', 'NOUN', 'ADP']",[],1,0,8,"['alkylpolyalkoxyalkyl', 'glucosides', 'and', 'process', 'of', 'preparation', 'therefor']",1
US3219661A,1962-12-14,Spirooxindole and spirodehydroindole alkaloids and process therefor,"['PROPN', 'CCONJ', 'ADJ', 'NOUN', 'CCONJ', 'NOUN', 'ADP']",[],1,0,8,"['spirooxindole', 'and', 'spirodehydroindole', 'alkaloids', 'and', 'process', 'therefor']",1
US3219790A,1964-07-30,Fastener and electrode therefor,"['PROPN', 'CCONJ', 'NOUN', 'ADP']",[],1,0,5,"['fastener', 'and', 'electrode', 'therefor']",1
US3220475A,1963-10-11,Method for fluid pressure fracturing of formation and fluid recovery therefrom,"['PROPN', 'ADP', 'ADJ', 'NOUN', 'NOUN', 'ADP', 'NOUN', 'CCONJ', 'ADJ', 'NOUN', 'ADP']",[],1,0,12,"['method', 'for', 'fluid', 'pressure', 'fracturing', 'of', 'formation', 'and', 'fluid', 'recovery', 'therefrom']",1
US3220476A,1963-10-11,Method for fluid pressure vibratory fracture of formations and fluid recovery therefrom,"['PROPN', 'ADP', 'ADJ', 'NOUN', 'NOUN', 'NOUN', 'ADP', 'NOUN', 'CCONJ', 'ADJ', 'NOUN', 'ADP']",[],1,0,13,"['method', 'for', 'fluid', 'pressure', 'vibratory', 'fracture', 'of', 'formations', 'and', 'fluid', 'recovery', 'therefrom']",1
US3220852A,1963-02-04,Process for producing an expanded foodstuff and an intermediate therefor,"['PROPN', 'ADP', 'VERB', 'DET', 'VERB', 'NOUN', 'CCONJ', 'DET', 'ADJ', 'ADP']",[],1,0,11,"['process', 'for', 'producing', 'an', 'expanded', 'foodstuff', 'and', 'an', 'intermediate', 'therefor']",1
US3222302A,1961-04-19,Method of foaming organo-plastic synthetic resins and products produced therefrom,"['PROPN', 'ADP', 'VERB', 'NOUN', 'PUNCT', 'ADJ', 'ADJ', 'NOUN', 'CCONJ', 'NOUN', 'VERB', 'ADP']",[],1,0,13,"['method', 'of', 'foaming', 'organo-plastic', 'synthetic', 'resins', 'and', 'products', 'produced', 'therefrom']",1
US3222764A,1962-02-28,Method of making articles having base layers and integral fins projecting therefrom,"['PROPN', 'ADP', 'VERB', 'NOUN', 'VERB', 'NOUN', 'NOUN', 'CCONJ', 'ADJ', 'NOUN', 'VERB', 'ADP']",[],1,0,13,"['method', 'of', 'making', 'articles', 'having', 'base', 'layers', 'and', 'integral', 'fins', 'projecting', 'therefrom']",1
US3222840A,1962-03-09,Wall structure and building block therefor,"['PROPN', 'NOUN', 'CCONJ', 'NOUN', 'NOUN', 'ADP']",[],1,0,7,"['wall', 'structure', 'and', 'building', 'block', 'therefor']",1
US3223527A,1960-05-12,Process for the production of photographic images by the silver dyestuff bleaching process and photographic layers therefor,"['NOUN', 'ADP', 'DET', 'NOUN', 'ADP', 'ADJ', 'NOUN', 'ADP', 'DET', 'PROPN', 'PROPN', 'NOUN', 'NOUN', 'CCONJ', 'ADJ', 'NOUN', 'ADP']",[],1,0,18,"['process', 'for', 'the', 'production', 'of', 'photographic', 'images', 'by', 'the', 'silver', 'dyestuff', 'bleaching', 'process', 'and', 'photographic', 'layers', 'therefor']",1
US3223669A,1962-11-13,Pigment pad-dyeing compositions and textiles decorated therewith,"['PROPN', 'NOUN', 'PUNCT', 'NOUN', 'NOUN', 'CCONJ', 'NOUN', 'VERB', 'ADP']",[],1,0,10,"['pigment', 'pad-dyeing', 'compositions', 'and', 'textiles', 'decorated', 'therewith']",1
US3225199A,1962-01-08,Radioisotope identifier,"['PROPN', 'ADP']",['PRODUCT'],1,0,3,"['radioisotope', 'identifier']",1
US3225265A,1961-09-08,Remote control electrical switch and radio frequency actuating system therefor,"['PROPN', 'VERB', 'ADJ', 'NOUN', 'CCONJ', 'NOUN', 'NOUN', 'VERB', 'NOUN', 'ADP']",[],1,0,11,"['remote', 'control', 'electrical', 'switch', 'and', 'radio', 'frequency', 'actuating', 'system', 'therefor']",1
US3225389A,1963-01-29,Cotton gin rotary brush means and brush strip holder therefor,"['NOUN', 'NOUN', 'NOUN', 'NOUN', 'VERB', 'CCONJ', 'PROPN', 'PROPN', 'PROPN', 'ADP']",['ORG'],1,0,11,"['cotton', 'gin', 'rotary', 'brush', 'means', 'and', 'brush', 'strip', 'holder', 'therefor']",1
US3226003A,1963-11-29,Carton and blank therefor,"['PROPN', 'CCONJ', 'ADJ', 'ADP']",['PERSON'],1,1,5,"['carton', 'and', 'blank', 'therefor']",1
US3226358A,1960-11-10,Ultraviolet light-absorbing epoxy resins and containers coated therewith,"['PROPN', 'NOUN', 'PUNCT', 'VERB', 'NOUN', 'NOUN', 'CCONJ', 'NOUN', 'VERB', 'ADP']",[],1,0,11,"['ultraviolet', 'light-absorbing', 'epoxy', 'resins', 'and', 'containers', 'coated', 'therewith']",1
US3227020A,1963-09-23,Microtome blade holder and anti-roll means therefor,"['PROPN', 'NOUN', 'NOUN', 'CCONJ', 'ADJ', 'ADJ', 'ADJ', 'NOUN', 'ADP']",[],1,0,10,"['microtome', 'blade', 'holder', 'and', 'anti-roll', 'means', 'therefor']",1
US3227514A,1960-11-28,Method and apparatus of continuously obtaining uranium dioxide with predetermined characteristics from uranium trioxide,"['PROPN', 'CCONJ', 'NOUN', 'ADP', 'ADV', 'VERB', 'NOUN', 'NOUN', 'ADP', 'VERB', 'NOUN', 'ADP', 'NOUN', 'ADP']",[],1,0,15,"['method', 'and', 'apparatus', 'of', 'continuously', 'obtaining', 'uranium', 'dioxide', 'with', 'predetermined', 'characteristics', 'from', 'uranium', 'trioxide']",1
US3227607A,1963-10-15,Method of adding silica pigments to newsprint pulp to improve ink strike properties of the newsprint and pigment therefor,"['PROPN', 'ADP', 'VERB', 'PROPN', 'NOUN', 'PART', 'VERB', 'NOUN', 'PART', 'VERB', 'NOUN', 'NOUN', 'NOUN', 'ADP', 'DET', 'NOUN', 'CCONJ', 'NOUN', 'ADP']",[],1,0,20,"['method', 'of', 'adding', 'silica', 'pigments', 'to', 'newsprint', 'pulp', 'to', 'improve', 'ink', 'strike', 'properties', 'of', 'the', 'newsprint', 'and', 'pigment', 'therefor']",1
US3227883A,1960-01-04,Electroluminescent light amplifier,"['PROPN', 'NOUN', 'ADP']",[],1,0,4,"['electroluminescent', 'light', 'amplifier']",1
US3227959A,1960-05-13,Crossed fields electron beam parametric amplifier,"['VERB', 'NOUN', 'PROPN', 'PROPN', 'NOUN', 'ADP']",[],1,0,7,"['crossed', 'fields', 'electron', 'beam', 'parametric', 'amplifier']",1
US3228608A,1961-04-26,Electrophotographic developer electrode,"['PROPN', 'NOUN', 'ADP']",[],1,0,4,"['electrophotographic', 'developer', 'electrode']",1
US3228809A,1953-12-09,Method of regulating an electric glow discharge and discharge vessel therefor,"['PROPN', 'ADP', 'VERB', 'DET', 'ADJ', 'NOUN', 'NOUN', 'CCONJ', 'VERB', 'NOUN', 'ADP']",[],1,0,12,"['method', 'of', 'regulating', 'an', 'electric', 'glow', 'discharge', 'and', 'discharge', 'vessel', 'therefor']",1
US3228878A,1963-05-06,Method and apparatus for treatment of flowing liquids to control deposition of solid matter therefrom,"['PROPN', 'CCONJ', 'NOUN', 'ADP', 'NOUN', 'ADP', 'VERB', 'NOUN', 'PART', 'VERB', 'NOUN', 'ADP', 'ADJ', 'NOUN', 'ADP']",[],1,0,16,"['method', 'and', 'apparatus', 'for', 'treatment', 'of', 'flowing', 'liquids', 'to', 'control', 'deposition', 'of', 'solid', 'matter', 'therefrom']",1
US3228896A,1961-05-16,Method of making microporous polyolefin articles and product therefrom,"['PROPN', 'ADP', 'VERB', 'ADJ', 'NOUN', 'NOUN', 'CCONJ', 'NOUN', 'ADP']",[],1,0,10,"['method', 'of', 'making', 'microporous', 'polyolefin', 'articles', 'and', 'product', 'therefrom']",1
US3229454A,1964-06-05,Guard shoe for preventing cam arm reversal on combine pick-up,"['PROPN', 'NOUN', 'ADP', 'VERB', 'NOUN', 'NOUN', 'NOUN', 'ADP', 'VERB', 'VERB', 'PUNCT', 'ADP']",[],1,0,13,"['guard', 'shoe', 'for', 'preventing', 'cam', 'arm', 'reversal', 'on', 'combine', 'pick-up']",1
US3230616A,1964-01-13,"Method of welding replacement elements such as grouser bars, drive sprocket rims, and replacement element therefor","['PROPN', 'ADP', 'NOUN', 'NOUN', 'NOUN', 'ADJ', 'ADP', 'NOUN', 'NOUN', 'PUNCT', 'VERB', 'NOUN', 'NOUN', 'PUNCT', 'CCONJ', 'NOUN', 'NOUN', 'ADP']",[],1,0,19,"['method', 'of', 'welding', 'replacement', 'elements', 'such', 'as', 'grouser', 'bars,', 'drive', 'sprocket', 'rims,', 'and', 'replacement', 'element', 'therefor']",1
US3231472A,1961-03-10,Method of increasing water-absorbing ability of human skin and composition therefor,"['PROPN', 'ADP', 'VERB', 'NOUN', 'PUNCT', 'VERB', 'NOUN', 'ADP', 'ADJ', 'NOUN', 'CCONJ', 'NOUN', 'ADP']",[],1,0,14,"['method', 'of', 'increasing', 'water-absorbing', 'ability', 'of', 'human', 'skin', 'and', 'composition', 'therefor']",1
US3231524A,1962-04-16,Method of foaming and extruding a blend of polymers and foamed article obtained therefrom,"['PROPN', 'ADP', 'VERB', 'CCONJ', 'VERB', 'DET', 'NOUN', 'ADP', 'NOUN', 'CCONJ', 'ADJ', 'NOUN', 'VERB', 'ADP']",[],1,0,15,"['method', 'of', 'foaming', 'and', 'extruding', 'a', 'blend', 'of', 'polymers', 'and', 'foamed', 'article', 'obtained', 'therefrom']",1
US3231569A,1964-05-19,"1alpha-halomethyl-16, 17-acetals and ketals of the pregnane series and intermediates therefor","['NOUN', 'NUM', 'PROPN', 'PUNCT', 'NUM', 'PUNCT', 'NOUN', 'CCONJ', 'NOUN', 'ADP', 'DET', 'NOUN', 'NOUN', 'CCONJ', 'NOUN', 'ADP']","['CARDINAL', 'CARDINAL']",1,0,17,"['1alpha-halomethyl-16,', '17-acetals', 'and', 'ketals', 'of', 'the', 'pregnane', 'series', 'and', 'intermediates', 'therefor']",1
US3231687A,1961-12-29,Echo suppressor with improved break-in,"['PROPN', 'NOUN', 'ADP', 'ADJ', 'NOUN', 'PUNCT', 'ADP']",['GPE'],1,0,8,"['echo', 'suppressor', 'with', 'improved', 'break-in']",1
US3231765A,1963-10-09,Pulse width control amplifier,"['PROPN', 'VERB', 'NOUN', 'ADP']",[],1,0,5,"['pulse', 'width', 'control', 'amplifier']",1
US3231825A,1960-11-14,D.c. pumped cyclotron wave parametric amplifier,"['PROPN', 'PUNCT', 'VERB', 'NOUN', 'NOUN', 'ADV', 'ADP']",['PERSON'],1,1,8,"['d.c.', 'pumped', 'cyclotron', 'wave', 'parametric', 'amplifier']",1
US3231849A,1956-10-08,Plug receiving receptacle and contact inserts therefor,"['PROPN', 'VERB', 'NOUN', 'CCONJ', 'NOUN', 'NOUN', 'ADP']",[],1,0,8,"['plug', 'receiving', 'receptacle', 'and', 'contact', 'inserts', 'therefor']",1
US3232949A,1961-10-12,Process of manufacturing branchedchain mono-olefinic aliphatic acids and intermediates therefor,"['PROPN', 'ADP', 'VERB', 'NOUN', 'PROPN', 'PUNCT', 'ADJ', 'ADJ', 'NOUN', 'CCONJ', 'NOUN', 'ADP']",[],1,0,13,"['process', 'of', 'manufacturing', 'branchedchain', 'mono-olefinic', 'aliphatic', 'acids', 'and', 'intermediates', 'therefor']",1
US3233187A,1962-03-06,Magneto-resistive amplifier,"['PROPN', 'PUNCT', 'NOUN', 'ADP']",[],1,0,5,"['magneto-resistive', 'amplifier']",1
US3233353A,1957-12-13,Toy gun and projectiles therefor,"['PROPN', 'NOUN', 'CCONJ', 'NOUN', 'ADP']",[],1,0,6,"['toy', 'gun', 'and', 'projectiles', 'therefor']",1
