patent_number,date,title,spacy_pos,spacy_label,is_prpn_spacy,is_person_spacy,spacy_pos_len,bad_endings
US3503034A,1967-06-07,Contact bridging connector utilizing electrically conductive fluid,"['NOUN', 'NOUN', 'NOUN', 'VERB', 'ADV', 'ADJ', 'NOUN']",[],0,0,8,1
US3503054A,1967-10-12,Domain wall propagation in magnetic shefts,"['NOUN', 'NOUN', 'NOUN', 'ADP', 'ADJ', 'NOUN']",[],0,0,7,1
US3503095A,1967-10-30,Injected parison blow molding apparatus,"['ADJ', 'NOUN', 'NOUN', 'NOUN', 'NOUN']",[],0,0,6,1
US3503153A,1966-06-18,Bee-line flow finishing apparatus,"['NOUN', 'PUNCT', 'NOUN', 'NOUN', 'VERB', 'NOUN']",[],0,0,7,1
US3503166A,1968-03-22,Architectural system of interior modular construction,"['ADJ', 'NOUN', 'ADP', 'ADJ', 'ADJ', 'NOUN']",[],0,0,7,1
US3503238A,1966-05-05,Manufacture of tubes,"['NOUN', 'ADP', 'NOUN']",[],0,0,4,1
US3503250A,1968-09-23,Filter for gravimetric determinations,"['NOUN', 'ADP', 'ADJ', 'NOUN']",[],0,0,5,1
US3503304A,1968-03-18,Power source,"['NOUN', 'NOUN']",[],0,0,3,1
US3503405A,1968-04-26,Multipurpose panty girdle type undergarment,"['ADJ', 'NOUN', 'NOUN', 'NOUN', 'NOUN']",[],0,0,6,1
US3503494A,1969-01-07,Dispensing package for aprons,"['VERB', 'NOUN', 'ADP', 'NOUN']",[],0,0,5,1
US3503495A,1968-11-29,Masking tape,"['VERB', 'NOUN']",[],0,0,3,1
US3503612A,1967-08-22,Word forming game apparatus,"['NOUN', 'VERB', 'NOUN', 'NOUN']",[],0,0,5,1
US3503688A,1966-08-15,Multiple axis laser angular rate sensor,"['ADJ', 'ADJ', 'NOUN', 'ADJ', 'NOUN', 'NOUN']",[],0,0,7,1
US3503691A,1968-09-13,Pressurized applicatory liquid feeding and applying apparatus,"['ADJ', 'NOUN', 'NOUN', 'VERB', 'CCONJ', 'VERB', 'NOUN']",['ORG'],0,0,8,1
US3503752A,1966-06-22,Process for enriching milk with proteins,"['NOUN', 'ADP', 'VERB', 'NOUN', 'ADP', 'NOUN']",[],0,0,7,1
US3503807A,1967-03-14,Storage battery having tubular type plates and unitary cover therefor,"['NOUN', 'NOUN', 'VERB', 'ADJ', 'NOUN', 'NOUN', 'CCONJ', 'ADJ', 'NOUN', 'ADP']",[],0,0,11,1
US3503832A,1965-04-07,Repetitive unit sculpturing apparatus,"['ADJ', 'NOUN', 'VERB', 'NOUN']",[],0,0,5,1
US3503926A,1968-05-17,Solid lubricant composition,"['ADJ', 'NOUN', 'NOUN']",[],0,0,4,1
US3503931A,1967-08-17,High molecular weight aromatic polyamides containing ether groups,"['ADJ', 'ADJ', 'NOUN', 'ADJ', 'NOUN', 'VERB', 'ADJ', 'NOUN']",[],0,0,9,1
US3503954A,1965-07-23,Water-insoluble monoazo dyestuffs,"['NOUN', 'PUNCT', 'ADJ', 'NOUN', 'NOUN']",[],0,0,6,1
US3504017A,1966-10-04,Polyfunctional carbonyl nitrile oxides,"['ADJ', 'NOUN', 'NOUN', 'VERB']",[],0,0,5,1
US3504087A,1966-08-06,6-substituted derivatives of 16-methyl-4-pregnene-3beta-ol-one,"['NUM', 'PUNCT', 'VERB', 'NOUN', 'ADP', 'NUM', 'PUNCT', 'SPACE', 'PUNCT', 'NOUN', 'PUNCT', 'NOUN', 'PUNCT', 'NUM']","['CARDINAL', 'CARDINAL']",0,0,15,1
US3504106A,1969-05-02,Electrical bushings,"['ADJ', 'NOUN']",[],0,0,3,1
US3504247A,1966-02-23,Non-linear servo-control,"['ADJ', 'ADJ', 'ADJ', 'NOUN', 'PUNCT', 'NOUN']",[],0,0,7,1
US3504263A,1967-12-04,Self-oscillating switching type power supply,"['NOUN', 'PUNCT', 'VERB', 'NOUN', 'NOUN', 'NOUN', 'NOUN']",[],0,0,8,1
US3504319A,1968-10-25,Electrical transformer,"['ADJ', 'NOUN']",[],0,0,3,1
US3504336A,1965-09-02,Safety seat belt warning systems for passenger security,"['NOUN', 'NOUN', 'NOUN', 'NOUN', 'NOUN', 'ADP', 'NOUN', 'NOUN']",[],0,0,9,1
US3504568A,1968-01-26,Impact-absorbing steering shaft,"['NOUN', 'PUNCT', 'VERB', 'NOUN', 'NOUN']",[],0,0,6,1
US3504823A,1968-05-06,Container,['NOUN'],[],0,0,2,1
US3504824A,1968-06-05,Random access strip storage system,"['ADJ', 'NOUN', 'NOUN', 'NOUN', 'NOUN']",[],0,0,6,1
US3504861A,1962-10-16,Means for spraying fibers and resinous material,"['NOUN', 'ADP', 'VERB', 'NOUN', 'CCONJ', 'ADJ', 'NOUN']",[],0,0,8,1
US3505032A,1965-11-09,Heater immersed zone refined melt,"['NOUN', 'VERB', 'NOUN', 'VERB', 'VERB']",[],0,0,6,1
US3505061A,1964-07-13,Process of desulphurizing pig iron in the reduction of ore in a rotary furnace,"['NOUN', 'ADP', 'VERB', 'NOUN', 'NOUN', 'ADP', 'DET', 'NOUN', 'ADP', 'NOUN', 'ADP', 'DET', 'ADJ', 'NOUN']",[],0,0,15,1
US3505063A,1967-07-05,Condensation of magnesium vapors,"['NOUN', 'ADP', 'NOUN', 'NOUN']",[],0,0,5,1
US3505067A,1967-03-16,Alkylated poly-n-vinyl-lactam stabilized silver halide emulsions,"['VERB', 'ADJ', 'PUNCT', 'NOUN', 'PUNCT', 'NOUN', 'PUNCT', 'NOUN', 'VERB', 'ADJ', 'NOUN', 'NOUN']",[],0,0,13,1
US3505223A,1967-03-30,Lubricant compositions,"['ADJ', 'NOUN']",[],0,0,3,1
US3505395A,1966-10-13,Novel alkylarylsulfonates,"['NOUN', 'VERB']",[],0,0,3,1
US3505422A,1969-01-23,Dehydrogenation and methanation catalyst and process,"['NOUN', 'CCONJ', 'NOUN', 'NOUN', 'CCONJ', 'NOUN']",[],0,0,7,1
US3505536A,1967-02-03,"Frequency dividing circuit,with semiconductors","['NOUN', 'VERB', 'NOUN', 'PUNCT', 'ADP', 'NOUN']",[],0,0,7,1
US3505575A,1967-05-18,Multiple capacitor,"['ADJ', 'NOUN']",[],0,0,3,1
US3505696A,1965-10-01,Fugitive tinting of synthetic fibers,"['ADJ', 'NOUN', 'ADP', 'ADJ', 'NOUN']",[],0,0,6,1
US3505907A,1968-04-04,Transmission and controls,"['NOUN', 'CCONJ', 'VERB']",[],0,0,4,1
US3505921A,1969-03-21,Fastening device,"['VERB', 'NOUN']",[],0,0,3,1
US3506018A,1967-12-27,Smoke cooling cigarette holder,"['NOUN', 'VERB', 'NOUN', 'NOUN']",[],0,0,5,1
US3506019A,1967-12-08,Subdivided meat mixer and grinder,"['ADJ', 'NOUN', 'NOUN', 'CCONJ', 'VERB']",[],0,0,6,1
US3506026A,1967-03-15,Valves,['NOUN'],[],0,0,2,1
US3506122A,1968-12-06,Stepped rod deck screen,"['VERB', 'NOUN', 'NOUN', 'NOUN']",[],0,0,5,1
US3506258A,1967-10-06,Document feeding mechanism,"['NOUN', 'NOUN', 'NOUN']",[],0,0,4,1
US3506263A,1966-11-30,Golf tee ball guard and modified tee,"['NOUN', 'NOUN', 'NOUN', 'NOUN', 'CCONJ', 'VERB', 'NOUN']",[],0,0,8,1
US3506595A,1965-10-30,Photoconductive insulating material,"['ADJ', 'VERB', 'NOUN']",[],0,0,4,1
US3506596A,1967-10-11,Semiconducting ceramic compositions with positive temperature coefficient of resistance,"['VERB', 'ADJ', 'NOUN', 'ADP', 'ADJ', 'NOUN', 'NOUN', 'ADP', 'NOUN']",[],0,0,10,1
US3506896A,1966-06-23,Self adaptive control system with means for automatically matching control system parameters to changes in parameters of a controlled process,"['NOUN', 'ADJ', 'NOUN', 'NOUN', 'ADP', 'NOUN', 'ADP', 'ADV', 'VERB', 'NOUN', 'NOUN', 'NOUN', 'ADP', 'NOUN', 'ADP', 'NOUN', 'ADP', 'DET', 'VERB', 'NOUN']",[],0,0,21,1
US3506941A,1967-09-13,Thermal tripping device for circuit breaker,"['ADJ', 'NOUN', 'NOUN', 'ADP', 'NOUN', 'NOUN']",[],0,0,7,1
US3506942A,1967-10-19,Self-locking contact,"['NOUN', 'PUNCT', 'VERB', 'NOUN']",[],0,0,5,1
US3506946A,1967-08-10,Anti-arcing electrical connector,"['ADJ', 'ADJ', 'ADJ', 'ADJ', 'NOUN']",[],0,0,6,1
US3506947A,1968-03-18,Mounting for electrical terminal blocks and sockets and the like,"['VERB', 'ADP', 'ADJ', 'ADJ', 'NOUN', 'CCONJ', 'NOUN', 'CCONJ', 'DET', 'ADJ']",[],0,0,11,1
US3507064A,1968-02-07,Cardholder rack and cardholder therefor,"['NOUN', 'VERB', 'CCONJ', 'VERB', 'ADP']",['NORP'],0,0,6,1
US3507253A,1968-10-07,Aquarium air stone ornament,"['NOUN', 'NOUN', 'NOUN', 'ADJ']",[],0,0,5,1
US3507483A,1966-11-03,Axially reciprocating screw conveyor means for closing tap hole,"['ADV', 'VERB', 'NOUN', 'NOUN', 'VERB', 'ADP', 'VERB', 'NOUN', 'NOUN']",[],0,0,10,1
US3507492A,1967-10-06,Stacking machine with flow control system,"['VERB', 'NOUN', 'ADP', 'NOUN', 'NOUN', 'NOUN']",[],0,0,7,1
US3507800A,1966-10-05,Flame resistant peroxides,"['NOUN', 'ADJ', 'NOUN']",[],0,0,4,1
US3507934A,1965-12-20,Block copolymer compositions having improved processability,"['NOUN', 'NOUN', 'NOUN', 'AUX', 'VERB', 'NOUN']",[],0,0,7,1
US3507955A,1968-11-25,Silicone containing dentifrices,"['NOUN', 'VERB', 'NOUN']",[],0,0,4,1
US3507959A,1967-03-23,"6beta,7beta-epoxysteroids","['NUM', 'PUNCT', 'NOUN']",['CARDINAL'],0,0,4,1
US3508038A,1966-08-30,Multiplying apparatus for performing division using successive approximate reciprocals of a divisor,"['NOUN', 'NOUN', 'ADP', 'VERB', 'NOUN', 'VERB', 'ADJ', 'ADJ', 'NOUN', 'ADP', 'DET', 'NOUN']",[],0,0,13,1
US3508041A,1966-08-31,Flashing tie clasp,"['VERB', 'NOUN', 'NOUN']",[],0,0,4,1
US3508123A,1966-07-13,Oxide-type varactor with increased capacitance range,"['NOUN', 'PUNCT', 'NOUN', 'NOUN', 'ADP', 'VERB', 'NOUN', 'VERB']",[],0,0,9,1
US3508228A,1967-03-28,Digital coding scheme providing indicium at cell boundaries under prescribed circumstances to facilitate self-clocking,"['ADJ', 'VERB', 'NOUN', 'VERB', 'NOUN', 'ADP', 'NOUN', 'NOUN', 'ADP', 'ADJ', 'NOUN', 'PART', 'VERB', 'NOUN', 'PUNCT', 'VERB']",['ORG'],0,0,17,1
US3508234A,1967-05-26,Bed wetting alarm and trainer,"['NOUN', 'VERB', 'NOUN', 'CCONJ', 'NOUN']",[],0,0,6,1
US3508455A,1968-02-16,Combination tool,"['NOUN', 'NOUN']",[],0,0,3,1
US3508457A,1967-09-27,Process for constructing thin film inductors,"['NOUN', 'ADP', 'VERB', 'ADJ', 'NOUN', 'NOUN']",[],0,0,7,1
US3508582A,1968-03-11,Selective coupling apparatus,"['ADJ', 'NOUN', 'NOUN']",[],0,0,4,1
US3508684A,1966-11-23,Combination collapsible tube and aerosol dispenser,"['NOUN', 'ADJ', 'NOUN', 'CCONJ', 'VERB', 'NOUN']",[],0,0,7,1
US3508769A,1968-03-12,Hydrodynamic pipe coupling,"['ADJ', 'NOUN', 'VERB']",[],0,0,4,1
US3508861A,1965-09-02,Protection of zirconium alloys against hydriding in organic coolants,"['NOUN', 'ADP', 'NOUN', 'NOUN', 'ADP', 'VERB', 'ADP', 'ADJ', 'NOUN']",[],0,0,10,1
US3508901A,1967-11-13,Glass feeding stirrer,"['NOUN', 'NOUN', 'VERB']",['PERSON'],0,1,4,1
US3509569A,1968-07-01,Direction finding system,"['NOUN', 'NOUN', 'NOUN']",[],0,0,4,1
US3509742A,1966-10-05,Supporting structure for a washing machine,"['VERB', 'NOUN', 'ADP', 'DET', 'NOUN', 'NOUN']",[],0,0,7,1
US3509752A,1966-12-30,Ultrasonic thickness measuring apparatus,"['ADJ', 'NOUN', 'VERB', 'NOUN']",[],0,0,5,1
US3509809A,1966-05-18,Developing device for processing copying materials,"['VERB', 'NOUN', 'ADP', 'NOUN', 'NOUN', 'NOUN']",[],0,0,7,1
US3509852A,1967-11-24,Glass container coating machine,"['NOUN', 'NOUN', 'NOUN', 'NOUN']",['PERSON'],0,1,5,1
US3509984A,1968-05-06,Article orienting conveyor,"['NOUN', 'VERB', 'NOUN']",[],0,0,4,1
US3510100A,1966-07-22,Zero leakage poppet valve,"['NUM', 'NOUN', 'NOUN', 'VERB']",['CARDINAL'],0,0,5,1
US3510101A,1967-02-16,High-pressure valve,"['ADJ', 'PUNCT', 'NOUN', 'NOUN']",[],0,0,5,1
US3510468A,1969-02-19,Recovery of fatty and rosin acids,"['NOUN', 'ADP', 'NOUN', 'CCONJ', 'NOUN', 'NOUN']",[],0,0,7,1
US3511183A,1968-03-06,Safety and arming mechanism for fuze,"['NOUN', 'CCONJ', 'VERB', 'NOUN', 'ADP', 'NOUN']",[],0,0,7,1
US3511342A,1965-10-08,Elevator control for ascertaining the capability of cars to serve hall calls,"['NOUN', 'NOUN', 'ADP', 'VERB', 'DET', 'NOUN', 'ADP', 'NOUN', 'PART', 'VERB', 'NOUN', 'VERB']",[],0,0,13,1
US3511346A,1967-09-18,Brake-actuation device,"['NOUN', 'PUNCT', 'NOUN', 'NOUN']",[],0,0,5,1
US3511379A,1967-03-27,Dirt trap,"['NOUN', 'VERB']",['PERSON'],0,1,3,1
US3511381A,1967-03-06,Dialysis blood distribution grooves,"['NOUN', 'NOUN', 'NOUN', 'VERB']",[],0,0,5,1
US3511401A,1967-07-20,Pressure-resistant plastics bottle,"['NOUN', 'PUNCT', 'ADJ', 'NOUN', 'NOUN']",[],0,0,6,1
US3511502A,1967-02-22,Machines for the stringing of tennis rackets,"['NOUN', 'ADP', 'DET', 'NOUN', 'ADP', 'NOUN', 'NOUN']",[],0,0,8,1
US3511577A,1968-04-10,Turbine nozzle construction,"['NOUN', 'NOUN', 'NOUN']",[],0,0,4,1
US3511588A,1968-02-28,Burner construction having electrical spark ignition means,"['ADJ', 'NOUN', 'VERB', 'ADJ', 'NOUN', 'NOUN', 'VERB']",['GPE'],0,0,8,1
US3511772A,1968-11-19,Hydrocracking,['NOUN'],[],0,0,2,1
US3511907A,1965-12-13,Animal feed components comprising a biologically active substance and an aminopolyamide resin,"['NOUN', 'NOUN', 'NOUN', 'VERB', 'DET', 'ADV', 'ADJ', 'NOUN', 'CCONJ', 'DET', 'ADJ', 'NOUN']",[],0,0,13,1
US3511952A,1967-05-15,Electrical switches,"['ADJ', 'NOUN']",[],0,0,3,1
US3511957A,1965-02-02,Device for improving efficiency of radio-frequency welding,"['NOUN', 'ADP', 'VERB', 'NOUN', 'ADP', 'NOUN', 'PUNCT', 'NOUN', 'NOUN']",[],0,0,10,1
US3511998A,1966-03-18,Acquisition system,"['NOUN', 'NOUN']",[],0,0,3,1
US3512082A,1967-03-21,Roof rack for cars,"['NOUN', 'VERB', 'ADP', 'NOUN']",[],0,0,5,1
US3512173A,1967-12-28,Alphanumeric ink droplet recorder,"['ADJ', 'NOUN', 'NOUN', 'NOUN']",[],0,0,5,1
US3512277A,1967-03-15,Control system for two-engine vehicle,"['NOUN', 'NOUN', 'ADP', 'NUM', 'PUNCT', 'NOUN', 'NOUN']",['CARDINAL'],0,0,8,1
US3512613A,1968-07-03,Wheel chock and traction device for vehicles,"['NOUN', 'NOUN', 'CCONJ', 'NOUN', 'NOUN', 'ADP', 'NOUN']",[],0,0,8,1
US3512853A,1968-05-29,Water and lubricant sealing means for mill rolls,"['NOUN', 'CCONJ', 'NOUN', 'NOUN', 'NOUN', 'ADP', 'NOUN', 'NOUN']",[],0,0,9,1
US3513064A,1966-04-27,Composite polyfluorocarbon sheet material,"['ADJ', 'NOUN', 'NOUN', 'NOUN']",[],0,0,5,1
US3513073A,1968-07-01,Novel lipase composition and method for producing same,"['ADJ', 'NOUN', 'NOUN', 'CCONJ', 'NOUN', 'ADP', 'VERB', 'ADJ']",[],0,0,9,1
US3513188A,1964-03-09,Polyoxaalkylene ethers of phenyl carboxylic acids and derivatives,"['ADJ', 'NOUN', 'ADP', 'NOUN', 'ADJ', 'NOUN', 'CCONJ', 'VERB']",['ORG'],0,0,9,1
US3513189A,1968-04-05,Preparation of acetoacetic esters,"['NOUN', 'ADP', 'ADJ', 'NOUN']",[],0,0,5,1
US3513216A,1968-03-28,Dehydrogenation process,"['NOUN', 'NOUN']",[],0,0,3,1
US3513252A,1969-04-07,Insulated aluminum alloy magnet wire,"['ADJ', 'NOUN', 'NOUN', 'NOUN', 'NOUN']",[],0,0,6,1
US3513365A,1968-06-24,Field-effect integrated circuit and method of fabrication,"['NOUN', 'PUNCT', 'NOUN', 'VERB', 'NOUN', 'CCONJ', 'NOUN', 'ADP', 'NOUN']",[],0,0,10,1
US3513474A,1967-01-09,Collapsible hyperbolic reflector formed of spaced wires,"['ADJ', 'ADJ', 'NOUN', 'VERB', 'ADP', 'VERB', 'NOUN']",[],0,0,8,1
US3513578A,1968-06-26,Price indicator,"['NOUN', 'NOUN']",[],0,0,3,1
US3513579A,1967-12-29,Calendar with picture complement,"['NOUN', 'ADP', 'NOUN', 'NOUN']",[],0,0,5,1
US3513859A,1967-11-06,Filter for smoking devices,"['NOUN', 'ADP', 'NOUN', 'NOUN']",[],0,0,5,1
US3513872A,1968-12-06,Anti-syphon valve,"['ADJ', 'ADJ', 'ADJ', 'NOUN']",[],0,0,5,1
US3513879A,1967-08-16,Ported disc valve,"['VERB', 'NOUN', 'NOUN']",[],0,0,4,1
US3514192A,1967-04-11,Achromatic variable-angle fluid prism,"['ADJ', 'ADJ', 'PUNCT', 'NOUN', 'ADJ', 'NOUN']",[],0,0,7,1
US3514307A,1966-10-03,Artificial suede from sanded polymer containing textile flock and method for producing the same,"['ADJ', 'NOUN', 'ADP', 'ADJ', 'NOUN', 'VERB', 'NOUN', 'NOUN', 'CCONJ', 'NOUN', 'ADP', 'VERB', 'DET', 'ADJ']",[],0,0,15,1
US3514417A,1964-10-26,Ethylene,['NOUN'],[],0,0,1,1
US3514478A,1966-09-15,Production of aromatic nitriles from n-formylated primary amino compounds in contact with a silicate catalyst,"['NOUN', 'ADP', 'ADJ', 'NOUN', 'ADP', 'ADV', 'PUNCT', 'VERB', 'ADJ', 'NOUN', 'NOUN', 'ADP', 'NOUN', 'ADP', 'DET', 'ADJ', 'NOUN']",[],0,0,18,1
US3514616A,1969-02-26,Rapid access character memory,"['ADJ', 'NOUN', 'NOUN', 'NOUN']",[],0,0,5,1
US3514623A,1967-11-20,Control system for operating electrical automotive accessories independently of other automotive accessories,"['NOUN', 'NOUN', 'ADP', 'VERB', 'ADJ', 'ADJ', 'NOUN', 'ADV', 'ADP', 'ADJ', 'ADJ', 'NOUN']",[],0,0,13,1
US3514772A,1968-05-17,Communication apparatus in a computer system,"['NOUN', 'NOUN', 'ADP', 'DET', 'NOUN', 'NOUN']",[],0,0,7,1
US3514862A,1967-02-17,Super-flevation and gradient measuring devices for track,"['ADJ', 'NOUN', 'NOUN', 'CCONJ', 'ADJ', 'NOUN', 'NOUN', 'ADP', 'NOUN']",[],0,0,10,1
US3514864A,1967-09-27,Extensometer,['NOUN'],[],0,0,2,1
US3514902A,1969-02-14,Top door mechanism for top loading refuse vehicle,"['ADJ', 'NOUN', 'NOUN', 'ADP', 'ADJ', 'NOUN', 'NOUN', 'NOUN']",[],0,0,9,1
US3514977A,1965-09-04,Full fashioned knitting machine,"['ADJ', 'ADJ', 'NOUN', 'NOUN']",[],0,0,5,1
US3514982A,1967-10-16,Lock with adjustable tumbler assembly,"['VERB', 'ADP', 'ADJ', 'NOUN', 'NOUN']",[],0,0,6,1
US3514986A,1966-06-02,Cooling means for extruded material,"['VERB', 'NOUN', 'ADP', 'ADJ', 'NOUN']",[],0,0,6,1
US3515073A,1966-09-14,Transport facilities with fluid sustained vehicle,"['NOUN', 'NOUN', 'ADP', 'ADJ', 'VERB', 'NOUN']",[],0,0,7,1
US3515229A,1968-05-22,Hydraulic bucket drill,"['ADJ', 'NOUN', 'VERB']",[],0,0,4,1
US3515247A,1968-07-05,Safety device for a winch,"['NOUN', 'NOUN', 'ADP', 'DET', 'NOUN']",[],0,0,6,1
US3515454A,1966-10-21,System for artificially seeing in three dimensions without using glasses or other interpreting means,"['NOUN', 'ADP', 'ADV', 'VERB', 'ADP', 'NUM', 'NOUN', 'ADP', 'VERB', 'NOUN', 'CCONJ', 'ADJ', 'NOUN', 'VERB']",['CARDINAL'],0,0,15,1
US3516058A,1966-06-24,Dual warning indicator device,"['ADJ', 'NOUN', 'NOUN', 'NOUN']",[],0,0,5,1
US3516391A,1968-06-20,Steam generating unit,"['NOUN', 'NOUN', 'NOUN']",[],0,0,4,1
US3516492A,1968-05-23,Underwater wellhead connector,"['ADJ', 'NOUN', 'NOUN']",[],0,0,4,1
US3516654A,1968-04-18,Sheet sorter having automatic sheet feed control and restart,"['NOUN', 'NOUN', 'VERB', 'ADJ', 'NOUN', 'NOUN', 'NOUN', 'CCONJ', 'VERB']",[],0,0,10,1
US3516705A,1968-05-22,Mobile home,"['ADJ', 'NOUN']",['GPE'],0,0,3,1
US3516967A,1968-10-28,Polyiminoimide and polyamide nitrile compositions,"['ADJ', 'CCONJ', 'NOUN', 'ADJ', 'VERB']",[],0,0,6,1
US3517062A,1966-08-05,"Process for the preparation of substantially pure 4,4'-diaminodiphenylmethane","['NOUN', 'ADP', 'DET', 'NOUN', 'ADP', 'ADV', 'ADJ', 'NUM']",[],0,0,9,1
US3517092A,1968-04-15,Process for preparing high-density isotropic graphite structures,"['NOUN', 'ADP', 'VERB', 'ADJ', 'PUNCT', 'NOUN', 'ADJ', 'NOUN', 'NOUN']",[],0,0,10,1
US3517099A,1968-06-10,Production of a cycloserine-o-carbamyl-d-serine composition,"['NOUN', 'ADP', 'DET', 'ADJ', 'PUNCT', 'NOUN', 'PUNCT', 'NOUN', 'PUNCT', 'NOUN', 'PUNCT', 'NOUN', 'NOUN']",[],0,0,14,1
US3517151A,1968-09-03,Heat storage,"['NOUN', 'NOUN']",[],0,0,3,1
US3517506A,1967-10-25,Fuel control governor,"['NOUN', 'NOUN', 'NOUN']",[],0,0,4,1
US3517570A,1968-08-07,Multi-position rotary actuating mechanism,"['ADJ', 'ADJ', 'ADJ', 'ADJ', 'NOUN', 'NOUN']",[],0,0,7,1
US3517583A,1968-07-25,Fastening device,"['VERB', 'NOUN']",[],0,0,3,1
US3517923A,1968-05-24,Sheet registration apparatus,"['NOUN', 'NOUN', 'NOUN']",[],0,0,4,1
US3517990A,1969-10-02,"Fade-in,fade-out control","['NOUN', 'PUNCT', 'NOUN', 'PUNCT', 'NOUN', 'PUNCT', 'ADP', 'NOUN']",[],0,0,9,1
US3518023A,1967-07-01,Standby control system for multi-engine power plants,"['ADJ', 'NOUN', 'NOUN', 'ADP', 'ADJ', 'ADJ', 'ADJ', 'NOUN', 'NOUN']",[],0,0,10,1
US3518101A,1967-05-23,Cationic asphalt emulsions,"['ADJ', 'NOUN', 'NOUN']",['ORG'],0,0,4,1
US3518126A,1968-05-10,Deferred action battery,"['ADJ', 'NOUN', 'NOUN']",[],0,0,4,1
US3518222A,1968-05-27,Curable silicone compositions containing certain acidic fillers,"['ADJ', 'NOUN', 'NOUN', 'VERB', 'ADJ', 'ADJ', 'NOUN']",[],0,0,8,1
US3518329A,1966-11-26,Preparation of diphenylolpropane granules,"['NOUN', 'ADP', 'NOUN', 'NOUN']",[],0,0,5,1
US3518457A,1967-03-30,Push-pull current source,"['VERB', 'PUNCT', 'VERB', 'ADJ', 'NOUN']",[],0,0,6,1
US3518665A,1968-07-17,Rotor drive mechanism for two-position indicating instrument,"['NOUN', 'NOUN', 'NOUN', 'ADP', 'NUM', 'PUNCT', 'NOUN', 'VERB', 'NOUN']",['CARDINAL'],0,0,10,1
US3518697A,1967-12-18,Material tester and recorder,"['ADJ', 'NOUN', 'CCONJ', 'VERB']",[],0,0,5,1
US3518706A,1968-09-16,Bedspread support,"['ADJ', 'NOUN']",[],0,0,3,1
US3518771A,1966-07-22,North-seeking gyroscope,"['NOUN', 'PUNCT', 'VERB', 'NOUN']",[],0,0,5,1
US3518887A,1968-03-21,Flow-sensing apparatus,"['NOUN', 'PUNCT', 'VERB', 'NOUN']",[],0,0,5,1
US3518904A,1968-03-06,Lathe carrier center,"['NOUN', 'NOUN', 'NOUN']",[],0,0,4,1
US3518923A,1967-08-11,Pre-crimped coin wrapper forming apparatus,"['VERB', 'VERB', 'VERB', 'NOUN', 'NOUN', 'VERB', 'NOUN']",[],0,0,8,1
US3518992A,1966-09-17,"Oral inhaler with spring biased,cam driven piercing device","['ADJ', 'NOUN', 'ADP', 'NOUN', 'VERB', 'PUNCT', 'NOUN', 'VERB', 'VERB', 'NOUN']",[],0,0,11,1
US3519026A,1967-08-16,Weaving shuttle for inserting weft threads,"['VERB', 'NOUN', 'ADP', 'VERB', 'ADJ', 'NOUN']",[],0,0,7,1
US3519057A,1967-08-08,Eliminating patterns from and hardening of shell molds,"['VERB', 'NOUN', 'ADP', 'CCONJ', 'NOUN', 'ADP', 'ADJ', 'NOUN']",[],0,0,9,1
US3519058A,1968-05-03,Molding method,"['NOUN', 'VERB']",[],0,0,3,1
US3519060A,1968-02-07,Continuous casting apparatus with a molten metal level control,"['ADJ', 'NOUN', 'NOUN', 'ADP', 'DET', 'ADJ', 'NOUN', 'NOUN', 'NOUN']",['PERSON'],0,1,10,1
US3519065A,1968-10-04,Gas heating and cooling system,"['NOUN', 'NOUN', 'CCONJ', 'VERB', 'NOUN']",[],0,0,6,1
US3519073A,1968-03-22,Pitless well system,"['NOUN', 'NOUN', 'NOUN']",[],0,0,4,1
US3519109A,1967-06-29,Shock absorber apparatus,"['NOUN', 'NOUN', 'NOUN']",[],0,0,4,1
US3519430A,1967-05-29,Photographic silver halide emulsions and elements containing merocyanine sensitizing dyes,"['ADJ', 'NOUN', 'NOUN', 'NOUN', 'CCONJ', 'NOUN', 'VERB', 'NOUN', 'VERB', 'NOUN']",[],0,0,11,1
US3519728A,1968-05-16,Protective enclosure for cables,"['ADJ', 'NOUN', 'ADP', 'NOUN']",[],0,0,5,1
US3519773A,1968-08-28,Dual-throw switch,"['ADJ', 'PUNCT', 'NOUN', 'NOUN']",[],0,0,5,1
US3520232A,1968-08-12,Radial piston pump and motor device,"['ADJ', 'NOUN', 'NOUN', 'CCONJ', 'NOUN', 'NOUN']",[],0,0,7,1
US3520237A,1966-01-14,Rotary socket for multiple flashbulb holders,"['ADJ', 'NOUN', 'ADP', 'ADJ', 'NOUN', 'NOUN']",[],0,0,7,1
US3520286A,1967-07-20,Valve gear disposal,"['NOUN', 'NOUN', 'NOUN']",[],0,0,4,1
US3520308A,1968-06-17,Pipe reamer,"['ADJ', 'NOUN']",[],0,0,3,1
US3520309A,1968-05-03,Hairpiece including relatively rigid and relatively flexible plastic portions,"['NOUN', 'VERB', 'ADV', 'ADJ', 'CCONJ', 'ADV', 'ADJ', 'NOUN', 'NOUN']",[],0,0,10,1
US3520460A,1967-04-25,Magnetic tape drive system,"['ADJ', 'NOUN', 'NOUN', 'NOUN']",[],0,0,5,1
US3520500A,1968-08-02,Aircraft ejection system,"['NOUN', 'NOUN', 'NOUN']",[],0,0,4,1
US3520666A,1967-06-14,Bismuth alloy impregnated grinding wheel,"['ADJ', 'NOUN', 'VERB', 'VERB', 'NOUN']",[],0,0,6,1
US3520700A,1968-01-02,Process for the pasteurization of egg whites,"['NOUN', 'ADP', 'DET', 'NOUN', 'ADP', 'NOUN', 'VERB']",[],0,0,8,1
US3520788A,1951-01-28,Process for the extension of the effective surface of aluminium electrodes or foils for electrolytic capacitors,"['NOUN', 'ADP', 'DET', 'NOUN', 'ADP', 'DET', 'ADJ', 'NOUN', 'ADP', 'NOUN', 'NOUN', 'CCONJ', 'NOUN', 'ADP', 'ADJ', 'NOUN']",[],0,0,17,1
US3521279A,1968-08-20,Mobile clock synchronization techniques,"['ADJ', 'NOUN', 'NOUN', 'NOUN']",[],0,0,5,1
US3521300A,1967-08-11,Automatic electric self-synchronizing polarizing windows,"['ADJ', 'ADJ', 'NOUN', 'PUNCT', 'VERB', 'NOUN', 'NOUN']",[],0,0,8,1
US3521472A,1967-02-03,Process and apparatus for the production of parts from ductile materials with integral stiffeners on one or both sides,"['NOUN', 'CCONJ', 'NOUN', 'ADP', 'DET', 'NOUN', 'ADP', 'NOUN', 'ADP', 'ADJ', 'NOUN', 'ADP', 'ADJ', 'NOUN', 'ADP', 'NUM', 'CCONJ', 'DET', 'NOUN']",['CARDINAL'],0,0,20,1
US3521501A,1968-09-09,Steering control means for watercraft,"['NOUN', 'NOUN', 'VERB', 'ADP', 'NOUN']",[],0,0,6,1
US3521512A,1968-09-26,Three delivery folder,"['NUM', 'NOUN', 'NOUN']",['CARDINAL'],0,0,4,1
US3521573A,1966-11-25,Railroad car side,"['NOUN', 'NOUN', 'NOUN']",[],0,0,4,1
US3521638A,1969-02-10,Fabrics having water soluble discrete areas and methods of making,"['NOUN', 'VERB', 'NOUN', 'ADJ', 'ADJ', 'NOUN', 'CCONJ', 'NOUN', 'ADP', 'VERB']",[],0,0,11,1
US3521866A,1964-07-03,Coking apparatus tube construction,"['VERB', 'NOUN', 'NOUN', 'NOUN']",[],0,0,5,1
US3521923A,1968-02-15,Tongs,['NOUN'],['GPE'],0,0,2,1
US3522070A,1965-01-21,Aqueous coating compositions containing dispersed submicron cellulosic polymer particles and the process of preparing said coating compositions,"['ADJ', 'NOUN', 'NOUN', 'VERB', 'VERB', 'NOUN', 'NOUN', 'NOUN', 'NOUN', 'CCONJ', 'DET', 'NOUN', 'ADP', 'VERB', 'VERB', 'NOUN', 'NOUN']",[],0,0,18,1
US3522150A,1968-04-18,Vacuum flash distilling apparatus,"['NOUN', 'NOUN', 'NOUN', 'NOUN']",[],0,0,5,1
US3522220A,1968-01-31,"Sulfated,hydroxylated diolefin polymers","['VERB', 'PUNCT', 'VERB', 'NOUN', 'NOUN']",[],0,0,6,1
US3522375A,1967-07-28,Facsimile carrier oscillator circuit including means for synchronizing the carrier with respect to the scanner,"['ADJ', 'NOUN', 'NOUN', 'NOUN', 'VERB', 'NOUN', 'ADP', 'VERB', 'DET', 'NOUN', 'ADP', 'NOUN', 'ADP', 'DET', 'NOUN']",['ORG'],0,0,16,1
US3522428A,1966-05-17,Mass spectrometer having a plurality of relatively movable collectors,"['ADJ', 'NOUN', 'VERB', 'DET', 'NOUN', 'ADP', 'ADV', 'ADJ', 'NOUN']",[],0,0,10,1
US3522471A,1968-03-19,Transistor driver circuits for cathode glow display tubes,"['NOUN', 'NOUN', 'NOUN', 'ADP', 'NOUN', 'NOUN', 'NOUN', 'NOUN']",[],0,0,9,1
US3522520A,1967-11-20,Alternator with rotary transformer for self-excitation,"['NOUN', 'ADP', 'NOUN', 'NOUN', 'ADP', 'NOUN', 'PUNCT', 'NOUN']",[],0,0,9,1
US3522553A,1968-03-18,Pulsed laser employing an active absorption cell,"['VERB', 'NOUN', 'VERB', 'DET', 'ADJ', 'NOUN', 'NOUN']",[],0,0,8,1
US3522738A,1969-01-21,Article contour follower mechanism,"['NOUN', 'VERB', 'NOUN', 'NOUN']",[],0,0,5,1
US3522756A,1967-08-04,Axially split expanding plug of elastically flexible material for an anchor bolt or screw,"['ADV', 'VERB', 'VERB', 'NOUN', 'ADP', 'ADV', 'ADJ', 'NOUN', 'ADP', 'DET', 'NOUN', 'NOUN', 'CCONJ', 'VERB']",[],0,0,15,1
US3522923A,1965-11-17,Magnetic panel supporting and securing devices,"['ADJ', 'NOUN', 'VERB', 'CCONJ', 'VERB', 'NOUN']",[],0,0,7,1
US3523071A,1968-08-01,Process for reducing the pour point of shale oil,"['NOUN', 'ADP', 'VERB', 'DET', 'NOUN', 'NOUN', 'ADP', 'ADJ', 'NOUN']",[],0,0,10,1
US3523073A,1968-07-05,Solvent dewaxing or deoiling process,"['NOUN', 'VERB', 'CCONJ', 'VERB', 'NOUN']",[],0,0,6,1
US3523077A,1968-10-11,Uni-flow filter and method,"['ADJ', 'PUNCT', 'NOUN', 'NOUN', 'CCONJ', 'VERB']",[],0,0,7,1
US3523188A,1965-12-20,Semiconductor current control device and method,"['NOUN', 'ADJ', 'NOUN', 'NOUN', 'CCONJ', 'NOUN']",[],0,0,7,1
US3523399A,1967-10-12,Coin distributor,"['NOUN', 'NOUN']",['ORG'],0,0,3,1
US3523408A,1968-04-02,Gas separator,"['NOUN', 'NOUN']",[],0,0,3,1
